{"organizations": [], "uuid": "131af5f7daf7f451ef9b64b3e1bdd0d3de17d97b", "thread": {"social": {"gplus": {"shares": 1}, "pinterest": {"shares": 0}, "vk": {"shares": 0}, "linkedin": {"shares": 0}, "facebook": {"likes": 148, "shares": 148, "comments": 0}, "stumbledupon": {"shares": 0}}, "site_full": "www.rappler.com", "main_image": "http://assets.rappler.com/8EDB3D34F87D4192A1D58ED31AA271F3/img/8E626F04453B4C0395613CB0D40AE56E/20170112-Miss_Universe-002.jpg", "site_section": "http://feeds.rappler.com/rappler/life-and-style", "section_title": "Rappler: Life and Style", "url": "http://www.rappler.com/life-and-style/specials/miss-universe/158080-miss-universe-candidates-arrive-manila", "country": "US", "domain_rank": 1586, "title": "IN PHOTOS: Miss Universe candidates arrive in Manila", "performance_score": 1, "site": "rappler.com", "participants_count": 1, "title_full": "IN PHOTOS: Miss Universe candidates arrive in Manila", "spam_score": 0.0, "site_type": "blogs", "published": "2017-01-12T09:15:00.000+02:00", "replies_count": 0, "uuid": "131af5f7daf7f451ef9b64b3e1bdd0d3de17d97b"}, "author": "Rappler.com", "url": "http://www.rappler.com/life-and-style/specials/miss-universe/158080-miss-universe-candidates-arrive-manila", "ord_in_thread": 0, "title": "IN PHOTOS: Miss Universe candidates arrive in Manila", "locations": [], "entities": {"persons": [{"name": "deshauna barber", "sentiment": "none"}, {"name": "rodrigo duterte", "sentiment": "none"}, {"name": "carolyn carter", "sentiment": "none"}, {"name": "guyana soyini fraser", "sentiment": "none"}, {"name": "sierra leone hawa kamara", "sentiment": "none"}, {"name": "erika", "sentiment": "none"}, {"name": "erika creque", "sentiment": "none"}, {"name": "pia wurtzbach", "sentiment": "none"}, {"name": "nicaragua marina jacoby", "sentiment": "none"}, {"name": "kat de castro", "sentiment": "none"}, {"name": "chalita suansane", "sentiment": "none"}, {"name": "carolyn carter", "sentiment": "none"}, {"name": "brazil raissa santana", "sentiment": "none"}, {"name": "katherine de castro", "sentiment": "none"}, {"name": "raissa santana", "sentiment": "none"}, {"name": "costa rica carolina duran", "sentiment": "none"}, {"name": "albania lindita idrizi", "sentiment": "none"}], "locations": [{"name": "manila", "sentiment": "none"}, {"name": "us virgin islands", "sentiment": "none"}, {"name": "philippines", "sentiment": "none"}, {"name": "miss british virgin islands", "sentiment": "none"}, {"name": "manila", "sentiment": "none"}, {"name": "deshauna", "sentiment": "none"}, {"name": "costa rica carolina duran", "sentiment": "none"}], "organizations": [{"name": "usa deshauna barber", "sentiment": "none"}, {"name": "siera", "sentiment": "none"}, {"name": "miss canada siera bearchell", "sentiment": "none"}, {"name": "department of tourism", "sentiment": "none"}, {"name": "pst  miss canada siera bearchell", "sentiment": "none"}, {"name": "dot  here", "sentiment": "none"}, {"name": "miss usa deshauna barber", "sentiment": "none"}]}, "highlightText": "", "language": "english", "persons": [], "text": "IN PHOTOS: Miss Universe candidates arrive in Manila (UPDATED) The 65th Miss Universe candidates arrive in Manila ahead of the January 30 pageant Published 11:10 AM, January 12, 2017 Updated 12:56 PM, January 12, 2017 NOW IN MANILA. Miss Nicaragua Marina Jacoby greets those waiting for her at the airport after she lands in Manila. Photo courtesy of DOT \nMANILA, Philippines (UPDATED) – The candidates for the 65th Miss Universe pageant are here! \nMany of the Miss Universe candidates are landing in Manila on January 12 and 13, with Miss Costa Rica Carolina Duran and Miss Nicaragua Marina Jacoby arriving first. ([READ] Miss Universe 2016: Everything you need to know about the pageant ) Miss Costa Rica Carolina Duran. Photo courtesy of DOT \nHere's a look at all the 65th Miss Universe ladies at the airport. This page will be updated as more of the ladies arrive. \nMiss USA Deshauna Barber A photo posted by Deshauna Barber (@missusa) on Jan 11, 2017 at 8:02pm PST \nMiss Canada Siera Bearchell and Miss British Virgin Islands Erika Creque \nIn the photo below, Deshauna, Siera, and Erika pose with Department of Tourism (DOT) Undersecretary Kat de Castro. DOT Undersecretary Katherine de Castro with Miss USA Deshauna Barber, Miss Canada Siera Bearchell, and Miss British Virgin Islands Erika Creque. Photo courtesy of DOT \nA few days before January 12, 6 candidates arrived ahead of the rest: Miss US Virgin Islands Carolyn Carter, Miss Guyana Soyini Fraser, Miss Brazil Raissa Santana, Miss Sierra Leone Hawa Kamara , Miss Thailand Chalita Suansane, and Miss Albania Lindita Idrizi. (IN PHOTOS: First Miss Universe candidates arrive in Manila ) A photo posted by CAROLYN CARTER (@carolyncarter) on Jan 7, 2017 at 7:08am PST A photo posted by 65thMissUniverse (@65thmissuniverse) on Jan 8, 2017 at 10:19pm PST A photo posted by Raissa Santana (@santana_raissa) on Jan 9, 2017 at 1:46am PST A photo posted by Chalita Suansane (@namtanlitaa) on Jan 10, 2017 at 4:20am PST \nAside from the Miss Universe candidates, representatives from the organization are set to visit Manila for the pageant too. \nOf course, Miss Universe 2015 Pia Wurtzbach will be in the country as well, to crown her successor on coronation night, January 30. \nBefore the big night and the preliminary competition, the ladies will tour the country , attend events like fashion shows and charities, and even meet President Rodrigo Duterte. – Rappler.com HOW DOES THIS STORY MAKE YOU FEEL? Happy", "external_links": [], "published": "2017-01-12T09:15:00.000+02:00", "crawled": "2017-01-12T08:24:31.603+02:00", "highlightTitle": ""}