{"organizations": [], "uuid": "925d764d99f816d418fb53f527ea562d1e314f33", "thread": {"social": {"gplus": {"shares": 1}, "pinterest": {"shares": 0}, "vk": {"shares": 0}, "linkedin": {"shares": 0}, "facebook": {"likes": 248, "shares": 248, "comments": 0}, "stumbledupon": {"shares": 0}}, "site_full": "www.geo.tv", "main_image": "https://www.geo.tv/assets/uploads/updates/2017-01-22/128258_075151_updates.jpg", "site_section": "http://feeds.feedburner.com/GeoSport-GeoTvNetwork", "section_title": "GEO TV - Sports", "url": "https://www.geo.tv/latest/128258-Australia-win-toss-choose-to-bat-first-in-fourth-ODI", "country": "TV", "domain_rank": 8287, "title": "Australia win toss, choose to bat first in fourth ODI", "performance_score": 2, "site": "geo.tv", "participants_count": 0, "title_full": "Australia win toss, choose to bat first in fourth ODI", "spam_score": 0.0, "site_type": "blogs", "published": "2017-01-22T14:50:00.000+02:00", "replies_count": 0, "uuid": "925d764d99f816d418fb53f527ea562d1e314f33"}, "author": "", "url": "https://www.geo.tv/latest/128258-Australia-win-toss-choose-to-bat-first-in-fourth-ODI", "ord_in_thread": 0, "title": "Australia win toss, choose to bat first in fourth ODI", "locations": [], "entities": {"persons": [{"name": "steven smith", "sentiment": "none"}, {"name": "imad", "sentiment": "none"}, {"name": "azhar", "sentiment": "none"}, {"name": "smith", "sentiment": "none"}, {"name": "hazlewood", "sentiment": "none"}, {"name": "hasan", "sentiment": "none"}, {"name": "akmal", "sentiment": "none"}, {"name": "junaid", "sentiment": "none"}, {"name": "malik", "sentiment": "none"}, {"name": "sharjeel", "sentiment": "none"}, {"name": "wade", "sentiment": "none"}, {"name": "babar", "sentiment": "none"}, {"name": "khawaja", "sentiment": "none"}, {"name": "rizwan", "sentiment": "none"}, {"name": "maxwell", "sentiment": "none"}, {"name": "amir", "sentiment": "none"}, {"name": "azhar ali", "sentiment": "none"}, {"name": "mohammad hafeez", "sentiment": "none"}, {"name": "geo", "sentiment": "none"}, {"name": "hafeez", "sentiment": "none"}], "locations": [{"name": "pakistan", "sentiment": "none"}, {"name": "australia", "sentiment": "none"}, {"name": "starc", "sentiment": "none"}, {"name": "brisbane", "sentiment": "none"}, {"name": "fourth odi", "sentiment": "none"}, {"name": "zampa", "sentiment": "none"}, {"name": "handscomb", "sentiment": "none"}, {"name": "sydney", "sentiment": "none"}, {"name": "sydney", "sentiment": "none"}], "organizations": [{"name": "cummins", "sentiment": "none"}, {"name": "warner", "sentiment": "none"}, {"name": "mcg", "sentiment": "none"}]}, "highlightText": "", "language": "english", "persons": [], "text": "Australia win toss, choose to bat first in fourth ODI | Australia beat Pakistan by 7 wickets in third ODI \nSYDNEY: Australia has won the toss and elected to bat first in fourth ODI against Pakistan at Sydney Cricket Ground on Sunday. \nThe playing 11 for Australia : Warner, Khawaja, Smith (c), Head, Handscomb, Maxwell, Wade (wk), Starc, Cummins, Zampa, Hazlewood. \nPakistan`s playing squad is : Azhar (c), Sharjeel, Babar, Hafeez, Malik, Akmal, Rizwan (wk), Imad, Amir, Hasan, Junaid. \nAzhar suffered a hamstring injury in the opening ODI in Brisbane and had to miss the second ODI at MCG. \nIn his absence, veteran all-rounder Mohammad Hafeez captained the side and top-scored to help Pakistan record their first victory on Australian soil in 12 years. \nIn the third ODI, Hafeez was retained as captain, however, Pakistan were unable to secure a victory. \nAustralia lead the five match ODI series 2-1 and clean swept Pakistan in the Test series. 0 0 Australia win toss, choose to bat first in fourth ODI was posted in sports of Geo TV - https://www.geo.tv on January 22, 2017 and was last updated on January 22, 2017. This news story is related to Australia Vs Pakistan, Azhar Ali, Cricket, Fourth Odi, Geo, Geo News, One Day International. Sports, Pakistan Vs Australia, Sports News, Steven Smith. Permanent link to the news story \"Australia win toss, choose to bat first in fourth ODI\" is https://www.geo.tv/latest/128258-Australia-win-toss-choose-to-bat-first-in-fourth-ODI+GeoSport-GeoTvNetwork+%28Geo+Sport+-+Geo+TV+Network%29 . More From Sports:", "external_links": [], "published": "2017-01-22T14:50:00.000+02:00", "crawled": "2017-01-22T05:15:15.040+02:00", "highlightTitle": ""}