{"organizations": [], "uuid": "2bde8145770a8f8b8a6631db25c180a739524de9", "thread": {"social": {"gplus": {"shares": 1}, "pinterest": {"shares": 0}, "vk": {"shares": 0}, "linkedin": {"shares": 1}, "facebook": {"likes": 106, "shares": 106, "comments": 0}, "stumbledupon": {"shares": 0}}, "site_full": "www.rappler.com", "main_image": "http://rappler-assets.s3-us-west-1.amazonaws.com/612F469A6EA84F6BAE882D2B94A4B421/img/372FC5661B3644E78155BC47EF703E6C/pagasa-satpic-1irbig-8-20170128-5pm.gif", "site_section": "http://feeds.rappler.com/disasters-and-weather", "section_title": "Project Agos + #WeatherAlert feed", "url": "http://www.rappler.com/nation/special-coverage/weather-alert/159808-20170128-rainfall-warnings-philippine-weather-forecast", "country": "US", "domain_rank": 1586, "title": "Rainfall warnings raised in VisMin due to LPA, tail end of cold front", "performance_score": 1, "site": "rappler.com", "participants_count": 1, "title_full": "Rainfall warnings raised in VisMin due to LPA, tail end of cold front", "spam_score": 0.0, "site_type": "blogs", "published": "2017-01-28T16:44:00.000+02:00", "replies_count": 0, "uuid": "2bde8145770a8f8b8a6631db25c180a739524de9"}, "author": "Rappler.com", "url": "http://www.rappler.com/nation/special-coverage/weather-alert/159808-20170128-rainfall-warnings-philippine-weather-forecast", "ord_in_thread": 0, "title": "Rainfall warnings raised in VisMin due to LPA, tail end of cold front", "locations": [], "entities": {"persons": [{"name": "caraga", "sentiment": "none"}], "locations": [{"name": "lanao del sur", "sentiment": "none"}, {"name": "bohol", "sentiment": "none"}, {"name": "eastern visayas", "sentiment": "none"}, {"name": "philippines", "sentiment": "none"}, {"name": "luzon", "sentiment": "none"}, {"name": "metro manila", "sentiment": "none"}, {"name": "aurora", "sentiment": "none"}, {"name": "zamboanga peninsula", "sentiment": "none"}, {"name": "davao", "sentiment": "none"}, {"name": "manila", "sentiment": "none"}, {"name": "mindanao", "sentiment": "none"}, {"name": "northern mindanao", "sentiment": "none"}, {"name": "visayas", "sentiment": "none"}, {"name": "cagayan valley", "sentiment": "none"}, {"name": "quezon", "sentiment": "none"}], "organizations": [{"name": "lpa", "sentiment": "negative"}, {"name": "general santos city", "sentiment": "none"}, {"name": "pagasa", "sentiment": "none"}]}, "highlightText": "", "language": "english", "persons": [], "text": "#WeatherAlert Rainfall warnings raised in VisMin due to LPA, tail end of cold front (3rd UPDATE) Moderate to occasionally heavy rain will affect many parts of Visayas and Mindanao in the next 24 hours, says PAGASA Published 6:50 PM, January 28, 2017 Updated 1:18 AM, January 29, 2017 Satellite image from PAGASA website \nMANILA, Philippines (3rd UPDATE) – A low pressure area (LPA) is affecting many parts of southern Philippines on Saturday, January 28, according to state weather bureau PAGASA. \nIn its afternoon advisory , PAGASA said that the LPA was spotted at 115 kms southeast of General Santos City at 4 pm. A tail-end of a cold front is also affecting Visayas and Mindanao. (READ: Red alert: Cagayan de Oro orders evacuation in flood-prone areas ) \nThe bureau in separate advisories raised heavy rainfall warnings in the following areas as of 1 am Sunday: \nYellow warning - Flooding is possible. Flooding in low-lying areas specially along river channels. Surigao del Norte Camiguin \nMany areas in northern and eastern Mindanao were placed under the red warning at 4 pm . (READ: How to use PAGASA’s color-coded rainfall advisory ) \nSunday forecast \nAlso in its afternoon advisory Saturday, PAGASA said that cloudy skies with moderate to occasionally heavy rain and thunderstorms is expected over the regions of Eastern Visayas, Caraga, Davao, Northern Mindanao and Zamboanga Peninsula as well as the provinces of Bohol and Lanao del Sur in the next 24 hours. \nThe rain may trigger flashfloods and landslides, it added. \nOver the rest of Visayas and Mindanao, it will be cloudy with light to moderate rain and thunderstorms. \nMeanwhile, skies will be cloudy with light rain over the Cagayan Valley region and the provinces of Aurora and Quezon. \nIn Metro Manila and the rest of Luzon, partly cloudy to cloudy with isolated light rains will prevail. \nModerate to strong winds from the northeast will blow over the entire archipelago, with moderate to rough seas. – Rappler.com HOW DOES THIS STORY MAKE YOU FEEL? Happy", "external_links": [], "published": "2017-01-28T16:44:00.000+02:00", "crawled": "2017-01-29T07:10:49.649+02:00", "highlightTitle": ""}