{"organizations": [], "uuid": "9a91df917a0f01e631647b231a1bfbc6a559ad0d", "thread": {"social": {"gplus": {"shares": 7}, "pinterest": {"shares": 2}, "vk": {"shares": 1}, "linkedin": {"shares": 1}, "facebook": {"likes": 556, "shares": 556, "comments": 0}, "stumbledupon": {"shares": 0}}, "site_full": "www.telegraph.co.uk", "main_image": "http://www.telegraph.co.uk/content/dam/news/2017/01/27/JS117915503-AFP-COMBO-trump-putin-xlarge_trans_NvBQzQNjv4Bq6CbGQpPl2gHgm3yFXhGx6pjna8cAoIa3e3UTe5Q1ttQ.jpg", "site_section": "http://www.telegraph.co.uk/newsfeed/rss/letters.xml", "section_title": "News", "url": "http://www.telegraph.co.uk/news/2017/01/27/donald-trump-speak-vladimir-putin-saturday/", "country": "GB", "domain_rank": 317, "title": "Donald Trump to speak with Vladimir Putin on Saturday", "performance_score": 5, "site": "telegraph.co.uk", "participants_count": 1, "title_full": "Donald Trump to speak with Vladimir Putin on Saturday", "spam_score": 0.0, "site_type": "blogs", "published": "2017-01-27T17:23:00.000+02:00", "replies_count": 0, "uuid": "9a91df917a0f01e631647b231a1bfbc6a559ad0d"}, "author": "Roland Oliphant", "url": "http://www.telegraph.co.uk/news/2017/01/27/donald-trump-speak-vladimir-putin-saturday/", "ord_in_thread": 0, "title": "Donald Trump to speak with Vladimir Putin on Saturday", "locations": [], "entities": {"persons": [{"name": "donald trump", "sentiment": "neutral"}, {"name": "vladimir putin", "sentiment": "neutral"}, {"name": "roland oliphant", "sentiment": "none"}, {"name": "donbas", "sentiment": "none"}, {"name": "hitler", "sentiment": "none"}, {"name": "trump", "sentiment": "none"}, {"name": "putin", "sentiment": "none"}, {"name": "theresa may", "sentiment": "none"}, {"name": "mrs merkel", "sentiment": "none"}, {"name": "carl bildt", "sentiment": "none"}, {"name": "angela merkel", "sentiment": "none"}, {"name": "mr trump", "sentiment": "none"}], "locations": [{"name": "britain", "sentiment": "none"}, {"name": "us", "sentiment": "none"}, {"name": "moscow", "sentiment": "none"}, {"name": "crimea", "sentiment": "none"}, {"name": "ukraine", "sentiment": "none"}, {"name": "west", "sentiment": "none"}, {"name": "kremlin", "sentiment": "none"}, {"name": "europe", "sentiment": "none"}, {"name": "uk", "sentiment": "none"}, {"name": "eu", "sentiment": "none"}, {"name": "florida", "sentiment": "none"}, {"name": "palm beach", "sentiment": "none"}, {"name": "russia", "sentiment": "none"}, {"name": "minsk", "sentiment": "none"}], "organizations": [{"name": "follow telegraph news", "sentiment": "none"}, {"name": "reuters", "sentiment": "none"}, {"name": "white house", "sentiment": "none"}, {"name": "eu", "sentiment": "none"}]}, "highlightText": "", "language": "english", "persons": [], "text": "News Donald Trump to speak with Vladimir Putin on Saturday This combination of pictures created on December 30, 2016 shows a file photo taken on December 28, 2016 of US President-elect Donald Trump (L) in Palm Beach, Florida and a file photo taken on December 23, 2016 of Russian President Vladimir Putin speaking in Moscow Roland Oliphant 27 January 2017 â€¢ 10:23am \nV ladimir Putin and Donald Trump will speak directly for the first time since the US president's inauguration in a telephone call on Saturday, the Kremlin has confirmed. \nThe planned telephone call between the two leaders, which was earlier reported in US media, has raised nervousness in Europe about the possibility of Mr Trump offering to unilaterally ease US sanctions against Russia. \nThe meeting comes a day after Mr Trump's meeting with Theresa May, who has said the West should \"engage with but beware\" of Mr Putin. \nMr Trump's line on Russia is emerging as a major point of difference between the new administration and traditional US allies in Europe, including the UK. Watch | Protestor compares Trump to Hitler 00:51 \nS ome Russian diplomats believe Britain and other European governments may try to sabotage a new rapprochement between the Kremlin and the White House. \nAngela Merkel, the German Chancellor, is also likely to speak with Mr Trump on Saturday. \nThe conversation is expected to focus on Russia, a source familiar with the matter told Reuters, underscoring European concern that Mr Trump might offer Russia a unilateral deal on sanctions. \nMrs Merkel has been a strong supporter of the EU and US sanctions regime imposed on Russia following the annexation of Crimea and invasion of eastern Ukraine in 2014. \nShe is expected to push for the EU to maintain its sanctions even if Mr Trump moves to cancel US ones. \nCarl Bildt, the former Swedish prime minister and diplomat, warned of the consequences of a deal between Mr Trump and Mr Putin on Ukraine sanctions. \n\"If Trump unilaterally lifts Russia sanctions it means torpedoing the Minsk agreement. Signals he's ready to hand Donbas to Russia,\" he wrote on Twitter. Follow Telegraph News", "external_links": [], "published": "2017-01-27T17:23:00.000+02:00", "crawled": "2017-01-27T12:39:39.226+02:00", "highlightTitle": ""}