{"organizations": [], "uuid": "ed2022ebf21e6796858caf133b8217b633e81d53", "thread": {"social": {"gplus": {"shares": 0}, "pinterest": {"shares": 0}, "vk": {"shares": 0}, "linkedin": {"shares": 0}, "facebook": {"likes": 920, "shares": 920, "comments": 0}, "stumbledupon": {"shares": 0}}, "site_full": "www.rappler.com", "main_image": "http://rappler-assets.s3-us-west-1.amazonaws.com/612F469A6EA84F6BAE882D2B94A4B421/img/BE51D95CA12D4FE39FDFF504E4784349/miss-universe-france-crowning-january-30-2017.jpg", "site_section": "http://feeds.feedburner.com/rappler/", "section_title": "RAPPLER", "url": "http://www.rappler.com/life-and-style/specials/miss-universe/159912-miss-universe-2016-photo-recap", "country": "US", "domain_rank": 1586, "title": "PHOTO RECAP: Miss Universe 2016 grand coronation", "performance_score": 9, "site": "rappler.com", "participants_count": 1, "title_full": "PHOTO RECAP: Miss Universe 2016 grand coronation", "spam_score": 0.0, "site_type": "blogs", "published": "2017-01-30T00:39:00.000+02:00", "replies_count": 0, "uuid": "ed2022ebf21e6796858caf133b8217b633e81d53"}, "author": "Rappler.com", "url": "http://www.rappler.com/life-and-style/specials/miss-universe/159912-miss-universe-2016-photo-recap", "ord_in_thread": 0, "title": "PHOTO RECAP: Miss Universe 2016 grand coronation", "locations": [], "entities": {"persons": [{"name": "steve harvey", "sentiment": "none"}, {"name": "chalita suansane", "sentiment": "none"}, {"name": "steve", "sentiment": "none"}, {"name": "maxine medina", "sentiment": "none"}, {"name": "iris mittenaere", "sentiment": "none"}, {"name": "pia wurtzbach", "sentiment": "none"}, {"name": "france iris mittenaere", "sentiment": "none"}, {"name": "pia", "sentiment": "none"}], "locations": [{"name": "philippines", "sentiment": "none"}, {"name": "thailand", "sentiment": "none"}, {"name": "manila", "sentiment": "none"}, {"name": "yamamay", "sentiment": "none"}, {"name": "asia arena", "sentiment": "none"}], "organizations": [{"name": "miss universe organization  congratulations", "sentiment": "none"}, {"name": "pldt", "sentiment": "none"}, {"name": "miss universe organization photo", "sentiment": "none"}, {"name": "miss universe organization", "sentiment": "none"}, {"name": "img", "sentiment": "none"}]}, "highlightText": "", "language": "english", "persons": [], "text": "Miss Universe PHOTO RECAP: Miss Universe 2016 grand coronation Check out the photos from the emotional coronation and look back at some of the moments from the pageant's finale! Published 1:34 PM, January 30, 2017 Updated 1:34 PM, January 30, 2017 Photo courtesy of the Miss Universe Organization \nMANILA, Philippines – After 3 weeks, a new Miss Universe was crowned on Monday, January 30 at the Mall of Asia Arena, succeeding Miss Universe 2015 Pia Wurtzbach. \nIris Mittenaere was crowned in front of a jam-packed arena, as supporters cheered her on. \nThe show started with Steve Harvey introducing Miss Universe 2015 Pia Wurtzbach to the stage. Pia announced that she was signed on to IMG Models. Screengrab from etc \nHost Steve Harvey then came on stage and announced the Top 13. The Philippine's Maxine Medina made it to the Top 13, while Thailand's Chalita Suansane won the fan vote. Screengrab from etc \nThe Top 13 confidently walked on stage in Yamamay swimwear. Screengrab from etc Screengrab from etc Screengrab from etc \nFrom top 13, the candidates were narrowed to the top 9 for the long gown competition. \nAfter the long gown competition, 6 candidates moved on for the question and answer portion, wherein they were asked about current issues affecting their countries. \nFrom 6, it was time for the final 3. \nThe judges were able to observe a final walk from the 3 candidates. Meanwhile, R&B group Boyz II Men came out to serenade the ladies as well as the audience with a medley of songs. \nBefore the winner's announcement, Steve called Miss Universe 2015 Pia Wurtzbach for her farewell walk. \nCheck out these photos of Miss France Iris Mittenaere's emotional coronation: Photo courtesy of the Miss Universe Organization Photo courtesy of the Miss Universe Organization Photo courtesy of the Miss Universe Organization Photo courtesy of the Miss Universe Organization \nCongratulations to the new Miss Universe, and well done to all the ladies in the competition! – Rappler.com Miss Universe 2016 is powered by PLDT Home Fibr, Home’s most powerful broadband, now reaching 2.5 Million homes. As low as P1,899. Visit www.pldthome.com. HOW DOES THIS STORY MAKE YOU FEEL? Happy", "external_links": [], "published": "2017-01-30T00:39:00.000+02:00", "crawled": "2017-01-30T12:28:30.162+02:00", "highlightTitle": ""}