{"organizations": [], "uuid": "c1749b4fe556f4b3f71dfeda30a3bda482ef854c", "thread": {"social": {"gplus": {"shares": 5}, "pinterest": {"shares": 0}, "vk": {"shares": 0}, "linkedin": {"shares": 0}, "facebook": {"likes": 113, "shares": 113, "comments": 0}, "stumbledupon": {"shares": 0}}, "site_full": "ftw.usatoday.com", "main_image": "http://www.gannett-cdn.com/-mm-/4d34949ca1f8167c4784a88c97d930ca724030d0/c=0-201-3378-2109&amp;r=x1683&amp;c=3200x1680/local/-/media/2017/01/25/USATODAY/usatsports/usp-nfl_-baltimore-ravens-at-detroit-lions_001.jpg", "site_section": "http://rssfeeds.usatoday.com/UsatodaycomNfl-TopStories", "section_title": "GANNETT Syndication Service", "url": "http://ftw.usatoday.com/2017/01/nfl-pro-bowl-baltimore-ravens-justin-tucker-75-yard-field-goal-kick-practice-video", "country": "US", "domain_rank": 313, "title": "Justin Tucker absolutely annihilated 75-yard kick", "performance_score": 1, "site": "usatoday.com", "participants_count": 1, "title_full": "Justin Tucker absolutely annihilated 75-yard kick", "spam_score": 0.0, "site_type": "blogs", "published": "2017-01-26T03:34:00.000+02:00", "replies_count": 0, "uuid": "c1749b4fe556f4b3f71dfeda30a3bda482ef854c"}, "author": "USA TODAY", "url": "http://ftw.usatoday.com/2017/01/nfl-pro-bowl-baltimore-ravens-justin-tucker-75-yard-field-goal-kick-practice-video", "ord_in_thread": 0, "title": "Justin Tucker absolutely annihilated 75-yard kick", "locations": [], "entities": {"persons": [{"name": "justin tucker", "sentiment": "negative"}, {"name": "tucker", "sentiment": "none"}, {"name": "brandon mcmanus", "sentiment": "none"}, {"name": "charles curtis", "sentiment": "none"}], "locations": [{"name": "detroit", "sentiment": "none"}, {"name": "usa", "sentiment": "none"}, {"name": "denver", "sentiment": "none"}, {"name": "orlando", "sentiment": "none"}], "organizations": [{"name": "detroit lions", "sentiment": "none"}, {"name": "baltimore ravens", "sentiment": "none"}, {"name": "ford field", "sentiment": "none"}, {"name": "denver broncos", "sentiment": "none"}]}, "highlightText": "", "language": "english", "persons": [], "text": "  Justin Tucker absolutely annihilated 75-yard kick Whoa. Justin Tucker absolutely annihilated 75-yard kick Whoa.  //ftw.usatoday.com/2017/01/nfl-pro-bowl-baltimore-ravens-justin-tucker-75-yard-field-goal-kick-practice-video/   Join the Nation's Conversation To   Justin Tucker absolutely annihilated 75-yard kick Charles Curtis , USA TODAY 3:34 p.m. ET Jan. 25, 2017 \nDec 16, 2013; Detroit, MI, USA; Baltimore Ravens kicker Justin Tucker (9) celebrates after kicking a 61 yard field goal during the fourth quarter against the Detroit Lions at Ford Field. Baltimore Ravens defeated the Detroit Lions 18-16. (Photo: Andrew Weber-USA TODAY Sports) \nBaltimore Ravens kicker Justin Tucker has a leg of steel and proved it in Pro Bowl practice on Wednesday. \nCheck this out: He booted a ball 75 yards through the uprights: From 75 in sunny Orlando! Shoutout to #RavensFlock !! pic.twitter.com/QYaxVw7FML â€” Justin Tucker (@jtuck9) January 25, 2017 \nIt's crazy how that thing takes off like it was shot out of a cannon. \nHere's the biggest takeaway: Tucker has claimed he would try an 84.5-yard attempt if the conditions were right , which was challenged by Denver Broncos kicker Brandon McManus . Now, Tucker kicked this one in from 75, and you figure the altitude in Denver might add a few more yards. So maybe he'd be pretty close to hitting from 80 yards in Mile High in practice? Read or Share this story: http://ftw.usatoday.com/2017/01/nfl-pro-bowl-baltimore-ravens-justin-tucker-75-yard-field-goal-kick-practice-video/ Most Popular", "external_links": [], "published": "2017-01-26T03:34:00.000+02:00", "crawled": "2017-01-26T00:00:41.903+02:00", "highlightTitle": ""}