{"organizations": [], "uuid": "916bc3eb13a1ec7af91bd645d085721201940566", "thread": {"social": {"gplus": {"shares": 6}, "pinterest": {"shares": 3}, "vk": {"shares": 0}, "linkedin": {"shares": 909}, "facebook": {"likes": 741, "shares": 741, "comments": 0}, "stumbledupon": {"shares": 0}}, "site_full": "www.techinasia.com", "main_image": "", "site_section": "https://www.techinasia.com", "section_title": "Tech in Asia", "url": "https://www.techinasia.com/10-marketing-public-relations-job-list-asia", "country": "US", "domain_rank": 6989, "title": "10 marketing jobs: Swiftcow, CybrHome, Kredivest and more", "performance_score": 7, "site": "techinasia.com", "participants_count": 1, "title_full": "10 marketing jobs: Swiftcow, CybrHome, Kredivest and more", "spam_score": 0.0, "site_type": "blogs", "published": "2017-01-26T11:45:00.000+02:00", "replies_count": 8, "uuid": "916bc3eb13a1ec7af91bd645d085721201940566"}, "author": "Elvina Taher", "url": "https://www.techinasia.com/10-marketing-public-relations-job-list-asia", "ord_in_thread": 0, "title": "10 marketing jobs: Swiftcow, CybrHome, Kredivest and more", "locations": [], "entities": {"persons": [{"name": "kredivest", "sentiment": "negative"}], "locations": [{"name": "hong kong", "sentiment": "none"}, {"name": "bangalore", "sentiment": "none"}, {"name": "jakarta", "sentiment": "none"}, {"name": "thailand", "sentiment": "none"}, {"name": "indonesia", "sentiment": "none"}, {"name": "kuala lumpur", "sentiment": "none"}, {"name": "india", "sentiment": "none"}, {"name": "bangkok", "sentiment": "none"}, {"name": "malaysia", "sentiment": "none"}, {"name": "singapore", "sentiment": "none"}, {"name": "swiftcow  swiftcow", "sentiment": "none"}, {"name": "wedge asia", "sentiment": "none"}, {"name": "kredivest  kredivest", "sentiment": "none"}, {"name": "southeast asia", "sentiment": "none"}, {"name": "asia", "sentiment": "none"}, {"name": "indian ocean islands", "sentiment": "none"}, {"name": "middle east", "sentiment": "none"}], "organizations": [{"name": "microsoft office suite", "sentiment": "none"}, {"name": "shentilium technologies  content/ marketing analyst", "sentiment": "none"}, {"name": "microsoft", "sentiment": "none"}, {"name": "facebook", "sentiment": "none"}, {"name": "analytics", "sentiment": "none"}, {"name": "cybrhome  digital marketing internship", "sentiment": "none"}, {"name": "myr", "sentiment": "none"}, {"name": "kredivest  product marketing", "sentiment": "none"}, {"name": "lynk global  lynk global", "sentiment": "none"}, {"name": "lynk global  digital marketing professional", "sentiment": "none"}, {"name": "shentilium technologies  shentilium technologies", "sentiment": "none"}, {"name": "bmasia limited  senior marketing research analyst", "sentiment": "none"}, {"name": "instagram", "sentiment": "none"}, {"name": "google analytics", "sentiment": "none"}, {"name": "market research analyst", "sentiment": "none"}, {"name": "digital", "sentiment": "none"}, {"name": "digital advertisements", "sentiment": "none"}]}, "highlightText": "", "language": "english", "persons": [], "text": "\nLooking for opportunities in marketing & public relations? We have handpicked 10 jobs for you this week. Click on the links below and apply away!\nRecruiting and keen to list your jobs in future articles? Click here to create your company profile and post jobs. We feature jobs based on the following criteria:\nActivity of recruiters on the platform. Recruiters who actively post new jobs, remove old ones, and accept/reject applicants will have higher chances of being featured. Completeness of company profile and job details. Company with incomplete profile or poor job description will not be featured. Marketing Intern at CybrHome \nCybrHome is the fastest way to explore the internet. Using CybrHome, one can find out top websites, blogs, apps and more for any given purpose, topic or category.\nWork location: Bangalore, India / Full-time Requirement: A keen interest in marketing and all things digital, strong analytical skills and data-driven thinking, understanding of SEO/SEM, Digital Advertisements, Analytics, Skills: SEO/SEM, social media, A/B testing. More jobs at CybrHome \nDigital Marketing Internship at Kredivest \nKredivest is fintech peer to peer lending that aims to get your unpaid invoices paid in advance\nWork location: Jakarta, Indonesia / Internship Requirement: Comfortable with the use of social media, a good understanding of social media marketing strategy, strong passion about being a user/provider of social content. Skills: Digital marketing, digital media, digital strategy. Equity: Yes More jobs at Kredivest \nProduct Marketing Manager at Seeties \nSeeties allows people to discover the best things happening in their cities and around Southeast Asia. Seeties’s mission is to make city life happy and meaningful, and we aspire to bring joy to millions of lives.\nWork location: Kuala Lumpur, Malaysia / Full-time Requirement: 3+ years of product marketing experience, has experience with both B2C and B2B audiences, good knowledge of digital marketing, willing to travel Skills: Product marketing, community management, digital marketing. Salary Range: MYR 6,000 – 8,000 More jobs at Seeties \nPlatform Growth at Lynk Global \nLynk Global is a platform dedicated to connecting people to the right experts for advice, insights, and knowledge. Bridging the gap of knowledge, one lynk at a time.\nWork location: Hong Kong / Full-time Requirement: 3-5 years of functionally relevant work experience in a role requiring critical analytical thinking, results oriented and highly motivated self-starters with high attention to detail. Skills: Writing, leadership, communication skills. Salary Range: IDR 1,000,000 – 2,000,000 More jobs at Lynk Global \nDigital Marketing Professional at BMAsia Limited \nBMAsia is a recognized provider of background music across Asia regions and from the Middle East to the Indian Ocean Islands.\nWork location: Bangkok, Thailand / Full-time Requirement: Male or Females of any nationality living in Thailand, working experience in digital marketing digital platforms & system, social media, customer portal, etc. for a minimum of 3 years. Skills: Analytics & reporting, digital marketing, digital strategy, data analysis. Salary Range: THB 25,000 – 50,000 More jobs at BMAsia Limited \nSenior Marketing Research Analyst at Swiftcow \nSwiftcow is a personal shopping and delivery service where you can shop from one of all of you favorite supermarkets and get your shopping in one delivery.\nWork location: Kuala Lumpur, Malaysia / Full-time Requirement: 2+ years experience in any business/marketing research role, passion for research & understanding, familiarity with retail metrics (preferred, not required). Skills: Research, Google Analytics, marketing. Equity: Yes More jobs at Swiftcow \nIntern – Market Research Analyst at Shentilium Technologies \nShentilium Technologies uses big data analytics, machine learning, and cutting-edge database technologies to discover actionable information from your data.\nWork location: Singapore / Full-time Requirement: Currently pursuing a diploma or degree in Business, Management, Finance or other related fields, good communication skills, proficient in Microsoft Office Suite. Skills: Microsoft Word, Microsoft PowerPoint, Microsoft Excel. Salary Range: SGD 800 – 1,000 More jobs at Shentilium Technologies \nContent/ Marketing Analyst at OKLink \nOKLink is more than a blockchain settlement company. OKLink is striving to change the world’s financial economy.\nWork location: Hong Kong / Full-time Requirement: Experience in developing content and managing social media platforms, has copywriting experience in PR, Social Media Feeds (Facebook, Instagram) or blogging experience. Skills: Copywriting & editing, PR, social media. Salary Range: HKD 20,000 – 40,000 More jobs at OKLink \nMarketing Internship at The Wedge Asia \nThe Wedge Asia is a leading platform that brings conscious people from around the world together to connect, find inspiration, gain knowledge, and take action to co-create a better future.\nWork location: Singapore / Internship Requirement: Loves putting their thinking cap on, learning hands-on skills and (sometimes) has quick feet, ability to develop social media campaigns and management. Skills: Social media marketing, client relations, brand management. Salary Range: SGD 3,500 – 5,500 More jobs at The Wedge Asia \nMarketing at HelloReporter \nHelloReporter helps the reporter to find qualified news source & helps startup domain expert to get media exposure.\nWork location: Hong Kong / Full-time Requirement: Experience: 1 – 2 years of PR / Media / Content experience, excellent English & Chinese, copywriting & writing skill, willing to use various technology & tools to work efficiently. Skills: Social media marketing, writing, Cantonese language. More jobs at HelloReporter \nWant to see more jobs? Click here to check out more marketing & PR jobs!\nHiring? Click here to post jobs!\nWant the latest job updates in your inbox? Join our mailing list here to get the best jobs in Asia’s tech scene on a weekly basis.\nThis post 10 marketing jobs: Swiftcow, CybrHome, Kredivest and more appeared first on Tech in Asia.\n", "external_links": [], "published": "2017-01-26T11:45:00.000+02:00", "crawled": "2017-01-26T06:47:40.115+02:00", "highlightTitle": ""}