{"organizations": [], "uuid": "f18cbb697182d34e532503adbe345d826dd29f03", "thread": {"social": {"gplus": {"shares": 2}, "pinterest": {"shares": 3}, "vk": {"shares": 0}, "linkedin": {"shares": 0}, "facebook": {"likes": 130, "shares": 130, "comments": 0}, "stumbledupon": {"shares": 0}}, "site_full": "digital-photography-school.com", "main_image": "", "site_section": "http://digital-photography-school.com", "section_title": "Digital Photography School", "url": "http://digital-photography-school.com/21-frozen-images-cold-winter-weather/", "country": "US", "domain_rank": 9488, "title": "24 Frozen Images of Some Cold Winter Weather", "performance_score": 1, "site": "digital-photography-school.com", "participants_count": 1, "title_full": "24 Frozen Images of Some Cold Winter Weather", "spam_score": 0.0, "site_type": "blogs", "published": "2017-01-27T20:00:00.000+02:00", "replies_count": 0, "uuid": "f18cbb697182d34e532503adbe345d826dd29f03"}, "author": "Darlene Hildebrandt", "url": "http://digital-photography-school.com/21-frozen-images-cold-winter-weather/", "ord_in_thread": 0, "title": "24 Frozen Images of Some Cold Winter Weather", "locations": [], "entities": {"persons": [{"name": "barbara friedman", "sentiment": "none"}, {"name": "simon doggett", "sentiment": "none"}, {"name": "mary j. i.", "sentiment": "none"}, {"name": "julie falk", "sentiment": "none"}, {"name": "gilmour", "sentiment": "none"}, {"name": "kamil dziedzina", "sentiment": "none"}, {"name": "brian hawkins", "sentiment": "none"}, {"name": "roger s. hart", "sentiment": "none"}, {"name": "nicolas raymond", "sentiment": "none"}, {"name": "gonzalo baeza", "sentiment": "none"}, {"name": "howard ignatius", "sentiment": "none"}, {"name": "ken mattison", "sentiment": "none"}, {"name": "melinda shelton", "sentiment": "none"}, {"name": "darlene hildebrandt", "sentiment": "none"}, {"name": "neil howard by dan", "sentiment": "none"}, {"name": "jack skipworth", "sentiment": "none"}], "locations": [], "organizations": [{"name": "frozen images of some cold winter", "sentiment": "negative"}, {"name": "digital photography school", "sentiment": "none"}, {"name": "usfws", "sentiment": "none"}, {"name": "mji photos", "sentiment": "none"}]}, "highlightText": "", "language": "english", "persons": [], "text": "Here in the northern hemisphere part of the world, it is winter. That means two things – cold and snow. But that doesn’t stop some people (nor should it stop you) from doing photography.\nLet’s have a look at some frozen images of some cold winter scenes.\nBy Howard Ignatius\nBy Neil Howard\nBy Dan (catching up)\nBy smilla4\nBy Ken Mattison\nBy Sigurd Rage\nBy Roger S. Hart\nBy Barbara Friedman\nBy Julie Falk\nBy chuddlesworth\nBy USFWS Mountain-Prairie\nBy Jack Skipworth\nBy ShinyPhotoScotland\nBy B Gilmour.\nBy Tupulak\nBy Kamil Dziedzina\nBy MJI Photos (Mary J. I.)\nBy Brian Hawkins\nBy Melinda Shelton\nBy Simon Doggett\nBy Nicolas Raymond\nBy ellenm1\nBy Gonzalo Baeza\nBy ravas51\nThe post 24 Frozen Images of Some Cold Winter Weather by Darlene Hildebrandt appeared first on Digital Photography School .\n", "external_links": [], "published": "2017-01-27T20:00:00.000+02:00", "crawled": "2017-01-29T04:54:16.579+02:00", "highlightTitle": ""}