{"organizations": [], "uuid": "52b584da2086e848e421bce66e4f862c1266aac9", "thread": {"social": {"gplus": {"shares": 0}, "pinterest": {"shares": 0}, "vk": {"shares": 0}, "linkedin": {"shares": 0}, "facebook": {"likes": 169, "shares": 169, "comments": 0}, "stumbledupon": {"shares": 0}}, "site_full": "www.garmin.com", "main_image": "", "site_section": "https://www.garmin.com/en-US/blog", "section_title": "Garmin Blog", "url": "https://www.garmin.com/en-US/blog/fishandhunt/garmin-adds-21-anglers-2017-marine-pro-team/", "country": "US", "domain_rank": 1026, "title": "Garmin adds 21 anglers to its 2017 Marine Pro Team", "performance_score": 1, "site": "garmin.com", "participants_count": 1, "title_full": "Garmin adds 21 anglers to its 2017 Marine Pro Team", "spam_score": 0.0, "site_type": "blogs", "published": "2017-01-10T22:46:00.000+02:00", "replies_count": 0, "uuid": "52b584da2086e848e421bce66e4f862c1266aac9"}, "author": "Alex Fulkerson", "url": "https://www.garmin.com/en-US/blog/fishandhunt/garmin-adds-21-anglers-2017-marine-pro-team/", "ord_in_thread": 0, "title": "Garmin adds 21 anglers to its 2017 Marine Pro Team", "locations": [], "entities": {"persons": [{"name": "garmin", "sentiment": "none"}, {"name": "bill dance", "sentiment": "none"}, {"name": "keith poche", "sentiment": "none"}, {"name": "billy mccaghren", "sentiment": "none"}, {"name": "jason lambert", "sentiment": "none"}, {"name": "chris johnston", "sentiment": "none"}, {"name": "luke dunkin", "sentiment": "none"}, {"name": "jason christie", "sentiment": "none"}, {"name": "anthony gagliardi", "sentiment": "none"}, {"name": "paul elias", "sentiment": "none"}, {"name": "mark menendez", "sentiment": "none"}, {"name": "bradley hallman", "sentiment": "none"}, {"name": "zack birge", "sentiment": "none"}, {"name": "jamie horton", "sentiment": "none"}, {"name": "peter thliveros", "sentiment": "none"}, {"name": "greg hackney", "sentiment": "none"}, {"name": "andrew upshaw", "sentiment": "none"}, {"name": "alton jones", "sentiment": "none"}, {"name": "alton jones sr.", "sentiment": "none"}, {"name": "jeff kriet", "sentiment": "none"}, {"name": "david mullins", "sentiment": "none"}, {"name": "darrel robertson", "sentiment": "none"}, {"name": "scott martin", "sentiment": "none"}, {"name": "bryan schmitt", "sentiment": "none"}, {"name": "justin mcclelland", "sentiment": "none"}, {"name": "chad morgenthaler", "sentiment": "none"}, {"name": "andy morgan", "sentiment": "none"}, {"name": "brock mosley", "sentiment": "none"}, {"name": "jimmy bell", "sentiment": "none"}, {"name": "shane lehew", "sentiment": "none"}], "locations": [{"name": "north america", "sentiment": "none"}, {"name": "garmin", "sentiment": "none"}], "organizations": [{"name": "marine pro team garmin", "sentiment": "negative"}, {"name": "garmin", "sentiment": "negative"}, {"name": "facebook twitter instagram", "sentiment": "none"}, {"name": "national marine electronics association", "sentiment": "none"}]}, "highlightText": "", "language": "english", "persons": [], "text": "Garmin is proud to announce the addition of 21 professional anglers to its 2017 marine pro team. The new additions round out the Garmin team of nearly 70 professional bass, walleye, and crappie fishermen who will be representing Garmin in tournament circuits across North America, including the B.A.S.S. Elite Series and FLW Tour. The new Garmin pro anglers include: Jimmy Bell (Walleye); Luke Dunkin (FLW); Paul Elias (B.A.S.S.); Anthony Gagliardi (FLW); Jeff Kriet (B.A.S.S.); Bradley Hallman (FLW); Jamie Horton (FLW); Alton Jones. Jr. (B.A.S.S.); Alton Jones Sr. (B.A.S.S.); Shane Lehew (FLW); Billy McCaghren (FLW); Justin McClelland (B.A.S.S.); Mark Menendez (B.A.S.S.); Chad Morgenthaler (B.A.S.S.); Brock Mosley (B.A.S.S.); David Mullins (B.A.S.S.); Keith Poche (B.A.S.S.); Darrel Robertson (FLW); Bryan Schmitt (FLW); Peter Thliveros (FLW); and Andrew Upshaw (FLW). The new anglers bring many impressive accolades to the Garmin team, including previous Bassmaster Classic wins by Alton Jones Sr. and Paul Elias.\nThey join the dozens of world-class professional fishermen already running Garmin electronics on the tournament trail, including Jason Christie (two-time Elite Series champion), Greg Hackney (2014 Bassmaster Angler of the Year), Chris Johnston (2016 FLW Rookie of the Year), Zack Birge (2015 FLW Rookie of the Year), Jason Lambert (2014 FLW Rookie of the Year), Scott Martin (2015 FLW Angler of the Year) , Andy Morgan (three-time FLW Angler of the Year) , bass fishing’s elder statesman and ambassador, Bill Dance , and many more. Meet the entire 2017 team here .\nThe 2017 pro team will use Garmin electronics on their boats and during tournaments, television shows, and in public appearances. They’ll be equipped with detailed lake maps and best-in-class electronics and technology, including the National Marine Electronics Association award-winning GPSMAP 7600xsv series chartplotters ranging in size from eight- to 16-inches, and the Garmin Panoptix PS-21-TR all-seeing sonar . Garmin was the first to bring Panoptix sonar imaging to the water, giving anglers the ability to see all around their boat in real time.\nFollow Garmin Fish & Hunt on social media for tips from our pros, videos and blogs to help you become a better angler.\nFacebook Twitter Instagram The post Garmin adds 21 anglers to its 2017 Marine Pro Team appeared first on Garmin Blog .\n", "external_links": [], "published": "2017-01-10T22:46:00.000+02:00", "crawled": "2017-01-10T20:21:03.276+02:00", "highlightTitle": ""}