{"organizations": [], "uuid": "3b8705f58d3e91576387a486566d20df09184825", "thread": {"social": {"gplus": {"shares": 2}, "pinterest": {"shares": 0}, "vk": {"shares": 0}, "linkedin": {"shares": 0}, "facebook": {"likes": 216, "shares": 216, "comments": 0}, "stumbledupon": {"shares": 0}}, "site_full": "www.vanguardngr.com", "main_image": "http://www.vanguardngr.com/vangurad.png", "site_section": "http://www.vanguardngr.com/feed", "section_title": "Vanguard News", "url": "http://www.vanguardngr.com/2017/01/senate-threatens-perm-sec-directors-arrest-defaulting-invitation/", "country": "US", "domain_rank": 2203, "title": "Senate threatens perm sec, directors with arrest for defaulting invitation", "performance_score": 2, "site": "vanguardngr.com", "participants_count": 1, "title_full": "Senate threatens perm sec, directors with arrest for defaulting invitation", "spam_score": 0.0, "site_type": "blogs", "published": "2017-01-12T12:45:00.000+02:00", "replies_count": 0, "uuid": "3b8705f58d3e91576387a486566d20df09184825"}, "author": "adekunle", "url": "http://www.vanguardngr.com/2017/01/senate-threatens-perm-sec-directors-arrest-defaulting-invitation/", "ord_in_thread": 0, "title": "Senate threatens perm sec, directors with arrest for defaulting invitation", "locations": [], "entities": {"persons": [{"name": "joseph erunke", "sentiment": "none"}, {"name": "henry umoru", "sentiment": "none"}], "locations": [{"name": "gaya", "sentiment": "none"}, {"name": "kano", "sentiment": "none"}, {"name": "mubi-madagali-michika road", "sentiment": "none"}, {"name": "kaduna", "sentiment": "none"}, {"name": "borno", "sentiment": "none"}, {"name": "adamawa", "sentiment": "none"}, {"name": "kano central", "sentiment": "none"}, {"name": "mararaba", "sentiment": "none"}, {"name": "abuja", "sentiment": "none"}, {"name": "zaria-hunkuyi-kafur-gidan mutundaya road", "sentiment": "none"}, {"name": "kabiru gaya", "sentiment": "none"}], "organizations": [{"name": "senate", "sentiment": "negative"}, {"name": "coasterners engineering and building services limited", "sentiment": "none"}, {"name": "house of representatives", "sentiment": "none"}, {"name": "senate committee on works", "sentiment": "none"}, {"name": "ministry of works", "sentiment": "none"}, {"name": "apc", "sentiment": "none"}]}, "highlightText": "", "language": "english", "persons": [], "text": "Home » News » Senate threatens perm sec, directors with arrest for defaulting invitation Senate threatens perm sec, directors with arrest for defaulting invitation On 6:45 am In News by adekunle Comments \nBy Henry Umoru & Joseph Erunke ABUJA—THE Senate, yesterday, threatened that henceforth, defaulters of its invitations would not be left without arrest, warning that it must be respected along with the House of Representatives. \nChairman, Senate Committee on Works, Kabiru Gaya (APC, Kano Central), handed down the threat following failure of the Permanent Secretary, Ministry of Works and the directors of the ministry to attend an investigative public hearing on alleged fraudulent award of contracts in some parts of the country. \nThe contracts include LOT B2 construction of Mararaba – Mubi-Madagali-Michika Road in Adamawa and Borno states and LOT C3 rehabilitation of the Zaria-Hunkuyi-Kafur-Gidan Mutundaya Road in Kaduna and Kano states. \nGaya said: “Most of the clients are the ministry’s staff and even the petitioners blame the ministry’s staff and none of them is here, not even a representation.” \nThe Senate had scheduled the investigative hearing following allegation by a lawyer to Coasterners Engineering and Building Services Limited that the process leading to the shortlisting of contractors for the two projects were characterised by fraud, manipulation and open disregard of the provisions of the Public Procurement Act, 2007. \nGaya, who was infuriated at the actions of the ministry’s permanent secretary and the directors, resulting in the unexpected postponement of the hearing, slated for the day, insisted that the absentee invitees would not go free in event of repeat of their actions on the yet to be rescheduled date. \nHe said: “We have shifted the public hearing forward and put a new date, if again, they refused to come, then we will do what is within our powers by signing a warrant of arrest and ask the Inspector-General of Police to produce whoever refuses to come.” adekunle", "external_links": [], "published": "2017-01-12T12:45:00.000+02:00", "crawled": "2017-01-12T11:11:45.838+02:00", "highlightTitle": ""}