{"organizations": [], "uuid": "eb52452834607b9418d701e4510920dc02fb7aec", "thread": {"social": {"gplus": {"shares": 1}, "pinterest": {"shares": 0}, "vk": {"shares": 0}, "linkedin": {"shares": 0}, "facebook": {"likes": 219, "shares": 219, "comments": 0}, "stumbledupon": {"shares": 0}}, "site_full": "www.geo.tv", "main_image": "https://www.geo.tv/assets/uploads/updates/2017-01-30/129245_124640_updates.jpg", "site_section": "https://www.geo.tv/rss/1/2", "section_title": "GEO TV - World", "url": "https://www.geo.tv/latest/129245-Dubai-airport-sends-back-handful-of-people-after-Trump-ban", "country": "TV", "domain_rank": 8287, "title": "Dubai airport sends back \"handful of people\" after Trump ban", "performance_score": 2, "site": "geo.tv", "participants_count": 0, "title_full": "Dubai airport sends back \"handful of people\" after Trump ban", "spam_score": 0.0, "site_type": "blogs", "published": "2017-01-30T19:36:00.000+02:00", "replies_count": 0, "uuid": "eb52452834607b9418d701e4510920dc02fb7aec"}, "author": "", "url": "https://www.geo.tv/latest/129245-Dubai-airport-sends-back-handful-of-people-after-Trump-ban", "ord_in_thread": 0, "title": "Dubai airport sends back \"handful of people\" after Trump ban", "locations": [], "entities": {"persons": [{"name": "trump", "sentiment": "negative"}, {"name": "donald trump", "sentiment": "none"}, {"name": "paul griffiths", "sentiment": "none"}], "locations": [{"name": "dubai", "sentiment": "none"}, {"name": "muslim-majority", "sentiment": "none"}, {"name": "united states", "sentiment": "none"}, {"name": "iran", "sentiment": "none"}, {"name": "america", "sentiment": "none"}, {"name": "u.s.", "sentiment": "none"}, {"name": "emirates", "sentiment": "none"}, {"name": "dubai international airport", "sentiment": "none"}, {"name": "yemen", "sentiment": "none"}, {"name": "syria", "sentiment": "none"}, {"name": "dubai airport", "sentiment": "none"}, {"name": "libya", "sentiment": "none"}, {"name": "sudan", "sentiment": "none"}, {"name": "iraq", "sentiment": "none"}, {"name": "somalia", "sentiment": "none"}], "organizations": [{"name": "trump", "sentiment": "negative"}, {"name": "trump ban   world news", "sentiment": "none"}, {"name": "trump ban", "sentiment": "none"}, {"name": "etihad airways", "sentiment": "none"}, {"name": "abu dhabi international", "sentiment": "none"}, {"name": "etihad", "sentiment": "none"}]}, "highlightText": "", "language": "english", "persons": [], "text": "Dubai airport sends back \"handful of people\" after Trump ban | 0 0 \nA \"handful of people\" have been stopped from flying to the United States from Dubai International Airport following a U.S. travel ban on seven Muslim-majority countries, the airport operator's chief executive said on Monday. \n\"The effect has been very minimal at the moment. We don't have the exact figures but literally a handful of people have had to be looked after and repatriated to their point of origin,\" Dubai Airports Chief Executive Paul Griffiths told the Dubai Eye radio station in an interview on Monday. \nDubai airport, is the world's busiest for international travel and the hub for Emirates, the world's largest long-haul airline. \nPresident Donald Trump on Friday suspended the entry of people from Iran, Iraq, Libya, Somalia, Sudan, Syria and Yemen. The decision caught airlines off guard, leading to challenges in enforcing the new rules. \nEmirates said on Sunday it had to change staffing on U.S.-bound flights \"to comply with the latest requirements\" and earlier said that \"a very small number\" of its passengers had been affected by the ban. \nAbu Dhabi International on Sunday directed questions on the number of passengers affected by the ban to its hub carrier Etihad Airways. \nEtihad earlier said \"a number of our passengers\" had been affected and that it had \"taken steps to ensure there will be no issues for flights departing over the coming weeks.\" \nThe airline did not provide further details. 0 0 Dubai airport sends back \"handful of people\" after Trump ban   World News, Trump Ban, Dubai Airport, Dubai Turns Back Passengers, No Flying To Usa, America No Go Area.   \"Dubai airport sends back \"handful of people\" after Trump ban\" is https://www.geo.tv/latest/129245-Dubai-airport-sends-back-handful-of-people-after-Trump-ban . More From World:", "external_links": [], "published": "2017-01-30T19:36:00.000+02:00", "crawled": "2017-01-30T09:49:57.957+02:00", "highlightTitle": ""}