{"organizations": [], "uuid": "bd840587d49b6bb1a78b5e536d44411f65b3ea5b", "thread": {"social": {"gplus": {"shares": 0}, "pinterest": {"shares": 0}, "vk": {"shares": 0}, "linkedin": {"shares": 1}, "facebook": {"likes": 116, "shares": 116, "comments": 0}, "stumbledupon": {"shares": 0}}, "site_full": "www.geo.tv", "main_image": "https://www.geo.tv/assets/uploads/updates/2017-01-18/127851_075642_updates.jpg", "site_section": "http://feeds.feedburner.com/geo/GiKR", "section_title": "GEO TV - Pakistan", "url": "https://www.geo.tv/latest/127851-Alibaba-group-expresses-interest-in-investment-in-Pakistan", "country": "TV", "domain_rank": 8287, "title": "Alibaba group expresses interest in investment in Pakistan", "performance_score": 1, "site": "geo.tv", "participants_count": 0, "title_full": "Alibaba group expresses interest in investment in Pakistan", "spam_score": 0.0, "site_type": "blogs", "published": "2017-01-19T02:52:00.000+02:00", "replies_count": 0, "uuid": "bd840587d49b6bb1a78b5e536d44411f65b3ea5b"}, "author": "", "url": "https://www.geo.tv/latest/127851-Alibaba-group-expresses-interest-in-investment-in-Pakistan", "ord_in_thread": 0, "title": "Alibaba group expresses interest in investment in Pakistan", "locations": [], "entities": {"persons": [{"name": "jack", "sentiment": "negative"}, {"name": "ranil wickremesinghe", "sentiment": "none"}, {"name": "jack ma", "sentiment": "none"}, {"name": "nawaz sharif", "sentiment": "none"}, {"name": "ma", "sentiment": "none"}], "locations": [{"name": "pakistan", "sentiment": "none"}, {"name": "davos", "sentiment": "none"}, {"name": "wef", "sentiment": "none"}, {"name": "switzerland", "sentiment": "none"}, {"name": "davos", "sentiment": "none"}], "organizations": [{"name": "alibaba", "sentiment": "negative"}, {"name": "pakistan alibaba", "sentiment": "negative"}, {"name": "cpec", "sentiment": "none"}, {"name": "world economic forum", "sentiment": "none"}, {"name": "procter & gamble", "sentiment": "none"}, {"name": "china-pakistan economic corridor", "sentiment": "none"}, {"name": "pakistan news", "sentiment": "none"}, {"name": "vimpelcom", "sentiment": "none"}, {"name": "standard chartered bank global", "sentiment": "none"}]}, "highlightText": "", "language": "english", "persons": [], "text": "Alibaba group expresses interest in investment in Pakistan | \nDAVOS: Chairman of Alibaba group Jack Ma met with Prime Minister Nawaz Sharif on Wednesday and showed seen interest in investing in Pakistan. \nBoth met in Davos, Switzerland on the sidelines of the 2017 World Economic Forum. \nJack Ma said that they have a lot of interest in investing and have closely followed positive economic developments in Pakistan and ready to invest in building eCommerce platform. \nHe said that China-Pakistan Economic Corridor (CPEC) has provided immense opportunities. Prime Minister invited Jack Ma to visit Pakistan at the earliest opportunity. \nWhile accepting the invitation Chairman Alibaba group invited Nawaz Sharif to visit his company's hub - Ghuangzou. \nJack Ma mentioned that 60 million companies worldwide were only benefiting from their group at the moment. \nThe Prime Minister, who is attending the ongoing World Economic Forum (WEF) in Davos, Switzerland, also met with Group CEO of Standard Chartered Bank Global, Chairman of Procter & Gamble and Group CEO of VimpelCom. \nPM Nawaz Sharif also met Sri Lankan Prime Minister Ranil Wickremesinghe. 0 0 Alibaba group expresses interest in investment in Pakistan   Geo News, Geo Tv, Latest News Pakistan, Nawaz Sharif, Pakistan, Pakistan News, Wef, Jack Ma, Nawaz Sharif, World Economic Forum, Davos, Switzerland.   \"Alibaba group expresses interest in investment in Pakistan\" is https://www.geo.tv/latest/127851-Alibaba-group-expresses-interest-in-investment-in-Pakistan+geo%2FGiKR+%28Geo+Pakistan+- ", "external_links": [], "published": "2017-01-19T02:52:00.000+02:00", "crawled": "2017-01-18T17:25:36.984+02:00", "highlightTitle": ""}