{"organizations": [], "uuid": "5aad3f5d1df63852640f41e699a58b7a996cb1d3", "thread": {"social": {"gplus": {"shares": 1}, "pinterest": {"shares": 0}, "vk": {"shares": 0}, "linkedin": {"shares": 0}, "facebook": {"likes": 821, "shares": 821, "comments": 0}, "stumbledupon": {"shares": 0}}, "site_full": "www.nba.com", "main_image": "http://i.cdn.turner.com/drp/nba/grizzlies/sites/default/files/cyprien-777-interim-coach-171009.jpg", "site_section": "http://www.nba.com/grizzlies/rss.xml", "section_title": "Memphis Grizzlies", "url": "http://www.nba.com/grizzlies/news/energy-cyprien-named-interim-head-coach-170109/", "country": "US", "domain_rank": 537, "title": "Iowa Energy Head Coach Matt Woodley relieved of duties", "performance_score": 8, "site": "nba.com", "participants_count": 1, "title_full": "Iowa Energy Head Coach Matt Woodley relieved of duties", "spam_score": 0.0, "site_type": "blogs", "published": "2017-01-10T06:22:00.000+02:00", "replies_count": 0, "uuid": "5aad3f5d1df63852640f41e699a58b7a996cb1d3"}, "author": "Malcolm Moore", "url": "http://www.nba.com/grizzlies/news/energy-cyprien-named-interim-head-coach-170109/", "ord_in_thread": 0, "title": "Iowa Energy Head Coach Matt Woodley relieved of duties", "locations": [], "entities": {"persons": [{"name": "matt woodley", "sentiment": "negative"}, {"name": "patrick patterson", "sentiment": "none"}, {"name": "josh harrellson", "sentiment": "none"}, {"name": "glynn cyprien", "sentiment": "none"}, {"name": "sonny weems", "sentiment": "none"}, {"name": "jodie meeks", "sentiment": "none"}, {"name": "khris middleton", "sentiment": "none"}, {"name": "cyprien", "sentiment": "none"}, {"name": "patrick beverley", "sentiment": "none"}, {"name": "will barton", "sentiment": "none"}, {"name": "tony allen", "sentiment": "none"}, {"name": "shawn marion", "sentiment": "none"}, {"name": "john lucas iii", "sentiment": "none"}, {"name": "josh pastner", "sentiment": "none"}], "locations": [{"name": "texas", "sentiment": "none"}, {"name": "frisco", "sentiment": "none"}, {"name": "memphis", "sentiment": "none"}, {"name": "new orleans", "sentiment": "none"}], "organizations": [{"name": "iowa energy head", "sentiment": "negative"}, {"name": "grizzlies basketball operations", "sentiment": "negative"}, {"name": "new mexico state university", "sentiment": "none"}, {"name": "ncaa", "sentiment": "none"}, {"name": "jacksonville university", "sentiment": "none"}, {"name": "university of arkansas", "sentiment": "none"}, {"name": "university of nevada las vegas", "sentiment": "none"}, {"name": "tigers", "sentiment": "none"}, {"name": "southern university-new orleans", "sentiment": "none"}, {"name": "university of kentucky", "sentiment": "none"}, {"name": "texas a&m university", "sentiment": "none"}, {"name": "utsa", "sentiment": "none"}, {"name": "university of memphis", "sentiment": "none"}, {"name": "nba", "sentiment": "none"}, {"name": "iowa energy on facebook", "sentiment": "none"}, {"name": "energy", "sentiment": "none"}, {"name": "western kentucky university", "sentiment": "none"}, {"name": "greensboro swarm", "sentiment": "none"}, {"name": "iowa energy", "sentiment": "none"}, {"name": "oklahoma state university", "sentiment": "none"}, {"name": "wells fargo arena ticket office", "sentiment": "none"}, {"name": "memphis grizzlies", "sentiment": "none"}, {"name": "wells fargo arena", "sentiment": "none"}, {"name": "university of texas-san antonio", "sentiment": "none"}, {"name": "lamar university", "sentiment": "none"}, {"name": "texas legends", "sentiment": "none"}]}, "highlightText": "", "language": "english", "persons": [], "text": "Iowa Energy Head Coach Matt Woodley relieved of duties Grizzlies Basketball Operations Assistant/Scout Glynn Cyprien Named Interim Head Coach Posted: Jan 09, 2017 \nThe Iowa Energy announced today that Head Coach Matt Woodley has been relieved of his head coaching duties, effective immediately. \nGlynn Cyprien , a native of New Orleans, has been named Interim Head Coach of the Energy. \nGlynn Cyprien joined the Memphis Grizzlies during the 2014-15 season as basketball operations assistant/scout, returning to the city where he helped guide the University of Memphis to 49 victories and consecutive postseason tournament appearances in two seasons (2009-11) as an assistant coach under Josh Pastner. The Tigers went 25-10 during the 2010-11 season, winning the Conference USA Tournament Championship and advancing to the second round of the NCAA Tournament. \nWidely considered one of the top assistants and recruiters in the country during his years on the collegiate scene, Cyprien coached or recruited current and former NBA players such as Tony Allen, Khris Middleton, Patrick Patterson, Patrick Beverley, Jodie Meeks, Will Barton, Sonny Weems, Josh Harrellson, John Lucas III and Shawn Marion. \nBefore returning to Memphis, Cyprien served three seasons (2011-14) as associate head coach at Texas A&M University. His resume also includes assistant coaching stints with the University of Kentucky (2007-09), the University of Arkansas (2006-07), New Mexico State University (2005-06), Oklahoma State University (2000-04), the University of Nevada Las Vegas (1995-2000), Western Kentucky University (1994-95), Jacksonville University (1991-94), Lamar University (1990-91) and the University of Texas-San Antonio (1987-90). \nThe New Orleans native lettered two seasons as a player at Southern University-New Orleans and earned his bachelorâ€™s degree in physical education from UTSA in 2004. \nThe Energy travel to Frisco, Texas this Wednesday, January 11 to take on the Texas Legends. The Energy return home to Wells Fargo Arena this Sunday, January 15 for a 4 p.m. matchup against the Greensboro Swarm. The \"90s Throwback\" game, presented by 98.3 The Vibe, will feature 90s music, outfits, dance routines and more! To purchase tickets, visit IowaNBA.com, call (515) 564-8550 or visit the Wells Fargo Arena Ticket Office. \nFor more information on the Energy, 'like' Iowa Energy on Facebook or follow on Twitter and Instagram (@iowaenergy). Tags", "external_links": [], "published": "2017-01-10T06:22:00.000+02:00", "crawled": "2017-01-11T02:04:54.619+02:00", "highlightTitle": ""}