{"organizations": [], "uuid": "f6484e5f81097b756497717138a59c55278407f6", "thread": {"social": {"gplus": {"shares": 0}, "pinterest": {"shares": 0}, "vk": {"shares": 0}, "linkedin": {"shares": 0}, "facebook": {"likes": 162, "shares": 162, "comments": 0}, "stumbledupon": {"shares": 0}}, "site_full": "www.geo.tv", "main_image": "https://www.geo.tv/assets/uploads/updates/2017-01-30/128966_061944_updates.jpg", "site_section": "http://feeds.feedburner.com/GeoBulletins", "section_title": "GEO TV - Pakistan", "url": "https://www.geo.tv/latest/128966-Govt-picks-Zubair-as-new-Sindh-governor", "country": "TV", "domain_rank": 8287, "title": "Govt picks Muhammad Zubair as new Sindh governor", "performance_score": 1, "site": "geo.tv", "participants_count": 0, "title_full": "Govt picks Muhammad Zubair as new Sindh governor", "spam_score": 0.0, "site_type": "blogs", "published": "2017-01-31T02:11:00.000+02:00", "replies_count": 0, "uuid": "f6484e5f81097b756497717138a59c55278407f6"}, "author": "", "url": "https://www.geo.tv/latest/128966-Govt-picks-Zubair-as-new-Sindh-governor", "ord_in_thread": 0, "title": "Govt picks Muhammad Zubair as new Sindh governor", "locations": [], "entities": {"persons": [{"name": "govt", "sentiment": "negative"}, {"name": "muhammad zubair", "sentiment": "negative"}, {"name": "karach", "sentiment": "negative"}, {"name": "sindh saeed-uz-zaman", "sentiment": "negative"}, {"name": "zubair", "sentiment": "none"}, {"name": "saeed uz zaman siddiqui", "sentiment": "none"}, {"name": "nawaz sharif", "sentiment": "none"}, {"name": "saeed uz zaman siddiqui", "sentiment": "none"}], "locations": [{"name": "islamabad", "sentiment": "none"}, {"name": "pakistan", "sentiment": "none"}, {"name": "karachi", "sentiment": "none"}, {"name": "sindh", "sentiment": "none"}, {"name": "middle east", "sentiment": "none"}], "organizations": [{"name": "sindh", "sentiment": "negative"}, {"name": "board of investment", "sentiment": "none"}, {"name": "ibm", "sentiment": "none"}, {"name": "privatisation commission", "sentiment": "none"}, {"name": "africa region", "sentiment": "none"}, {"name": "sindh governor justice", "sentiment": "none"}, {"name": "geo news", "sentiment": "none"}]}, "highlightText": "", "language": "english", "persons": [], "text": "Govt picks Muhammad Zubair as new Sindh governor | Governor Sindh Saeed-uz-Zaman passes away \nKARACHI: The government has picked Muhammad Zubair as the Sindh governor, Geo News learnt Monday, after the position fell vacant following the demise of Governor Saeed uz Zaman Siddiqui. \nMuhammad Zubair, who until now had been serving as chairman of Privatisation Commission, has been chosen for the post. They say an official announcement in this regard will soon be made. \nSpeaking exclusively to Geo News, Zubair confirmed his nomination as Sindh governor saying that improvement in situation of Sindh, particularly Karachi, will be his top priority. \nHe said that Sindh is the most sensitive province in the country, however, law and order situation in Karachi has significantly improved due to the measures taken on Prime Minister Nawaz Sharif's directives. \nZubair, an IBA graduate, has proven his mettle in the professional sector. He has spent 26 years with IBM from 1981 to 2007 as the chief financial officer for Middle East / Africa Region, as well as with IBM Pakistan. \nPreviously, he has also served as chairman of Board of Investment. \nOn January 12, Sindh Governor Justice (Retd) Saeed uz Zaman Siddiqui passed away after a prolonged illness. He was 79. \nThe key position had since been vacant. \n0 0 Govt picks Muhammad Zubair as new Sindh governor was posted in pakistan   Government, Governor, Muhammad Zubair, Picks, Sindh, Governor Saeed Uz Zaman Siddiqui, Muhammad Zubair, Islamabad, Karachi.   \"Govt picks Muhammad Zubair as new Sindh governor\" is https://www.geo.tv/latest/128966-Govt-picks-Zubair-as-new-Sindh-governor . More From Pakistan:", "external_links": [], "published": "2017-01-31T02:11:00.000+02:00", "crawled": "2017-01-30T16:23:57.332+02:00", "highlightTitle": ""}