{"organizations": [], "uuid": "4d7f688c7f8ca657f5e11af3c0453741626713e2", "thread": {"social": {"gplus": {"shares": 2}, "pinterest": {"shares": 0}, "vk": {"shares": 0}, "linkedin": {"shares": 0}, "facebook": {"likes": 128, "shares": 128, "comments": 0}, "stumbledupon": {"shares": 0}}, "site_full": "www.geo.tv", "main_image": "https://www.geo.tv/assets/uploads/updates/2017-01-15/127366_070651_updates.jpg", "site_section": "http://feeds.feedburner.com/GeoBulletins", "section_title": "GEO TV - Sports", "url": "https://www.geo.tv/latest/127366-62nd-Filmfare-Awards-2017-And-the-winners-are", "country": "TV", "domain_rank": 8287, "title": "62nd Filmfare Awards 2017- And the winners are?.", "performance_score": 1, "site": "geo.tv", "participants_count": 0, "title_full": "62nd Filmfare Awards 2017- And the winners are?.", "spam_score": 0.0, "site_type": "blogs", "published": "2017-01-15T13:57:00.000+02:00", "replies_count": 0, "uuid": "4d7f688c7f8ca657f5e11af3c0453741626713e2"}, "author": "", "url": "https://www.geo.tv/latest/127366-62nd-Filmfare-Awards-2017-And-the-winners-are", "ord_in_thread": 0, "title": "62nd Filmfare Awards 2017- And the winners are?.", "locations": [], "entities": {"persons": [{"name": "shatrughan sinha", "sentiment": "none"}, {"name": "adil shaikh", "sentiment": "none"}, {"name": "aamir khan", "sentiment": "none"}, {"name": "shyam kaushal", "sentiment": "none"}, {"name": "kar gayi chull", "sentiment": "none"}, {"name": "neerja bhanot", "sentiment": "none"}, {"name": "ashwini iyer tiwari", "sentiment": "none"}, {"name": "sonam kapoor", "sentiment": "none"}, {"name": "ritesh shah", "sentiment": "none"}, {"name": "neha bhasin", "sentiment": "none"}, {"name": "dangal", "sentiment": "none"}, {"name": "shahid kapoor", "sentiment": "none"}, {"name": "payal saluja", "sentiment": "none"}, {"name": "dil hai mushkil", "sentiment": "none"}, {"name": "neerja", "sentiment": "none"}, {"name": "amit mishra", "sentiment": "none"}, {"name": "alia bhatt", "sentiment": "none"}, {"name": "arijit singh", "sentiment": "none"}, {"name": "rahat fateh ali khan", "sentiment": "none"}, {"name": "nitesh tiwari", "sentiment": "none"}, {"name": "ritika singh", "sentiment": "none"}, {"name": "shakun batra", "sentiment": "none"}, {"name": "saala khadoos", "sentiment": "none"}, {"name": "pritam", "sentiment": "none"}, {"name": "tisca chopra", "sentiment": "none"}, {"name": "battey sannata", "sentiment": "none"}, {"name": "amitabh bhattacharya", "sentiment": "none"}, {"name": "rishi kapoor", "sentiment": "none"}, {"name": "atif aslam", "sentiment": "none"}, {"name": "bulleya", "sentiment": "none"}, {"name": "karan johar", "sentiment": "none"}, {"name": "shabana azmi", "sentiment": "none"}, {"name": "shahrukh khan", "sentiment": "none"}, {"name": "monisha baldawa", "sentiment": "none"}, {"name": "sameer uddin", "sentiment": "none"}, {"name": "ayesha devitre dhillon", "sentiment": "none"}, {"name": "channa mereya", "sentiment": "none"}, {"name": "diljit dosanjh", "sentiment": "none"}, {"name": "manoj bajpayee", "sentiment": "none"}, {"name": "fawad khan", "sentiment": "none"}], "locations": [{"name": "mumbai", "sentiment": "none"}, {"name": "aligarh", "sentiment": "none"}, {"name": "mubmai", "sentiment": "none"}, {"name": "bollywood", "sentiment": "none"}, {"name": "udta punjab", "sentiment": "none"}], "organizations": [{"name": "kapoor & sons", "sentiment": "none"}, {"name": "'kapoor & sons", "sentiment": "none"}, {"name": "indian television industry", "sentiment": "none"}, {"name": "bollywood", "sentiment": "none"}]}, "highlightText": "", "language": "english", "persons": [], "text": "62nd Filmfare Awards 2017- And the winners are…. | 0 0 \nMUMBAI: Celebrities descended in all their glory at the biggest night in Bollywood this year on Saturday. \nThe star-studded 62nd Filmfare awards was hosted by Bollywood’s biggest stars — Shahrukh Khan with Karan Johar. Record viewership was expected for this grand gala, and trade experts believe that this event marked a new history in the Indian Television Industry. \nFive Pakistanis were nominated in different categories: Fawad Khan for Best Actor in a Supporting Role (Male), Atif Aslam and Rahat Fateh Ali Khan for Best Playback Singer (Male) and Qurat-ul-Ain Balouch for Best Playback Singer (Female), however, none of them won. \nFor the first time, social media giant Twitter was also a part of this grand event. The behind-the-scene moments was enjoyed in Twitter's 'Periscope 360'. \nAamir Khan bagged the Best Actor Award for his performance in 'Dangal'. Alia Bhatt was honoured with the Best Actress Award for her gritty portrayal of a Bihari migrant in 'Udta Punjab'. Rounding up the top awards was 'Dangal' again- the wrestling drama was awarded the Best Film and Nitesh Tiwari bagged the Best Director Award. \nSonam Kapoor won the Critics Award for Best Actor (Female) for her portrayal of Neerja Bhanot in the biopic 'Neerja'. Actors Shahid Kapoor and Manoj Bajpayee got the Best Actor (Male) nod for their performances in 'Udta Punjab' and 'Aligarh' respectively. \n'Neerja' and 'Kapoor & Sons (Since 1921)' won five awards each. Actor Shatrughan Sinha took home the Filmfare Lifetime Achievement Award. \nHere is the complete list of those who won big at the 62nd Jio Filmfare Awards 2017. \nBest Actor (Male): Aamir Khan for 'Dangal' \nBest Actor (Female): Alia Bhatt for 'Udta Punjab' \nBest Film: 'Dangal' \nBest Director: Nitesh Tiwari for 'Dangal' \nFilmfare Critics Award for Best Film: 'Neerja' \nFilmfare Critics Award for Best Actor (Male): Shahid Kapoor for 'Udta Punjab' and Manoj Bajpayee for 'Aligarh' \nFilmfare Critics Award for Best Actor (Female): Sonam Kapoor for 'Neerja' \nBest Actor (Male) in a Short Film: Manoj Bajpayee for 'Taandav' \nBest Short Film People's Choice: Khamakha \nBest Short Film (Fiction): 'Chutney' \nBest Short Film (Non-fiction): 'Matitali Kusti' \nBest Actor (Female) in a Short Film: Tisca Chopra for 'Chutney' \nBest Debut Director: Ashwini Iyer Tiwari for 'Nil Battey Sannata' \nBest Male Debut: Diljit Dosanjh for 'Udta Punjab' \nBest Female Debut: Ritika Singh for 'Saala Khadoos' \nBest Dialogue: Ritesh Shah for 'Pink' \nBest Screenplay: Shakun Batra and Ayesha Devitre Dhillon for 'Kapoor & Sons (Since 1921)' \nBest Story: Shakun Batra and Ayesha Devitre Dhillon for 'Kapoor & Sons (Since 1921)' \nBest Actor in a Supporting Role (Male): Rishi Kapoor for 'Kapoor & Sons (Since 1921)' \nBest Actor in a Supporting Role (Female): Shabana Azmi for 'Neerja' \nFilmfare Lifetime Achievement Award: Shatrughan Sinha \nBest Music Album: Pritam for 'Ae Dil Hai Mushkil' \nBest Lyricist: Amitabh Bhattacharya for 'Channa Mereya' from 'Ae Dil Hai Mushkil' \nBest Playback Singer (Male): Arijit Singh for 'Ae Dil Hai Mushkil' from 'Ae Dil Hai Mushkil' \nBest Playback Singer (Female): Neha Bhasin for 'Jag Ghoomeya' from 'Sultan' \nFilmfare RD Burman Award for New Music Talent: Amit Mishra for 'Bulleya' from 'Ae Dil Hai Mushkil' \nBest Visual Effects: Red Chillies for 'Fan' \nBest Editing: Monisha Baldawa for 'Neerja' \nBest Costume: Payal Saluja for 'Udta Punjab' \nBest Action: Shyam Kaushal for 'Dangal' \nBest Background Score: Sameer Uddin for 'Kapoor & Sons (Since 1921)' \nBest Choreography: Adil Shaikh for 'Kar Gayi Chull' in 'Kapoor & Sons (Since 1921)' 0 0 62nd Filmfare Awards 2017- And the winners are…. was posted in entertainment   Entertainment News, Latest Entertainment News, Geo News, Filmfare Awards, Mubmai, Aamir Khan, Alia Bhatt, Shahid Kapoor, Sonam Kapoor.   \"62nd Filmfare Awards 2017- And the winners are….\" is https://www.geo.tv/latest/127366-62nd-Filmfare-Awards-2017-And-the-winners-are . More From Entertainment:", "external_links": [], "published": "2017-01-15T13:57:00.000+02:00", "crawled": "2017-01-15T05:04:40.248+02:00", "highlightTitle": ""}