{"organizations": [], "uuid": "d2e5c071df6ab9fe7cb58b61424d400f22ea699a", "thread": {"social": {"gplus": {"shares": 0}, "pinterest": {"shares": 0}, "vk": {"shares": 0}, "linkedin": {"shares": 0}, "facebook": {"likes": 354, "shares": 354, "comments": 0}, "stumbledupon": {"shares": 0}}, "site_full": "www.geo.tv", "main_image": "https://www.geo.tv/assets/uploads/updates/2017-01-06/126380_051954_updates.jpg", "site_section": "http://feeds.feedburner.com/geo/GiKR", "section_title": "GEO TV - Pakistan", "url": "https://www.geo.tv/latest/126380-COAS-praises-boxer-Muhammad-Waseem-for-his-achievements", "country": "TV", "domain_rank": 8287, "title": "COAS praises boxer Muhammad Waseem for his achievements", "performance_score": 3, "site": "geo.tv", "participants_count": 0, "title_full": "COAS praises boxer Muhammad Waseem for his achievements", "spam_score": 0.0, "site_type": "blogs", "published": "2017-01-07T00:19:00.000+02:00", "replies_count": 0, "uuid": "d2e5c071df6ab9fe7cb58b61424d400f22ea699a"}, "author": "", "url": "https://www.geo.tv/latest/126380-COAS-praises-boxer-Muhammad-Waseem-for-his-achievements", "ord_in_thread": 0, "title": "COAS praises boxer Muhammad Waseem for his achievements", "locations": [], "entities": {"persons": [{"name": "muhammad waseem", "sentiment": "negative"}, {"name": "boxer", "sentiment": "none"}, {"name": "boxer muhammad waseem", "sentiment": "none"}, {"name": "qamar javed bajwa", "sentiment": "none"}], "locations": [{"name": "rawalpindi", "sentiment": "none"}, {"name": "pakistan", "sentiment": "none"}], "organizations": [{"name": "world boxing council", "sentiment": "negative"}, {"name": "wbc", "sentiment": "negative"}, {"name": "coas", "sentiment": "negative"}, {"name": "army", "sentiment": "none"}, {"name": "pakistan army", "sentiment": "none"}, {"name": "general headquarters", "sentiment": "none"}, {"name": "ispr", "sentiment": "none"}, {"name": "ispr", "sentiment": "none"}, {"name": "army staff", "sentiment": "none"}, {"name": "inter services public relations", "sentiment": "none"}]}, "highlightText": "", "language": "english", "persons": [], "text": "COAS praises boxer Muhammad Waseem for his achievements | 0 0 \nRAWALPINDI: World Boxing Council (WBC) Silver Flyweight Champion Muhammad Waseem Friday met Chief of Army Staff (COAS) General Qamar Javed Bajwa, according to the Inter Services Public Relations (ISPR). \nThe meeting was held at the General Headquarters here, the ISPR said in a statement. The COAS praised boxer Muhammad Waseem for his outstanding achievements. \nThe army chief expressed his confidence that Pakistani youth will follow in his footsteps to bring good name to the country, it added. 0 0 COAS praises boxer Muhammad Waseem for his achievements   Coas, Praises, Boxer, Muhammad Waseem, Achievements, Ispr, Pakistan, Pakistan News, Latest News, General Qamar Javed Bajwa, Boxer Muhammad Waseem, Rawalpindi, Pakistan Army.   \"COAS praises boxer Muhammad Waseem for his achievements\" is https://www.geo.tv/latest/126380-COAS-praises-boxer-Muhammad-Waseem-for-his-achievements+geo%2FGiKR+%28Geo+Pakistan+- ", "external_links": [], "published": "2017-01-07T00:19:00.000+02:00", "crawled": "2017-01-06T16:04:34.767+02:00", "highlightTitle": ""}