{"organizations": [], "uuid": "44670562cb308211e82b8f78c40d4074dec063f4", "thread": {"social": {"gplus": {"shares": 0}, "pinterest": {"shares": 0}, "vk": {"shares": 0}, "linkedin": {"shares": 0}, "facebook": {"likes": 114, "shares": 114, "comments": 0}, "stumbledupon": {"shares": 0}}, "site_full": "www.vanguardngr.com", "main_image": "http://d19lga30codh7.cloudfront.net/wp-content/uploads/2017/01/Liverpool-Plymouth.png", "site_section": "http://www.vanguardngr.com/feed", "section_title": "Vanguard News", "url": "http://www.vanguardngr.com/2017/01/english-fa-cup-fourth-round-ties/", "country": "US", "domain_rank": 2203, "title": "English FA Cup fourth round ties", "performance_score": 1, "site": "vanguardngr.com", "participants_count": 1, "title_full": "English FA Cup fourth round ties", "spam_score": 0.0, "site_type": "blogs", "published": "2017-01-10T02:54:00.000+02:00", "replies_count": 0, "uuid": "44670562cb308211e82b8f78c40d4074dec063f4"}, "author": "Okogba", "url": "http://www.vanguardngr.com/2017/01/english-fa-cup-fourth-round-ties/", "ord_in_thread": 0, "title": "English FA Cup fourth round ties", "locations": [], "entities": {"persons": [{"name": "bolton", "sentiment": "none"}], "locations": [{"name": "derby county", "sentiment": "none"}, {"name": "east midlands", "sentiment": "none"}, {"name": "leicester city", "sentiment": "none"}], "organizations": [{"name": "blackpool  fulham", "sentiment": "none"}, {"name": "tottenham hotspur", "sentiment": "none"}, {"name": "norwich city", "sentiment": "none"}, {"name": "fleetwood town", "sentiment": "none"}, {"name": "barnsley", "sentiment": "none"}, {"name": "premier league", "sentiment": "none"}, {"name": "ipswich", "sentiment": "none"}, {"name": "watford  burnley", "sentiment": "none"}, {"name": "hull city  crystal palace", "sentiment": "none"}, {"name": "liverpool", "sentiment": "none"}, {"name": "cambridge united", "sentiment": "none"}, {"name": "arsenal  lincoln", "sentiment": "none"}, {"name": "leeds united  plymouth argyle", "sentiment": "none"}, {"name": "brighton  chelsea", "sentiment": "none"}, {"name": "wycombe wanderers  derby county", "sentiment": "none"}, {"name": "bristol city  blackburn rovers", "sentiment": "none"}, {"name": "manchester city okogba", "sentiment": "none"}, {"name": "newcastle united", "sentiment": "none"}, {"name": "birmingham city  afc wimbledon", "sentiment": "none"}, {"name": "okogba comments  holders manchester united", "sentiment": "none"}, {"name": "wolverhampton wanderers  southampton", "sentiment": "none"}, {"name": "brentford  manchester united", "sentiment": "none"}, {"name": "sunderland", "sentiment": "none"}, {"name": "sutton united", "sentiment": "none"}, {"name": "leicester city  oxford united", "sentiment": "none"}, {"name": "wigan athletic", "sentiment": "none"}, {"name": "wigan athletic  millwall", "sentiment": "none"}]}, "highlightText": "", "language": "english", "persons": [], "text": "Home » Sports » English FA Cup fourth round ties English FA Cup fourth round ties On 8:54 pm In Sports by Okogba Comments \nHolders Manchester United will host 2013 winners Wigan Athletic in the fourth round of the FA Cup. \nPremier League champions Leicester City will travel to Derby County in an East Midlands derby. \nThe fourth round represents the last-32 stage of the competition, and all ties are scheduled to be played between 27-30 January. \nDraw in full: \nTottenham Hotspur v Wycombe Wanderers \nDerby County v Leicester City \nOxford United v Newcastle United or Birmingham City \nAFC Wimbledon or Sutton United v Cambridge United or Leeds United \nPlymouth Argyle or Liverpool v Wolverhampton Wanderers \nSouthampton or Norwich City v Arsenal \nLincoln or Ipswich v Brighton \nChelsea v Brentford \nManchester United v Wigan Athletic \nMillwall v Watford \nBurnley or Sunderland v Fleetwood Town or Bristol City \nBlackburn Rovers v Barnsley or Blackpool \nFulham v Hull City \nCrystal Palace or Bolton v Manchester City Okogba", "external_links": [], "published": "2017-01-10T02:54:00.000+02:00", "crawled": "2017-01-10T00:50:30.543+02:00", "highlightTitle": ""}