{"organizations": [], "uuid": "346078261cf508a9c4909cbb84734400ced6bf31", "thread": {"social": {"gplus": {"shares": 3}, "pinterest": {"shares": 0}, "vk": {"shares": 0}, "linkedin": {"shares": 0}, "facebook": {"likes": 170, "shares": 170, "comments": 0}, "stumbledupon": {"shares": 0}}, "site_full": "www.vanguardngr.com", "main_image": "http://d19lga30codh7.cloudfront.net/wp-content/uploads/2016/12/Pedro.png", "site_section": "http://www.vanguardngr.com/feed", "section_title": "Vanguard News", "url": "http://www.vanguardngr.com/2017/01/fa-cup-chelsea-ease-past-peterborough-4-1/", "country": "US", "domain_rank": 2203, "title": "FA Cup: Chelsea ease past Peterborough 4-1", "performance_score": 1, "site": "vanguardngr.com", "participants_count": 1, "title_full": "FA Cup: Chelsea ease past Peterborough 4-1", "spam_score": 0.0, "site_type": "blogs", "published": "2017-01-09T03:12:00.000+02:00", "replies_count": 0, "uuid": "346078261cf508a9c4909cbb84734400ced6bf31"}, "author": "adekunle", "url": "http://www.vanguardngr.com/2017/01/fa-cup-chelsea-ease-past-peterborough-4-1/", "ord_in_thread": 0, "title": "FA Cup: Chelsea ease past Peterborough 4-1", "locations": [], "entities": {"persons": [{"name": "chelsea", "sentiment": "negative"}, {"name": "pedro", "sentiment": "none"}, {"name": "antonio conte", "sentiment": "none"}, {"name": "john terry", "sentiment": "none"}, {"name": "batshuayi", "sentiment": "none"}, {"name": "asmir begovic", "sentiment": "none"}, {"name": "willian", "sentiment": "none"}, {"name": "lee angol", "sentiment": "none"}, {"name": "tom nicholls", "sentiment": "none"}, {"name": "michy batshuayi", "sentiment": "none"}, {"name": "rodriguez pedro", "sentiment": "none"}, {"name": "victor moses", "sentiment": "none"}], "locations": [{"name": "peterborough", "sentiment": "none"}, {"name": "chelsea", "sentiment": "none"}, {"name": "nigeria", "sentiment": "none"}, {"name": "stamford bridge", "sentiment": "none"}, {"name": "abuja", "sentiment": "none"}, {"name": "cardiff city stadium", "sentiment": "none"}, {"name": "bournemouth", "sentiment": "none"}, {"name": "london", "sentiment": "none"}], "organizations": [{"name": "peterborough", "sentiment": "negative"}, {"name": "fulham", "sentiment": "none"}, {"name": "middlesbrough", "sentiment": "none"}, {"name": "cardiff", "sentiment": "none"}, {"name": "nan", "sentiment": "none"}, {"name": "sheffield wednesday", "sentiment": "none"}]}, "highlightText": "", "language": "english", "persons": [], "text": "Home » Sports » FA Cup: Chelsea ease past Peterborough 4-1 FA Cup: Chelsea ease past Peterborough 4-1 On 9:12 pm In Sports by adekunle Comments \nAbuja – Chelsea cruised into the fourth round of the English FA Cup on Sunday after thrashing Peterborough 4-1. \nA brace from Rodriguez Pedro, and a goal each from Michy Batshuayi and Willian saw Chelsea ease past Peterborough at Stamford Bridge. \nThe Blues made nine changes for the third-round tie and almost trailed when Asmir Begovic saved Lee Angol’s close-range header. \nBut Antonio Conte’s side had 20 shots by half time, with Pedro’s curled finish and a drilled Batshuayi effort giving them a cushion. \nWillian later drove in from 18 yards after the break. Chelsea’s Spanish midfielder Pedro (C) celebrates scoring the opening goal during the English Premier League football match between Chelsea and Bournemouth at Stamford Bridge in London on December 26, 2016. / AFP PHOTO \nChelsea’s captain John Terry however saw red for bringing Angol down as the last man in the 67th minute, and Tom Nicholls prodded in from six yards to make it 3-1. \nBut Chelsea put the game past the visitors after Pedro restored a three-goal advantage from the edge of the box in the 75th minute. \nNigeria’s Victor Moses who made the team list was however an unused substitute. \nIn other FA Cup matches also played on Sunday, 10-man Middlesbrough made it into the fourth round with a win over Championship side Sheffield Wednesday. \nAlso, Fulham comfortably beat Cardiff 2-1 at a poorly-attended Cardiff City Stadium. \nNAN also reports that the fourth round draw will take place on Monday.(NAN) VO/OLAL", "external_links": [], "published": "2017-01-09T03:12:00.000+02:00", "crawled": "2017-01-09T00:01:16.688+02:00", "highlightTitle": ""}