{"organizations": [], "uuid": "0959c89f0d7a244fced952d22f083cab18e84bda", "thread": {"social": {"gplus": {"shares": 1}, "pinterest": {"shares": 1}, "vk": {"shares": 0}, "linkedin": {"shares": 0}, "facebook": {"likes": 629, "shares": 629, "comments": 0}, "stumbledupon": {"shares": 0}}, "site_full": "www.telegraph.co.uk", "main_image": "http://www.telegraph.co.uk/content/dam/news/2016/12/31/JS116797553-AFP-Trump-estate-xlarge_trans_NvBQzQNjv4BqDI1jieMJtrozPRHESlT58gtCr9CEJaQ2HQ27XRihXxE.jpg", "site_section": "http://www.telegraph.co.uk/newsfeed/rss/news_main.xml", "section_title": "News", "url": "http://www.telegraph.co.uk/news/2017/01/11/donald-trump-briefed-former-british-spys-report-russia-claims/", "country": "GB", "domain_rank": 317, "title": "Donald Trump 'briefed on former British spy's report that Russia claims to have damaging information about him'", "performance_score": 6, "site": "telegraph.co.uk", "participants_count": 1, "title_full": "Donald Trump 'briefed on former British spy's report that Russia claims to have damaging information about him'", "spam_score": 0.0, "site_type": "blogs", "published": "2017-01-11T08:47:00.000+02:00", "replies_count": 0, "uuid": "0959c89f0d7a244fced952d22f083cab18e84bda"}, "author": "David Lawler", "url": "http://www.telegraph.co.uk/news/2017/01/11/donald-trump-briefed-former-british-spys-report-russia-claims/", "ord_in_thread": 0, "title": "Donald Trump 'briefed on former British spy's report that Russia claims to have damaging information about him'", "locations": [], "entities": {"persons": [{"name": "donald trump", "sentiment": "negative"}, {"name": "rex tillerson", "sentiment": "none"}, {"name": "hillary clinton", "sentiment": "none"}, {"name": "james comey", "sentiment": "none"}, {"name": "putin", "sentiment": "none"}, {"name": "barack obama", "sentiment": "none"}, {"name": "trump", "sentiment": "none"}, {"name": "david lawler", "sentiment": "none"}, {"name": "mr trump", "sentiment": "none"}, {"name": "— donald j. trump", "sentiment": "none"}, {"name": "vladimir putin", "sentiment": "none"}, {"name": "buzzfeed", "sentiment": "none"}], "locations": [{"name": "russia", "sentiment": "none"}, {"name": "britain", "sentiment": "none"}, {"name": "us", "sentiment": "none"}, {"name": "washington", "sentiment": "none"}, {"name": "moscow", "sentiment": "none"}, {"name": "trump tower", "sentiment": "none"}, {"name": "kremlin", "sentiment": "none"}, {"name": "uk", "sentiment": "none"}, {"name": "london", "sentiment": "none"}], "organizations": [{"name": "nsa", "sentiment": "none"}, {"name": "democratic national committee", "sentiment": "none"}, {"name": "exxon mobil", "sentiment": "none"}, {"name": "reuters", "sentiment": "none"}, {"name": "cia", "sentiment": "none"}, {"name": "cnn", "sentiment": "none"}, {"name": "state credit", "sentiment": "none"}, {"name": "foreign relations committee", "sentiment": "none"}, {"name": "fbi", "sentiment": "none"}, {"name": "senate", "sentiment": "none"}, {"name": "michael reynolds/epa  t", "sentiment": "none"}, {"name": "follow telegraph news", "sentiment": "none"}, {"name": "buzzfeed news", "sentiment": "none"}]}, "highlightText": "", "language": "english", "persons": [], "text": "Donald Trump 'briefed on former British spy's report that Russia claims to have damaging information about him' Donald Trump Credit: AFP David Lawler , Washington 11 January 2017 • 1:47am \nA former British spy reportedly tipped off US intelligence that Russian operatives are claiming to have compiled compromising information about Donald Trump , it emerged on Tuesday night. \nThe claims that Russia has potentially damaging information about Mr Trump were included in an addendum to a top secret report presented last week to the president-elect and to President Barack Obama, according to CNN . \nAccording to the report, the British source informed the US that Russian operatives were claiming to have compromising personal and financial information about Mr Trump. The FBI is now investigating the veracity of the Russian claims. \nWhile intelligence sources told CNN they consider the former British agent’s past work credible, doubts were raised after Buzzfeed News published a full version of the agent’s disclosures . James Comey, the FBI director Credit: Michael Reynolds/EPA \nT hey included factual errors, as well as allegations that Russia was aware of “sexual perversion” engaged in by Mr Trump during a visit to Moscow. According to Buzzfeed , the dossier was prepared for Mr Trump’s political rivals. \nMr Trump responded to the report on Twitter: FAKE NEWS - A TOTAL POLITICAL WITCH HUNT! — Donald J. Trump (@realDonaldTrump) January 11, 2017 \nA two-page summary of the findings was included in the report of Russia’s interference in the US election. \nThe director of national intelligence and the chiefs of the CIA, FBI and NSA all travelled to Trump Tower to brief Mr Trump on the report last Friday. Vladimir Putin Credit: AFP \nA fter the meeting Mr Trump for the first time accepted the possibility that Russia may have been behind the hacks of the Democratic National Committee and Hillary Clinton’s campaign chairman, but insisted that Russia’s efforts did not impact the election result. He also emphasised the importance of warmer relations with Moscow. \nJames Comey, the FBI director, declined to answer when asked during a Senate hearing on Tuesday whether the FBI was conducting an investigation into ties between Mr Trump or his associates and Russia. \nThe Senate's Foreign Relations Committee will hold a confirmation hearing for Rex Tillerson, Mr Trump’s nominee for be secretary of state, on Wednesday. Rex Tillerson, nominee for secretary of state Credit: Reuters \nS enators from both parties have expressed concern about the former Exxon Mobil chief executive’s close working relationship with key figures in the Kremlin during his time at the oil company. \nWhile Mr Trump has said he will improve relations with Russia, the country’s relationship with the UK may be souring. \nRussia has claimed Britain is launching an “official witch-hunt” against Mr Putin’s administration in an 800-word statement posted online on Tuesday by the country’s embassy in London. Follow Telegraph News", "external_links": [], "published": "2017-01-11T08:47:00.000+02:00", "crawled": "2017-01-11T03:53:28.888+02:00", "highlightTitle": ""}