{"organizations": [], "uuid": "e087e2025279b370e33e36ab39bb5713377cad54", "thread": {"social": {"gplus": {"shares": 0}, "pinterest": {"shares": 0}, "vk": {"shares": 0}, "linkedin": {"shares": 1}, "facebook": {"likes": 286, "shares": 286, "comments": 0}, "stumbledupon": {"shares": 0}}, "site_full": "www.independent.ie", "main_image": "http://www.independent.ie/incoming/article35338479.ece/ALTERNATES/h342/IMG_1007.JPG", "site_section": "http://www.independent.ie/rss", "section_title": "Independent.ie - Independent.ie RSS Feed", "url": "http://www.independent.ie/irish-news/a-quickthinking-christmas-elf-helped-to-save-a-mans-life-when-his-heart-stopped-on-christmas-eve-35338007.html", "country": "IE", "domain_rank": 3626, "title": "A quick-thinking 'Christmas elf' helped to save a man's life when his heart stopped on Christmas Eve", "performance_score": 2, "site": "independent.ie", "participants_count": 0, "title_full": "A quick-thinking 'Christmas elf' helped to save a man's life when his heart stopped on Christmas Eve", "spam_score": 0.0, "site_type": "blogs", "published": "2017-01-03T22:35:00.000+02:00", "replies_count": 0, "uuid": "e087e2025279b370e33e36ab39bb5713377cad54"}, "author": "", "url": "http://www.independent.ie/irish-news/a-quickthinking-christmas-elf-helped-to-save-a-mans-life-when-his-heart-stopped-on-christmas-eve-35338007.html", "ord_in_thread": 0, "title": "A quick-thinking 'Christmas elf' helped to save a man's life when his heart stopped on Christmas Eve", "locations": [], "entities": {"persons": [{"name": "michelle cooper galvin", "sentiment": "none"}, {"name": "david o'shea", "sentiment": "none"}, {"name": "marie coffey", "sentiment": "none"}, {"name": "rosemary mangan", "sentiment": "none"}, {"name": "laura larkin", "sentiment": "none"}, {"name": "ciara o'callaghan st john", "sentiment": "none"}, {"name": "austin rooney", "sentiment": "none"}, {"name": "padraig clifford", "sentiment": "none"}, {"name": "noel o'sullivan", "sentiment": "none"}, {"name": "anges rooney", "sentiment": "none"}, {"name": "agnes rooney", "sentiment": "none"}, {"name": "caitriona kelly", "sentiment": "none"}, {"name": "rory clifford", "sentiment": "none"}, {"name": "fiona landers", "sentiment": "none"}, {"name": "colette courtney", "sentiment": "none"}, {"name": "susan english", "sentiment": "none"}, {"name": "bernie costello", "sentiment": "none"}, {"name": "neilie o'sullivan", "sentiment": "none"}, {"name": "lorraine o'shea", "sentiment": "none"}], "locations": [{"name": "killarney", "sentiment": "none"}, {"name": "arklow photo", "sentiment": "none"}, {"name": "beaufort", "sentiment": "none"}], "organizations": [{"name": "kpfa", "sentiment": "none"}, {"name": "beaufort defibrillator group", "sentiment": "none"}, {"name": "facebook/ arklow community first responders padraig clifford", "sentiment": "none"}, {"name": "beaufort drama", "sentiment": "none"}]}, "highlightText": "", "language": "english", "persons": [], "text": "Tuesday 3 January 2017 A quick-thinking 'Christmas elf' helped to save a man's life when his heart stopped on Christmas Eve Laura Larkin 0 Comments Share A quick-thinking 'Christmas elf' helped to save a man's life when his heart stopped on Christmas Eve Independent.ie A quick-thinking 'Christmas elf' has been hailed for saving the life on an elderly man on Christmas Eve after his heart stopped. http://www.independent.ie/irish-news/a-quickthinking-christmas-elf-helped-to-save-a-mans-life-when-his-heart-stopped-on-christmas-eve-35338007.html Ciara O'Callaghan St John's Volunteer Thre youths destroyed a defibrillator in Arklow Photo via Facebook/ Arklow Community First Responders Padraig Clifford and David O'Shea of Beaufort Drama group (seated) presenting cheques for â‚¬1,000 to Agnes Rooney of the Buy A Bus Fund for KPFA and Susan English of Beaufort Defibrillator Group, with (front) Bernie Costello, Colette Courtney, Anges Rooney, Padraig Clifford, Susan English, David O'Shea, Rosemary Mangan (back from left) Fiona Landers, Marie Coffey, Austin Rooney, Rory Clifford, Lorraine O'Shea, Neilie O'Sullivan, Caitriona Kelly and Noel O'Sullivan at Beaufort bar Restaurant, Beaufort, Killarney on Saturday. The funds were raised from their recent production.Photo by Michelle Cooper Galvin A quick-thinking 'Christmas elf' has been hailed for saving the life on an elderly man on Christmas Eve after his heart stopped. Share A quick-thinking 'Christmas elf' helped to save a man's life when his heart stopped on Christmas Eve Independent.ie A quick-thinking 'Christmas elf' has been hailed for saving the life on an elderly man on Christmas Eve after his heart stopped. http://www.independent.ie/irish-news/a-quickthinking-christmas-elf-helped-to-save-a-mans-life-when-his-heart-stopped-on-christmas-eve-35338007.html", "external_links": [], "published": "2017-01-03T22:35:00.000+02:00", "crawled": "2017-01-04T00:24:23.282+02:00", "highlightTitle": ""}