{"organizations": [], "uuid": "6c8781209a942b2c9c8d3bd2aa652659151b8899", "thread": {"social": {"gplus": {"shares": 1}, "pinterest": {"shares": 0}, "vk": {"shares": 0}, "linkedin": {"shares": 0}, "facebook": {"likes": 217, "shares": 217, "comments": 0}, "stumbledupon": {"shares": 0}}, "site_full": "blogs.economictimes.indiatimes.com", "main_image": "http://blogs.economictimes.indiatimes.com/wp-content/themes/blogstheme/images/et-blog-facebook.jpg", "site_section": "http://blogs.economictimes.indiatimes.com", "section_title": "ET Blogs", "url": "http://blogs.economictimes.indiatimes.com/et-news/samajwadi-party-feud-now-mulayam-expels-ramgopal-terms-decisions-of-akhilesh-camp-illegal/", "country": "IN", "domain_rank": 116, "title": "NEW DELHI: Hours after the Akhilesh Yadav camp declared the young CM a", "performance_score": 2, "site": "indiatimes.com", "participants_count": 1, "title_full": "NEW DELHI: Hours after the Akhilesh Yadav camp declared the young CM a", "spam_score": 0.32, "site_type": "blogs", "published": "2017-01-01T11:37:00.000+02:00", "replies_count": 0, "uuid": "6c8781209a942b2c9c8d3bd2aa652659151b8899"}, "author": "ET Newsdesk", "url": "http://blogs.economictimes.indiatimes.com/et-news/samajwadi-party-feud-now-mulayam-expels-ramgopal-terms-decisions-of-akhilesh-camp-illegal/", "ord_in_thread": 0, "title": "NEW DELHI: Hours after the Akhilesh Yadav camp declared the young CM a", "locations": [], "entities": {"persons": [{"name": "akhilesh yadav", "sentiment": "negative"}, {"name": "ramgopal", "sentiment": "none"}, {"name": "yadav", "sentiment": "none"}, {"name": "shiv pal", "sentiment": "none"}, {"name": "mulayam singh yadav", "sentiment": "none"}, {"name": "akhilesh", "sentiment": "none"}, {"name": "mulayam", "sentiment": "none"}, {"name": "shivpal yadav", "sentiment": "none"}, {"name": "amar singh", "sentiment": "none"}, {"name": "ram gopal yadav", "sentiment": "none"}, {"name": "ramgopal yadav", "sentiment": "none"}, {"name": "marg darshak", "sentiment": "none"}], "locations": [{"name": "new delhi", "sentiment": "none"}, {"name": "lucknow", "sentiment": "none"}], "organizations": [{"name": "samajwadi party", "sentiment": "negative"}, {"name": "uttar pradesh sp", "sentiment": "none"}]}, "highlightText": "", "language": "english", "persons": [], "text": "NEW DELHI: Hours after the Akhilesh Yadav camp declared the young CM as the chief of Samajwadi Party, party patriarch Mulayam Singh Yadav expelled Ramgopal Yadav from the party for six years. The SP founder also dubbed the national executive meet as “unconstitutional” and the decisions taken in the same as “illegal”.\nCoincidentally, Mulayam has not said anything about son Akhilesh who was also in the national convention earlier today. Akhilesh infact was even more vociferous against Shivpal Yadav, his uncle and Uttar Pradesh SP president.\nRead Also: Akhilesh claims SP prez post, wants uncle Shiv Pal to step down from party post (http://blogs.economictimes.indiatimes.com/et-news/make-akhilesh-sp-national-prez-expel-amar-singh-and-shiv-pal-from-party-post-ram-gopal-yadav/)\nEarlier today, Ram Gopal Yadav held a national convention in Lucknow where Mulayam was made the Marg Darshak, while Shiv Pal Yadav was removed from state party chief post. The party also expelled Amar Singh from the party for fuelling tensions in the party.\nThis is the second time that Ramgopal has been expelled from the party in as many days.\nMulayam had expelled Ramgopal yesterday along with Akhilesh but later that day brought both of them back to the party fold.\nHere is the letter issued by Mulayam Singh Yadav today (image credit: ANI)", "external_links": [], "published": "2017-01-01T11:37:00.000+02:00", "crawled": "2017-01-01T11:13:51.509+02:00", "highlightTitle": ""}