{"organizations": [], "uuid": "ebdb5c581d313335f547e54d5762e49cc841ec40", "thread": {"social": {"gplus": {"shares": 2}, "pinterest": {"shares": 5}, "vk": {"shares": 0}, "linkedin": {"shares": 5}, "facebook": {"likes": 103, "shares": 103, "comments": 0}, "stumbledupon": {"shares": 0}}, "site_full": "www.infowars.com", "main_image": "http://hw.infowars.com/wp-content/uploads/2017/01/illegal-immigration-punishment-for-us-interventionism.jpg", "site_section": "http://infowars.com//feed/custom_feed_rss", "section_title": "Infowars", "url": "http://www.infowars.com/activist-tells-tucker-carlson-illegal-immigration-is-punishment-for-bad-things-u-s-has-done/", "country": "US", "domain_rank": 2774, "title": "Activist Tells Tucker Carlson Illegal Immigration Is PUNISHMENT For Bad Things U.S. Has Done", "performance_score": 1, "site": "infowars.com", "participants_count": 1, "title_full": "Activist Tells Tucker Carlson Illegal Immigration Is PUNISHMENT For Bad Things U.S. Has Done", "spam_score": 0.0, "site_type": "blogs", "published": "2017-01-24T19:17:00.000+02:00", "replies_count": 0, "uuid": "ebdb5c581d313335f547e54d5762e49cc841ec40"}, "author": "Chris Menahan", "url": "http://www.infowars.com/activist-tells-tucker-carlson-illegal-immigration-is-punishment-for-bad-things-u-s-has-done/", "ord_in_thread": 0, "title": "Activist Tells Tucker Carlson Illegal Immigration Is PUNISHMENT For Bad Things U.S. Has Done", "locations": [], "entities": {"persons": [{"name": "donald", "sentiment": "negative"}, {"name": "tucker carlson", "sentiment": "negative"}, {"name": "morones", "sentiment": "none"}, {"name": "donald trump", "sentiment": "none"}, {"name": "bush", "sentiment": "none"}, {"name": "ann coulter", "sentiment": "none"}, {"name": "coulter", "sentiment": "none"}, {"name": "enrique morones", "sentiment": "none"}, {"name": "alex jones", "sentiment": "none"}], "locations": [{"name": "u.s.", "sentiment": "none"}, {"name": "america", "sentiment": "none"}, {"name": "us", "sentiment": "none"}, {"name": "mexico", "sentiment": "none"}, {"name": "central america", "sentiment": "none"}, {"name": "middle east", "sentiment": "none"}], "organizations": [{"name": "trump", "sentiment": "none"}, {"name": "border angels", "sentiment": "none"}, {"name": "chris menahan | information liberation", "sentiment": "none"}, {"name": "twitter", "sentiment": "none"}]}, "highlightText": "", "language": "english", "persons": [], "text": "Activist Tells Tucker Carlson Illegal Immigration Is PUNISHMENT For Bad Things U.S. Has Done Donald Trump needs to start construction on the wall immediately Chris Menahan | Information Liberation - January 24, 2017 Comments \nIllegal immigration activist Enrique Morones told Tucker Carlson on Monday illegal immigration is the “price” the US is paying for the bad things it’s done in Mexico and Central America. \n“US policy is what drives a lot of these people out [of Mexico and Central America],” Morones, the founder of activist group Border Angels , said. “The intervention in Central America, the demand [for] drugs by the American public, the intervention in the Middle East by President Bush — those things cause people to leave.” \n“There’s a consequence to those actions,” he said. “If you’re going to get involved in other people’s policies, you gotta pay the price.” \nAnn Coulter reacted to the interview on Twitter saying Morones admitted “that illegal immigration is a way of punishing America for the bad things it’s done.” The opening segment on @TuckerCarlson right now is the greatest TV I've seen in years. \n— Ann Coulter (@AnnCoulter) January 24, 2017 Illegal alien advocate admits on @TuckerCarlson that illegal immigration is a way of punishing America for the bad things it's done. \n— Ann Coulter (@AnnCoulter) January 24, 2017 \nCoulter is absolutely right. \nBorder Angels founder Enrique Morones recognizes the American people do not want illegal immigrants flooding into our country, but he views it as divine retribution for our supposed sins. \nDonald Trump needs to start construction on the wall immediately. NEWSLETTER SIGN UP Get the latest breaking news & specials from Alex Jones and the Infowars Crew. Related Articles", "external_links": [], "published": "2017-01-24T19:17:00.000+02:00", "crawled": "2017-01-24T20:48:55.114+02:00", "highlightTitle": ""}