{"organizations": [], "uuid": "67ab223f0df769e4fe1859d7045ea6e969e4aa1a", "thread": {"social": {"gplus": {"shares": 0}, "pinterest": {"shares": 0}, "vk": {"shares": 0}, "linkedin": {"shares": 0}, "facebook": {"likes": 443, "shares": 443, "comments": 0}, "stumbledupon": {"shares": 0}}, "site_full": "www.thewrap.com", "main_image": "http://ww1.hdnux.com/photos/56/34/27/12174784/3/rawImage.png", "site_section": "http://www.sfgate.com/rss/feed/Daily-Dish-531.php", "section_title": "Daily Dish", "url": "http://www.thewrap.com/gus-fring-better-call-saul-season-3-teaser/", "country": "US", "domain_rank": 5807, "title": "Gus Fring Returns in ‘Better Call Saul’ Season 3 Teaser (Video)", "performance_score": 4, "site": "thewrap.com", "participants_count": 1, "title_full": "Gus Fring Returns in ‘Better Call Saul’ Season 3 Teaser (Video)", "spam_score": 0.0, "site_type": "blogs", "published": "2017-01-12T06:09:00.000+02:00", "replies_count": 0, "uuid": "67ab223f0df769e4fe1859d7045ea6e969e4aa1a"}, "author": "Jeremy Fuster, provided by", "url": "http://www.thewrap.com/gus-fring-better-call-saul-season-3-teaser/", "ord_in_thread": 0, "title": "Gus Fring Returns in ‘Better Call Saul’ Season 3 Teaser (Video)", "locations": [], "entities": {"persons": [{"name": "walter white", "sentiment": "none"}, {"name": "saul goodman", "sentiment": "none"}, {"name": "jeremy fuster", "sentiment": "none"}, {"name": "saul", "sentiment": "none"}, {"name": "gus", "sentiment": "none"}, {"name": "saul' star bob odenkirk", "sentiment": "none"}, {"name": "giancarlo esposito", "sentiment": "none"}, {"name": "jimmy mcgill", "sentiment": "none"}, {"name": "gus fring", "sentiment": "none"}, {"name": "jimmy", "sentiment": "none"}], "locations": [{"name": "albuquerque", "sentiment": "none"}], "organizations": [{"name": "better call saul", "sentiment": "negative"}, {"name": "los pollos hermanos", "sentiment": "none"}, {"name": "amc", "sentiment": "none"}]}, "highlightText": "", "language": "english", "persons": [], "text": "http://www.thewrap.com/gus-fring-better-call-saul-season-3-teaser/ Gus Fring Returns in ‘Better Call Saul’ Season 3 Teaser (Video) Giancarlo Esposito’s characters wants to sell you curly fries in this Los Pollos Hermanos commercial Jeremy Fuster, provided by Published 3:09 pm, Wednesday, January 11, 2017 \nHide the box cutters, everyone. Gus Fring is coming to “Better Call Saul.” \nAfter terrifying audiences as the fast food magnate/violent drug lord on “Breaking Bad,” Giancarlo Esposito is returning to the role that earned him his first Emmy nomination as part of season 3 of “Better Call Saul.” \nOf course, AMC revealed this in classic ABQ fashion: with a fake commercial for Gus’ fast food chain, Los Pollos Hermanos. Also Read: 'Better Call Saul' Star Bob Odenkirk Teases Season 3: 'Innocence Gets Torn Away' (Video) \nThis isn’t the first time we’ve seen viral ads from Walter White’s Albuquerque. \nDuring the run of “Breaking Bad,” AMC released commercials showing Saul Goodman — or Jimmy McGill, as he’s known on “Better Call Saul”— encouraging viewers to “sue ‘em now” with the help of his private practice. \nNow we have this wholesome ad that seems to be a sign that we will soon discover how Jimmy first encountered Gus and the shady dealings behind Los Pollos Hermanos. Image 1 of / 1", "external_links": [], "published": "2017-01-12T06:09:00.000+02:00", "crawled": "2017-01-12T01:32:55.945+02:00", "highlightTitle": ""}