{"organizations": [], "uuid": "d7e1b65de03d05cbb863954ecef74caaa2f3f7fc", "thread": {"social": {"gplus": {"shares": 0}, "pinterest": {"shares": 0}, "vk": {"shares": 0}, "linkedin": {"shares": 0}, "facebook": {"likes": 176, "shares": 176, "comments": 0}, "stumbledupon": {"shares": 0}}, "site_full": "www.ctvnews.ca", "main_image": "http://www.ctvnews.ca/polopoly_fs/1.3226070.1483476969!/httpImage/image.jpg_gen/derivatives/landscape_620/image.jpg", "site_section": "http://www.ctvnews.ca/rss/ctvnews-ca-canada-public-rss-1.822284", "section_title": "CTVNews.ca - Canada - Public RSS", "url": "http://www.ctvnews.ca/canada/b-c-s-lower-mainland-struggles-to-keep-roads-clear-of-ice-1.3226528", "country": "CA", "domain_rank": 4971, "title": "B.C.'s Lower Mainland struggles to keep roads clear of ice", "performance_score": 1, "site": "ctvnews.ca", "participants_count": 1, "title_full": "B.C.'s Lower Mainland struggles to keep roads clear of ice", "spam_score": 0.0, "site_type": "blogs", "published": "2017-01-04T08:48:00.000+02:00", "replies_count": 0, "uuid": "d7e1b65de03d05cbb863954ecef74caaa2f3f7fc"}, "author": "Nick Wells", "url": "http://www.ctvnews.ca/canada/b-c-s-lower-mainland-struggles-to-keep-roads-clear-of-ice-1.3226528", "ord_in_thread": 0, "title": "B.C.'s Lower Mainland struggles to keep roads clear of ice", "locations": [], "entities": {"persons": [{"name": "nick wells", "sentiment": "negative"}, {"name": "bill raddatz", "sentiment": "none"}, {"name": "herrling", "sentiment": "none"}, {"name": "tom popyk", "sentiment": "none"}, {"name": "marita herrling", "sentiment": "none"}, {"name": "naomi", "sentiment": "none"}, {"name": "david molko", "sentiment": "none"}, {"name": "michele brunoro", "sentiment": "none"}, {"name": "matt macdonald", "sentiment": "none"}, {"name": "dobrovny", "sentiment": "none"}, {"name": "ruth", "sentiment": "none"}, {"name": "jerry dobrovny", "sentiment": "none"}], "locations": [{"name": "vancouver", "sentiment": "none"}, {"name": "east vancouver", "sentiment": "none"}, {"name": "fraser valley", "sentiment": "none"}, {"name": "chilliwack", "sentiment": "none"}], "organizations": [{"name": "lower mainland", "sentiment": "negative"}, {"name": "environment canada", "sentiment": "none"}, {"name": "ctv vancouver", "sentiment": "none"}]}, "highlightText": "", "language": "english", "persons": [], "text": "B.C.'s Lower Mainland struggles to keep roads clear of ice Nick Wells, CTVNews.ca Published   8:48PM EST \nVancouver city officials are vowing to combat the icy, wintery conditions plaguing the city and surrounding region. \nAt a press conference held Tuesday, the city's general manager of engineering said non-emergency construction work in the city has been halted so 260 staff members can be deployed to help deal with icy residential roads. \nOne hundred and fifty staff have already been redeployed to start salting, sanding and clearing neighbourhood streets. \nThe move comes after ice failed to clear away on its own accord, which tends to happen in the city as temperatures fluctuate. \n\"Typically we don't go in and clear the residential streets because there's so many more of them, and typically the weather breaks,\" said Jerry Dobrovny. \nThe icy conditions led to social media posts showing East Vancouver residents skating and playing hockey on some side roads. \nThe city has already used 7,000 tonnes of salt this year, seven times more than last year. \n\"I'm confident now that we have enough salt, but we're using an awful lot of it,\" said Dobrovny. \nFirst responders are helping residents get access to salt, with 10 firehalls making salt available for the general public. \nThe snow has also left homeless people around the Lower Mainland scrambling for shelter. \nMarita Herrling, 70, has been living at a homeless camp in Chilliwack for five months with her adult children. \nOne daughter had been living in a tent beside her before the weight of the snow collapsed her shelter, killing her. \n\"One of the tent posts caved in…and smashed her across the face,\" said Herrling. \nOfficials in the Fraser Valley region estimate that there's as many as 230 homeless people sleeping outside at this time of year. \nShelter workers say the number is unprecedented. \n\"I've been in this role now for four years and you've never heard of or seen what we are facing today,\" said Bill Raddatz, the executive director with Ruth and Naomi's Mission in Chilliwack. \nWhile Vancouver battles icy conditions, cities in the Fraser Valley are bearing the brunt of the winter weather, with temperatures dropping to -20 C. \nSome shelters have begun sending out vans in an effort to help bring homeless people to warm shelters. \nHowever, those residents hoping for a break from the blast of wintery weather are out of luck, according to Environment Canada. \n\"Believe it or not, we actually have a chance of more snow come this weekend,” said Matt MacDonald, a meteorologist. \"It might be the most snow we've seen so far this season.\" \nWith reports from CTV Vancouver's David Molko, Michele Brunoro and Tom Popyk Photos The City of Vancouver said salt and plow crews are shifting their focus from main arterial routes to residential streets. Dec. 3, 2017. (CTV)", "external_links": [], "published": "2017-01-04T08:48:00.000+02:00", "crawled": "2017-01-04T04:19:35.408+02:00", "highlightTitle": ""}