{"organizations": [], "uuid": "955cf8cea053e2a6d3f96cf510ee88d13061dd63", "thread": {"social": {"gplus": {"shares": 2}, "pinterest": {"shares": 4}, "vk": {"shares": 0}, "linkedin": {"shares": 7}, "facebook": {"likes": 265, "shares": 265, "comments": 0}, "stumbledupon": {"shares": 0}}, "site_full": "www.thewrap.com", "main_image": "http://www.thewrap.com/wp-content/uploads/2016/12/GettyImages-578546876.jpg", "site_section": "http://www.thewrap.com/feed", "section_title": "TheWrapTheWrap", "url": "http://www.thewrap.com/donald-trump-new-years-tweet/", "country": "US", "domain_rank": 5807, "title": "Donald Trump’s Sour New Year’s Tweet Gets Slaughtered on Social Media", "performance_score": 2, "site": "thewrap.com", "participants_count": 1, "title_full": "Donald Trump’s Sour New Year’s Tweet Gets Slaughtered on Social Media", "spam_score": 0.0, "site_type": "blogs", "published": "2017-01-01T07:46:00.000+02:00", "replies_count": 0, "uuid": "955cf8cea053e2a6d3f96cf510ee88d13061dd63"}, "author": "Rosemary Rossi", "url": "http://www.thewrap.com/donald-trump-new-years-tweet/", "ord_in_thread": 0, "title": "Donald Trump’s Sour New Year’s Tweet Gets Slaughtered on Social Media", "locations": [], "entities": {"persons": [{"name": "donald trump", "sentiment": "negative"}, {"name": "fox  rick perry  trump", "sentiment": "none"}, {"name": "molly knight", "sentiment": "none"}, {"name": "betsy", "sentiment": "none"}, {"name": "michael skolnik", "sentiment": "none"}, {"name": "ben carson  trump", "sentiment": "none"}, {"name": "terry mcdermott", "sentiment": "none"}, {"name": "rosie o’donnell", "sentiment": "none"}, {"name": "elaine chao", "sentiment": "none"}, {"name": "mitch mcconnell", "sentiment": "none"}, {"name": "michael skolink", "sentiment": "none"}, {"name": "gary cohn  trump", "sentiment": "none"}, {"name": "betsy devos", "sentiment": "none"}, {"name": "perry", "sentiment": "none"}, {"name": "diane warren", "sentiment": "none"}, {"name": "jon cozart", "sentiment": "none"}, {"name": "forbes", "sentiment": "none"}, {"name": "richard devos sr.", "sentiment": "none"}, {"name": "rosie", "sentiment": "none"}, {"name": "james mattis", "sentiment": "none"}, {"name": "hank green", "sentiment": "none"}, {"name": "trump", "sentiment": "none"}, {"name": "gregory brothers", "sentiment": "none"}, {"name": "tom price  trump", "sentiment": "none"}, {"name": "— donald j. trump", "sentiment": "none"}, {"name": "obama", "sentiment": "none"}, {"name": "dick", "sentiment": "none"}, {"name": "linda mcmahon  trump", "sentiment": "none"}, {"name": "andrew puzder", "sentiment": "none"}, {"name": "steven mnuchin", "sentiment": "none"}, {"name": "rosemary rossi", "sentiment": "none"}, {"name": "wilbur ross", "sentiment": "none"}, {"name": "david frum", "sentiment": "none"}, {"name": "carl", "sentiment": "none"}, {"name": "vince", "sentiment": "none"}, {"name": "– malyndahale", "sentiment": "none"}, {"name": "rex tillerson  trump", "sentiment": "none"}], "locations": [{"name": "white house", "sentiment": "none"}, {"name": "texas", "sentiment": "none"}, {"name": "michigan", "sentiment": "none"}, {"name": "alabama", "sentiment": "none"}], "organizations": [{"name": "social media", "sentiment": "negative"}, {"name": "exxon", "sentiment": "none"}, {"name": "goldman sachs", "sentiment": "none"}, {"name": "defense", "sentiment": "none"}, {"name": "small business administration", "sentiment": "none"}, {"name": "bank of america", "sentiment": "none"}, {"name": "trump", "sentiment": "none"}, {"name": "soze agency", "sentiment": "none"}, {"name": "treasury", "sentiment": "none"}, {"name": "atlantic david frum", "sentiment": "none"}, {"name": "cke restaurants", "sentiment": "none"}, {"name": "general dynamics", "sentiment": "none"}, {"name": "international business times", "sentiment": "none"}, {"name": "wtf", "sentiment": "none"}, {"name": "hardee", "sentiment": "none"}, {"name": "senate", "sentiment": "none"}, {"name": "associated press", "sentiment": "none"}, {"name": "gop", "sentiment": "none"}, {"name": "politico", "sentiment": "none"}, {"name": "salary.com", "sentiment": "none"}, {"name": "amway", "sentiment": "none"}, {"name": "forbes", "sentiment": "none"}, {"name": "bloomberg", "sentiment": "none"}]}, "highlightText": "", "language": "english", "persons": [], "text": "Search Donald Trump’s Sour New Year’s Tweet Gets Slaughtered on Social Media \n“Looks like somebody woke up on the wrong side of humanity this morning,” one Twitter follower responded Rosemary Rossi | December 31, 2016 @ 4:46 PM Getty \nThe words “Happy New Year” casually roll off the tongue of most without sarcasm or condition. But many people — we’re talking a whole lot of people — didn’t receive President-elect Donald Trump’s holiday tidings with the hope and joy in which they’re usually sent. \nMaybe this is why: Happy New Year to all, including to my many enemies and those who have fought me and lost so badly they just don't know what to do. Love! \n— Donald J. Trump (@realDonaldTrump) December 31, 2016 \nFolks on Twitter immediately picked up on the tone and ran off with it, among them, a few notables, like senior editor at The Atlantic David Frum, Soze Agency co-founder Michael Skolink, Rosie O’Donnell and composer Diane Warren. “We are all Federalists; we are all Republicans.” \n“With malice toward none, with charity for all.” \n“Ask what you can do for your country.” https://t.co/oiPk7R1dO1 \n– David Frum (@davidfrum) December 31, 2016 \n“Do I not destroy my enemies when I make them my friends?” Different time, different president. \n– David Frum (@davidfrum) December 31, 2016 Try this … May the New Year bring out the best in all of us, and may our fears for country and world all prove misplaced \n— David Frum (@davidfrum) December 31, 2016 \nDemocratic activist Michael Skolnik posted a series of tweets comparing Trump’s wishes to those of President Obama in 2008: Obama v. Trump. pic.twitter.com/XiJ7DgdAOn \n— Michael Skolnik (@MichaelSkolnik) December 31, 2016 \nObama's 2008 election night speech: \n\"In this country, we rise or fall as one nation, as one people…\" \n1/ \n— Michael Skolnik (@MichaelSkolnik) December 31, 2016 \nLots of others followed suit with sarcasm and scorn, here’s a sampling: \n@realDonaldTrump – we know what to do RESIST YOU – and everything you represent #notANYONESpresident #resist #liar #cheater #fraud #crook– Rosie (@Rosie) December 31, 2016 \n@realDonaldTrump Like EVERYTHING else, let’s make even New Years about U and all your “enemies”. WTF grow up– Diane Warren (@Diane_Warren) December 31, 2016 \n@realDonaldTrump U seem to have forgotten that U lost the popular vote by almost 3 million but we haven’t…– Diane Warren (@Diane_Warren) December 31, 2016 \n@realDonaldTrump Let it go dude. Let it go. pic.twitter.com/kSwzCcqWYv– Terry McDermott (@TerryMacMusic) December 31, 2016 \n@shegeek it’s beyond ridiculous… i mean c’mon, pull your shit together 20 days before your sworn in…– Apple-Elgatha (@iamchefapple) December 31, 2016 \n@realDonaldTrump You are not great at being human.– Hank Green (@hankgreen) December 31, 2016 \n@hankgreen@realDonaldTrump wishing people a happy new year is usually the easiest presidential task behind pardoning the turkey– The Gregory Brothers (@gregorybrothers) December 31, 2016 \n@gregorybrothers@hankgreen@realDonaldTrump I thank u meant to post this, ur #TinyHands bump extra keyz pic.twitter.com/rmSJRbfpUw– Asstro Logic (@Asstro_Logic) December 31, 2016 \n@ZeRoyalViking@realDonaldTrump would it have been so hard to just tweet out…”Happy New Years. Look forward to serving you in 2017?”– Chilled Chaos (@ChilledChaos) December 31, 2016 \n@realDonaldTrump looks like somebody woke up on the wrong side of humanity this morning– Jon Cozart (@JonCozart) December 31, 2016 \n@realDonaldTrump why are you such a petulant little child? You’re so embarrassing.– MalyndaHale (@MalyndaHale) December 31, 2016 \n@realDonaldTrump Happy New Year, Mr. Bottomless Pit of Need! xo– Molly Knight (@molly_knight) December 31, 2016 \n.@realDonaldTrump You’re the president-elect! Is it too much to ask you to have some dignity? You sound like you just won at dodgeball.– (((BrokeAssStuart))) (@BrokeAssStuart) December 31, 2016 14 Donald Trump Appointees Who Are Millionaires or Billionaires (Photos) \nPresident-elect Donald Trump is surrounding himself with some very wealthy people. Let's take a look at his wealthy nominees for top posts. Getty Images \nWilbur Ross \nThe investor is Trump’s choice to be commerce secretary. He is worth roughly $2.5 billion, according to Forbes , after earning a fortune restructuring failed companies in industries such as steel, coal, telecommunications, foreign investment and textiles. Twitter \nRex Tillerson \nTrump chose The Exxon CEO as his secretary of state nominee because of his ability to close deals with foreign leaders. He is estimated to be worth $325 million, according to Forbes . Getty Images \nLinda McMahon \nTrump’s choice to lead the Small Business Administration is worth an estimated $1.35 billion, according to Bloomberg . She made her fortune, along with husband Vince, by turning WWE into a global powerhouse. Getty Images \nSteven Mnuchin \nThe former Goldman Sachs executive is expected to become Secretary of Treasury and is worth at least $46 million, according to Politico . Getty Images \nBen Carson \nTrump’s choice for housing and urban development secretary is a former neurosurgeon worth $29 million, according to Forbes . Getty Images \nElaine Chao \nThe former labor secretary is Trump’s choice for transportation secretary. She is married to Senate Majority Leader Mitch McConnell and is a former Bank of America executive who was worth $16.9 million back in 2008, according to OpenSecrets.org . Fox \nRick Perry \nTrump’s choice for energy secretary is a former governor of Texas estimated to be worth about $3 million, according to the Associated Press . Perry has close ties to the Texas oil industry and has received large donations from energy industry executives. Getty Images \nGary Cohn \nTrump’s choice for chief economic policy adviser is currently the chief operating officer of Goldman Sachs and made $20.6 million in 2015 alone, according to Salary.com . Twitter \nBetsy DeVos \nThe former Michigan GOP chair and education activist was selected to be education secretary. Her family is worth $5.1 billion, according to Forbes . Betsy’s husband, Dick, is the son of Richard DeVos Sr., the billionaire co-founder of the company Amway. Twitter \nJeff Sessions \nThe senator from Alabama is set to be Attorney General when Trump moves into the White House. Mutual funds, municipal bonds and real estate investments have given him a net worth of $6 million, according to Forbes . Getty Images \nJames Mattis \nThe man nicknamed “Mad Dog” is Trump’s selection for secretary of defense is worth about $5 million, according to Forbes . Besides military pay and a pension, he sat on the board of Theranos and remains a director of defense contractor General Dynamics, for which he was generously paid, according to the International Business Times. Twitter \nAndrew Puzder \nThe CEO of CKE Restaurants, the parent company of Carl’s Jr. and Hardee’s, is worth $45 million, according to Forbes . Trump has selected him to serve as secretary of labor. Twitter \nTom Price \nTrump's pick for secretary of health and human services is an orthopedic surgeon who dabbles in real estate. He’s worth $10 million, according for Forbes .", "external_links": [], "published": "2017-01-01T07:46:00.000+02:00", "crawled": "2017-01-01T03:30:31.478+02:00", "highlightTitle": ""}