{"organizations": [], "uuid": "8ddb89d2b95b943b20a43670c83b1ad12e6f5089", "thread": {"social": {"gplus": {"shares": 0}, "pinterest": {"shares": 0}, "vk": {"shares": 0}, "linkedin": {"shares": 0}, "facebook": {"likes": 197, "shares": 197, "comments": 0}, "stumbledupon": {"shares": 0}}, "site_full": "ftw.usatoday.com", "main_image": "http://www.gannett-cdn.com/-mm-/7d33dbbd771d9ac1d01bd6c5f42e97dce87d4cb2/c=0-5-5281-2988&amp;r=x1683&amp;c=3200x1680/local/-/media/2017/01/26/USATODAY/usatsports/ap_rockets_grizzlies_basketball_88190404.jpg", "site_section": "http://rssfeeds.usatoday.com/UsatodaycomNba-TopStories", "section_title": "GANNETT Syndication Service", "url": "http://ftw.usatoday.com/2017/01/houston-rockets-mike-dantoni-alternative-facts-donald-trump-kellyanne-conway-quote", "country": "US", "domain_rank": 313, "title": "Mike D'Antoni delivers 'alternative facts' joke", "performance_score": 1, "site": "usatoday.com", "participants_count": 1, "title_full": "Mike D'Antoni delivers 'alternative facts' joke", "spam_score": 0.0, "site_type": "blogs", "published": "2017-01-26T21:25:00.000+02:00", "replies_count": 0, "uuid": "8ddb89d2b95b943b20a43670c83b1ad12e6f5089"}, "author": "USA TODAY", "url": "http://ftw.usatoday.com/2017/01/houston-rockets-mike-dantoni-alternative-facts-donald-trump-kellyanne-conway-quote", "ord_in_thread": 0, "title": "Mike D'Antoni delivers 'alternative facts' joke", "locations": [], "entities": {"persons": [{"name": "mike d'antoni", "sentiment": "neutral"}, {"name": "kellyanne conway", "sentiment": "neutral"}, {"name": "d'antoni", "sentiment": "none"}, {"name": "gregg popovich", "sentiment": "none"}, {"name": "charles curtis", "sentiment": "none"}, {"name": "jonathan feigen", "sentiment": "none"}], "locations": [{"name": "tenn.", "sentiment": "none"}, {"name": "usa", "sentiment": "none"}, {"name": "tennessee", "sentiment": "none"}, {"name": "memphis", "sentiment": "none"}], "organizations": [{"name": "nba", "sentiment": "none"}, {"name": "boston celtics", "sentiment": "none"}, {"name": "san antonio spurs", "sentiment": "none"}, {"name": "houston rockets", "sentiment": "none"}, {"name": "shares  houston rockets", "sentiment": "none"}, {"name": "memphis grizzlies", "sentiment": "none"}, {"name": "rockets", "sentiment": "none"}, {"name": "ap", "sentiment": "none"}]}, "highlightText": "", "language": "english", "persons": [], "text": "  Mike D'Antoni delivers 'alternative facts' joke More jokes about Kellyanne Conway's quote. Post to Facebook Mike D'Antoni delivers 'alternative facts' joke More jokes about Kellyanne Conway's quote.  //ftw.usatoday.com/2017/01/houston-rockets-mike-dantoni-alternative-facts-donald-trump-kellyanne-conway-quote/   Mike D'Antoni delivers 'alternative facts' joke Charles Curtis , USA TODAY 9:25 a.m. ET Jan. 26, 2017 3 Shares \nHouston Rockets head coach Mike D'Antoni smiles during the second half of an NBA basketball game against the Memphis Grizzlies Saturday, Jan. 21, 2017, in Memphis, Tenn. (AP Photo/Brandon Dill) ORG XMIT: TNBD114 (Photo: AP) \nThanks to Houston Rockets head coach Mike D'Antoni, Kellyanne Conway's \"alternative facts\" phrase continues to makes its way through the sports world. \nAfter San Antonio Spurs' Gregg Popovich and Tennessee's basketball media guide used it , here's what D'Antoni said before Wednesday's game against the Boston Celtics: D'Antoni, asked about Rockets going 3-5 past few weeks: \"Actually we won all those games. I'm going with that alternative fact thing.\" â€” Jonathan Feigen (@Jonathan_Feigen) January 25, 2017 \nCan we officially call this a meme now if it isn't already? Read or Share this story: http://ftw.usatoday.com/2017/01/houston-rockets-mike-dantoni-alternative-facts-donald-trump-kellyanne-conway-quote/ Most Popular", "external_links": [], "published": "2017-01-26T21:25:00.000+02:00", "crawled": "2017-01-26T18:53:45.575+02:00", "highlightTitle": ""}