{"organizations": [], "uuid": "6e69e400eb20b416e928898cc4e31c17b2f828fd", "thread": {"social": {"gplus": {"shares": 1}, "pinterest": {"shares": 0}, "vk": {"shares": 0}, "linkedin": {"shares": 1}, "facebook": {"likes": 126, "shares": 126, "comments": 0}, "stumbledupon": {"shares": 0}}, "site_full": "www.rappler.com", "main_image": "http://assets.rappler.com/5C4CFB2A60634230B21F87AB2A15BF3A/img/1D1F734C65B640D8B33CB85FEFC27F1F/20170110-pagasa-satellite-730pm.gif", "site_section": "http://feeds.feedburner.com/rappler/", "section_title": "RAPPLER", "url": "http://www.rappler.com/nation/special-coverage/weather-alert/157933-20170111-philippine-weather-forecast-lpa", "country": "US", "domain_rank": 1586, "title": "Rainy Wednesday for Luzon, Visayas", "performance_score": 1, "site": "rappler.com", "participants_count": 1, "title_full": "Rainy Wednesday for Luzon, Visayas", "spam_score": 0.0, "site_type": "blogs", "published": "2017-01-10T18:59:00.000+02:00", "replies_count": 0, "uuid": "6e69e400eb20b416e928898cc4e31c17b2f828fd"}, "author": "Rappler.com", "url": "http://www.rappler.com/nation/special-coverage/weather-alert/157933-20170111-philippine-weather-forecast-lpa", "ord_in_thread": 0, "title": "Rainy Wednesday for Luzon, Visayas", "locations": [], "entities": {"persons": [{"name": "rappler", "sentiment": "none"}], "locations": [{"name": "luzon", "sentiment": "none"}, {"name": "visayas", "sentiment": "none"}, {"name": "central luzon", "sentiment": "none"}, {"name": "philippines", "sentiment": "none"}, {"name": "metro manila", "sentiment": "none"}, {"name": "puerto princesa", "sentiment": "none"}, {"name": "palawan", "sentiment": "none"}, {"name": "northern luzon", "sentiment": "none"}, {"name": "quezon", "sentiment": "none"}, {"name": "eastern visayas", "sentiment": "none"}, {"name": "calabarzon", "sentiment": "none"}, {"name": "agos", "sentiment": "none"}, {"name": "aurora", "sentiment": "none"}, {"name": "mimaropa", "sentiment": "none"}, {"name": "bicol", "sentiment": "none"}, {"name": "mindanao", "sentiment": "none"}, {"name": "cagayan valley", "sentiment": "none"}], "organizations": [{"name": "lpa", "sentiment": "none"}, {"name": "pagasa  manila", "sentiment": "none"}, {"name": "pagasa", "sentiment": "none"}]}, "highlightText": "", "language": "english", "persons": [], "text": "#WeatherAlert Rainy Wednesday for Luzon, Visayas The low pressure area is already 230 kilometers southeast of Puerto Princesa, Palawan. The northeast monsoon also continues to affect Northern Luzon and Central Luzon. Published 8:10 PM, January 10, 2017 Updated 8:10 PM, January 10, 2017 \nWhat's the weather like in your area? Report the situation through Rappler's Agos or tweet us at @rapplerdotcom . Satellite image as of January 10, 7:30 pm. Image courtesy of PAGASA \nMANILA, Philippines – It will be rainy in Luzon and the Visayas on Wednesday, January 11, due to the low pressure area (LPA) which was formerly Tropical Depression Auring , plus the northeast monsoon. \nIn a bulletin issued 5 pm on Tuesday, January 10, state weather bureau PAGASA said the LPA is already 230 kilometers southeast of Puerto Princesa, Palawan. \nThe northeast monsoon also continues to affect Northern Luzon and Central Luzon. \nOn Wednesday, moderate to heavy rain is expected in the regions of Bicol and Eastern Visayas, as well as the provinces of Aurora, Quezon, and Palawan. Those areas should be on alert for possible floods and landslides. \nThere will also be light to moderate rain in the rest of Mimaropa, Central Luzon, and Calabarzon, plus Metro Manila, Cagayan Valley, and the rest of the Visayas. \nThe rest of Luzon will have isolated light rain. \nMindanao, meanwhile, should expect isolated thunderstorms. \nPAGASA also warned that coastal waters in Luzon and the Visayas will be moderate to rough. – Rappler.com HOW DOES THIS STORY MAKE YOU FEEL? Happy", "external_links": [], "published": "2017-01-10T18:59:00.000+02:00", "crawled": "2017-01-12T13:03:32.670+02:00", "highlightTitle": ""}