{"organizations": [], "uuid": "8967bd2c043ea67da56ddb8514c1710e2cccfda9", "thread": {"social": {"gplus": {"shares": 1}, "pinterest": {"shares": 0}, "vk": {"shares": 0}, "linkedin": {"shares": 0}, "facebook": {"likes": 205, "shares": 205, "comments": 0}, "stumbledupon": {"shares": 0}}, "site_full": "www.geo.tv", "main_image": "https://www.geo.tv/assets/uploads/updates/2017-01-19/127902_075420_updates.jpg", "site_section": "http://feeds.feedburner.com/GeoBulletins", "section_title": "GEO TV - Sports", "url": "https://www.geo.tv/latest/127902-Australia-wins-toss-elect-to-bowl-against-Pakistan-in-third-ODI", "country": "TV", "domain_rank": 8287, "title": "Australia wins toss, elect to bowl against Pakistan in third ODI", "performance_score": 2, "site": "geo.tv", "participants_count": 0, "title_full": "Australia wins toss, elect to bowl against Pakistan in third ODI", "spam_score": 0.0, "site_type": "blogs", "published": "2017-01-19T14:47:00.000+02:00", "replies_count": 0, "uuid": "8967bd2c043ea67da56ddb8514c1710e2cccfda9"}, "author": "", "url": "https://www.geo.tv/latest/127902-Australia-wins-toss-elect-to-bowl-against-Pakistan-in-third-ODI", "ord_in_thread": 0, "title": "Australia wins toss, elect to bowl against Pakistan in third ODI", "locations": [], "entities": {"persons": [{"name": "steven smith", "sentiment": "none"}, {"name": "smith", "sentiment": "none"}, {"name": "hazlewood", "sentiment": "none"}, {"name": "handscomb", "sentiment": "none"}, {"name": "peter handscomb", "sentiment": "none"}, {"name": "wasim", "sentiment": "none"}, {"name": "junaid", "sentiment": "none"}, {"name": "adam gilchrist", "sentiment": "none"}, {"name": "shafiq", "sentiment": "none"}, {"name": "malik", "sentiment": "none"}, {"name": "mitchell marsh", "sentiment": "none"}, {"name": "wade", "sentiment": "none"}, {"name": "babar", "sentiment": "none"}, {"name": "rizwan", "sentiment": "none"}, {"name": "amir", "sentiment": "none"}, {"name": "billy stanlake", "sentiment": "none"}, {"name": "hafeez", "sentiment": "none"}, {"name": "hasan", "sentiment": "none"}, {"name": "faulkner", "sentiment": "none"}, {"name": "akmal", "sentiment": "none"}, {"name": "stanlake", "sentiment": "none"}, {"name": "mitchell starc", "sentiment": "none"}, {"name": "muhammad hafeez", "sentiment": "none"}, {"name": "sharjeel", "sentiment": "none"}, {"name": "khawaja", "sentiment": "none"}, {"name": "maxwell", "sentiment": "none"}, {"name": "azhar ali", "sentiment": "none"}, {"name": "mohammad hafeez", "sentiment": "none"}], "locations": [{"name": "pakistan", "sentiment": "none"}, {"name": "australia", "sentiment": "none"}, {"name": "handscomb", "sentiment": "none"}, {"name": "perth", "sentiment": "none"}, {"name": "3rd odi", "sentiment": "none"}, {"name": "melbourne", "sentiment": "none"}, {"name": "perth", "sentiment": "none"}], "organizations": [{"name": "odi australia", "sentiment": "negative"}, {"name": "cummins", "sentiment": "none"}, {"name": "warner", "sentiment": "none"}]}, "highlightText": "", "language": "english", "persons": [], "text": "Australia wins toss, elect to bowl against Pakistan in third ODI | Pakistan record first ODI win in Australia in 12 years \nPERTH: Aussies will bowl for the first time in ODI cricket this summer with the series levelled at 1-all \nAustralia have made two changes to the playing 11 that lost in Melbourne on Sunday, with Mitchell Starc (rested) and Mitchell Marsh (injury) omitted for ODI debutant Peter Handscomb and fast bowler Billy Stanlake. \nHandscomb, 25, was presented his maiden ODI cap, No.219 for Australia, by legendary wicketkeeper-batsman Adam Gilchrist. \nPakistan have named an unchanged line-up, with Mohammad Hafeez to captain again in the absence of injured skipper Azhar Ali. \nThe Australian playing 11 for today is: Warner, Khawaja, Smith (c), Head, Handscomb, Maxwell, Wade (wk), Faulkner, Cummins, Hazlewood, Stanlake. \nPakistan has decided to continue with the combination of second ODI. \nHafeez (c), Sharjeel, Babar, Shafiq, Malik, Akmal, Rizwan (wk), Wasim, Amir, Hasan, Junaid. \n0 0 Australia wins toss, elect to bowl against Pakistan in third ODI was posted in sports   Pakistan Vs Australia, Muhammad Hafeez, 3rd Odi, Pakistan, Australia, Steven Smith, Perth.   \"Australia wins toss, elect to bowl against Pakistan in third ODI\" is https://www.geo.tv/latest/127902-Australia-wins-toss-elect-to-bowl-against-Pakistan-in-third-ODI . More From Sports:", "external_links": [], "published": "2017-01-19T14:47:00.000+02:00", "crawled": "2017-01-19T05:15:52.373+02:00", "highlightTitle": ""}