{"organizations": [], "uuid": "f567f8de1cd415627eaa8ff97ea74cab0a77f312", "thread": {"social": {"gplus": {"shares": 0}, "pinterest": {"shares": 0}, "vk": {"shares": 0}, "linkedin": {"shares": 0}, "facebook": {"likes": 395, "shares": 395, "comments": 0}, "stumbledupon": {"shares": 0}}, "site_full": "www.rappler.com", "main_image": "http://rappler-assets.s3-us-west-1.amazonaws.com/612F469A6EA84F6BAE882D2B94A4B421/img/5B424CCFA15641C4AA2EF1C7245B5D8E/wesg-cup.jpg", "site_section": "http://feeds.rappler.com/rappler/technology", "section_title": "Rappler: Technology", "url": "http://www.rappler.com/technology/news/158459-wesg-2016-tnc-staz-win-dota2-hearthstone", "country": "US", "domain_rank": 1586, "title": "PH wins big at the 2016 World Electronic Sports Games", "performance_score": 3, "site": "rappler.com", "participants_count": 1, "title_full": "PH wins big at the 2016 World Electronic Sports Games", "spam_score": 0.0, "site_type": "blogs", "published": "2017-01-16T05:12:00.000+02:00", "replies_count": 0, "uuid": "f567f8de1cd415627eaa8ff97ea74cab0a77f312"}, "author": "Rappler.com", "url": "http://www.rappler.com/technology/news/158459-wesg-2016-tnc-staz-win-dota2-hearthstone", "ord_in_thread": 0, "title": "PH wins big at the 2016 World Electronic Sports Games", "locations": [], "entities": {"persons": [{"name": "jon orange westberg", "sentiment": "none"}, {"name": "samson", "sentiment": "none"}, {"name": "ryo", "sentiment": "none"}, {"name": "euneil", "sentiment": "none"}, {"name": "gosugamers", "sentiment": "none"}, {"name": "hidalgo", "sentiment": "none"}, {"name": "fausto", "sentiment": "none"}, {"name": "timothy", "sentiment": "none"}, {"name": "euneil staz javiñas", "sentiment": "none"}, {"name": "marc", "sentiment": "none"}, {"name": "hasegawa", "sentiment": "none"}, {"name": "staz", "sentiment": "none"}], "locations": [{"name": "philippines", "sentiment": "none"}, {"name": "us", "sentiment": "none"}, {"name": "hearthstone", "sentiment": "none"}, {"name": "manila", "sentiment": "none"}, {"name": "denmark", "sentiment": "none"}, {"name": "china", "sentiment": "none"}, {"name": "changzhou", "sentiment": "none"}], "organizations": [{"name": "tnc pro team", "sentiment": "negative"}, {"name": "wesg hearthstone world finals", "sentiment": "none"}, {"name": "dota", "sentiment": "none"}, {"name": "tnc", "sentiment": "none"}, {"name": "philippine hearthstone", "sentiment": "none"}, {"name": "wesg", "sentiment": "none"}]}, "highlightText": "", "language": "english", "persons": [], "text": "Tech News PH wins big at the 2016 World Electronic Sports Games TNC Pro Team wins the WESG 2016 DOTA 2 tournament while Euneil 'Staz' Javiñas bags the Hearthstone grand prize Published 9:17 AM, January 16, 2017 Updated 9:17 AM, January 16, 2017 TROPHY. This Trophy awaits the winners of the 2016 World Electronic Sports Games. Photo from WESG website. \nMANILA, Philippines – Six Filipinos took home big winnings in two different video game tournaments at the Alibaba-sponsored 2016 World Electronic Sports Games (WESG) grand finals, held from January 12 to 15 in Changzhou, China. \nTNC Pro Team – made up of Marc \" Raven\" Fausto, Ryo \" ryOyr\" Hasegawa, Samson \" Sam_H\" Hidalgo, Carlo \" Kuku\" Palad, and Timothy \" Tims\" Randrup – won the lion's share of a $1.5 million DOTA 2 prize pool, taking home $800,000 or roughly P40 million in this year's WESG. \nDOTA 2 is a team-based multiplayer online battle arena game pitting two teams against each other to destroy the opposing team's base. \nTNC Pro Team took on and defeated Denmark's Cloud9 in the grand finals match. TO GOD BE THE GLORY! THANK TOU FOR THE SUPPORT AND FOR PRAYING WITH US!! — TNC Pro Team (@TNCProTeam) January 15, 2017 \nThis is TNC's biggest DOTA 2 score to date, eclipsing the team's top 8 finish in Valve's The International tournament – which net them approximately $510,000 or around P23.8 million pesos at that time – by around P14 million. CONTEMPLATION. Euneil 'Staz' Javinas at the WESG 2016 grand finals. Photo from WESG website \nMeanwhile, Philippine Hearthstone player Euneil Staz Javiñas defeated Swedish player Jon Orange Westberg to win the WESG Hearthstone World Finals, netting him a cash prize of $150,000 (approximately P7.5 million). \nHearthstone is a turn-based, online collectible card game where two opposing players attempt to whittle down the other's health by summoning spells and attack units in the form of cards. The game is based off the Warcraft and World of Warcraft games of Blizzard Entertainment. \nFollowing Staz's win, GosuGamers now places him in the 4th rank on the Asian rankings . – Rappler.com HOW DOES THIS STORY MAKE YOU FEEL? Happy", "external_links": [], "published": "2017-01-16T05:12:00.000+02:00", "crawled": "2017-01-16T03:28:58.329+02:00", "highlightTitle": ""}