{"organizations": [], "uuid": "674c8fd432088ee25f7b1013cc6ca269d89e56e7", "thread": {"social": {"gplus": {"shares": 0}, "pinterest": {"shares": 0}, "vk": {"shares": 0}, "linkedin": {"shares": 0}, "facebook": {"likes": 133, "shares": 133, "comments": 0}, "stumbledupon": {"shares": 0}}, "site_full": "www.rappler.com", "main_image": "http://assets.rappler.com/5C4CFB2A60634230B21F87AB2A15BF3A/img/5523807CD51A4B2B8929526C7BA74C20/20170114-lpa-satellite-5pm.gif", "site_section": "http://feeds.rappler.com/disasters-and-weather", "section_title": "Project Agos + #WeatherAlert feed", "url": "http://www.rappler.com/nation/special-coverage/weather-alert/158360-20170115-philippine-weather-forecast-lpa", "country": "US", "domain_rank": 1586, "title": "Rainy Sunday for Bicol, Northern and Eastern Samar", "performance_score": 1, "site": "rappler.com", "participants_count": 1, "title_full": "Rainy Sunday for Bicol, Northern and Eastern Samar", "spam_score": 0.0, "site_type": "blogs", "published": "2017-01-14T16:43:00.000+02:00", "replies_count": 0, "uuid": "674c8fd432088ee25f7b1013cc6ca269d89e56e7"}, "author": "Rappler.com", "url": "http://www.rappler.com/nation/special-coverage/weather-alert/158360-20170115-philippine-weather-forecast-lpa", "ord_in_thread": 0, "title": "Rainy Sunday for Bicol, Northern and Eastern Samar", "locations": [], "entities": {"persons": [{"name": "catarman", "sentiment": "none"}, {"name": "rappler", "sentiment": "none"}], "locations": [{"name": "bicol", "sentiment": "none"}, {"name": "oriental mindoro", "sentiment": "none"}, {"name": "philippines", "sentiment": "none"}, {"name": "central luzon", "sentiment": "none"}, {"name": "luzon", "sentiment": "none"}, {"name": "eastern samar", "sentiment": "none"}, {"name": "romblon", "sentiment": "none"}, {"name": "marinduque", "sentiment": "none"}, {"name": "manila", "sentiment": "none"}, {"name": "northern samar", "sentiment": "none"}, {"name": "visayas", "sentiment": "none"}, {"name": "northern luzon", "sentiment": "none"}, {"name": "quezon", "sentiment": "none"}, {"name": "catarman", "sentiment": "none"}, {"name": "agos", "sentiment": "none"}, {"name": "mindanao", "sentiment": "none"}], "organizations": [{"name": "lpa", "sentiment": "none"}, {"name": "occidental mindoro", "sentiment": "none"}, {"name": "pagasa", "sentiment": "none"}]}, "highlightText": "", "language": "english", "persons": [], "text": "Rainy Sunday for Bicol, Northern and Eastern Samar The low pressure area is already 115 kilometers east northeast of Catarman, Northern Samar Published 5:45 PM, January 14, 2017 Updated 5:45 PM, January 14, 2017 \nWhat's the weather like in your area? Report the situation through Rappler's Agos or tweet us at @rapplerdotcom . Satellite image as of January 14, 5 pm. Image courtesy of PAGASA \nMANILA, Philippines – A low pressure area (LPA) and the northeast monsoon will bring more rain to parts of the country on Sunday, January 15. \nIn a bulletin issued 5 pm on Saturday, January 14, state weather bureau PAGASA said the LPA is already 115 kilometers east northeast of Catarman, Northern Samar. \nPAGASA earlier said that the LPA has a \"low\" chance of developing into a tropical cyclone, but advised the public to continue monitoring updates. \nThe northeast monsoon also continues to affect Northern Luzon and Central Luzon. \nOn Sunday, moderate to heavy rain is expected in the region of Bicol, as well as the provinces of Northern Samar and Eastern Samar. Those areas should be on alert for possible floods and landslides. \nThere will also be light to moderate rain in the rest of the Visayas, plus the provinces of Quezon, Oriental Mindoro, Occidental Mindoro, Marinduque, and Romblon. \nLight rain, meanwhile, will be experienced in the rest of Luzon. \nMindanao will just have isolated rainshowers or thunderstorms. \nPAGASA also warned that coastal waters in Luzon and the Visayas will be moderate to rough. – Rappler.com HOW DOES THIS STORY MAKE YOU FEEL? Happy", "external_links": [], "published": "2017-01-14T16:43:00.000+02:00", "crawled": "2017-01-15T03:32:42.080+02:00", "highlightTitle": ""}