{"organizations": [], "uuid": "adc5c30a345616752af5740d5c1150e301f8b8da", "thread": {"social": {"gplus": {"shares": 0}, "pinterest": {"shares": 0}, "vk": {"shares": 0}, "linkedin": {"shares": 0}, "facebook": {"likes": 302, "shares": 302, "comments": 0}, "stumbledupon": {"shares": 0}}, "site_full": "comicbook.com", "main_image": "http://media.comicbook.com/2017/02/aqualad-momoa-233272-640x320.jpeg", "site_section": "http://www.comicbook.com//rss", "section_title": "Comicbook.com", "url": "http://comicbook.com/2017/02/20/james-wan-talks-aqualad-in-aquaman-movie/", "country": "US", "domain_rank": 2930, "title": "James Wan Comments On The Possibility Of Aqualad Appearing In Aquaman", "performance_score": 3, "site": "comicbook.com", "participants_count": 1, "title_full": "James Wan Comments On The Possibility Of Aqualad Appearing In Aquaman", "spam_score": 0.0, "site_type": "blogs", "published": "2017-02-21T00:45:00.000+02:00", "replies_count": 0, "uuid": "adc5c30a345616752af5740d5c1150e301f8b8da"}, "author": "Charlie Ridgely", "url": "http://comicbook.com/2017/02/20/james-wan-talks-aqualad-in-aquaman-movie/", "ord_in_thread": 0, "title": "James Wan Comments On The Possibility Of Aqualad Appearing In Aquaman", "locations": [], "entities": {"persons": [{"name": "articl", "sentiment": "negative"}, {"name": "james wan", "sentiment": "negative"}, {"name": "jason momoa", "sentiment": "none"}, {"name": "aqualad", "sentiment": "none"}, {"name": "gal gadot", "sentiment": "none"}, {"name": "jeremy irons", "sentiment": "none"}, {"name": "ciarán hinds", "sentiment": "none"}, {"name": "amy adams", "sentiment": "none"}, {"name": "bruce wayne", "sentiment": "none"}, {"name": "diana prince", "sentiment": "none"}, {"name": "chris terrio", "sentiment": "none"}, {"name": "ray fisher", "sentiment": "none"}, {"name": "ben affleck", "sentiment": "none"}, {"name": "henry cavill", "sentiment": "none"}, {"name": "ezra miller", "sentiment": "none"}, {"name": "batman", "sentiment": "none"}, {"name": "jesse eisenberg", "sentiment": "none"}, {"name": "zack snyder", "sentiment": "none"}, {"name": "robin", "sentiment": "none"}, {"name": "diane lane", "sentiment": "none"}, {"name": "superman", "sentiment": "none"}, {"name": "arthur curry", "sentiment": "none"}], "locations": [{"name": "aqualad", "sentiment": "none"}, {"name": "vulko", "sentiment": "none"}, {"name": "atlanna", "sentiment": "none"}, {"name": "black manta", "sentiment": "none"}], "organizations": [{"name": "justice league", "sentiment": "none"}, {"name": "justice league 2017 comicbook anticipated", "sentiment": "none"}]}, "highlightText": "", "language": "english", "persons": [], "text": "James Wan Comments On The Possibility Of Aqualad Appearing In Aquaman Charlie Ridgely Back to Article Image of \nWith Aquaman beginning production soon, fans are starting to realize just how big of a world James Wan will be exploring in the film. \nThe cast continues to grow, proving that a ton of classic Aquaman characters will make themselves known. Mera, Orm, Black Manta, Vulko, and Atlanna are all confirmed to appear alongside Arthur Curry in the movie. \nThat's a pretty long list, and there's surely more to come. However, if you're a fan of Young Justice or Teen Titans , there's one glaring omission to the cast. \nWhat about Aqualad? \nMany have been asking if the famous sidekick will appear in Aquaman . Finally, on Twitter, director James Wan shut down those rumors once and for all. \nAbsolutely not at all. But thanks for asking. https://t.co/THEIDZG1n8 — James Wan (@creepypuppet) February 20, 2017 \nAfter Wan was pretty definitive about the character not showing up in the film, some fans stated that their hearts were being broken. This gave Wan an opportunity to explain why he chose not to include Aqualad in the movie, and his answer makes a ton of sense. \nHow about we get Batman established properly first, before we cram in Robin. https://t.co/RlX3YiWelB — James Wan (@creepypuppet) February 20, 2017 \nAquaman is set to hit theaters in 2018, but he will first appear in this year's Justice League film. \nLet us know how pumped you are about Justice League below with our anticipation rankings! Right now, it’s the third-most anticipated movie on all of ComicBook.com! \nIn Justice League, fueled by his restored faith in humanity and inspired by Superman’s selfless act, Bruce Wayne enlists the help of his newfound ally, Diana Prince, to face an even greater enemy. Together, Batman and Wonder Woman work quickly to find and recruit a team of metahumans to stand against this newly awakened threat. But despite the formation of this unprecedented league of heroes—Batman, Wonder Woman, Aquaman, Cyborg and The Flash—it may already be too late to save the planet from an assault of catastrophic proportions. \nJustice League is directed by Zack Snyder, from a screenplay by Chris Terrio, and features an ensemble cast that includes Ben Affleck, Henry Cavill, Gal Gadot, Ezra Miller, Jason Momoa , Ray Fisher, Ciarán Hinds, Amy Adams, Diane Lane, Jeremy Irons and Jesse Eisenberg. \nJustice League hits theaters on November 11, 2017. Justice League 2017 ComicBook Anticipated #6 Best-Rated Before Release Anticipated Rating", "external_links": [], "published": "2017-02-21T00:45:00.000+02:00", "crawled": "2017-02-20T20:44:47.088+02:00", "highlightTitle": ""}