{"organizations": [], "uuid": "bb5bf7fc3a539744511b95b2776a8b8f921523cb", "thread": {"social": {"gplus": {"shares": 0}, "pinterest": {"shares": 0}, "vk": {"shares": 0}, "linkedin": {"shares": 1}, "facebook": {"likes": 249, "shares": 249, "comments": 2}, "stumbledupon": {"shares": 0}}, "site_full": "www.independent.ie", "main_image": "http://www.independent.ie/incoming/article35355907.ece/ALTERNATES/h342/GettyImages-630526056.jpg", "site_section": "http://www.independent.ie/rss", "section_title": "Independent.ie - Independent.ie RSS Feed", "url": "http://www.independent.ie/irish-news/politics/walkout-at-council-meeting-after-lord-mayor-of-dublin-awards-freedom-of-the-city-to-the-obamas-35429635.html", "country": "IE", "domain_rank": 3626, "title": "Walk-out at council meeting after Lord Mayor of Dublin awards Freedom of the City to the Obamas", "performance_score": 2, "site": "independent.ie", "participants_count": 0, "title_full": "Walk-out at council meeting after Lord Mayor of Dublin awards Freedom of the City to the Obamas", "spam_score": 0.0, "site_type": "blogs", "published": "2017-02-07T05:53:00.000+02:00", "replies_count": 0, "uuid": "bb5bf7fc3a539744511b95b2776a8b8f921523cb"}, "author": "", "url": "http://www.independent.ie/irish-news/politics/walkout-at-council-meeting-after-lord-mayor-of-dublin-awards-freedom-of-the-city-to-the-obamas-35429635.html", "ord_in_thread": 0, "title": "Walk-out at council meeting after Lord Mayor of Dublin awards Freedom of the City to the Obamas", "locations": [], "entities": {"persons": [{"name": "joe biden", "sentiment": "none"}, {"name": "malia", "sentiment": "none"}, {"name": "martha argerich", "sentiment": "none"}, {"name": "barack obama", "sentiment": "none"}, {"name": "martinez monsivais", "sentiment": "none"}, {"name": "jill biden", "sentiment": "none"}, {"name": "michelle", "sentiment": "none"}, {"name": "james taylor", "sentiment": "none"}, {"name": "al pacino", "sentiment": "none"}, {"name": "mavis staples", "sentiment": "none"}, {"name": "michelle obama", "sentiment": "none"}], "locations": [{"name": "dublin", "sentiment": "none"}, {"name": "ellipse of the national mall", "sentiment": "none"}, {"name": "moneygall", "sentiment": "none"}, {"name": "us", "sentiment": "none"}, {"name": "washington", "sentiment": "none"}, {"name": "dublin us", "sentiment": "none"}, {"name": "ireland", "sentiment": "none"}, {"name": "chicago", "sentiment": "none"}, {"name": "marine corps base hawaii", "sentiment": "none"}, {"name": "kailua", "sentiment": "none"}, {"name": "washington, dc", "sentiment": "none"}], "organizations": [{"name": "obamas", "sentiment": "negative"}, {"name": "kennedy center", "sentiment": "none"}, {"name": "dublin city council", "sentiment": "none"}, {"name": "the eagles", "sentiment": "none"}, {"name": "obamas ian begley", "sentiment": "none"}, {"name": "kennedy center honors", "sentiment": "none"}, {"name": "ollie hayes bar", "sentiment": "none"}, {"name": "ap", "sentiment": "none"}, {"name": "mccormick place", "sentiment": "none"}]}, "highlightText": "", "language": "english", "persons": [], "text": "Monday 6 February 2017 Walk-out at council meeting after Lord Mayor of Dublin awards Freedom of the City to the Obamas Ian Begley 0 Comments Share Walk-out at council meeting after Lord Mayor of Dublin awards Freedom of the City to the Obamas Independent.ie There was a walk-out at Dublin City Council's meeting today after the Lord Mayor awarded the Freedom of the City to Barack Obama. http://www.independent.ie/irish-news/politics/walkout-at-council-meeting-after-lord-mayor-of-dublin-awards-freedom-of-the-city-to-the-obamas-35429635.html http://www.independent.ie/incoming/article35355907.ece/b5244/AUTOCROP/h342/GettyImages-630526056.jpg US President Barack Obama addresses troops with First Lady Michelle Obama at Marine Corps Base Hawaii in Kailua President Barack Obama and first lady Michelle Obama attend the Kennedy Center Honors show December 4, 2016 at the Kennedy Center in Washington, DC. The honorees include the band The Eagles, singer Mavis Staples, actor Al Pacino, singer James Taylor and pianist Martha Argerich. Photo: Aude Guerrucci-Pool/Getty Images Thirsty work: Michelle and Barack Obama enjoy a drink of Guinness at Ollie Hayes Bar in Moneygall, Co Offaly - the president's ancestral home - on their previous trip to Ireland in 2011 Photo: MAXWELLS DUBLIN US President Barack Obama and First Lady Michelle Obama react during the National Christmas Tree Lighting on the Ellipse of the National Mall in Washington on December 1, 2016. President Barack Obama waves on stage with first lady Michelle Obama, daughter Malia, Vice President Joe Biden and his wife Jill Biden after his farewell address at McCormick Place in Chicago, Tuesday, Jan. 10, 2017. (AP Photo/Pablo Martinez Monsivais) First lady Michelle Obama hugs President Barack Obama after his farewell address at McCormick Place in Chicago, Tuesday, Jan. 10, 2017. (AP Photo/Pablo Martinez Monsivais) There was a walk-out at Dublin City Council's meeting today after the Lord Mayor awarded the Freedom of the City to Barack Obama. Share Walk-out at council meeting after Lord Mayor of Dublin awards Freedom of the City to the Obamas Independent.ie There was a walk-out at Dublin City Council's meeting today after the Lord Mayor awarded the Freedom of the City to Barack Obama. http://www.independent.ie/irish-news/politics/walkout-at-council-meeting-after-lord-mayor-of-dublin-awards-freedom-of-the-city-to-the-obamas-35429635.html", "external_links": [], "published": "2017-02-07T05:53:00.000+02:00", "crawled": "2017-02-07T01:30:14.791+02:00", "highlightTitle": ""}