{"organizations": [], "uuid": "fd612c32bca2a8ed74dea59ddf3ceecaf2bc804b", "thread": {"social": {"gplus": {"shares": 1}, "pinterest": {"shares": 0}, "vk": {"shares": 0}, "linkedin": {"shares": 0}, "facebook": {"likes": 140, "shares": 140, "comments": 0}, "stumbledupon": {"shares": 0}}, "site_full": "www.telegraph.co.uk", "main_image": "http://www.telegraph.co.uk/content/dam/news/2017/02/07/PD45507489-AP-trump-robe-xlarge_trans_NvBQzQNjv4BqPkPWLXP_iG_X2Wo3V95CSl62skVtud8P1z36O1Wu_sU.jpg", "site_section": "http://www.telegraph.co.uk/newsfeed/rss/education.xml", "section_title": "News", "url": "http://www.telegraph.co.uk/news/2017/02/07/donald-trump-definitely-doesnt-wear-bathrobe-says-sean-spicer/", "country": "GB", "domain_rank": 317, "title": "Donald Trump 'definitely doesn't wear' a bathrobe, says Sean Spicer ... but Twitter disagrees", "performance_score": 1, "site": "telegraph.co.uk", "participants_count": 1, "title_full": "Donald Trump 'definitely doesn't wear' a bathrobe, says Sean Spicer ... but Twitter disagrees", "spam_score": 0.0, "site_type": "blogs", "published": "2017-02-07T13:23:00.000+02:00", "replies_count": 0, "uuid": "fd612c32bca2a8ed74dea59ddf3ceecaf2bc804b"}, "author": "Chris Graham", "url": "http://www.telegraph.co.uk/news/2017/02/07/donald-trump-definitely-doesnt-wear-bathrobe-says-sean-spicer/", "ord_in_thread": 0, "title": "Donald Trump 'definitely doesn't wear' a bathrobe, says Sean Spicer ... but Twitter disagrees", "locations": [], "entities": {"persons": [{"name": "donald trump", "sentiment": "negative"}, {"name": "sean spicer", "sentiment": "negative"}, {"name": "— katie jacobs stanton", "sentiment": "none"}, {"name": "trump", "sentiment": "none"}, {"name": "spicer", "sentiment": "none"}, {"name": "hunter schwarz", "sentiment": "none"}, {"name": "john aravosis", "sentiment": "none"}, {"name": "— donald j. trump", "sentiment": "none"}, {"name": "jenna mullins", "sentiment": "none"}, {"name": "mike rowe", "sentiment": "none"}, {"name": "jennifer bendery", "sentiment": "none"}, {"name": "chris graham", "sentiment": "none"}, {"name": "mr trump", "sentiment": "none"}], "locations": [{"name": "panama city", "sentiment": "none"}, {"name": "america", "sentiment": "none"}, {"name": "white house", "sentiment": "none"}, {"name": "trump ocean club international hotel and tower", "sentiment": "none"}], "organizations": [{"name": "white house", "sentiment": "none"}, {"name": "google", "sentiment": "none"}, {"name": "new york times", "sentiment": "none"}]}, "highlightText": "", "language": "english", "persons": [], "text": "News Donald Trump 'definitely doesn't wear' a bathrobe, says Sean Spicer ... but Twitter disagrees A bathrobe hangs in a room at the Trump Ocean Club International Hotel and Tower in Panama City Credit: AP Chris Graham  23am \nT he White House has gone on the offensive after a New York Times report painted a picture of a chaotic first couple of weeks for Donald Trump's presidency. \nBut while the article describes the \"bungled rollout\" of the executive order on immigration and \"a flurry of ... embarrassments\", it was the assertion that Mr Trump wears a bathrobe that seemed to particularly irk the administration. The failing @nytimes was forced to apologize to its subscribers for the poor reporting it did on my election win. Now they are worse! — Donald J. Trump (@realDonaldTrump) February 7, 2017 \nC alling it the \"epitome of fake news\", Sean Spicer, the White House press secretary, said: \"I don’t think the president owns a bathrobe. He definitely doesn’t wear one.\" \nTwitter users begged to differ. \nThe assertion prompted a flurry of pictures showing the president lounging around in white bathrobes. Sean Spicer: \"I don't think the president owns a bathrobe.\" (via @justinsink Let's see, Google \"Trump\"\"bathrobe\" ... OH MY GOD pic.twitter.com/bnb0odcTXD — Jennifer Bendery (@jbendery) February 6, 2017 Donald Trump would never wear a bathrobe. pic.twitter.com/uGo1unhwE6 — John Aravosis (@aravosis) February 7, 2017 Speaking of Donald Trump and bathrobes, Mike Rowe once auctioned an autographed Trump bathrobe https://t.co/gxBktjoCYd pic.twitter.com/V7vB6mQ6xT — Hunter Schwarz (@hunterschwarz) February 6, 2017 \nT he images were not an entirely welcome sight for some users. America's reaction upon hearing Sean Spicer felt the need to say Trump doesn't own a bathrobe… pic.twitter.com/aTOnNT2Q9O — kate hannon (@CoastalKate) February 6, 2017 OMG NO MORE PHOTOS OF TRUMP IN A BATHROBE! — Katie Jacobs Stanton (@KatieS) February 6, 2017 Me: \"Time to log onto the ol' Twitter!\"*HUNDREDS OF PHOTOS OF TRUMP IN A BATHROBE* — Jenna Mullins (@JBomb11) February 6, 2017 \nS ome people, meanwhile, wondered how exactly Mr Spicer could confirm this. The idea that Spicer can definitively confirm that Trump never puts on a bathrobe after getting out of the shower is a tad creepy #bathrobe", "external_links": [], "published": "2017-02-07T13:23:00.000+02:00", "crawled": "2017-02-07T08:42:31.164+02:00", "highlightTitle": ""}