{"organizations": [], "uuid": "93813269d14fd665755109bb3ccbb7727f1319f5", "thread": {"social": {"gplus": {"shares": 1}, "pinterest": {"shares": 0}, "vk": {"shares": 0}, "linkedin": {"shares": 0}, "facebook": {"likes": 161, "shares": 161, "comments": 0}, "stumbledupon": {"shares": 0}}, "site_full": "www.jpost.com", "main_image": "http://www.jpost.com/HttpHandlers/ShowImage.ashx?ID=323556", "site_section": "http://www.jpost.com/Rss/RssFeedsBenjaminNetanyahu", "section_title": "JPost.com - Benjamin Netanyahu", "url": "http://www.jpost.com/Israel-News/Benjamin-Netanyahu/Netanyahu-Settlements-are-an-issue-but-not-the-main-issue-481858", "country": "US", "domain_rank": 7307, "title": "Netanyahu: Settlements are an issue but not the main issue", "performance_score": 1, "site": "jpost.com", "participants_count": 1, "title_full": "Netanyahu: Settlements are an issue but not the main issue", "spam_score": 0.0, "site_type": "blogs", "published": "2017-02-17T10:10:00.000+02:00", "replies_count": 0, "uuid": "93813269d14fd665755109bb3ccbb7727f1319f5"}, "author": "JPOST.COM STAFF", "url": "http://www.jpost.com/Israel-News/Benjamin-Netanyahu/Netanyahu-Settlements-are-an-issue-but-not-the-main-issue-481858", "ord_in_thread": 0, "title": "Netanyahu: Settlements are an issue but not the main issue", "locations": [], "entities": {"persons": [{"name": "netanyahu", "sentiment": "negative"}, {"name": "arab", "sentiment": "none"}, {"name": "van susteren", "sentiment": "none"}, {"name": "trump", "sentiment": "none"}, {"name": "barack obama", "sentiment": "none"}, {"name": "donald trump", "sentiment": "none"}, {"name": "benjamin netanyahu", "sentiment": "none"}, {"name": "greta van susteren", "sentiment": "none"}], "locations": [{"name": "iran", "sentiment": "none"}, {"name": "jordan river", "sentiment": "none"}, {"name": "us", "sentiment": "none"}, {"name": "efrat", "sentiment": "none"}, {"name": "white house", "sentiment": "none"}, {"name": "west bank", "sentiment": "none"}, {"name": "israel", "sentiment": "none"}, {"name": "middle east", "sentiment": "none"}], "organizations": [{"name": "msnbc", "sentiment": "none"}, {"name": "islamic state", "sentiment": "none"}, {"name": "marc israel sellem/the jerusalem post", "sentiment": "none"}, {"name": "reuters", "sentiment": "none"}]}, "highlightText": "", "language": "english", "persons": [], "text": "Netanyahu: Settlements are an issue but not the main issue By JPOST.COM STAFF February 17, 2017 05:10 Nonetheless, the prime minister says it is vital for Israel to \"retain security control\" in the West Bank. Efrat settlement, West Bank. (photo credit:MARC ISRAEL SELLEM/THE JERUSALEM POST) \nPrime Minister Benjamin Netanyahu said that Palestinian refusal to accept Israel, not settlements, is the main roadblock to peace. Speaking with MSNBC's Greta Van Susteren late on Thursday evening , he was asked why both US President Donald Trump and former US President Barack Obama have pegged Israeli settlements as a roadblock to Israeli-Palestinian peace. Netanyahu responded that he thinks settlements are \"an issue, but I don't think it's the issue.\" Trump tells Netanyahu to 'hold back on settlements' during first meet The interview comes the day after his first meeting with Trump at the White House, where Trump asking Netanyahu to â€œhold back on settlements for a bit.\"\"The real core of the conflict is not this or that settlement or this or that community,\" Netanyahu told Van Susteren, \"but rather the persistent and enduring Palestinian refusal to recognize a Jewish state in any boundary.\" Trump tells Israel to 'hold back on settlements' during meeting with Netanyahu at White House on Feb. 15, 2017 (credit: REUTERS) He also said it was vital for Israel to \"retain security control of the area west of the Jordan River,\" referring to the West BankTurning to the topic of peace in the region, Netanyahu said there was great potential for a broader peace between Israel and Arab countries in the Middle East, saying that Arab countries are beginning to view Israel as an ally for confronting Iran and Islamic State. \"That has been bringing us closer together and may also pave avenues for peace.\"When asked to specifically name a country that has been softening its stance toward Israel he said \"who's not?\" to which Van Susteren responded that \"Iran's not.\" Netanyahu responded back that Iran is not an Arab country. Relevant to your professional network? Please share on Linkedin Tags:", "external_links": [], "published": "2017-02-17T10:10:00.000+02:00", "crawled": "2017-02-17T05:24:00.384+02:00", "highlightTitle": ""}