{"organizations": [], "uuid": "3d65b291b68738abc2edf27d9d5cf5acbd028473", "thread": {"social": {"gplus": {"shares": 1}, "pinterest": {"shares": 0}, "vk": {"shares": 0}, "linkedin": {"shares": 0}, "facebook": {"likes": 320, "shares": 320, "comments": 0}, "stumbledupon": {"shares": 0}}, "site_full": "www.telegraph.co.uk", "main_image": "http://www.telegraph.co.uk/content/dam/news/2017/02/04/iranmissile-xlarge_trans_NvBQzQNjv4BqNJjoeBT78QIaYdkJdEY4CnGTJFJS74MYhNY6w3GNbO8.jpg", "site_section": "http://www.telegraph.co.uk/newsfeed/rss/letters.xml", "section_title": "News", "url": "http://www.telegraph.co.uk/news/2017/02/05/iran-vows-roaring-missiles-threatened-defies-new-sanctions/", "country": "GB", "domain_rank": 317, "title": "Iran vows 'roaring missiles' if threatened, defies new sanctions", "performance_score": 3, "site": "telegraph.co.uk", "participants_count": 1, "title_full": "Iran vows 'roaring missiles' if threatened, defies new sanctions", "spam_score": 0.0, "site_type": "blogs", "published": "2017-02-05T12:27:00.000+02:00", "replies_count": 0, "uuid": "3d65b291b68738abc2edf27d9d5cf5acbd028473"}, "author": "Reuters", "url": "http://www.telegraph.co.uk/news/2017/02/05/iran-vows-roaring-missiles-threatened-defies-new-sanctions/", "ord_in_thread": 0, "title": "Iran vows 'roaring missiles' if threatened, defies new sanctions", "locations": [], "entities": {"persons": [{"name": "tasnim", "sentiment": "none"}, {"name": "amir ali hajizadeh", "sentiment": "none"}, {"name": "trump", "sentiment": "none"}, {"name": "donald trump", "sentiment": "none"}, {"name": "ahmad reza pourdastan", "sentiment": "none"}, {"name": "michael flynn", "sentiment": "none"}, {"name": "jim mattis", "sentiment": "none"}], "locations": [{"name": "iran", "sentiment": "none"}, {"name": "america", "sentiment": "none"}, {"name": "islamic republic", "sentiment": "none"}, {"name": "washington", "sentiment": "none"}, {"name": "tehran", "sentiment": "none"}, {"name": "u.s.", "sentiment": "none"}, {"name": "semnan", "sentiment": "none"}, {"name": "middle east", "sentiment": "none"}], "organizations": [{"name": "reuters", "sentiment": "negative"}, {"name": "defence", "sentiment": "none"}, {"name": "follow telegraph news", "sentiment": "none"}, {"name": "u.n. security council", "sentiment": "none"}, {"name": "isna", "sentiment": "none"}]}, "highlightText": "", "language": "english", "persons": [], "text": "Iran vows 'roaring missiles' if threatened, defies new sanctions Iran missile Reuters 5 February 2017 • 5:27am \nA Revolutionary Guards commander said Iran would use its missiles if its security is under threat, as the elite force defied new U.S. sanctions on its missile programme by holding a military exercise on Saturday. \nTensions between Tehran and Washington have risen since a recent Iranian ballistic missile test which prompted U.S. President Donald Trump's administration to impose sanctions on individuals and entities linked to the Revolutionary Guards. \nTrump's national security adviser Michael Flynn said the Washington was putting Iran on notice over its \"destabilising activity\", and Trump tweeted Tehran was \"playing with fire\" \n\"We are working day and night to protect Iran’s security,\" head of Revolutionary Guards' aerospace unit, Brigadier General Amir Ali Hajizadeh was quoted as saying by Tasnim news agency. Watch | Iran deploys air defence system around nuclear facility 01:04 \n\"If we see smallest misstep from the enemies, our roaring missiles will fall on their heads,\" he added. \nD espite the heated words, U.S. Defence Secretary Jim Mattis said on Saturday he was not considering raising the number of U.S. forces in the Middle East to address Iran's \"misbehavior\", but warned that the world would not ignore Iranian activities. \nIran's Revolutionary Guards is holding the military exercise in Semnan province on Saturday to test missile and radar systems and to \"showcase the power of Iran's revolution and to dismiss the sanctions,\" according to the force's website. \nDismissing Trump's comments that \"nothing is off the table\" in dealing with Tehran, the commander of Iran's ground forces said on Saturday that the Islamic Republic has been hearing such threats since its 1979 revolution. Iran nuclear talks \n\"The defence capability and the offensive prowess of Iran's armed forces would make America or any other enemy regretful of any incursion,\" Ahmad Reza Pourdastan was quoted as saying by ISNA. \nr anian state news agencies reported that home-made missile systems, radars, command and control centres, and cyber warfare systems would be tested in Saturday's drill. \nIran has one of the Middle East's largest missile programmes and held a similar exercise in December to showcase its defence systems, including radars, anti-missile defence units, and short and medium-range missiles. \nTehran confirmed on Wednesday that it had test-fired a new ballistic missile, but said the test did not breach the Islamic Republic's nuclear agreement with world powers or a U.N. Security Council resolution endorsing the pact. Follow Telegraph News", "external_links": [], "published": "2017-02-05T12:27:00.000+02:00", "crawled": "2017-02-05T07:34:33.759+02:00", "highlightTitle": ""}