{"organizations": [], "uuid": "40696a41b5715fae5b7a21a9524ca28c83f30610", "thread": {"social": {"gplus": {"shares": 0}, "pinterest": {"shares": 0}, "vk": {"shares": 0}, "linkedin": {"shares": 0}, "facebook": {"likes": 103, "shares": 103, "comments": 0}, "stumbledupon": {"shares": 0}}, "site_full": "ftw.usatoday.com", "main_image": "http://www.gannett-cdn.com/-mm-/e1e0485299e7e676e5cad61ca80a6659d4aeb9ac/c=0-218-3105-1965&amp;r=x633&amp;c=1200x630/local/-/media/2017/02/05/USATODAY/usatsports/gty_633957188_88577926.jpg", "site_section": "http://rssfeeds.usatoday.com/UsatodaycomNfl-TopStories", "section_title": "GANNETT Syndication Service", "url": "http://ftw.usatoday.com/2017/02/roger-goodell-tom-brady-robert-kraft", "country": "US", "domain_rank": 313, "title": "See the moments when Tom Brady, Robert Kraft shook hands with Roger Goodell", "performance_score": 1, "site": "usatoday.com", "participants_count": 1, "title_full": "See the moments when Tom Brady, Robert Kraft shook hands with Roger Goodell", "spam_score": 0.0, "site_type": "blogs", "published": "2017-02-06T11:01:00.000+02:00", "replies_count": 0, "uuid": "40696a41b5715fae5b7a21a9524ca28c83f30610"}, "author": "USA TODAY Sports", "url": "http://ftw.usatoday.com/2017/02/roger-goodell-tom-brady-robert-kraft", "ord_in_thread": 0, "title": "See the moments when Tom Brady, Robert Kraft shook hands with Roger Goodell", "locations": [], "entities": {"persons": [{"name": "roger goodell", "sentiment": "positive"}, {"name": "robert kraft", "sentiment": "positive"}, {"name": "tom brady", "sentiment": "positive"}, {"name": "brady", "sentiment": "none"}, {"name": "andrew jerell jones", "sentiment": "none"}, {"name": "julia haley", "sentiment": "none"}, {"name": "steven ruiz", "sentiment": "none"}, {"name": "barry kriger", "sentiment": "none"}, {"name": "kraft", "sentiment": "none"}, {"name": "goodell", "sentiment": "none"}, {"name": "roger goodell nina mandell", "sentiment": "none"}], "locations": [{"name": "usa", "sentiment": "none"}, {"name": "houston", "sentiment": "none"}, {"name": "nrg stadium", "sentiment": "none"}, {"name": "texas", "sentiment": "none"}], "organizations": [{"name": "atlanta falcons", "sentiment": "none"}, {"name": "gillette", "sentiment": "none"}, {"name": "nfl", "sentiment": "none"}]}, "highlightText": "", "language": "english", "persons": [], "text": "  See the moments when Tom Brady, Robert Kraft shook hands with Roger Goodell This moment. Post to Facebook See the moments when Tom Brady, Robert Kraft shook hands with Roger Goodell This moment.  //ftw.usatoday.com/2017/02/roger-goodell-tom-brady-robert-kraft/   See the moments when Tom Brady, Robert Kraft shook hands with Roger Goodell Nina Mandell , USA TODAY Sports 11:01 p.m. ET Feb. 5, 2017 \nNFL commissioner Roger Goodell speaks to Tom Brady #12 of the New England Patriots after defeating the Atlanta Falcons during Super Bowl 51 at NRG Stadium on February 5, 2017 in Houston, Texas. (Photo: Getty Images) \nIn case you missed it, a scandal we nicknamed 'Deflategate' made the relationship between the NFL commissioner and the Patriots just a bit icy. But, as Brady promised, it was all professionalism when the QB shook hands with the man that suspended him. Goodell, of course, got booed by Patriots fans. remember when roger goodell thought that suspending Tom Brady would ruin our season hahahahahaha pic.twitter.com/06yhWwZ6K4 — Julia Haley (@juliahaley61) February 6, 2017 Goodell getting booed. But Brady's a class act. @WWLP22News pic.twitter.com/KumZvRcbgO — Barry Kriger (@KrigerBarry) February 6, 2017 So this is why Goodell is avoiding Gillette pic.twitter.com/H5tLSqnvaI — Steven Ruiz (@theStevenRuiz) February 6, 2017 \nAfter the game, Brady was asked if the win was a bit of \"redemption\". \n\"\"This is all positive,\" he said. \"I'm going to go see my family.\" \nMinutes later, Kraft shook hands with Goodell but then later took pretty blatant shots at the Commissioner shortly after. Roger Goodell booed all over #SuperBowl pic.twitter.com/F22DI9vDc2 — Andrew Jerell Jones (@sluggahjells) February 6, 2017 Read or Share this story: http://ftw.usatoday.com/2017/02/roger-goodell-tom-brady-robert-kraft/ Most Popular", "external_links": [], "published": "2017-02-06T11:01:00.000+02:00", "crawled": "2017-02-06T06:10:01.665+02:00", "highlightTitle": ""}