{"organizations": [], "uuid": "2d3c9c50c9a0ce8c51fd8ae91e8ae875d57f262c", "thread": {"social": {"gplus": {"shares": 3}, "pinterest": {"shares": 0}, "vk": {"shares": 0}, "linkedin": {"shares": 0}, "facebook": {"likes": 181, "shares": 181, "comments": 0}, "stumbledupon": {"shares": 0}}, "site_full": "disneyparks.disney.go.com", "main_image": "", "site_section": "https://disneyparks.disney.go.com/blog", "section_title": "Disney Parks Blog", "url": "https://disneyparks.disney.go.com/blog/2017/02/quiz-rivers-of-light-at-disneys-animal-kingdom/", "country": "US", "domain_rank": 72, "title": "QUIZ: ‘Rivers of Light’ at Disney’s Animal Kingdom", "performance_score": 1, "site": "go.com", "participants_count": 1, "title_full": "QUIZ: ‘Rivers of Light’ at Disney’s Animal Kingdom", "spam_score": 0.0, "site_type": "blogs", "published": "2017-02-22T04:02:00.000+02:00", "replies_count": 0, "uuid": "2d3c9c50c9a0ce8c51fd8ae91e8ae875d57f262c"}, "author": "Allison Montgomery", "url": "https://disneyparks.disney.go.com/blog/2017/02/quiz-rivers-of-light-at-disneys-animal-kingdom/", "ord_in_thread": 0, "title": "QUIZ: ‘Rivers of Light’ at Disney’s Animal Kingdom", "locations": [], "entities": {"persons": [{"name": "aseema", "sentiment": "none"}, {"name": "ketu pongo", "sentiment": "none"}, {"name": "kruzhilina ambu", "sentiment": "none"}, {"name": "aditya irina", "sentiment": "none"}], "locations": [{"name": "new york city", "sentiment": "none"}, {"name": "disney parks blog", "sentiment": "none"}, {"name": "nashville", "sentiment": "none"}, {"name": "tennessee abbey road studios", "sentiment": "none"}, {"name": "discovery river amphitheater", "sentiment": "none"}, {"name": "london", "sentiment": "none"}, {"name": "walt disney world resort", "sentiment": "none"}], "organizations": [{"name": "disney", "sentiment": "negative"}, {"name": "england capitol studios in los angeles platinum sound recording studios", "sentiment": "none"}, {"name": "new york each animal spirit guide", "sentiment": "none"}]}, "highlightText": "", "language": "english", "persons": [], "text": "The newest show to debut at Disney’s Animal Kingdom , “ Rivers of Light ,” just celebrated its debut to Walt Disney World Resort guests this past weekend, bringing to life an awe-inspiring nighttime show on Discovery River. If you’ve seen the show or have been following the updates about “Rivers of Light” here on the Disney Parks Blog , be sure to take our quiz to see how much you know about this new show!\n\n‘Rivers of Light’ at Disney’s Animal Kingdom Where was the musical score for “Rivers of Light” recorded? RCA Studio B in Nashville, Tennessee Abbey Road Studios in London, England Capitol Studios in Los Angeles Platinum Sound Recording Studios in New York City, New York Each Animal Spirit Guide represents a different element. Which element does the Asian Tiger represent? Earth Fire Water The Sky What are the names of the two storyteller characters who appear in “Rivers of Light?” Aseema and Aditya Irina and Kruzhilina Ambu and Ketu Pongo and Perdita Paintings of lotus flowers inside Discovery River Amphitheater, where “Rivers of Light” is performed, symbolize what? Wisdom Enlightenment Compassion Protection Embed Quiz on Your Website Embed Code <div class=\"wp-quiz\" data-quiz-id=\"184459\" data-site-url=\"https://disneyparks.disney.go.com/blog\"></div> <script type=\"text/javascript\" src=\"https://disneyparks.disney.go.com/blog/wp-content/plugins/wp-quizzes/js/embed.js\"></script> \nCopy and paste above embed code where you would like the quiz to appear on your website.\n", "external_links": [], "published": "2017-02-22T04:02:00.000+02:00", "crawled": "2017-02-21T23:53:31.042+02:00", "highlightTitle": ""}