{"organizations": [], "uuid": "f584a7e594df58cd47ec8b10c6a0f6f2ca1f61f3", "thread": {"social": {"gplus": {"shares": 0}, "pinterest": {"shares": 0}, "vk": {"shares": 0}, "linkedin": {"shares": 0}, "facebook": {"likes": 165, "shares": 165, "comments": 0}, "stumbledupon": {"shares": 0}}, "site_full": "www.rappler.com", "main_image": "http://rappler-assets.s3-us-west-1.amazonaws.com/5ADB4D5F0742444BAE9CA827E999ECD9/img/BCE2907B187449ACB9E2C70D89592186/supwerbowlcommercials.jpg", "site_section": "http://feeds.rappler.com/rappler/entertainment", "section_title": "Rappler: Entertainment", "url": "http://www.rappler.com/entertainment/news/160534-justin-bieber-lady-gaga-gal-gadot-melissa-mccarthy-super-bowl-2017-commercials", "country": "US", "domain_rank": 1586, "title": "WATCH: Celebrities star in Super Bowl 2017 commercials", "performance_score": 1, "site": "rappler.com", "participants_count": 1, "title_full": "WATCH: Celebrities star in Super Bowl 2017 commercials", "spam_score": 0.0, "site_type": "blogs", "published": "2017-02-05T13:43:00.000+02:00", "replies_count": 0, "uuid": "f584a7e594df58cd47ec8b10c6a0f6f2ca1f61f3"}, "author": "Rappler.com", "url": "http://www.rappler.com/entertainment/news/160534-justin-bieber-lady-gaga-gal-gadot-melissa-mccarthy-super-bowl-2017-commercials", "ord_in_thread": 0, "title": "WATCH: Celebrities star in Super Bowl 2017 commercials", "locations": [], "entities": {"persons": [{"name": "justin bieber", "sentiment": "negative"}, {"name": "dustin", "sentiment": "none"}, {"name": "jason statham", "sentiment": "none"}, {"name": "tina fey", "sentiment": "none"}, {"name": "miranda kerr", "sentiment": "none"}, {"name": "gal gadot", "sentiment": "none"}, {"name": "john malkovich", "sentiment": "none"}, {"name": "melissa mccarthy", "sentiment": "none"}, {"name": "mike", "sentiment": "none"}, {"name": "lady gaga", "sentiment": "none"}, {"name": "cam newton", "sentiment": "none"}, {"name": "amy adams", "sentiment": "none"}, {"name": "viola davis", "sentiment": "none"}, {"name": "lucas", "sentiment": "none"}, {"name": "missy elliot", "sentiment": "none"}], "locations": [{"name": "philippines", "sentiment": "none"}, {"name": "manila", "sentiment": "none"}, {"name": "manila", "sentiment": "none"}], "organizations": [{"name": "entertainment weekly", "sentiment": "none"}, {"name": "buick", "sentiment": "none"}, {"name": "kia", "sentiment": "none"}, {"name": "youtube/t-mobile/kia motors", "sentiment": "none"}, {"name": "tiffany & co", "sentiment": "none"}, {"name": "honda", "sentiment": "none"}, {"name": "t-mobile", "sentiment": "none"}, {"name": "tiffany", "sentiment": "none"}]}, "highlightText": "", "language": "english", "persons": [], "text": "Entertainment News WATCH: Celebrities star in Super Bowl 2017 commercials Justin Bieber appears in an ad for T-Mobile, Lady Gaga for Tiffany, Melissa McCarthy for Kia, and more Published 6:11 PM, February 05, 2017 Updated 6:11 PM, February 05, 2017 Screengrabs from YouTube/T-Mobile/Kia Motors America/Wix.com \nMANILA, Philippines – It's Super Bowl season once again, with the big game set for Sunday, February 5 (Monday, February 6 Manila time), and advertisers have come out with commercials featuring some of our favorite stars. \nHere's a roundup of some of the commercials shown so far: \nHonda has gathered some big names such as Tina Fey , Missy Elliot , Viola Davis , Amy Adams , and more in a cool yearbook-themed commercial reminding folks to go after their dreams. \nJustin Bieber showcased his moves for T-Mobile. \nMelissa McCarthy meanwhile appeared in an advertisement for Kia's new car Niro to save the planet, in which she discovers it's not easy saving the earth. \nLady Gaga appeared in a commercial for Tiffany & Co, where she briefly talked about challenging the status quo. The singer is set to perform at halftime. \nWonder Woman star Gal Gadot and Furious 7 actor Jason Statham showed off some of their action skills in Wix's new TV ad. \nModel Miranda Kerr made a cameo with football star Cam Newton in an ad for Buick. \nAnd there's actor John Malkovich who's trying to get a domain for his business in a TV commercial for Squarespace.com. \nEntertainment Weekly also reported that the teaser for Stranger Things season 2 will debut during the game. In the photo posted by EW, Dustin, Lucas, and Mike are dressed as Ghostbusters. A photo posted by Entertainment Weekly (@entertainmentweekly) on Feb 3, 2017 at 12:01pm PST \nWhich commercial of the stars did you like? Let us know in the comments section below. – Rappler.com HOW DOES THIS STORY MAKE YOU FEEL? Happy", "external_links": [], "published": "2017-02-05T13:43:00.000+02:00", "crawled": "2017-02-05T12:21:05.063+02:00", "highlightTitle": ""}