{"organizations": [], "uuid": "0ad865c58c8ff65f846b01cf54b342fdc719a58b", "thread": {"social": {"gplus": {"shares": 0}, "pinterest": {"shares": 0}, "vk": {"shares": 0}, "linkedin": {"shares": 0}, "facebook": {"likes": 408, "shares": 408, "comments": 0}, "stumbledupon": {"shares": 0}}, "site_full": "comicbook.com", "main_image": "http://media.comicbook.com/2017/02/alien-covenant-234189-640x320.png", "site_section": "http://Comicbook.com/rss", "section_title": "Comicbook.com", "url": "http://comicbook.com/2017/02/23/new-alien-covenant-photo/", "country": "US", "domain_rank": 2930, "title": "Brand New Alien: Covenant Photo Released", "performance_score": 4, "site": "comicbook.com", "participants_count": 1, "title_full": "Brand New Alien: Covenant Photo Released", "spam_score": 0.0, "site_type": "blogs", "published": "2017-02-23T20:28:00.000+02:00", "replies_count": 0, "uuid": "0ad865c58c8ff65f846b01cf54b342fdc719a58b"}, "author": "Charlie Ridgely", "url": "http://comicbook.com/2017/02/23/new-alien-covenant-photo/", "ord_in_thread": 0, "title": "Brand New Alien: Covenant Photo Released", "locations": [], "entities": {"persons": [{"name": "david", "sentiment": "none"}, {"name": "billy crudup", "sentiment": "none"}, {"name": "nathaniel dean", "sentiment": "none"}, {"name": "danny mcbride", "sentiment": "none"}, {"name": "michael fassbender", "sentiment": "none"}, {"name": "carmen ejogo", "sentiment": "none"}, {"name": "ridley scott", "sentiment": "none"}, {"name": "benjamin rigby", "sentiment": "none"}, {"name": "james cameron", "sentiment": "none"}, {"name": "amy seimetz", "sentiment": "none"}, {"name": "katherine waterston", "sentiment": "none"}, {"name": "jussie smollett", "sentiment": "none"}, {"name": "demián bichir", "sentiment": "none"}, {"name": "callie hernandez", "sentiment": "none"}, {"name": "alexander", "sentiment": "none"}], "locations": [{"name": "england", "sentiment": "none"}], "organizations": []}, "highlightText": "", "language": "english", "persons": [], "text": "Brand New Alien: Covenant Photo Released Charlie Ridgely Back to Article Image of \nIn just a couple of months, audiences will return to the world of Alien once again. Covenant , part two of Ridley Scott's Alien prequel trilogy, will show the second interaction between humans and the aliens. \nAfter a five minute prologue was released online this week, a new image was unveiled on Thursday morning. \nThe new image is one of the brighter photos we've seen from the film so far. It shows the crew getting off the Covenant, and looking to explore this bright new world. \nThe photo debuted on Empire , and the magazine also added a little more information regarding the plot of the film - and why the crew is on the planet in the first place. This planet is not their original destination: they have detoured to answer a distress call. And given this franchise, it’s a good guess that “distress” will soon be too mild a description. For a full look at the new image, head to the gallery below! \nAlien: Covenant is the sequel to Prometheus and the second film in the Alien prequel trilogy. It is the sixth installment of the over-arching Alien franchise. The film is directed by Ridley Scott , who directed the original Alien. The two films are said to share a direct connection. \nAlien: Covenant currently has a 3.66 out of 5 ComicBook.com anticipation rating . Let us know how excited you are for the film by giving it your own anticipation rating below. \nMore Alien : James Cameron Not Impressed By Modern Franchise / Alien 5 Chances Are Slim / All Of The Alien Movies Ranked \nIn Alien: Covenant , bound for a remote planet on the far side of the galaxy, the crew of the colony ship Covenant discovers what they think is an uncharted paradise, but is actually a dark, dangerous world — whose sole inhabitant is the “synthetic” David, survivor of the doomed Prometheus expedition. \nAlien: Covenant stars Michael Fassbender , Katherine Waterston, Billy Crudup, Danny McBride, Demián Bichir, Carmen Ejogo, Amy Seimetz, Jussie Smollett, Callie Hernandez, Nathaniel Dean, Alexander England and Benjamin Rigby. \nAlien: Covenant opens in theaters on May 19, 2017. \nLegion airs Wednesdays at 10 p.m. ET on FX. Alien: Covenant 2017", "external_links": [], "published": "2017-02-23T20:28:00.000+02:00", "crawled": "2017-02-23T15:43:22.147+02:00", "highlightTitle": ""}