{"organizations": [], "uuid": "24d353ffb308bb340198a50b2d140dbc491aae1b", "thread": {"social": {"gplus": {"shares": 0}, "pinterest": {"shares": 0}, "vk": {"shares": 0}, "linkedin": {"shares": 0}, "facebook": {"likes": 827, "shares": 827, "comments": 0}, "stumbledupon": {"shares": 0}}, "site_full": "comicbook.com", "main_image": "http://media.comicbook.com/2017/02/dc-collectibles-2017-toy-fair-header-232996-640x320.jpg", "site_section": "http://Comicbook.com/rss", "section_title": "Comicbook.com", "url": "http://comicbook.com/2017/02/18/dc-unveils-toy-fair-2017-collectibles/", "country": "US", "domain_rank": 2930, "title": "DC Unveils Toy Fair 2017 Collectibles", "performance_score": 8, "site": "comicbook.com", "participants_count": 1, "title_full": "DC Unveils Toy Fair 2017 Collectibles", "spam_score": 0.0, "site_type": "blogs", "published": "2017-02-19T05:58:00.000+02:00", "replies_count": 0, "uuid": "24d353ffb308bb340198a50b2d140dbc491aae1b"}, "author": "Matthew Mueller", "url": "http://comicbook.com/2017/02/18/dc-unveils-toy-fair-2017-collectibles/", "ord_in_thread": 0, "title": "DC Unveils Toy Fair 2017 Collectibles", "locations": [], "entities": {"persons": [{"name": "matthew mueller", "sentiment": "neutral"}, {"name": "alfred", "sentiment": "none"}, {"name": "ant lucia", "sentiment": "none"}, {"name": "harley", "sentiment": "none"}, {"name": "harley quinn", "sentiment": "none"}, {"name": "batgirl", "sentiment": "none"}, {"name": "katana", "sentiment": "none"}, {"name": "jim fletcher", "sentiment": "none"}, {"name": "amanda conner", "sentiment": "none"}, {"name": "superman", "sentiment": "none"}, {"name": "jonathan matthews", "sentiment": "none"}, {"name": "john romita jr.", "sentiment": "none"}], "locations": [{"name": "hawkgirl", "sentiment": "none"}], "organizations": [{"name": "conners", "sentiment": "none"}, {"name": "batman black and white", "sentiment": "none"}, {"name": "starfire bombshell", "sentiment": "none"}, {"name": "dc bombshell", "sentiment": "none"}, {"name": "justice league", "sentiment": "none"}, {"name": "dc", "sentiment": "none"}, {"name": "harley quinn deluxe", "sentiment": "none"}, {"name": "justice league 2017 comicbook anticipated", "sentiment": "none"}]}, "highlightText": "", "language": "english", "persons": [], "text": "DC Unveils Toy Fair 2017 Collectibles Matthew Mueller Start Slideshow Slide of \nDC made a big splash at this year's Toy Fair, unleashing a huge wave of movie and comic styled statues and action figures, and here's a heavy sampling of what they've got in store for 2017. \nDC previously showed off their Justice League movie statues , which continues to fuel the 4.35 out of 5 the film has on ComicBook.com's anticipation ranking . DC isn't abandoning you comic fans however, and they've got new additions to some of the most popular lines ( via Action Figure Insider ), including the Batman Black and White line. The fan-favorite series will be getting four new additions that include Batman statues styled after Amanda Conner, John Romita Jr., and Jonathan Matthews. There will also be a Conners inspired Harley Quinn to round out the set. \nIf you're more a diorama fan, DC will be offering a Batman vs Harley Quinn statue (complete with Harley's hyenas), a Designer Series Superman , and a beautiful Designer Series Aquaman and Mera statue. For fans of the animated series, you'll also have 15.5 x 17 x 21 Batcave Vignette will include a light-up Bat-computer, interchangeable computer screens, and an exclusive Alfred figure. \n“The Batcave Vignette is a great example of how we’re constantly looking for new ways to capture the most iconic and authentic moments from the DC Universe and reimagine them in three-dimensional form,” stated DC Collectibles Executive Director, Creative, Jim Fletcher. “Now Batman: The Animated Series action figure collectors have an entirely new way to display and enhance their collections.” \nIn addition, there will also be a Harley's Holiday statue if you prefer villains. \nDC Bombshell fans will also have more than a few choices, with a Harley Quinn Deluxe statue and a new Starfire Bombshell statue joining the line. There will also be a Designer Series action figure set themed after Ant Lucia's art with Mera, Katana, Batgirl, Hawkgirl, Supergirl, and Bumblebee. \nAction figure fans will also be able to purchase several DC Icons figures, including Supergirl (Rebirth), Nightwing (Hush), a Super Sons Two-Pack, and a Death of Superman Two-Pack that comes with Doomsday, three interchangeable heads for Superman, and heat vision accessory. \nHit the next slide to get an up-close look at DC Collectibles 2017 offerings. Justice League 2017 ComicBook Anticipated #8 Best-Rated Before Release Anticipated Rating", "external_links": [], "published": "2017-02-19T05:58:00.000+02:00", "crawled": "2017-02-19T01:24:33.598+02:00", "highlightTitle": ""}