{"organizations": [], "uuid": "9cc95bf893fa157d1d9d67bec5e9170cadddbb0a", "thread": {"social": {"gplus": {"shares": 0}, "pinterest": {"shares": 0}, "vk": {"shares": 0}, "linkedin": {"shares": 0}, "facebook": {"likes": 231, "shares": 231, "comments": 0}, "stumbledupon": {"shares": 0}}, "site_full": "www.geo.tv", "main_image": "https://www.geo.tv/assets/uploads/updates/2017-02-03/129817_023640_updates.jpg", "site_section": "http://feeds.feedburner.com/GeoBulletins", "section_title": "GEO TV - Sports", "url": "https://www.geo.tv/latest/129817-Aqeel-Aisam-give-Pakistan-winning-start-in-Davis-Cup-tie-against-Iran", "country": "TV", "domain_rank": 8287, "title": "Aqeel, Aisam give Pakistan winning start in Davis Cup tie against Iran", "performance_score": 2, "site": "geo.tv", "participants_count": 0, "title_full": "Aqeel, Aisam give Pakistan winning start in Davis Cup tie against Iran", "spam_score": 0.0, "site_type": "blogs", "published": "2017-02-03T21:36:00.000+02:00", "replies_count": 0, "uuid": "9cc95bf893fa157d1d9d67bec5e9170cadddbb0a"}, "author": "", "url": "https://www.geo.tv/latest/129817-Aqeel-Aisam-give-Pakistan-winning-start-in-Davis-Cup-tie-against-Iran", "ord_in_thread": 0, "title": "Aqeel, Aisam give Pakistan winning start in Davis Cup tie against Iran", "locations": [], "entities": {"persons": [{"name": "aisam", "sentiment": "negative"}, {"name": "aqeel", "sentiment": "negative"}, {"name": "iran aqeel", "sentiment": "negative"}, {"name": "rashid malik", "sentiment": "none"}, {"name": "aisam ul haq", "sentiment": "none"}, {"name": "aisam-ul-haq", "sentiment": "none"}, {"name": "abid ali akbar", "sentiment": "none"}, {"name": "shahin khaledan", "sentiment": "none"}, {"name": "aqeel khan", "sentiment": "none"}, {"name": "amir hossein badi", "sentiment": "none"}, {"name": "saeid ahmadvand", "sentiment": "none"}, {"name": "hamid reza nadaf", "sentiment": "none"}, {"name": "davis cup tie", "sentiment": "none"}, {"name": "abid mushtaq", "sentiment": "none"}, {"name": "anoosha shahgholi", "sentiment": "none"}], "locations": [{"name": "iran", "sentiment": "none"}, {"name": "pakistan", "sentiment": "none"}, {"name": "asia oceania", "sentiment": "none"}, {"name": "islamabad", "sentiment": "none"}, {"name": "asia", "sentiment": "none"}], "organizations": [{"name": "oceania group", "sentiment": "none"}, {"name": "pakistan sports board", "sentiment": "none"}]}, "highlightText": "", "language": "english", "persons": [], "text": "Aqeel, Aisam give Pakistan winning start in Davis Cup tie against Iran | File Photo/Getty Images Related Stories \nISLAMABAD: Aqeel Khan and Aisam-ul-Haq saw Pakistan off to a winning start on the opening day of their Asia Oceania Group II Davis Cup tie against Iran on Friday. \nAqeel, playing the opening singles, defeated his rival Shahin Khaledan 7-6, 6-4, 6-2. \nAisam, in the other singles match, beat Anoosha Shahgholi 6-1, 6-2, 6-2, giving Pakistan a 2-0 lead over Iran. \nPakistani team comprises Aqeel Khan, Aisam-ul-Haq, Abid Ali Akbar and Abid Mushtaq. Rashid Malik is the captain. \nIran’s team consists of Anoosha Shahgholi, Shahin Khaledan, Hamid Reza Nadaf, and Amir Hossein Badi. Their non-playing captain is Saeid Ahmadvand. \nThe tie, which is the first round of Asia Oceania Group II, is being played from February 3-5 at Pakistan Sports Board’s refurbished synthetic courts \nPakistan and Iran have played each other thrice, with Pakistan winning two ties (both in Iran) and Iran winning once (in Pakistan). \nThis event is Pakistan’s first Davis Cup tennis tie at home in 12 years, as the hosts were earlier forced to play at neutral venues due to security fears. 0 0 Aqeel, Aisam give Pakistan winning start in Davis Cup tie against Iran was posted in sports of Geo TV - https://www.geo.tv on February 03, 2017 and was last updated on February 03, 2017. This news story is related to Sport, Sport News, Geo News, Latest Sport News, Tennis, Davis Cup Tie, Pakistan Vs Iran, Aisam Ul Haq, Aqeel Khan. Permanent link to the news story \"Aqeel, Aisam give Pakistan winning start in Davis Cup tie against Iran\" is https://www.geo.tv/latest/129817-Aqeel-Aisam-give-Pakistan-winning-start-in-Davis-Cup-tie-against-Iran . More From Sports:", "external_links": [], "published": "2017-02-03T21:36:00.000+02:00", "crawled": "2017-02-03T11:46:37.078+02:00", "highlightTitle": ""}