{"organizations": [], "uuid": "4f106238be0190a867755ccd92464e6008b7fd5f", "thread": {"social": {"gplus": {"shares": 0}, "pinterest": {"shares": 0}, "vk": {"shares": 0}, "linkedin": {"shares": 0}, "facebook": {"likes": 349, "shares": 349, "comments": 0}, "stumbledupon": {"shares": 0}}, "site_full": "www.rappler.com", "main_image": "https://assets.rappler.com/A38C7D43DD9B4B51BD5CE6ECA0BCFAB8/img/C258DBCDD63E41BBBA01BBADCF2F6260/starsreaction.jpg", "site_section": "http://feeds.rappler.com/rappler/entertainment", "section_title": "Rappler: Entertainment", "url": "http://www.rappler.com/entertainment/news/162690-stars-react-oscars-2017-gaffe-moonlight-la-la-land-best-picture", "country": "US", "domain_rank": 1586, "title": "Stars react to Oscars Best Picture gaffe", "performance_score": 3, "site": "rappler.com", "participants_count": 1, "title_full": "Stars react to Oscars Best Picture gaffe", "spam_score": 0.0, "site_type": "blogs", "published": "2017-02-27T12:59:00.000+02:00", "replies_count": 0, "uuid": "4f106238be0190a867755ccd92464e6008b7fd5f"}, "author": "Rappler.com", "url": "http://www.rappler.com/entertainment/news/162690-stars-react-oscars-2017-gaffe-moonlight-la-la-land-best-picture", "ord_in_thread": 0, "title": "Stars react to Oscars Best Picture gaffe", "locations": [], "entities": {"persons": [{"name": "steve harvey", "sentiment": "none"}, {"name": "— josh gad", "sentiment": "none"}, {"name": "marcia cross", "sentiment": "none"}, {"name": "pia wurtzbach", "sentiment": "none"}, {"name": "la la land", "sentiment": "none"}, {"name": "— tyra banks", "sentiment": "none"}, {"name": "oprah", "sentiment": "none"}, {"name": "darren cris", "sentiment": "none"}, {"name": "ellen degeneres", "sentiment": "none"}, {"name": "olivia culpo", "sentiment": "none"}, {"name": "darren criss", "sentiment": "none"}, {"name": "joseph gordon-levitt", "sentiment": "none"}, {"name": "ariadna gutierrez", "sentiment": "none"}, {"name": "moon", "sentiment": "none"}, {"name": "— billy crystal", "sentiment": "none"}, {"name": "emma", "sentiment": "none"}, {"name": "katy perry", "sentiment": "none"}, {"name": "billy crystal", "sentiment": "none"}, {"name": "— olivia culpo", "sentiment": "none"}, {"name": "— oprah winfrey", "sentiment": "none"}, {"name": "jimmy kimmel", "sentiment": "none"}, {"name": "katy perry", "sentiment": "none"}, {"name": "elizabeth banks", "sentiment": "none"}, {"name": "— pia alonzo wurtzbach", "sentiment": "none"}, {"name": "ansel elgort", "sentiment": "none"}, {"name": "emma stone", "sentiment": "none"}, {"name": "josh gad", "sentiment": "none"}], "locations": [{"name": "philippines", "sentiment": "none"}, {"name": "america", "sentiment": "none"}, {"name": "manila", "sentiment": "none"}, {"name": "hollywood", "sentiment": "none"}, {"name": "colombia", "sentiment": "none"}], "organizations": [{"name": "la la land", "sentiment": "none"}, {"name": "hollywood reporter", "sentiment": "none"}, {"name": "miss universe organization", "sentiment": "none"}]}, "highlightText": "", "language": "english", "persons": [], "text": "Entertainment News Stars react to Oscars Best Picture gaffe 'Have your people call our people – we know what to do,' says the Miss Universe Organization. This and more reactions to the Oscars gaffe here! Published 5:24   5:26   Photo from Angela Weiss/Christopher Polk/Getty Images for People's Choice Awards/AFP/Instagram/@tyrabanks \nMANILA, Philippines – Following the Oscars 2017 Best Picture gaffe, many stars took to social media to express their thoughts and reactions. \nAt Hollywood's biggest awards night on     initially announced La La Land the Best Picture. However, once the cast and crew were onstage, La La Land   said that there was a mistake and that Moonlight won. ( WATCH:   \nEmma Stone , who won for Best Actress for La La Land , reacted to the press after the event. The Hollywood Reporter posted a video of Emma saying that while winning Best Picture would have been great, she and the La La Land cast and crew were happy for Moonlight. \n\" Of course, it was an amazing thing to hear La La Land, and I think we would have all loved to win Best Picture, but we are so excited for Moonlight, I think it's one of the best films of all time, so I was pretty beside myself.\" Emma Stone backstage: \"I f—ing love 'Moonlight.'\" #Oscars pic.twitter.com/hzSEp5nrBa — Hollywood Reporter (@THR) February 27, 2017 \nPia Wurtzbach, who had a similar experience when Steve Harvey initially named Colombia's Ariadna Gutierrez as the winner of Miss Universe in 2015, reacted to the gaffe online. She posted a clip of her Creamsilk commercial of her saying, \"And if it can happen to me, it can happen to anybody.\" — Pia Alonzo Wurtzbach (@PiaWurtzbach) February 27, 2017 \nFormer Oscars host Ellen DeGeneres commended the cast of La La Land and congratulated the people behind Moonlight. Nothing like live TV. Congrats to Moonlight! And to La La Land for such a gracious reaction. #Oscars — Ellen DeGeneres (@TheEllenShow) February 27, 2017 \nKaty Perry expressed shock right after the gaffe. WHAT WAIT OMG — KATY PERRY (@katyperry) February 27, 2017 \nJoseph Gordon-Levitt tweeted: \" If you haven't seen Moonlight yet, don't let this [ Oscars] mixup overshadow things. See it. It's beautiful. Same goes for La La Land.\" If you haven't seen Moonlight yet, don't let this #Oscars mixup overshadow things. See it. It's beautiful. Same goes for La La Land. — Joseph Gordon-Levitt (@hitRECordJoe) February 27, 2017 \nTyra Banks joked on Twitter: \" America's next top model is La La – OOPS! I meant Moon[light] .\" America's next top Model is LaLa. OOPS! I meant Moon. — Tyra Banks (@tyrabanks) February 27, 2017 \nFormer Desperate Housewives star Marcia Cross tweeted: \" Don't blame the old folks! It was not their fault! We don't need to add (more) ageism to our country's problems.\" Don't blame the old folks!! It was NOT THEIR FAULT!!! We don't need to add (more) ageism to our country's problems. #Oscars — Marcia Cross (@ReallyMarcia) February 27, 2017 \nShe also praised the producers of La La Land for correcting the mistake, adding: \" Kudos to the La La Land winner who gracefully handed over the Oscar.\" Kudos to the La La Land winner who gracefully handed over the Oscar. xo m — Marcia Cross (@ReallyMarcia) February 27, 2017 \nActress Elizabeth Banks joked, \"That ending to the [O scars] should win Best Picture next year\" before congratulating Moonlight. That ending to the #oscars should win best picture next year. #holyshit congrats #moonlight — Elizabeth Banks (@ElizabethBanks) February 27, 2017 \nFormer Miss Universe Olivia Culpo wrote: \" This situation is unreal.\" This situation is unre . Talking about all the #oscars details on #ERedCarpet now! — Olivia Culpo (@oliviaculpo) February 27, 2017 \nThe people behind Miss Universe also posted their funny reaction to the mix-up. Have your people call our people - we know what to do. #Oscars #MissUniverse — Miss Universe (@MissUniverse) February 27, 2017 \nDarren Cris wrote: \" But like hey my homies still won so I'm still gonna celebrate whoo! Also I loved Moonlight ! What a wild night! Congrats to all!\" But like HEY my homies still won so I'm still gonna celebrate whooo!!! Also I LOVED Moonlight! What a wild night! Congrats to all! k NOW bye — Darren Criss (@DarrenCriss) February 27, 2017 \nAnsel Elgort tweeted: — Ansel Elgort (@AnselElgort) February 27, 2017 \nBeauty and the Beast star Josh Gad tweeted: \" Wait a second. I'm traveling. How many movies just won Best Picture?\" Wait a second. I'm traveling. How many movies just won best picture? — Josh Gad (@joshgad) February 27, 2017 \nOprah congratulated the folks behind Moonlight. Wh ??!congratulations Moonlight! My favorite #Oscars in memory!! — Oprah Winfrey (@Oprah) February 27, 2017 \nFormer Oscars host Billy Crystal said: \"Amazing ending. Wish that had happened on Election Day.\" Amazing ending. Wish that had happened on Election Day. — Billy Crystal (@BillyCrystal) February 27, 2017 \nLa La Land took home 6 awards at the Oscars, which was hosted by Jimmy Kimmel. – Rappler.com \nMore Oscars 2017 on Rappler here:", "external_links": [], "published": "2017-02-27T12:59:00.000+02:00", "crawled": "2017-02-27T11:58:08.810+02:00", "highlightTitle": ""}