{"organizations": [], "uuid": "e6176a58d5a26a5cff0473a61117063e356ec3ad", "thread": {"social": {"gplus": {"shares": 2}, "pinterest": {"shares": 1}, "vk": {"shares": 0}, "linkedin": {"shares": 2}, "facebook": {"likes": 435, "shares": 435, "comments": 0}, "stumbledupon": {"shares": 0}}, "site_full": "www.telegraph.co.uk", "main_image": "http://www.telegraph.co.uk/content/dam/news/2017/02/27/JS121890474_Trump-dinner-1-NEWS-xlarge_trans_NvBQzQNjv4Bq0RglTN43wyGR-NQABDM7EkdijWCdRYl6PyLHMKfN-ss.jpg", "site_section": "http://www.telegraph.co.uk/newsfeed/rss/education.xml", "section_title": "News", "url": "http://www.telegraph.co.uk/news/2017/02/27/lot-fun-accomplished-almost-everything-says-donald-trump-hails/", "country": "GB", "domain_rank": 317, "title": "‚ÄòIt‚Äôs been a lot of fun and we've accomplished almost everything‚Äô says Donald Trump as he hails first month at gala dinner hosted by Melania", "performance_score": 4, "site": "telegraph.co.uk", "participants_count": 1, "title_full": "‚ÄòIt‚Äôs been a lot of fun and we've accomplished almost everything‚Äô says Donald Trump as he hails first month at gala dinner hosted by Melania", "spam_score": 0.0, "site_type": "blogs", "published": "2017-02-27T11:02:00.000+02:00", "replies_count": 0, "uuid": "e6176a58d5a26a5cff0473a61117063e356ec3ad"}, "author": "David Millward", "url": "http://www.telegraph.co.uk/news/2017/02/27/lot-fun-accomplished-almost-everything-says-donald-trump-hails/", "ord_in_thread": 0, "title": "‚ÄòIt‚Äôs been a lot of fun and we've accomplished almost everything‚Äô says Donald Trump as he hails first month at gala dinner hosted by Melania", "locations": [], "entities": {"persons": [{"name": "donald trump", "sentiment": "neutral"}, {"name": "melania", "sentiment": "neutral"}, {"name": "mcauliffe", "sentiment": "none"}, {"name": "melania melania trump", "sentiment": "none"}, {"name": "mrs trump", "sentiment": "none"}, {"name": "trump", "sentiment": "none"}, {"name": "joshua", "sentiment": "none"}, {"name": "ivanka", "sentiment": "none"}, {"name": "ivanka trump", "sentiment": "none"}, {"name": "michael delauzon", "sentiment": "none"}, {"name": "terry mcauliffe", "sentiment": "none"}, {"name": "melania trump", "sentiment": "none"}, {"name": "mcauliffe", "sentiment": "none"}, {"name": "donald", "sentiment": "none"}, {"name": "david millward", "sentiment": "none"}, {"name": "john quincy adams", "sentiment": "none"}, {"name": "louisa adams", "sentiment": "none"}, {"name": "mr trump", "sentiment": "none"}, {"name": "nicholas kamm/afp", "sentiment": "none"}], "locations": [{"name": "united states", "sentiment": "none"}, {"name": "us", "sentiment": "none"}, {"name": "u.s.", "sentiment": "none"}, {"name": "virginia", "sentiment": "none"}, {"name": "white house", "sentiment": "none"}, {"name": "hollywood", "sentiment": "none"}], "organizations": [{"name": "trump", "sentiment": "none"}, {"name": "national governors association", "sentiment": "none"}, {"name": "white house", "sentiment": "none"}, {"name": "cnn", "sentiment": "none"}]}, "highlightText": "", "language": "english", "persons": [], "text": "‚ÄòIt‚Äôs been a lot of fun and we've accomplished almost everything‚Äô says Donald Trump as he hails first month at gala dinner hosted by Melania Melania Trump listens to Donald Trump's toast Credit: Chip Somodevilla/Getty David Millward , US Correspondent 27 February 2017 ‚Ä¢ 4:02am \nA fter a month of controversy , political hostilities were suspended as Donald and Melania Trump welcomed 46 state governors to the White House. \nAn ebullient president hailed the first month of his presidency as he welcomed his guests to the black tie gala. \n\"I can say that after four weeks - it's been a lot of fun - but we've accomplished almost everything we've started out to accomplish. The borders are stricter, tighter,\" he said. Donald Trump offers a toast Credit: Nicholas Kamm/AFP \n\"We're very happy with the way things are working but, again, we've made a lot of promises over the last two years and many of those promises already are kept so we're very honoured by that.\" \nShe is only the second First Lady to come from outside the United States. The last was Louisa Adams, the London-born wife of John Quincy Adams, who served as president between 1825 and 1829. Ivanka Trump stands as U.S. President Donald Trump makes a toast during Credit: Joshua roberts/Reuters \nM rs Trump wore a black sleeveless dress for the occasion. Mr Trump‚Äôs daughter from an earlier marriage, Ivanka, wore a black polka-dot strapless gown. \nThe theme of the dinner was ‚ÄúSpring‚Äôs Renewal‚Äù, with the White House proclaiming that the executive mansion would ‚Äúcome to life, gleaming with the dazzling, senorial experience of eternal spring‚Äù. \nExplaining the theme, Mrs Trump said: ‚ÄúThe scents of jasmine and roses fill the air as we give thanks for this great nation and the glory of renewal.‚Äù @heartbreakfink They're so self absorbed they don't know Trump and Pence are at The Governors Ball and not concerned with petty Hollywood üòÇüòÇ ‚Äî RNcat50 (@RNcat50) February 27, 2017 \nS triking a conciliatory note, she added: ‚ÄúTonight, we come together as one Nation, leaving political labels and partisan interests behind.‚Äù \nEven if the tone was friendly, politics was never too far from the surface as Mr Trump toasted his guests - albeit with a glass of water. \n\"It's such an easy job you have,\" he said as he gently mocked his guests. \nLooking forward to his meetings with governors on Monday he added ‚Äúperhaps health care will come up\". \nOn social media there was some speculation over the four governors who were missing from the occasion. \n@heartbreakfink They're so self absorbed they don't know Trump and Pence are at The Governors Ball and not concerned with petty Hollywood üòÇüòÇ ‚Äî RNcat50 (@RNcat50) February 27, 2017 \nI nevitably on Twitter supporters and opponents of the president swapped barbs, especially with the Oscars taking place on the other side of the country. \nOne wag tweeted that CNN - one of the channels banned from a White House press briefing - was watching Fox News to see if any Russians were attending the ball. \nA Trump supporter took a swipe at Hollywood stars who have made little attempt to conceal their hostility to the president, dismissing them as ‚Äúself absorbed‚Äù. HAPPENING NOW: Better than the #Oscars - The White House Governors' Ball pic.twitter.com/Ift6rRzalX ‚Äî Michael Delauzon (@MichaelDelauzon) February 27, 2017 \nB ut back at the White House, the atmosphere was jovial and light-hearted with Virginia‚Äôs Terry McAuliffe, a Democrat and the chairman of the National Governors Association, getting into the spirit of the occasion. \nNoting that Mr Trump had described him as a friend, Mr McAuliffe suggested that the president had just destroyed his political career. \nRecalling the controversy over the number of people at Mr Trump‚Äôs inauguration last month, Mr Mcauliffe noted that this was a record attendance for the governors‚Äô ball. \n‚ÄúIn the spirit of bipartisanship, sir, we will both take credit.‚Äù", "external_links": [], "published": "2017-02-27T11:02:00.000+02:00", "crawled": "2017-02-27T06:19:07.908+02:00", "highlightTitle": ""}