{"organizations": [], "uuid": "529e4d5956760ea999329216facdb753a3233266", "thread": {"social": {"gplus": {"shares": 1}, "pinterest": {"shares": 0}, "vk": {"shares": 0}, "linkedin": {"shares": 0}, "facebook": {"likes": 269, "shares": 269, "comments": 0}, "stumbledupon": {"shares": 0}}, "site_full": "www.telegraph.co.uk", "main_image": "http://www.telegraph.co.uk/content/dam/news/2017/02/06/Nigel-Farage-wife-French-politician-comp-xlarge_trans_NvBQzQNjv4BqqVzuuqpFlyLIwiB6NTmJwfSVWeZ_vEN7c6bHu2jJnT8.jpg", "site_section": "http://www.telegraph.co.uk/newsfeed/rss/leaders.xml", "section_title": "News", "url": "http://www.telegraph.co.uk/news/2017/02/06/nigel-farages-wife-pictured-without-wedding-ring-ex-ukip-leader/", "country": "GB", "domain_rank": 317, "title": "Nigel Farage's wife pictured without wedding ring as ex-Ukip leader forced to deny affair with French housemate", "performance_score": 2, "site": "telegraph.co.uk", "participants_count": 1, "title_full": "Nigel Farage's wife pictured without wedding ring as ex-Ukip leader forced to deny affair with French housemate", "spam_score": 0.0, "site_type": "blogs", "published": "2017-02-06T15:16:00.000+02:00", "replies_count": 0, "uuid": "529e4d5956760ea999329216facdb753a3233266"}, "author": "Danny Boyle", "url": "http://www.telegraph.co.uk/news/2017/02/06/nigel-farages-wife-pictured-without-wedding-ring-ex-ukip-leader/", "ord_in_thread": 0, "title": "Nigel Farage's wife pictured without wedding ring as ex-Ukip leader forced to deny affair with French housemate", "locations": [], "entities": {"persons": [{"name": "nigel farage", "sentiment": "negative"}, {"name": "steve finn", "sentiment": "none"}, {"name": "godfrey bloom", "sentiment": "none"}, {"name": "kirsten farage", "sentiment": "none"}, {"name": "jim bennett", "sentiment": "none"}, {"name": "mr farage", "sentiment": "none"}, {"name": "paul nuttall", "sentiment": "none"}, {"name": "laure ferrari", "sentiment": "none"}, {"name": "kirsten", "sentiment": "none"}, {"name": "farage", "sentiment": "none"}, {"name": "ukip", "sentiment": "none"}, {"name": "danny boyle", "sentiment": "none"}, {"name": "nigel", "sentiment": "none"}, {"name": "mrs farage", "sentiment": "none"}, {"name": "ferrari", "sentiment": "none"}], "locations": [{"name": "chelsea", "sentiment": "none"}, {"name": "kent", "sentiment": "none"}, {"name": "strasbourg", "sentiment": "none"}, {"name": "ukip", "sentiment": "none"}, {"name": "europe", "sentiment": "none"}, {"name": "biggin hill", "sentiment": "none"}, {"name": "frankfurt", "sentiment": "none"}, {"name": "london", "sentiment": "none"}], "organizations": [{"name": "institute for direct democracy", "sentiment": "none"}, {"name": "commission", "sentiment": "none"}, {"name": "european parliament", "sentiment": "none"}, {"name": "european union", "sentiment": "none"}, {"name": "institute for direct democracy in europe", "sentiment": "none"}, {"name": "ms ferrari", "sentiment": "none"}, {"name": "adde", "sentiment": "none"}, {"name": "eu", "sentiment": "none"}, {"name": "alliance for direct democracy in europe", "sentiment": "none"}, {"name": "idde", "sentiment": "none"}, {"name": "ferrari", "sentiment": "none"}, {"name": "electoral commission", "sentiment": "none"}, {"name": "europe of freedom and democracy", "sentiment": "none"}]}, "highlightText": "", "language": "english", "persons": [], "text": "News Nigel Farage's wife pictured without wedding ring as ex-Ukip leader forced to deny affair with French housemate Nigel Farage and his wife, Kirsten, (right) outside their family home in Kent on Sunday after revelations the ex-Ukip leader has been sharing his weekday house with a French former waitress Credit: Jim Bennett for The Telegraph/Twitter Danny Boyle 6 February 2017 • 8:16am \nN igel Farage's wife has been photographed without her wedding ring as the former Ukip leader was forced to dismiss suggestions he is having an affair with a French politician 15 years his junior. \nLaure Ferrari, a 37-year-old former waitress, has been sharing the weekday home of Mr Farage, 52, in London's Chelsea. \nShe was photographed on Friday morning putting out the bins at the three-storey rented Georgian property shortly after Mr Farage left in his chauffeur-driven Land Rover. \nMr Farage has dismissed as \"crackers\" suggestions that he is having an affair with Ms Ferrari, the executive director of the Institute for Direct Democracy in Europe (IDDE) think-tank. \nOn Sunday, Mr Farage was photographed returning to his family home near Biggin Hill, Kent . \nKirsten, his German-born wife with whom he has two daughters, was also seen leaving the property without her wedding ring. Kirsten Farage, with whom Nigel Farage has two daughters, was pictured without her wedding ring on Sunday Credit: Jim Bennett for The Telegraph \nM r Farage told the Mail on Sunday that he and Ms Ferrari had a \"working relationship\" and dismissed any suggestion of an affair as \"ludicrous\". \nAsked by reporters on Sunday if he wanted to comment further, he said: \"I've said what I've said.\" Nigel Farage speaking to reporters outside his Kent home on Sunday Credit: Jim Bennett for The Telegraph \nM s Ferrari heads a think tank at the centre of an investigation into the alleged misspending of European Union funding of Ukip, according to reports. \nThe Electoral Commission has opened an investigation into whether Ukip accepted £400,000 in \"impermissible donations\" from the IDDE and another political alliance in the run-up to the general election and the Brexit referendum. \nThe claims have been strongly contested by Ukip and Mr Farage has said the party is \"fighting it very hard.\" \nThe European Parliament had advised the Commission that \"it has formally concluded that the Alliance for Direct Democracy in Europe (ADDE) and IDDE used EU grant funding for the benefit of Ukip in breach of its rules and, therefore, these expenses were declared as non-eligible for the financing\". \nMs Ferrari first became involved in politics as a result of a chance meeting with Mr Farage ten years ago, while she was working as a waitress in Strasbourg. Laure Ferrari heads the Institute for Direct Democracy in Europe think-tank Credit: Twitter \nO n Saturday night, she insisted she had been forced to move out of her own flat after the European Parliament stopped the IDDE's funding. \n\"I have no trustworthy friends in London who could have hosted me,\" she told the Mail on Sunday. \"I asked and he accepted. He is just trying to be helpful.\" \nAsked by the newspaper if he was having an affair with Ms Ferrari, Mr Farage said he was not prepared to answer \"ludicrous questions\". You are putting two and two together, but it is not as simple as that. I cannot stop people from fantasising Laure Ferrari \nH e said: \"She is someone I have worked with and known well for a long time who wanted somewhere to stay for a week that wouldn't cost her any money. It's a working relationship.\" \nMs Ferrari said: \"You are putting two and two together, but it is not as simple as that. I cannot stop people from fantasising. \n\"I am not pleased to be in this situation and I am so sorry it is bringing awful things on Nigel's life and on my life.\" \nThe pair met in 2007, when Mr Farage was dining with his friend Godfrey Bloom, then also a Ukip MEP. \n\"I met these two MEPs and we started talking about politics,\" she said later. \"The two Brits have no hierarchy and neither of them comes from a political background.\" Nigel Farage pictured in Stoke on Trent on Friday on the campaign trail with new Ukip leader Paul Nuttall ahead of a by-election later this month Credit: Steve Finn for The Telegraph \nW ithin months, Ms Ferrari was made head of public relations for the British delegation to the Europe of Freedom and Democracy group, which was led by Ukip. \n\"Everyone says that I am Nigel Farage's parliamentary assistant, but this is not true,\" she told the EurActiv news website in 2014. \n\"I was head of public relations.\" In March 2015, she was appointed executive director for ADDE's think tank, the IDDE. Watch | Nigel Farage and his awkward Ukip leadership gaffes - in 60 seconds 01:09 \nL ast month, Mr Farage said that he spent most week nights at a \"bachelor pad\" and denied that he had split from his wife. \nMrs Farage has worked as his parliamentary secretary and the couple met on a business trip to Frankfurt. \nHe has always made an effort to keep his wife and four children from the public eye.", "external_links": [], "published": "2017-02-06T15:16:00.000+02:00", "crawled": "2017-02-06T10:23:31.814+02:00", "highlightTitle": ""}