{"organizations": [], "uuid": "42144f8cda11b69222bfd27eff38768959a10fca", "thread": {"social": {"gplus": {"shares": 0}, "pinterest": {"shares": 0}, "vk": {"shares": 0}, "linkedin": {"shares": 0}, "facebook": {"likes": 393, "shares": 393, "comments": 0}, "stumbledupon": {"shares": 0}}, "site_full": "www.telegraph.co.uk", "main_image": "http://www.telegraph.co.uk/content/dam/news/2016/10/31/Orgreave_3-xlarge_trans_NvBQzQNjv4BqtaUHo69JdSmh3rLslnsVx8VHAKqfrnr3ps2ecs2KY3A.jpg", "site_section": "http://www.telegraph.co.uk/newsfeed/rss/news_main.xml", "section_title": "News", "url": "http://www.telegraph.co.uk/news/2017/02/09/tory-mps-criticise-government-cap-child-refugees/", "country": "GB", "domain_rank": 317, "title": "Tory MPs criticise Government over 'cap' on child refugees", "performance_score": 3, "site": "telegraph.co.uk", "participants_count": 1, "title_full": "Tory MPs criticise Government over 'cap' on child refugees", "spam_score": 0.0, "site_type": "blogs", "published": "2017-02-09T20:36:00.000+02:00", "replies_count": 0, "uuid": "42144f8cda11b69222bfd27eff38768959a10fca"}, "author": "Peter Dominiczak", "url": "http://www.telegraph.co.uk/news/2017/02/09/tory-mps-criticise-government-cap-child-refugees/", "ord_in_thread": 0, "title": "Tory MPs criticise Government over 'cap' on child refugees", "locations": [], "entities": {"persons": [{"name": "amber rudd", "sentiment": "negative"}, {"name": "burrowes", "sentiment": "none"}, {"name": "abbott", "sentiment": "none"}, {"name": "rudd", "sentiment": "none"}, {"name": "trump", "sentiment": "none"}, {"name": "donald trump", "sentiment": "none"}, {"name": "peter dominiczak", "sentiment": "none"}, {"name": "heidi allen", "sentiment": "none"}, {"name": "dianne abbott", "sentiment": "none"}, {"name": "david cameron", "sentiment": "none"}, {"name": "david burrowes", "sentiment": "none"}, {"name": "pat mcfadden", "sentiment": "none"}, {"name": "allen", "sentiment": "none"}, {"name": "quince", "sentiment": "none"}], "locations": [{"name": "france", "sentiment": "none"}, {"name": "britain", "sentiment": "none"}, {"name": "america", "sentiment": "none"}, {"name": "europe", "sentiment": "none"}, {"name": "uk", "sentiment": "none"}, {"name": "iraq", "sentiment": "none"}], "organizations": [{"name": "labour", "sentiment": "none"}, {"name": "follow telegraph news", "sentiment": "none"}, {"name": "parliament", "sentiment": "none"}, {"name": "conservative", "sentiment": "none"}, {"name": "house of lords", "sentiment": "none"}]}, "highlightText": "", "language": "english", "persons": [], "text": "Tory MPs criticise Government over 'cap' on child refugees Amber Rudd, the Home Secretary Credit: PA Peter Dominiczak , Political Editor 9 February 2017 • 1:36pm \nT heresa May is facing a backlash from Conservative MPs after the Government decided to cap the number of lone child refugees being brought to Britain. \nAt least three senior Tory MPs have openly criticised the Government over the issue, with one even calling for a Judicial Review against the decision, which was announced by Amber Rudd, the Home Secretary. \nMinisters have announced that just 350 children will be brought to the UK under the Dubs Amendment - far fewer than the 3,000 originally expected. \nMPs compared the decision to Donald Trump's controversial travel ban in America. Watch | Child refugees 'pushed-back' trying to cross Serbian border 01:19 \nI t prompted a backlash from MPs, with Dianne Abbott, Labour’s shadow Home Secretary, questioning how Ms Rudd can “live with herself”. \nConservative MPs including David Burrowes, Heidi Allen and Will Quince have all raised concerns about the Government’s reversal. \nMs Allen said it was a “very, very poor result” and said she would back a Judicial Review of the decision. \nMr Burrowes accused Conservative ministers of having “cut and run from child refugees”. Watch | Drone footage reveals scale of child refugee camp in Iraq 00:28 \nH e said that when MPs and peers last year voted to set up the scheme “Parliament did not intend to set a time a limit on our compassion for vulnerable child refugees in Europe”. \nMr Quince said that the cap had made him “sad and disappointed”. \nFaced with a rebellion in the House of Lords, then prime minister David Cameron announced last year that he would accept the Dubs Amendment and settle more child refugees. Watch | PM signals U-turn over unaccompanied child refugees 01:41 \nO n Wednesday, ministers quietly announced that 200 children have been brought in under the scheme, and that it will close after another 150 are settled in the UK. \nIn Parliament Ms Abbott attacked Ms Rudd, saying: \"How does she live with herself, leaving thousands of children subject to disease, people trafficking, squalor and hopelessness?\" \nMs Abbott said many children currently in France were not being cared for and had resorted to sleeping on the streets and in informal encampments. \nShe added: \"The worst thing about this Government's failure to step up to the totality of the refugee crisis is the children.\" \nIn reply, Ms Rudd said it was the children that mattered most and it was \"an absolutely disgraceful\" situation on the borders of Europe, due to the amount of people being trafficked. \nMs Rudd also told her critics to reconsider their “high moral tone”. \nLabour's Pat McFadden said: \"I want to ask [Ms Rudd] what signal she thinks this sends to the world in the wake of the announcement last week from President Trump, in a different context. \n\"There are always those who will say look after our own, charity begins at home, Britain first, America first, France first, and so on. \n\"Does she really want us to be aligned with that sentiment, or a different one?\" \nThere was controversy last year after MPs raised concerns that a number of the child refugees coming to Britain were in fact adults. Follow Telegraph News", "external_links": [], "published": "2017-02-09T20:36:00.000+02:00", "crawled": "2017-02-09T15:50:06.450+02:00", "highlightTitle": ""}