{"organizations": [], "uuid": "5529367bf9f42da9680dcec4eba6a97033e6df97", "thread": {"social": {"gplus": {"shares": 0}, "pinterest": {"shares": 0}, "vk": {"shares": 0}, "linkedin": {"shares": 2}, "facebook": {"likes": 111, "shares": 111, "comments": 0}, "stumbledupon": {"shares": 0}}, "site_full": "www.geo.tv", "main_image": "https://www.geo.tv/assets/uploads/updates/2017-02-21/131854_124856_updates.jpg", "site_section": "http://feeds.feedburner.com/geo/GiKR", "section_title": "GEO TV - Pakistan", "url": "https://www.geo.tv/latest/131854-Seven-martyred-in-attack-on-local-court-in-Charsadda", "country": "TV", "domain_rank": 8287, "title": "Seven martyred in attack on local court in Charsadda", "performance_score": 1, "site": "geo.tv", "participants_count": 0, "title_full": "Seven martyred in attack on local court in Charsadda", "spam_score": 0.0, "site_type": "blogs", "published": "2017-02-21T20:30:00.000+02:00", "replies_count": 0, "uuid": "5529367bf9f42da9680dcec4eba6a97033e6df97"}, "author": "", "url": "https://www.geo.tv/latest/131854-Seven-martyred-in-attack-on-local-court-in-Charsadda", "ord_in_thread": 0, "title": "Seven martyred in attack on local court in Charsadda", "locations": [], "entities": {"persons": [{"name": "sabz ali tareen", "sentiment": "none"}, {"name": "khan", "sentiment": "none"}, {"name": "— maj gen asif ghafoor", "sentiment": "none"}, {"name": "qamar javed bajwa", "sentiment": "none"}, {"name": "sheeba haider", "sentiment": "none"}, {"name": "aftab ahmed", "sentiment": "none"}, {"name": "shaukat yousafzai", "sentiment": "none"}, {"name": "yousafzai", "sentiment": "none"}, {"name": "irfanullah jan", "sentiment": "none"}, {"name": "ijaz khan", "sentiment": "none"}, {"name": "marda", "sentiment": "none"}, {"name": "mehmood jan", "sentiment": "none"}, {"name": "noman khan", "sentiment": "none"}], "locations": [{"name": "pakistan", "sentiment": "none"}, {"name": "charsadda seven", "sentiment": "none"}, {"name": "charsadda", "sentiment": "none"}, {"name": "shabqadar", "sentiment": "none"}, {"name": "peshawar", "sentiment": "none"}, {"name": "mohmand  pakistan", "sentiment": "none"}, {"name": "sehwan", "sentiment": "none"}, {"name": "lahore", "sentiment": "none"}, {"name": "tangi bazaar", "sentiment": "none"}, {"name": "charsadda", "sentiment": "none"}, {"name": "karachi", "sentiment": "none"}, {"name": "khyber pakhtunkhwa", "sentiment": "none"}, {"name": "quetta", "sentiment": "none"}], "organizations": [{"name": "army", "sentiment": "none"}, {"name": "pti", "sentiment": "none"}, {"name": "army staff", "sentiment": "none"}, {"name": "mohmand agency", "sentiment": "none"}, {"name": "coas", "sentiment": "none"}]}, "highlightText": "", "language": "english", "persons": [], "text": "Seven martyred in attack on local court in Charsadda | What is behind terror attacks in Pakistan now? \nCHARSADDA: Militants stormed a local court in Tangi Bazaar on Tuesday claiming the lives of seven people while 20 others were injured, hospital and rescue sources confirmed. \nSpeaking to the media, DIG Police Marda, Ijaz Khan said the terrorists first opened fire and hurled hand grenades. The police official stated that three terrorists tried to enter the premises. The first terrorists detonated his suicide vest near the gate of the court. The other two terrorists were shot dead by the police in an exchange of fire. \nAccording to the DIG, a major tragedy was prevented when the terrorists were stopped from entering the court. \nKhan explained that rumours say there were four militants; however, the police found three dead bodies of terrorists. \nAmong the martyred, the DIG noted, is a lawyer as well. The police official stressed that there is a rush in the court and surrounding areas at this time of the morning, which is why the attack could have been worse. \nCondemning the blast, Khan commented that security forces will try their best to find the person or group facilitating these attacks, and will make sure that they are presented in the court of law. \nSecurity forces have cordoned off the area while a bomb disposal squad and Army's quick response contingent has reached the spot. \nEmergency has been declared in hospitals in the area where the injured have been shifted. COAS lauds forces' response \nChief of Army Staff (COAS) General Qamar Javed Bajwa praised the response of security forces' to the blast in Charsadda. The COAS said first tier response saved many lives and he expressed grief over the lives lost. #COAS lauds security forces' response to Charsada Blast. First tier Police response has saved many lives. Shares grief on loss of lives. — Maj Gen Asif Ghafoor (@OfficialDGISPR) February 21, 2017 Militants Came From Mohmand \nPakistan Tehreek-e-Insaf (PTI) MPA Shaukat Yousafzai said according to his information the militants had come from Mohmand Agency. \n\"Security institutions are alert in Khyber Pakhtunkhwa,\" Yousafzai said. Wave of Terrorism \nPakistan has been hit by a string of militant bombings and suicide attacks over the past 10 days, killing more than 100 people and wounding hundreds. \nAt least 88 people were killed when a suicide bomber struck the Lal Shahbaz Qalandar shrine in Sehwan last week. On 13 February, 14 people including two senior police officials were killed in a suicide attack during a protest rally in Lahore. Peshawar, Karachi, Quetta, Awaran and Mohmand Agency have also been targeted by terrorists. \nA similar attack in March last year killed at least 16 and injured more than 20 when a suicide bomber hit the gates of a local court building in Shabqadar district, Charsadda. \n\nSabz Ali Tareen, Irfanullah Jan, Aftab Ahmed, Mehmood Jan, Noman Khan, Sheeba Haider contributed to the filing of this report \n0 0 Seven martyred in attack on local court in Charsadda   , Charsadda, Explosion, Latest Pakistan News, Suicide Bombers, Terrorism.   \"Seven martyred in attack on local court in Charsadda\" is https://www.geo.tv/latest/131854-Seven-martyred-in-attack-on-local-court-in-Charsadda+geo%2FGiKR+%28Geo+Pakistan+- ", "external_links": [], "published": "2017-02-21T20:30:00.000+02:00", "crawled": "2017-02-21T11:08:06.095+02:00", "highlightTitle": ""}