{"organizations": [], "uuid": "cb9df0d103d7907f05a97cd9274d59cea5864dcf", "thread": {"social": {"gplus": {"shares": 0}, "pinterest": {"shares": 0}, "vk": {"shares": 0}, "linkedin": {"shares": 0}, "facebook": {"likes": 134, "shares": 134, "comments": 0}, "stumbledupon": {"shares": 0}}, "site_full": "www.geo.tv", "main_image": "https://www.geo.tv/assets/uploads/updates/2017-02-17/131423_024539_updates.jpg", "site_section": "http://feeds.feedburner.com/geo/GiKR", "section_title": "GEO TV - Pakistan", "url": "https://www.geo.tv/latest/131423-Over-100-terrorists-killed-in-operations-across-Pakistan-ISPR", "country": "TV", "domain_rank": 8287, "title": "Over 100 terrorists killed in operations across Pakistan: ISPR", "performance_score": 1, "site": "geo.tv", "participants_count": 0, "title_full": "Over 100 terrorists killed in operations across Pakistan: ISPR", "spam_score": 0.0, "site_type": "blogs", "published": "2017-02-18T02:39:00.000+02:00", "replies_count": 0, "uuid": "cb9df0d103d7907f05a97cd9274d59cea5864dcf"}, "author": "", "url": "https://www.geo.tv/latest/131423-Over-100-terrorists-killed-in-operations-across-Pakistan-ISPR", "ord_in_thread": 0, "title": "Over 100 terrorists killed in operations across Pakistan: ISPR", "locations": [], "entities": {"persons": [{"name": "qamar javed bajwa", "sentiment": "none"}], "locations": [{"name": "pakistan", "sentiment": "none"}, {"name": "balochistan  fc", "sentiment": "none"}, {"name": "darakshan", "sentiment": "none"}, {"name": "tehreek-e-taliban pakistan", "sentiment": "none"}, {"name": "sindh", "sentiment": "none"}, {"name": "afghanistan", "sentiment": "none"}, {"name": "super highway", "sentiment": "none"}, {"name": "regi lalma", "sentiment": "none"}, {"name": "peshawar", "sentiment": "none"}, {"name": "sehwan", "sentiment": "none"}, {"name": "karachi", "sentiment": "none"}, {"name": "manghopir", "sentiment": "none"}, {"name": "quetta", "sentiment": "none"}, {"name": "punjab", "sentiment": "none"}, {"name": "bannu", "sentiment": "none"}], "organizations": [{"name": "ispr", "sentiment": "negative"}, {"name": "pakistan army", "sentiment": "none"}, {"name": "army", "sentiment": "none"}, {"name": "ispr   pakistan news", "sentiment": "none"}, {"name": "sariyab police", "sentiment": "none"}, {"name": "ssp malir rao anwar", "sentiment": "none"}, {"name": "ssp", "sentiment": "none"}, {"name": "rangers", "sentiment": "none"}, {"name": "inter services public relations", "sentiment": "none"}, {"name": "rangers headquarters", "sentiment": "none"}, {"name": "inter-services public relations", "sentiment": "none"}]}, "highlightText": "", "language": "english", "persons": [], "text": "PM condemns Sehwan incident, terms it an attack on countryâ€™s future \nRAWALPINDI: Security and law enforcement agencies (LEAs), in a swift response to recent terror attacks, have killed over a hundred terrorists, besides apprehending several miscreants from different parts of the country, the Inter Services Public Relations said Friday. \nThe security agencies responded shortly after the Chief of Army Staff (COAS) General Qamar Javed Bajwa directed for combing and intelligence-based operations in the country, following Thursday bombing at a Sufi shrine in Sindh that left 88 devotees dead. \nThe operations are ongoing across the country, including Punjab, the ISPR said in a statement. \"Over 100 terrorists have been killed since last night and sizeable apprehensions also made.\" \nIntelligence agencies are making progress to unearth networks behind recent terrorist incidents and the outcome will be shared, said the military's public relations wing. 'Linkages from across the border' \n\"There are linkages of support for these incidents from across the border,\" the ISPR said. \"The [Pak-Afghan] border has been closed since last night.\" \nNo cross-border or unauthorised entry into Pakistan from Afghanistan will be allowed, it said, for which the security forces have been given special orders to keep a strict watch all along the border. \nMeanwhile, the Afghan authorities have been given list of 76 terrorists who have long been hiding across the border and \"planning/directing/supporting terrorist activities in Pakistan\", the ISPR said. \n\"The Afghan government has been asked to target them or hand over to Pakistan.\" \nThe statement further read that Pakistani security forces have also effectively targeted hideouts on Pak-Afghan border. Army is for security of people, says COAS \nThe COAS, in his message to countrymen, said, \"Army is for security of people of Pakistan against all types of threats. Nation to stay steadfast with full confidence in their security forces\". \n\"We shall not let the hostile agenda succeed whatever it may cost,\" he pledged. Tribal Areas \nIn the tribal areas, security forces killed 10 terrorists belonging to the banned Tehreek-e-Taliban Pakistan (TTP). According to the Inter-Services Public Relations (ISPR) wing of the Pakistan Army, six terrorists were killed in the exchange of fire while others managed to escape. \nMeanwhile, in Bannu acting on actionable intelligence security forces carried out a raid on a terrorist hideout. In the ensuing exchange of fire four terrorists were killed. In both operations, security forces seized a large cache of arms and ammunition from the terrorists. Sindh \nIn Karachi on Thursday night a Rangers paramilitary force convoy returning after carrying out relief operations in Sehwan exchanged fire with terrorists on the Super Highway killing seven terrorists. One paramilitary force soldier sustained injuries in the gunfight. The paramilitary force carried out a targeted operation in the Manghopir area during which 11 terrorists were killed and two paramilitary force personnel sustained injuries. During the operations, paramilitary force personnel seized latest weapons and ammunition from the terrorists. 'Nine terrorists killed in Karachi encounter' \nSSP Malir Rao Anwar said Friday that the police conducted raids at the house of the father-in-law of TTP Karachi chief on the Super Highway, where an exchange of fire took place, killing nine terrorists. \nThe SSP informed that the terrorists were planning a major attack in the city. They were also planning to attack Rangers Headquarters, Karachi. Khyber Pakhtunkhwa \nDuring a search operation in Peshawar carried out by Police and Pakistan Army troops, three terrorists were killed. According to Police sources, the operation was carried out in Regi Lalma area, north of Peshawar city. \nEarlier in the night, following the attack on a police van security force personnel carried out a search operation during which 2 terrorists were killed and a large cache of arms, ammunition and grenades were seized. Balochistan \nFC personnel carried out an operation in in Quetta killing two important commanders of the banned Tehreek-e-Taliban. Two security personnel also sustained injuries during the operation. According to FC sources, acting on intelligence the force surrounded a terrorist hideout in Darakshan scheme 1 when terrorists opened fire on the raiding party. Retaliating the FC personnel killed two terrorists and seized a large cache of arms and ammunition which was handed over to Sariyab Police personnel along with the dead terrorists. \n0 0 Over 100 terrorists killed in operations across Pakistan: ISPR   Pakistan News, Terrorist Attacks In Pakistan, Terrorists Killed.   \"Over 100 terrorists killed in operations across Pakistan: ISPR\" is https://www.geo.tv/latest/131423-Over-100-terrorists-killed-in-operations-across-Pakistan-ISPR+geo%2FGiKR+%28Geo+Pakistan+- ", "external_links": [], "published": "2017-02-18T02:39:00.000+02:00", "crawled": "2017-02-17T17:04:15.014+02:00", "highlightTitle": ""}