{"organizations": [], "uuid": "16d09e1bcb97cd708e3e8d276da943344d75a514", "thread": {"social": {"gplus": {"shares": 0}, "pinterest": {"shares": 0}, "vk": {"shares": 0}, "linkedin": {"shares": 0}, "facebook": {"likes": 708, "shares": 708, "comments": 0}, "stumbledupon": {"shares": 0}}, "site_full": "baltimore.cbslocal.com", "main_image": "https://cbsbaltimore.files.wordpress.com/2017/01/sean-spicer.jpg?w=453", "site_section": "http://baltimore.cbslocal.com/comments/feed/", "section_title": "CBS Baltimore", "url": "http://baltimore.cbslocal.com/2017/02/24/several-news-organizations-blocked-from-white-house-press-briefing/", "country": "US", "domain_rank": 1192, "title": "Several News Organizations Blocked from White House Press Briefing", "performance_score": 7, "site": "cbslocal.com", "participants_count": 1, "title_full": "Several News Organizations Blocked from White House Press Briefing", "spam_score": 0.0, "site_type": "blogs", "published": "2017-02-25T02:49:00.000+02:00", "replies_count": 0, "uuid": "16d09e1bcb97cd708e3e8d276da943344d75a514"}, "author": "CBS Baltimore", "url": "http://baltimore.cbslocal.com/2017/02/24/several-news-organizations-blocked-from-white-house-press-briefing/", "ord_in_thread": 0, "title": "Several News Organizations Blocked from White House Press Briefing", "locations": [], "entities": {"persons": [{"name": "alex wong/getty images", "sentiment": "none"}, {"name": "sean spicer", "sentiment": "none"}, {"name": "spicer", "sentiment": "none"}], "locations": [{"name": "white house", "sentiment": "none"}, {"name": "white house washington", "sentiment": "none"}, {"name": "baltimore", "sentiment": "none"}, {"name": "washington, dc", "sentiment": "none"}], "organizations": [{"name": "one america news network", "sentiment": "none"}, {"name": "white house correspondents association", "sentiment": "none"}, {"name": "time", "sentiment": "none"}, {"name": "associated press", "sentiment": "none"}, {"name": "breitbart news", "sentiment": "none"}, {"name": "politico", "sentiment": "none"}, {"name": "los angeles times", "sentiment": "none"}, {"name": "white house", "sentiment": "none"}, {"name": "washington times", "sentiment": "none"}, {"name": "james brady press", "sentiment": "none"}, {"name": "cnn", "sentiment": "none"}, {"name": "white house press", "sentiment": "none"}, {"name": "cbs baltimore", "sentiment": "none"}, {"name": "new york times", "sentiment": "none"}]}, "highlightText": "", "language": "english", "persons": [], "text": "Several News Organizations Blocked from White House Press Briefing February 24, 2017 2:49 PM Filed Under: Press Briefing , White House WASHINGTON, DC - JANUARY 21: White House Press Secretary Sean Spicer makes a statement to members of the media at the James Brady Press Briefing Room of the White House January 21, 2017 in Washington, DC. Spicer spoke on a few topics including his accusation of media not to report honestly. (Photo by Alex Wong/Getty Images) \nBALTIMORE (WJZ)â€“ CNN and other news organizations were blocked Friday from an off-camera White House press briefing, CNN reports . \nThere was no immediate explanation from the White House. The New York Times, the Los Angeles Times, and Politico were also excluded from the meeting, which is known as a gaggle and is less formal than the televised Q-and-A session in the White House briefing room. \nThe Associated Press and Time magazine boycotted the briefing because of how it was handled. The White House Correspondents Association is protesting. \nThe conservative media organizations Breitbart News, The Washington Times and One America News Network were allowed in. \nFollow @CBSBaltimore on Twitter and like WJZ-TV | CBS Baltimore on Facebook", "external_links": [], "published": "2017-02-25T02:49:00.000+02:00", "crawled": "2017-02-25T05:23:16.156+02:00", "highlightTitle": ""}