{"organizations": [], "uuid": "93e4f0e8e9d8d5166d9f470181a5bf064845fad5", "thread": {"social": {"gplus": {"shares": 0}, "pinterest": {"shares": 0}, "vk": {"shares": 0}, "linkedin": {"shares": 0}, "facebook": {"likes": 120, "shares": 120, "comments": 0}, "stumbledupon": {"shares": 0}}, "site_full": "www.philly.com", "main_image": "http://media.philly.com/images/RS_phillyThumb2_1200x800_20170214_4614202_SGERM06_F_262920799.jpg", "site_section": "", "section_title": "", "url": "http://www.philly.com/philly/blogs/rick-obrien/All-Inter-Ac-League-Boys-Basketball-Team.html", "country": "US", "domain_rank": 3314, "title": "All-Inter-Ac League Boys' Basketball Team", "performance_score": 1, "site": "philly.com", "participants_count": 0, "title_full": "All-Inter-Ac League Boys' Basketball Team", "spam_score": 0.254, "site_type": "blogs", "published": "2017-02-15T03:28:00.000+02:00", "replies_count": 0, "uuid": "93e4f0e8e9d8d5166d9f470181a5bf064845fad5"}, "author": "Rick O'Brien", "url": "http://www.philly.com/philly/blogs/rick-obrien/All-Inter-Ac-League-Boys-Basketball-Team.html", "ord_in_thread": 0, "title": "All-Inter-Ac League Boys' Basketball Team", "locations": [], "entities": {"persons": [{"name": "rick", "sentiment": "negative"}, {"name": "brien", "sentiment": "none"}, {"name": "malvern prep", "sentiment": "none"}, {"name": "christian ray", "sentiment": "none"}, {"name": "rick o'brien", "sentiment": "none"}, {"name": "conner delaney", "sentiment": "none"}, {"name": "kyle mccloskey", "sentiment": "none"}, {"name": "nick alikakos", "sentiment": "none"}, {"name": "evan-eric longino", "sentiment": "none"}, {"name": "billy corcoran", "sentiment": "none"}, {"name": "ryan holmes", "sentiment": "none"}, {"name": "kharon randolph", "sentiment": "none"}], "locations": [{"name": "penn charter", "sentiment": "none"}, {"name": "philadelphia", "sentiment": "none"}, {"name": "philly.com", "sentiment": "none"}, {"name": "schuylkill", "sentiment": "none"}, {"name": "southeastern pennsylvania", "sentiment": "none"}], "organizations": [{"name": "all-inter-ac league boys' basketball team all-inter-ac league boys' basketball team updated", "sentiment": "neutral"}, {"name": "episcopal academy", "sentiment": "none"}, {"name": "penn relays", "sentiment": "none"}, {"name": "haverford school", "sentiment": "none"}, {"name": "all-inter-ac league boys’ basketball team  mvp", "sentiment": "none"}, {"name": "philly.com", "sentiment": "none"}, {"name": "deuce turner malvern prep", "sentiment": "none"}, {"name": "mason williams penn charter", "sentiment": "none"}, {"name": "germantown academy", "sentiment": "none"}]}, "highlightText": "", "language": "english", "persons": [], "text": "All-Inter-Ac League Boys' Basketball Team Updated: February 14, 2017 — 3:28 PM EST 117 Share Rick O'Brien Staff Writer \nRick O'Brien has been writing for the Inquirer since 1993, primarily covering high school sports in Southeastern Pennsylvania. He focuses on football and boys' basketball and baseball, with other events (Penn Relays, regattas on the Schuylkill, etc.) and some pro sports mixed in. More by Rick O'Brien \nAll-Inter-Ac League Boys’ Basketball Team \nMVP: Kyle McCloskey, Germantown Academy \nFIRST TEAM \nKyle McCloskey, Germantown Academy, Sr. \nEvan-Eric Longino, Germantown Academy, Sr. \nConner Delaney, Episcopal Academy, Sr. \nKharon Randolph, Haverford School, Jr. \nNick Alikakos, Episcopal Academy, Sr. \nChristian Ray, Haverford School, So. \nSECOND TEAM \nDeuce Turner Malvern Prep, Fr. \nMason Williams Penn Charter, Jr. \nRyan Holmes, Penn Charter, Fr. \nBilly Corcoran, Malvern Prep, Jr. \nClick HERE to read more posts from The O'Zone. More Coverage February 14, 2017 — 3:28 PM EST The Philadelphia Inquirer We encourage respectful comments but reserve the right to delete anything that doesn't contribute to an engaging dialogue Help us moderate this thread by flagging comments that violate our guidelines Commenting policy | Comments FAQ Comment policy: \nPhilly.com comments are intended to be civil, friendly conversations. Please treat other participants with respect and in a way that you would want to be treated. You are responsible for what you say. And please, stay on topic. If you see an objectionable post, please report it to us using the \"Report Abuse\" option. \nPlease note that comments are monitored by Philly.com staff. We reserve the right at all times to remove any information or materials that are unlawful, threatening, abusive, libelous, defamatory, obscene, vulgar, pornographic, profane, indecent or otherwise objectionable. Personal attacks, especially on other participants, are not permitted. We reserve the right to permanently block any user who violates these terms and conditions. \nAdditionally comments that are long, have multiple paragraph breaks, include code, or include hyperlinks may not be posted. ", "external_links": [], "published": "2017-02-15T03:28:00.000+02:00", "crawled": "2017-02-15T11:17:09.158+02:00", "highlightTitle": ""}