{"organizations": [], "uuid": "8537deaa3e607b2dfd0701c31f7af84215a46f5f", "thread": {"social": {"gplus": {"shares": 3}, "pinterest": {"shares": 5}, "vk": {"shares": 0}, "linkedin": {"shares": 893}, "facebook": {"likes": 738, "shares": 738, "comments": 0}, "stumbledupon": {"shares": 0}}, "site_full": "www.techinasia.com", "main_image": "", "site_section": "https://www.techinasia.com", "section_title": "Tech in Asia", "url": "https://www.techinasia.com/10-sales-business-development-jobs-asia", "country": "US", "domain_rank": 6989, "title": "10 sales and business development jobs: Bridestory, Blaire Labs, Easyship and more", "performance_score": 7, "site": "techinasia.com", "participants_count": 1, "title_full": "10 sales and business development jobs: Bridestory, Blaire Labs, Easyship and more", "spam_score": 0.0, "site_type": "blogs", "published": "2017-02-14T12:15:00.000+02:00", "replies_count": 7, "uuid": "8537deaa3e607b2dfd0701c31f7af84215a46f5f"}, "author": "Elvina Taher", "url": "https://www.techinasia.com/10-sales-business-development-jobs-asia", "ord_in_thread": 0, "title": "10 sales and business development jobs: Bridestory, Blaire Labs, Easyship and more", "locations": [], "entities": {"persons": [{"name": "easyship", "sentiment": "none"}, {"name": "blaire labs", "sentiment": "none"}], "locations": [{"name": "easyship", "sentiment": "none"}, {"name": "philippines", "sentiment": "none"}, {"name": "hanoi", "sentiment": "none"}, {"name": "hong kong", "sentiment": "none"}, {"name": "jakarta", "sentiment": "none"}, {"name": "bridestory  bridestory", "sentiment": "none"}, {"name": "indonesia", "sentiment": "none"}, {"name": "delhi", "sentiment": "none"}, {"name": "east malaysia", "sentiment": "none"}, {"name": "kuala lumpur", "sentiment": "none"}, {"name": "vietnam", "sentiment": "none"}, {"name": "india", "sentiment": "none"}, {"name": "malaysia", "sentiment": "none"}, {"name": "makati city", "sentiment": "none"}, {"name": "singapore", "sentiment": "none"}, {"name": "south-east asia", "sentiment": "none"}, {"name": "easyship  easyship", "sentiment": "none"}, {"name": "new delhi", "sentiment": "none"}, {"name": "asia", "sentiment": "none"}], "organizations": [{"name": "blaire labs", "sentiment": "negative"}, {"name": "phinemo kreasi media  phinemo kreasi media", "sentiment": "none"}, {"name": "enk ventures sdn bhd  management trainee", "sentiment": "none"}, {"name": "enk ventures sdn bhd  enk ventures", "sentiment": "none"}, {"name": "blaire labs  business development intern", "sentiment": "none"}, {"name": "microsoft office", "sentiment": "none"}, {"name": "damansara", "sentiment": "none"}, {"name": "ltv", "sentiment": "none"}, {"name": "myr", "sentiment": "none"}, {"name": "blaire labs  blaire labs", "sentiment": "none"}, {"name": "easyship  business development executive", "sentiment": "none"}, {"name": "phinemo kreasi media  sales intern", "sentiment": "none"}, {"name": "valuepotion  valuepotion", "sentiment": "none"}, {"name": "launchpad startup  launchpad", "sentiment": "none"}, {"name": "audience.to  bussiness development", "sentiment": "none"}, {"name": "pear comms pte ltd  as pear comms", "sentiment": "none"}, {"name": "magic sewa  digital merchandiser", "sentiment": "none"}, {"name": "launchpad startup", "sentiment": "none"}, {"name": "digital", "sentiment": "none"}, {"name": "pear comms pte ltd", "sentiment": "none"}]}, "highlightText": "", "language": "english", "persons": [], "text": "\nLooking for sales and business development opportunities? We have handpicked 10 jobs for you this week. Click on the links below and apply away!\nRecruiting and keen to list your jobs in future articles? Click here to create your company profile and post jobs. We feature jobs based on the following criteria:\nActivity of recruiters on the platform. Recruiters who actively post new jobs, remove old ones, and accept/reject applicants will have higher chances of being featured. Completeness of company profile and job details. Company with incomplete profile or poor job description will not be featured. Business Development Manager at Audience.to \nAudience.to lets people create and send personal messages based on what users do on your website and mobile app.\nWork location: Makati City, Philippines / Full-time Requirement: Experience in CRM/ERP/Cloud based or SaaS solution sales, successful track record in of identifying and converting B2B Sales opportunities. Skills: Digital marketing, SaaS. Salary Range: PHP 50,000 – 100,000 Equity: Yes More jobs at Audience.to \nBussiness Development at Phinemo Kreasi Media \nPhinemo Kreasi Media runs Phinemo.com as online travel media in Indonesia. Create original creative, informative & entertaining content for the travel enthusiast.\nWork location: Jakarta, Indonesia / Full-time Requirement: Understand how to network and work with a client, passion with digital media & travel industry, having at least 2-4 years experience in digital advertising agency. Skills: Business development & partnerships, sales, time management. Salary Range: IDR 6,000,000 – 10,000,000 More jobs at Phinemo Kreasi Media \nSales Intern at Pear Comms Pte Ltd \nAs Pear Comms’s flagship product ,QuickDesk is a cloud-based CRM sales engagement tool which helps sales professionals better track leads and sales activities for sales productivity.\nWork location: Singapore / Internship Requirement: Excellent communication and interpersonal skills, highly self-motivated and self-driven with the ability to learn fast and think on feet. Skills: Sales strategy & management, CRM, sales & marketing. Salary Range: SGD 600 – 750 More jobs at Pear Comms Pte Ltd \nBusiness Manager Singapore at Bridestory \nBridestory is an inspiring and resourceful online global wedding directory and marketplace that helps to connect wedding professionals and vendors with engaged couples around the world.\nWork location: Singapore / Full-time Requirement: Great verbal and written communication skills Confident, assertive self-starter who is extremely organized and goal driven, ability to learn and think quickly. Skills: Sales, business development. Salary Range: SGD 2,000 – 3,000 More jobs at Bridestory \nAccounts Manager at Magic Sewa \nMagic Sewa is taxi service that offers secure, reliable and responsible service in Delhi.\nWork location: New Delhi, India / Full-time Requirement: Ability to establish and maintain robust tracking and reporting mechanism to support decision-making. Skills: Account management. Salary Range: INR 25,000 – 33,000 More jobs at Magic Sewa \nDigital Merchandiser at Blaire Labs \nBlaire Labs is fast-growing startup focusing on the digitization of retail businesses in Indonesia and Singapore.\nWork location: Jakarta, Indonesia / Full-time Requirement: Highly analytical with a passion for Excel and data, fluent in English, able to work under tight timelines and in a high pressure, fast-paced environment. Skills: Business development & partnerships, merchandising, e-commerce. Salary Range: IDR 10,000,000 – 15,000,000 More jobs at Blaire Labs \nBusiness Development Intern at Easyship \nEasyship is the one-stop solution for all e-commerce sellers fulfillment needs with our algorithm and smart in-house logistics solution all on demand.\nWork location: Hong Kong / Internship Requirement: Business or related studies, great organizational skills with big attention to detail, excellent communication skills. Skills: Business development, sales, growth hacking. Salary Range: HKD 1,500 – 3,000 More jobs at Easyship \nBusiness Development Executive at ENK Ventures Sdn Bhd \nENK Ventures is known as Real Estate Entrepreneur & Negotiator from East Malaysia.\nWork location: Kuala Lumpur, Malaysia / Full-time Requirement: Love meeting people, good interpersonal, presentation and communication skills, with a passion for the property industry. Skills: Business development, English language, Microsoft Office. More jobs at ENK Ventures Sdn Bhd \nManagement Trainee (Sales and Marketing) at LaunchPad Startup \nLaunchPad is a venture builder headquartered in Malaysia which identifies and maximizes tech-related opportunities across South-East Asia.\nWork location: Damansara, Malaysia / Full-time Requirement: An energetic, hungry and passionate individual with the willingness to learn, extroverted and comfortable talking to strangers. Skills: Sales strategy & management, communication skills. Salary Range: MYR 2,500 – 3,500 More jobs at LaunchPad Startup \nPublisher Sales Manager at Valuepotion \nValuepotion is a mobile-app lifetime value (LTV) maximization platform specialized in app analytics and marketing.\nWork location: Hanoi, Vietnam / Full-time Requirement: 3 years+ of professional experience of publisher sales in ad tech company or agencies, strong verbal and written communication skill both in Vietnamese and English. Skills: Business development & partnerships, sales, mobile advertising. Salary Range: USD 1,000 – 1,500 More jobs at Valuepotion \nWant to see more jobs? Click here to check out other opportunities!\nHiring? Click here to post jobs!\nWant the latest job updates in your inbox? Join our mailing list here to get the best jobs in Asia’s tech scene on a weekly basis.\nThis post 10 sales and business development jobs: Bridestory, Blaire Labs, Easyship and more appeared first on Tech in Asia.\n", "external_links": [], "published": "2017-02-14T12:15:00.000+02:00", "crawled": "2017-02-14T07:17:31.240+02:00", "highlightTitle": ""}