{"organizations": [], "uuid": "923fac3f27e6f53a5057c2343fe138df6abc706d", "thread": {"social": {"gplus": {"shares": 0}, "pinterest": {"shares": 0}, "vk": {"shares": 0}, "linkedin": {"shares": 0}, "facebook": {"likes": 288, "shares": 288, "comments": 0}, "stumbledupon": {"shares": 0}}, "site_full": "www.geo.tv", "main_image": "https://www.geo.tv/assets/uploads/updates/2017-02-03/129864_085156_updates.jpg", "site_section": "http://feeds.feedburner.com/geo/GiKR", "section_title": "GEO TV - Pakistan", "url": "https://www.geo.tv/latest/129864-Nawaz-most-popular-political-figure-in-Pakistan-survey-suggests", "country": "TV", "domain_rank": 8287, "title": "Nawaz most popular political figure in Pakistan, survey suggests", "performance_score": 2, "site": "geo.tv", "participants_count": 0, "title_full": "Nawaz most popular political figure in Pakistan, survey suggests", "spam_score": 0.0, "site_type": "blogs", "published": "2017-02-04T03:50:00.000+02:00", "replies_count": 0, "uuid": "923fac3f27e6f53a5057c2343fe138df6abc706d"}, "author": "", "url": "https://www.geo.tv/latest/129864-Nawaz-most-popular-political-figure-in-Pakistan-survey-suggests", "ord_in_thread": 0, "title": "Nawaz most popular political figure in Pakistan, survey suggests", "locations": [], "entities": {"persons": [{"name": "nawa", "sentiment": "negative"}, {"name": "nawaz", "sentiment": "negative"}, {"name": "tahirul qadri", "sentiment": "none"}, {"name": "bilawal bhutto", "sentiment": "none"}, {"name": "nawaz sharif", "sentiment": "none"}, {"name": "bilawal", "sentiment": "none"}, {"name": "mqm founder", "sentiment": "none"}, {"name": "sharif", "sentiment": "none"}, {"name": "asif ali zardari", "sentiment": "none"}, {"name": "imran khan", "sentiment": "none"}, {"name": "khyber pakhtunkhwa", "sentiment": "none"}], "locations": [{"name": "pakistan", "sentiment": "none"}, {"name": "karachi", "sentiment": "none"}, {"name": "panama", "sentiment": "none"}, {"name": "punjab", "sentiment": "none"}], "organizations": [{"name": "institute for republic opinion research", "sentiment": "none"}, {"name": "international republican institute and institute for republic opinion research", "sentiment": "none"}, {"name": "international republican institute", "sentiment": "none"}, {"name": "mqm", "sentiment": "none"}]}, "highlightText": "", "language": "english", "persons": [], "text": "Nawaz most popular political figure in Pakistan, survey suggests | 0 0 \nKARACHI: Prime Minister Nawaz Sharif has been the most popular political figure in Pakistan, liked by 63 percent people of the country, according to a survey. \nAround 39 percent people favoured Imran Khan, while Bilawal garnered appreciation from 32 percent countrymen, suggested a joint survey by International Republican Institute and Institute for Republic Opinion Research. \nThe same people were also questioned about their dislike for leading political personalities. The survey suggested 85 percent Pakistanis disliked the MQM founder, followed by Asif Ali Zardari and Tahirul Qadri with 80 and 79 percent masses respectively expressing their dislike for. \nAsked about their satisfaction over government performance, 64 percent people expressed satisfaction over the performance of federal government. \nAmong provinces, Punjab stood on top hailed by 79 percent Pakistanis, followed by Khyber Pakhtunkhwa. \nInterestingly, 59 percent people across the country, when asked about Panama Papers leaks, said they knew nothing of it, while 26 percent called for a complete probe into it. \nNearly 38 percent people said they were partially interested in the Panama Leaks case. \nThe masses expressed power shortfall to be their biggest issue. \nThe survey further reflected that 74 percent Pakistanis feel themselves safe. 0 0 Nawaz most popular political figure in Pakistan, survey suggests was posted in pakistan of Geo TV - https://www.geo.tv on February 03, 2017 and was last updated on February 03, 2017. This news story is related to Nawaz Sharif, Most Popular Figure, Pakistan, Survey, , Nawaz Sharif, Imran Khan, Bilawal Bhutto, Asif Ali Zardari, Mqm Founder, Tahirul Qadri, International Republican Institute, Institute For Republic Opinion Research. Permanent link to the news story \"Nawaz most popular political figure in Pakistan, survey suggests\" is https://www.geo.tv/latest/129864-Nawaz-most-popular-political-figure-in-Pakistan-survey-suggests+geo%2FGiKR+%28Geo+Pakistan+-+Geo+TV+Network%29 . More From Pakistan:", "external_links": [], "published": "2017-02-04T03:50:00.000+02:00", "crawled": "2017-02-03T18:07:57.065+02:00", "highlightTitle": ""}