{"organizations": [], "uuid": "5c1127557b626a3f92d128245b46ef20bfb5cde2", "thread": {"social": {"gplus": {"shares": 1}, "pinterest": {"shares": 0}, "vk": {"shares": 0}, "linkedin": {"shares": 0}, "facebook": {"likes": 201, "shares": 201, "comments": 0}, "stumbledupon": {"shares": 0}}, "site_full": "www.aol.com", "main_image": "https://s.aolcdn.com/dims-shared/dims3/GLOB/legacy_thumbnail/1028x675/format/jpg/quality/85/http%3A%2F%2Fo.aolcdn.com%2Fhss%2Fstorage%2Fmidas%2F2136e1a7bf2aa9436c9d5ec103bacf1a%2F204918702%2FRTX30CW7.jpeg", "site_section": "http://crime.alltop.com/rss", "section_title": "Alltop RSS", "url": "https://www.aol.com/article/news/2017/02/09/arizona-mother-deported-to-mexico-in-immigration-action/21711068/", "country": "US", "domain_rank": 154, "title": "Arizona mother deported to Mexico in immigration action", "performance_score": 2, "site": "aol.com", "participants_count": 0, "title_full": "Arizona mother deported to Mexico in immigration action", "spam_score": 0.0, "site_type": "blogs", "published": "2017-02-10T08:14:00.000+02:00", "replies_count": 0, "uuid": "5c1127557b626a3f92d128245b46ef20bfb5cde2"}, "author": "", "url": "https://www.aol.com/article/news/2017/02/09/arizona-mother-deported-to-mexico-in-immigration-action/21711068/", "ord_in_thread": 0, "title": "Arizona mother deported to Mexico in immigration action", "locations": [], "entities": {"persons": [{"name": "ray ybarra-maldonado", "sentiment": "none"}, {"name": "trump", "sentiment": "none"}, {"name": "donald trump", "sentiment": "none"}, {"name": "reuters/aaron p. bernstein", "sentiment": "none"}, {"name": "sarah ijaz", "sentiment": "none"}, {"name": "jessica rinaldi/the", "sentiment": "none"}, {"name": "reuters/brian snyder", "sentiment": "none"}, {"name": "don beyer", "sentiment": "none"}, {"name": "bill clark/cq roll call", "sentiment": "none"}, {"name": "joe", "sentiment": "none"}, {"name": "esma", "sentiment": "none"}, {"name": "guadalupe garcia de rayos", "sentiment": "none"}, {"name": "reuters/laura buckman", "sentiment": "none"}, {"name": "susan barimo", "sentiment": "none"}, {"name": "david schwartz feb", "sentiment": "none"}, {"name": "reuters/brian snyder izzy berdan", "sentiment": "none"}, {"name": "reuters/aaron p. bernstein samah mansur", "sentiment": "none"}], "locations": [{"name": "mexico", "sentiment": "none"}, {"name": "arizona", "sentiment": "none"}, {"name": "united states", "sentiment": "none"}, {"name": "phoenix", "sentiment": "none"}, {"name": "copley square", "sentiment": "none"}, {"name": "boston", "sentiment": "none"}, {"name": "nogales", "sentiment": "none"}, {"name": "los angeles international airport", "sentiment": "none"}, {"name": "florida", "sentiment": "none"}, {"name": "boston", "sentiment": "none"}, {"name": "california", "sentiment": "none"}, {"name": "dulles international airport", "sentiment": "none"}, {"name": "massachusetts", "sentiment": "none"}, {"name": "chantilly", "sentiment": "none"}, {"name": "dallas", "sentiment": "none"}, {"name": "fl", "sentiment": "none"}, {"name": "miami international airport", "sentiment": "none"}, {"name": "miami", "sentiment": "none"}, {"name": "us", "sentiment": "none"}, {"name": "washington", "sentiment": "none"}, {"name": "virginia", "sentiment": "none"}, {"name": "houston", "sentiment": "none"}, {"name": "us capitol", "sentiment": "none"}, {"name": "texas", "sentiment": "none"}, {"name": "dallas/fort worth international airport", "sentiment": "none"}, {"name": "egypt", "sentiment": "none"}, {"name": "queens", "sentiment": "none"}, {"name": "new york", "sentiment": "none"}, {"name": "miami", "sentiment": "none"}, {"name": "d-va.", "sentiment": "none"}, {"name": "u.s.", "sentiment": "none"}, {"name": "mass", "sentiment": "none"}, {"name": "white house", "sentiment": "none"}, {"name": "los angeles", "sentiment": "none"}], "organizations": [{"name": "snyder demonstrators", "sentiment": "none"}, {"name": "trump", "sentiment": "none"}, {"name": "muslim", "sentiment": "none"}, {"name": "reuters", "sentiment": "none"}, {"name": "getty images", "sentiment": "none"}, {"name": "boston protest against muslim ban", "sentiment": "none"}, {"name": "snyder an", "sentiment": "none"}, {"name": "boston globe", "sentiment": "none"}, {"name": "snyder people", "sentiment": "none"}, {"name": "aclu", "sentiment": "none"}, {"name": "state house", "sentiment": "none"}, {"name": "reuters/andrew kelly international", "sentiment": "none"}, {"name": "united states", "sentiment": "none"}, {"name": "first baptist church", "sentiment": "none"}, {"name": "snyder muslim", "sentiment": "none"}, {"name": "john f. kennedy international airport", "sentiment": "none"}]}, "highlightText": "", "language": "english", "persons": [], "text": "Arizona mother deported to Mexico in immigration action Before you go, we thought you'd like these... David Schwartz Feb 9th 2017 8:14PM \nPHOENIX, Feb 9 (Reuters) - An Arizona mother of two who lived in the United States for more than 20 years was deported to Mexico on Thursday, becoming one of the first to be swept up in the Trump administration's crackdown on illegal immigrants in the United States, her attorney and family said. \nGuadalupe Garcia de Rayos, 36, was taken to Nogales, Mexico, on Thursday morning by U.S. immigration staff, her attorney Ray Ybarra-Maldonado told a news conference. Both of her American-born children and her husband remained in the United States. 34 PHOTOS Protests erupt throughout US cities over Trump immigration ban See Gallery Protests erupt throughout US cities over Trump immigration ban Demonstrators gather in Copley Square for the \"Boston Protest Against Muslim Ban and Anti-Immigration Orders\" to protest U.S. President Donald Trump's executive order travel ban in Boston, Massachusetts, U.S. January 29, 2017. REUTERS/Brian Snyder An international traveler smiles as she walks past the protest against the travel ban imposed by U.S. President Donald Trump's executive order, at Dallas/Fort Worth International Airport in Dallas, Texas, U.S. January 29, 2017. REUTERS/Laura Buckman Demonstrators yell slogans during protest against the travel ban imposed by U.S. President Donald Trump's executive order, at Los Angeles International Airport in Los Angeles, California, U.S., January 29, 2017. REUTERS/Ted Soqui Sarah Ijaz joins the \"Boston Protest Against Muslim Ban and Anti-Immigration Orders\" to protest U.S. President Donald Trump's executive order travel ban in Boston, Massachusetts, U.S. January 29, 2017. REUTERS/Brian Snyder BOSTON - JANUARY 29: People hold signs as they march from Copley Square to the Mass. State House in Boston on Jan. 29, 2017, to protest President Donald Trump's executive order banning people from several predominantly Muslim countries from entering the country. (Photo by Jessica Rinaldi/The Boston Globe via Getty Images) Muslim women pray during the \"Boston Protest Against Muslim Ban and Anti-Immigration Orders\" protesting U.S. President Donald Trump's executive order travel ban in Boston, Massachusetts, U.S. January 29, 2017. REUTERS/Brian Snyder People gather to pray in baggage claim during a protest against the travel ban imposed by U.S. President Donald Trump's executive order, at Dallas/Fort Worth International Airport in Dallas, Texas, U.S. January 29, 2017. REUTERS/Laura Buckman Eight year-old Esma, an Irish-Moroccan-American, prays with other Muslim women during the \"Boston Protest Against Muslim Ban and Anti-Immigration Orders\" protesting U.S. President Donald Trump's executive order travel ban in Boston, Massachusetts, U.S. January 29, 2017. REUTERS/Brian Snyder Demonstrators spell out \"# No Muslim Ban\" during the \"Boston Protest Against Muslim Ban and Anti-Immigration Orders\" to protest U.S. President Donald Trump's executive order travel ban in Boston, Massachusetts, U.S. January 29, 2017. REUTERS/Brian Snyder Izzy Berdan (R) joins the \"Boston Protest Against Muslim Ban and Anti-Immigration Orders\" to protest U.S. President Donald Trump's executive order travel ban in Boston, Massachusetts, U.S. January 29, 2017. REUTERS/Brian Snyder Muslim women pray during the \"Boston Protest Against Muslim Ban and Anti-Immigration Orders\" protesting U.S. President Donald Trump's executive order travel ban in Boston, Massachusetts, U.S. January 29, 2017. REUTERS/Brian Snyder Muslim women pray during the \"Boston Protest Against Muslim Ban and Anti-Immigration Orders\" protesting U.S. President Donald Trump's executive order travel ban in Boston, Massachusetts, U.S. January 29, 2017. REUTERS/Brian Snyder Demonstrators gather in Copley Square for the \"Boston Protest Against Muslim Ban and Anti-Immigration Orders\" to protest U.S. President Donald Trump's executive order travel ban in Boston, Massachusetts, U.S. January 29, 2017. REUTERS/Brian Snyder An activist holds a sign outside the White House to protest President Donald Trump's executive actions on immigration in Washington January 29, 2017. REUTERS/Aaron P. Bernstein Activists gather outside the White House to protest President Donald Trump's executive actions on immigration in Washington January 29, 2017. REUTERS/Aaron P. Bernstein Activists gather outside the White House to protest President Donald Trump's executive actions on immigration in Washington January 29, 2017. REUTERS/Aaron P. Bernstein Activists gather outside the White House to protest President Donald Trump's executive actions on immigration in Washington January 29, 2017. REUTERS/Aaron P. Bernstein Samah Mansur, from Egypt, takes part in the \"Boston Protest Against Muslim Ban and Anti-Immigration Orders\" to protest U.S. President Donald Trump's executive order travel ban in Boston, Massachusetts, U.S. January 29, 2017. REUTERS/Brian Snyder Activists gather outside the White House to protest President Donald Trump's executive actions on immigration in Washington January 29, 2017. REUTERS/Aaron P. Bernstein People gather to protest against the travel ban imposed by U.S. President Donald Trump's executive order, at First Baptist Church in Dallas, Texas, U.S., January 29, 2017. REUTERS/Laura Buckman BOSTON - JANUARY 29: People hold signs as they gather in Copley Square in Boston on Jan. 29, 2017, to protest President Donald Trump's executive order banning people from several predominantly Muslim countries from entering the country. (Photo by Jessica Rinaldi/The Boston Globe via Getty Images) BOSTON - JANUARY 29: People gather in Copley Square in Boston on Jan. 29, 2017, to protest President Donald Trump's executive order banning people from several predominantly Muslim countries from entering the country. (Photo by Jessica Rinaldi/The Boston Globe via Getty Images) UNITED STATES - JANUARY 29: Rep. Don Beyer, D-Va., speaks with an ACLU legal observer during the protest at Dulles International Airport in Virginia on Sunday, Jan. 29, 2017. Protests erupted at airports around the country following President Trump's executive order restricting travel from several Islamic countries. (Photo By Bill Clark/CQ Roll Call) MIAMI, FL - JANUARY 29: A protester holds up a sign that reads, 'Banning Immigrants is UnAmerican!,' as she stands with others at the Miami International Airport against the executive order that President Donald Trump signed clamping down on refugee admissions and temporarily restricting travelers from seven predominantly Muslim countries on January 29, 2017 in Miami, Florida. Demonstrators gathered at airports across the country in protest of the order. (Photo by Joe Raedle/Getty Images) MIAMI, FL - JANUARY 29: Protesters stand together at the Miami International Airport against the executive order that President Donald Trump signed clamping down on refugee admissions and temporarily restricting travelers from seven predominantly Muslim countries on January 29, 2017 in Miami, Florida. Demonstrators gathered at airports across the country in protest of the order. (Photo by Joe Raedle/Getty Images) MIAMI, FL - JANUARY 29: Susan Barimo joins with other protesters as they stand together at the Miami International Airport against the executive order that President Donald Trump signed clamping down on refugee admissions and temporarily restricting travelers from seven predominantly Muslim countries on January 29, 2017 in Miami, Florida. Demonstrators gathered at airports across the country in protest of the order. (Photo by Joe Raedle/Getty Images) People gather outside Terminal 4 during a protest against Donald Trump's travel ban at John F. Kennedy International Airport in Queens, New York, U.S., January 29, 2017. REUTERS/Andrew Kelly International travelers walk past protestors holding signs as they protest against the travel ban imposed by U.S. President Donald Trump's executive order, at Dallas/Fort Worth International Airport in Dallas, Texas, U.S. January 29, 2017. REUTERS/Laura Buckman Protesters at Discovery Green Park during Super Bowl events in Houston, Texas, U.S., January 29, 2017. REUTERS/Trish Badger Dozens of pro-immigration demonstrators cheer and hold sign as international passengers arrive at Dulles International Airport, to protest President Donald Trump's executive order baring visitors, refugees and immigrants from certain countries to the United States, in Chantilly, Virginia, in suburban Washington, U.S., January 29, 2017. REUTERS/Mike Theiler Activists march to the US Capitol to protest President Donald Trump's executive actions on immigration in Washington January 29, 2017. REUTERS/Aaron P. Bernstein TPX IMAGES OF THE DAY Activists march to the US Capitol to protest President Donald Trump's executive actions on immigration in Washington January 29, 2017. REUTERS/Aaron P. Bernstein Activists gather at the US Capitol to protest President Donald Trump's executive actions on immigration in Washington January 29, 2017. REUTERS/Aaron P. Bernstein Up Next", "external_links": [], "published": "2017-02-10T08:14:00.000+02:00", "crawled": "2017-02-10T04:26:36.997+02:00", "highlightTitle": ""}