{"organizations": [], "uuid": "a356a25644d1811e9fc802aa535bf047a4d8a91c", "thread": {"social": {"gplus": {"shares": 0}, "pinterest": {"shares": 0}, "vk": {"shares": 0}, "linkedin": {"shares": 0}, "facebook": {"likes": 109, "shares": 109, "comments": 0}, "stumbledupon": {"shares": 0}}, "site_full": "www.geo.tv", "main_image": "https://www.geo.tv/assets/uploads/updates/2017-02-03/129837_044755_updates.jpg", "site_section": "http://feeds.feedburner.com/geo/GiKR", "section_title": "GEO TV - Pakistan", "url": "https://www.geo.tv/latest/129837-Army-Rangers-ready-to-give-befitting-response-to-any-misadventure-COAS", "country": "TV", "domain_rank": 8287, "title": "Army, Rangers ready to give befitting response to any misadventure: COAS", "performance_score": 1, "site": "geo.tv", "participants_count": 0, "title_full": "Army, Rangers ready to give befitting response to any misadventure: COAS", "spam_score": 0.0, "site_type": "blogs", "published": "2017-02-03T23:19:00.000+02:00", "replies_count": 0, "uuid": "a356a25644d1811e9fc802aa535bf047a4d8a91c"}, "author": "", "url": "https://www.geo.tv/latest/129837-Army-Rangers-ready-to-give-befitting-response-to-any-misadventure-COAS", "ord_in_thread": 0, "title": "Army, Rangers ready to give befitting response to any misadventure: COAS", "locations": [], "entities": {"persons": [{"name": "qamar javed bajwa", "sentiment": "negative"}, {"name": "sadiq ali", "sentiment": "none"}], "locations": [{"name": "lahore garrison", "sentiment": "none"}, {"name": "lahore corps", "sentiment": "none"}, {"name": "pakistan", "sentiment": "none"}, {"name": "india", "sentiment": "none"}], "organizations": [{"name": "army", "sentiment": "negative"}, {"name": "rangers", "sentiment": "negative"}, {"name": "rawalpindi", "sentiment": "negative"}, {"name": "coas", "sentiment": "negative"}, {"name": "pakistan army", "sentiment": "none"}, {"name": "ispr", "sentiment": "none"}, {"name": "lin of control", "sentiment": "none"}, {"name": "army staff", "sentiment": "none"}, {"name": "punjab rangers hq", "sentiment": "none"}, {"name": "corps hq", "sentiment": "none"}, {"name": "punjab rangers", "sentiment": "none"}, {"name": "inter-services public relations", "sentiment": "none"}]}, "highlightText": "", "language": "english", "persons": [], "text": "0 0 \nRAWALPINDI: Chief of Army Staff (COAS) General Qamar Javed Bajwa visited the Lahore Garrison on Friday where he spoke with troops and reiterated the Pakistan Army's resolve to always \"come up to the expectations of the people of Pakistan.\" \nAccording to a statement issued by the Inter-Services Public Relations (ISPR) branch of the Pakistan Army, upon his arrival the COAS laid a floral wreath at the Yadgar-e-Shuhada and was later given briefings on operation preparedness at the Corps HQ and the Punjab Rangers HQ. The Army Chief expressed his satisfaction on the force's readiness and appreciated the Punjab Rangers' response to ongoing ceasefire violations along the working boundary by Indian troops. \nLater the COAS addressed troops at the Lahore Garrison and took them into confidence about the prevailing security environment, highlighting the challenges for the Pakistan Army. He said the Pakistan Army and Punjab Rangers have played an important role for reduction in internal security threats as well as their response along the working boundary. \nThe Chief of Army Staff said the nation acknowledges the and fully supports Pakistan Army's contributions in the fight against terrorism and militancy. \nHe added, \"We shall always come up to the expectations of the people of Pakistan who are our real strength.\" \nIndian Provocation \nTalking about Indian provocations along the Lin of Control (LoC) and the working boundary that Army Chief said that India is trying to divert the world's attention form atrocities committed by the Indian forces against innocent Kashmiris. \n\"Pakistan Army and Rangers are fully prepared for a befitting response to any misadventure from across the border,\" he pledged. \nEarlier upon his arrival at the Lahore Garrison that COAS was received by Lr. General Sadiq Ali, Commander Lahore Corps. \n0 0 Army, Rangers ready to give befitting response to any misadventure: COAS   Coas, Army Chief, Pakistan Army, Punjab Rangers, Pakistan Forces.   \"Army, Rangers ready to give befitting response to any misadventure: COAS\" is https://www.geo.tv/latest/129837-Army-Rangers-ready-to-give-befitting-response-to-any-misadventure-COAS+geo%2FGiKR+%28Geo+Pakistan+- ", "external_links": [], "published": "2017-02-03T23:19:00.000+02:00", "crawled": "2017-02-03T14:03:29.419+02:00", "highlightTitle": ""}