{"organizations": [], "uuid": "500f4c36a3b7200e384ca73f2c33af7cc926fbfc", "thread": {"social": {"gplus": {"shares": 0}, "pinterest": {"shares": 0}, "vk": {"shares": 0}, "linkedin": {"shares": 0}, "facebook": {"likes": 102, "shares": 102, "comments": 0}, "stumbledupon": {"shares": 0}}, "site_full": "www.geo.tv", "main_image": "https://www.geo.tv/assets/uploads/updates/2017-02-17/131490_105049_updates.jpg", "site_section": "http://feeds.feedburner.com/GeoBulletins", "section_title": "GEO TV - Sports", "url": "https://www.geo.tv/latest/131490-COAS-asks-RSM-to-stop-use-of-Afghan-soil-for-terrorist-attacks-in-Pakistan", "country": "TV", "domain_rank": 8287, "title": "COAS asks RSM to stop use of Afghan soil for terrorist attacks in Pakistan", "performance_score": 1, "site": "geo.tv", "participants_count": 0, "title_full": "COAS asks RSM to stop use of Afghan soil for terrorist attacks in Pakistan", "spam_score": 0.0, "site_type": "blogs", "published": "2017-02-18T05:50:00.000+02:00", "replies_count": 0, "uuid": "500f4c36a3b7200e384ca73f2c33af7cc926fbfc"}, "author": "", "url": "https://www.geo.tv/latest/131490-COAS-asks-RSM-to-stop-use-of-Afghan-soil-for-terrorist-attacks-in-Pakistan", "ord_in_thread": 0, "title": "COAS asks RSM to stop use of Afghan soil for terrorist attacks in Pakistan", "locations": [], "entities": {"persons": [{"name": "coas", "sentiment": "none"}, {"name": "gen bajwa", "sentiment": "none"}, {"name": "lal shahbaz qalandar", "sentiment": "none"}, {"name": "taimur", "sentiment": "none"}, {"name": "qamar javed bajwa", "sentiment": "none"}, {"name": "nicholson", "sentiment": "none"}, {"name": "john nicholson", "sentiment": "none"}], "locations": [{"name": "pakistan", "sentiment": "none"}, {"name": "peshawar", "sentiment": "none"}, {"name": "rawalpindi", "sentiment": "none"}, {"name": "us", "sentiment": "none"}, {"name": "lal shahbaz qalandar", "sentiment": "none"}, {"name": "sehwan", "sentiment": "none"}, {"name": "lahore", "sentiment": "none"}, {"name": "mohmand agency", "sentiment": "none"}, {"name": "karachi", "sentiment": "none"}, {"name": "afghanistan", "sentiment": "none"}], "organizations": [{"name": "coas", "sentiment": "negative"}, {"name": "army", "sentiment": "none"}, {"name": "pakistan army", "sentiment": "none"}, {"name": "ispr", "sentiment": "none"}, {"name": "dg health services sindh-hyderabad", "sentiment": "none"}, {"name": "samaa news", "sentiment": "none"}, {"name": "inter services public relations", "sentiment": "none"}]}, "highlightText": "", "language": "english", "persons": [], "text": "COAS asks RSM to stop use of Afghan soil for terrorist attacks in Pakistan | At least 88 martyred in bombing at Lal Shahbaz Qalandar shrine \nRAWALPINDI: Chief of Army Staff (COAS) General Qamar Javed Bajwa Friday held a telephonic conversation with US General John Nicholson, Commander of Resolute Support Mission (RSM) in Afghanistan, according to the Inter Services Public Relations. \nDuring the conversation, the COAS expressed his concerns over continued acts of terrorism in Pakistan with impunity from Afghanistan, the ISPR said in a statement. \nOn Thursday, at least 88 people were martyred when a suicide bomber attacked the crowded Sufi shrine of Lal Shahbaz Qalandar in Sehwan, injuring up to 343 others, according to DG Health Services Sindh-Hyderabad. \nThe powerful blast took place inside the premises of the shrine as a dhamaal was taking place. \n\"Most of the incidents in Pakistan are claimed by terrorist organisations with leadership hiding in Afghanistan,\" Gen Bajwa told US General John Nicholson. \nRead: Security concerns prompt closure of Pak-Afghan border \n\"The COAS said that such terrorist activities and inaction against them are testing our current policy of cross-border restraint,\" read the statement. \n\"He asked the RSM commander to play his role in disconnecting this planning, direction, coordination and financial support.\" \nThe attack in Sehwan came as part of a recent wave of terrorist attacks in the country, and the fifth blast in less than a week targeting innocent people. \nThe army chief also informed him about list of terrorists handed over to Afghan officials for action against them who are hiding inside Afghanistan since long, according to the statement. \nAlso read: Afghan embassy officials summoned at GHQ in Rawalpindi \nThe US general expressed his condolences on the loss of precious lives in recent terrorist incidents [in Pakistan] and assured him full assistance in response to his concerns, the ISPR said. \nGeneral Nicholson also shared his plans to undertake special coordination at appropriate level between RSM, Afghan security forces and Pakistan. \nOn February 15, three suicide bombers targeted Khyber Pakhtunkhwa and the adjoining tribal areas leaving around seven people dead. One of the incidents occurred in Peshawar where a suicide bomber riding a motorbike hit a vehicle carrying civil judges, while two other suicide bombers blew themselves up at separate locations in Mohmand Agency. \nEarlier to these, a suicide attack in Lahore on February 13 killed 14 people and wounded over 60 others. \nOn February 12, a cameraman, Taimur from Samaa News was killed when the channelâ€™s DSNG van was attacked in Karachi. 0 0 COAS asks RSM to stop use of Afghan soil for terrorist attacks in Pakistan was posted in pakistan of Geo TV - https://www.geo.tv on February 17, 2017 and was last updated on February 17, 2017. This news story is related to Coas, Rsm, Stop, Use, Afghan Soil, Terrorist Attacks, Pakistan, Afghanistan, Resolute Support Mission, General Qamar Javed Bajwa, General John Nicholson, , Rawalpindi, Pakistan Army, Resolute Support Mission. Permanent link to the news story \"COAS asks RSM to stop use of Afghan soil for terrorist attacks in Pakistan\" is https://www.geo.tv/latest/131490-COAS-asks-RSM-to-stop-use-of-Afghan-soil-for-terrorist-attacks-in-Pakistan . More From Pakistan:", "external_links": [], "published": "2017-02-18T05:50:00.000+02:00", "crawled": "2017-02-17T19:57:19.448+02:00", "highlightTitle": ""}