{"organizations": [], "uuid": "0bb530597be188dc2710bf059a19b45fdc500c09", "thread": {"social": {"gplus": {"shares": 0}, "pinterest": {"shares": 0}, "vk": {"shares": 0}, "linkedin": {"shares": 0}, "facebook": {"likes": 391, "shares": 391, "comments": 0}, "stumbledupon": {"shares": 0}}, "site_full": "www.rappler.com", "main_image": "https://assets.rappler.com/0582366C80A24589A52676FCEA650ECA/img/E09B190E7C204ABBBBB31FA44401AAD5/GawadUrian-20150616-029.jpg", "site_section": "http://feeds.rappler.com/rappler/entertainment", "section_title": "Rappler: Entertainment", "url": "http://www.rappler.com/entertainment/news/162270-eula-valdes-joins-encantadia-avria", "country": "US", "domain_rank": 1586, "title": "Eula Valdes plays new villain in 'Encantadia'", "performance_score": 3, "site": "rappler.com", "participants_count": 1, "title_full": "Eula Valdes plays new villain in 'Encantadia'", "spam_score": 0.0, "site_type": "blogs", "published": "2017-02-22T20:32:00.000+02:00", "replies_count": 0, "uuid": "0bb530597be188dc2710bf059a19b45fdc500c09"}, "author": "Rappler.com", "url": "http://www.rappler.com/entertainment/news/162270-eula-valdes-joins-encantadia-avria", "ord_in_thread": 0, "title": "Eula Valdes plays new villain in 'Encantadia'", "locations": [], "entities": {"persons": [{"name": "avria", "sentiment": "negative"}, {"name": "eula valdes", "sentiment": "negative"}, {"name": "eula", "sentiment": "negative"}, {"name": "aquil", "sentiment": "none"}, {"name": "inah de belen", "sentiment": "none"}, {"name": "amarro", "sentiment": "none"}, {"name": "muros", "sentiment": "none"}, {"name": "gilas", "sentiment": "none"}, {"name": "mikee quintos", "sentiment": "none"}, {"name": "danaya", "sentiment": "none"}, {"name": "sanya lopez", "sentiment": "none"}, {"name": "sapiro", "sentiment": "none"}, {"name": "glaiza de castro", "sentiment": "none"}, {"name": "manman dejeto/rappler", "sentiment": "none"}, {"name": "jhake vargas", "sentiment": "none"}, {"name": "carlo gonzalez", "sentiment": "none"}, {"name": "ang ikalimang kaharian ng encantadia", "sentiment": "none"}, {"name": "kate valdez", "sentiment": "none"}, {"name": "ybrahim", "sentiment": "none"}, {"name": "encantadia", "sentiment": "none"}, {"name": "lireo", "sentiment": "none"}, {"name": "alfred vargas", "sentiment": "none"}, {"name": "francine prieto", "sentiment": "none"}, {"name": "gabbi garcia", "sentiment": "none"}, {"name": "pirena", "sentiment": "none"}, {"name": "diana zubiri", "sentiment": "none"}, {"name": "rocco nacino", "sentiment": "none"}, {"name": "alena", "sentiment": "none"}, {"name": "mira", "sentiment": "none"}], "locations": [{"name": "encantadia", "sentiment": "none"}, {"name": "lireo", "sentiment": "none"}, {"name": "philippines", "sentiment": "none"}, {"name": "adamya", "sentiment": "none"}, {"name": "lilasari", "sentiment": "none"}, {"name": "etheria", "sentiment": "none"}, {"name": "manila", "sentiment": "none"}, {"name": "hathoria", "sentiment": "none"}, {"name": "avria", "sentiment": "none"}], "organizations": [{"name": "encantadia instagram", "sentiment": "none"}, {"name": "ruru madrid", "sentiment": "none"}]}, "highlightText": "", "language": "english", "persons": [], "text": "Eula Valdes plays new villain in 'Encantadia' Encantadia is facing a new enemy – Eula plays Avria, the queen of Etheria Published 11:04 AM, February 23, 2017 Updated 11:04 AM, February 23, 2017 HARA AVRIA. Eula Valdes is Avria, the queen of Etheria, in 'Encantadia.' File photo by Manman Dejeto/Rappler \nMANILA, Philippines – Actress Eula Valdes has joined the fantaserye Encantadia asthe villain Avria, the queen of Etheria. \nEula's character was introduced in a February 22 teaser posted by GMA on YouTube. Screengrab from YouTube/GMA Network \nFrancine Prieto originally played the role of Avria in Etheria: Ang Ikalimang Kaharian ng Encantadia, the second book of the original series. A post shared by Etheria 2017/Encantadia 2016 (@etheria2017) on Feb 10, 2017 at 11:07pm PST \nPrior to announcing Eula's participation in the show, the official Encantadia Instagram account teased the the new character, saying, \" Muling haharap ang Encantadia sa mapanganib na kalaban. Abangan.\" (Encantadia is once again facing a dangerous enemy. Watch out.) A post shared by Encantadia 2016 (@gmaencantadia) on Feb 22, 2017 at 2:22am PST \nOther characters have also been introduced on the show. It was recently announced that Inah de Belen will play Deshna/Luna, the missing daughter of Lilasari (Diana Zubiri). Jhake Vargas will also play Gilas, Deshna/Luna's childhood friend. A post shared by Encantadia 2016 (@gmaencantadia) on Feb 13, 2017 at 8:34pm PST \nAlfred Vargas, who originally played the role of Aquil, has returned to the show as Amarro, Aquil's father. Aquil is now played by Rocco Nacino. A post shared by Encantadia 2016 (@gmaencantadia) on Feb 21, 2017 at 1:37am PST \nIn the new chapter of Encantadia , danger continues to hound the 4 kingdoms of Hathoria, Lireo, Sapiro, and Adamya. The remaining sang'gres Pirena (Glaiza de Castro), Alena (Gabbi Garcia) and Danaya (Sanya Lopez), now Lireo's new ruler, continue to guard and protect the land. \nTogether with Ybrahim, Sapiro's king (Ruru Madrid), Aquil (Rocco Nacino), Muros (Carlo Gonzalez), and new sang'gres Mira (Kate Valdez) and Lira (Mikee Quintos), they face a new enemy – Etheria, once considered as the most powerful kingdom in Encantadia. \nHave you been keeping up with Encantadia 's new chapter? What do you think of it? Let us know in the comments below! – Rappler.com HOW DOES THIS STORY MAKE YOU FEEL? Happy", "external_links": [], "published": "2017-02-22T20:32:00.000+02:00", "crawled": "2017-02-23T08:42:53.826+02:00", "highlightTitle": ""}