{"organizations": [], "uuid": "2ed178da7cd9d6fdedec3b1b4563fa7b0f7a4c4d", "thread": {"social": {"gplus": {"shares": 0}, "pinterest": {"shares": 0}, "vk": {"shares": 0}, "linkedin": {"shares": 0}, "facebook": {"likes": 808, "shares": 808, "comments": 0}, "stumbledupon": {"shares": 0}}, "site_full": "www.geo.tv", "main_image": "https://www.geo.tv/assets/uploads/updates/2017-03-08/133548_052341_updates.jpg", "site_section": "http://feeds.feedburner.com/GeoBulletins", "section_title": "GEO TV - Pakistan", "url": "https://www.geo.tv/latest/133548-Qatar-seeks-assistance-of-Pak-Army-over-security-for-FIFA-World-Cup-2022", "country": "TV", "domain_rank": 8287, "title": "Qatar seeks assistance of Pak Army over security for FIFA World Cup 2022", "performance_score": 8, "site": "geo.tv", "participants_count": 0, "title_full": "Qatar seeks assistance of Pak Army over security for FIFA World Cup 2022", "spam_score": 0.0, "site_type": "blogs", "published": "2017-03-08T12:23:00.000+02:00", "replies_count": 0, "uuid": "2ed178da7cd9d6fdedec3b1b4563fa7b0f7a4c4d"}, "author": "", "url": "https://www.geo.tv/latest/133548-Qatar-seeks-assistance-of-Pak-Army-over-security-for-FIFA-World-Cup-2022", "ord_in_thread": 0, "title": "Qatar seeks assistance of Pak Army over security for FIFA World Cup 2022", "locations": [], "entities": {"persons": [{"name": "hazza bin khalid al shahwani", "sentiment": "none"}, {"name": "bajwa", "sentiment": "none"}, {"name": "hazza bin khalil al shahwani", "sentiment": "none"}, {"name": "muhammed ali ghanim al ghanim", "sentiment": "none"}, {"name": "sheikh abdullah bin nasser bin khalifa al thani", "sentiment": "none"}, {"name": "qamar javed bajwa", "sentiment": "none"}], "locations": [{"name": "qatar", "sentiment": "none"}, {"name": "pakistan", "sentiment": "none"}], "organizations": [{"name": "fifa world", "sentiment": "negative"}, {"name": "pak army", "sentiment": "negative"}, {"name": "pakistan army", "sentiment": "none"}, {"name": "qatar emiri land forces", "sentiment": "none"}, {"name": "fifa", "sentiment": "none"}, {"name": "army", "sentiment": "none"}, {"name": "qatar emiri guard headquarters", "sentiment": "none"}, {"name": "inter services public relations", "sentiment": "none"}, {"name": "ahmed bin mohamed military college", "sentiment": "none"}, {"name": "qatar emiri guard", "sentiment": "none"}]}, "highlightText": "", "language": "english", "persons": [], "text": "Qatar seeks assistance of Pak Army over security for FIFA World Cup 2022 | 0 0 \nRAWALPINDI: Chief of Army Staff General Qamar Javed Bajwa, met Qatar's Prime Minister, Sheikh Abdullah bin Nasser bin Khalifa Al Thani, on Tuesday in Qatar. \nThe Prime Minister of Qatar acknowledged Pakistan's contribution to the development and growth of Qatar. He also praised Pakistan Army's efforts towards regional peace. \nHe expressed his desire to learn from Pakistan Army's experience in the security domain and sought assistance for the FIFA World Cup to be played in Qatar in 2022. \nThe Prime Minister also hoped to move forward with Pakistan on multiple fronts including cyber security, defence production and ease of travel. \nAccording to Inter Services Public Relations, militaryâ€™s media wing, General Qamar Javed Bajwa also met Commander Qatar Emiri Land Forces, Major General Muhammed Ali Ghanim Al Ghanim and Commander Qatar Emiri Guard, Major General Hazza Bin Khalil Al Shahwani. \nDuring his meeting with Major General Muhammed Ali Ghanim Al Ghanim, Commander Qatar Emiri Land Forces, the host appreciated Pakistan Army's professionalism and performance in the ongoing fight against terrorism, and showed interest in joint training and field exercises. \nThe Army Chief thanked the hosts for their expression and assured all possible cooperation in the desired fields. \nOn his visit to Qatar, General Bajwa also visited the Qatar Emiri Guard Headquarters and met Major General Hazza Bin Khalid Al Shahwani. \nHe also paid a visit to Ahmed Bin Mohamed Military College, where Pakistani tri-services contingent of 166 members is imparting training. 0 0 Qatar seeks assistance of Pak Army over security for FIFA World Cup 2022 was posted in pakistan of Geo TV - https://www.geo.tv on March 08, 2017 and was last updated on March 08, 2017. This news story is related to Geo News, Geo Tv, Latest News Pakistan, Pakistan, Pakistan News, Bajwa, Qatar. Permanent link to the news story \"Qatar seeks assistance of Pak Army over security for FIFA World Cup 2022\" is https://www.geo.tv/latest/133548-Qatar-seeks-assistance-of-Pak-Army-over-security-for-FIFA-World-Cup-2022 . More From Pakistan:", "external_links": [], "published": "2017-03-08T12:23:00.000+02:00", "crawled": "2017-03-08T02:36:47.628+02:00", "highlightTitle": ""}