{"organizations": [], "uuid": "28ec92aac10089a174309b3bd6761a5d51dbc1d6", "thread": {"social": {"gplus": {"shares": 0}, "pinterest": {"shares": 0}, "vk": {"shares": 0}, "linkedin": {"shares": 0}, "facebook": {"likes": 166, "shares": 166, "comments": 0}, "stumbledupon": {"shares": 0}}, "site_full": "ftw.usatoday.com", "main_image": "https://www.gannett-cdn.com/-mm-/1cf203c5ba251c266ef4226ca807eaa6ce84a118/c=0-266-4763-2957&amp;r=x1683&amp;c=3200x1680/local/-/media/2017/03/25/USATODAY/USATODAY/636260010086993563-USP-NCAA-BASKETBALL-NCAA-TOURNAMENT-EAST-REGIONAL-89791898.JPG", "site_section": "http://rssfeeds.usatoday.com/_/20/124898669/UsatodaycomCollegeMensBasketball-TopStories", "section_title": "GANNETT Syndication Service", "url": "http://ftw.usatoday.com/2017/03/florida-chris-chiozza-buzzer-beater-overtime-3-pointer-one-foot-highlight-march-madness-clutch-video-ncaa-tournament-sweet-16", "country": "US", "domain_rank": 313, "title": "Watch Florida's spectacular OT buzzer-beater", "performance_score": 1, "site": "usatoday.com", "participants_count": 1, "title_full": "Watch Florida's spectacular OT buzzer-beater", "spam_score": 0.0, "site_type": "blogs", "published": "2017-03-25T13:10:00.000+03:00", "replies_count": 0, "uuid": "28ec92aac10089a174309b3bd6761a5d51dbc1d6"}, "author": "USA TODAY", "url": "http://ftw.usatoday.com/2017/03/florida-chris-chiozza-buzzer-beater-overtime-3-pointer-one-foot-highlight-march-madness-clutch-video-ncaa-tournament-sweet-16", "ord_in_thread": 0, "title": "Watch Florida's spectacular OT buzzer-beater", "locations": [], "entities": {"persons": [{"name": "alysha tsuji", "sentiment": "none"}, {"name": "robert deutsch", "sentiment": "none"}, {"name": "chris chiozza", "sentiment": "none"}, {"name": "robert", "sentiment": "none"}, {"name": "zak showalter", "sentiment": "none"}], "locations": [{"name": "florida", "sentiment": "none"}, {"name": "new york", "sentiment": "none"}, {"name": "usa", "sentiment": "none"}, {"name": "ny", "sentiment": "none"}, {"name": "south carolina", "sentiment": "none"}, {"name": "wisconsin", "sentiment": "none"}, {"name": "florida", "sentiment": "none"}, {"name": "madison square garden", "sentiment": "none"}], "organizations": [{"name": "ncaa tournament", "sentiment": "none"}, {"name": "florida gators", "sentiment": "none"}, {"name": "ncaa", "sentiment": "none"}, {"name": "wisconsin badgers", "sentiment": "none"}, {"name": "badgers", "sentiment": "none"}]}, "highlightText": "", "language": "english", "persons": [], "text": "  Watch Florida's spectacular OT buzzer-beater Finally, a buzzer-beater -- in overtime. Post to Facebook Watch Florida's spectacular OT buzzer-beater Finally, a buzzer-beater -- in overtime.  //ftw.usatoday.com/2017/03/florida-chris-chiozza-buzzer-beater-overtime-3-pointer-one-foot-highlight-march-madness-clutch-video-ncaa-tournament-sweet-16     Watch Florida's spectacular OT buzzer-beater Alysha Tsuji , USA TODAY 1:10 a.m. ET March 25, 2017 \nMar 24, 2017; New York, NY, USA; Florida Gators guard Chris Chiozza (11) makes a three point basket to beat the Wisconsin Badgers in overtime in the semifinals of the East Regional of the 2017 NCAA Tournament at Madison Square Garden. Mandatory Credit: Robert Deutsch-USA TODAY Sports ORG XMIT: USATSI-357254 ORIG FILE ID: 20170324_pjc_usa_311.JPG (Photo: Robert Deutsch, Robert Deutsch-USA TODAY Sports) \nAround 1 a.m. ET on Friday, March Madness finally gave us the stunning buzzer-beater that we've all been waiting for. \nFlorida's Chris Chiozza buried an absolutely insane one-footed three at the buzzer - in overtime - to beat Wisconsin, 84-83. The Gators are heading to the Elite Eight. FLORIDA WINS ON A BUZZER-BEATER! #Sweet16 pic.twitter.com/t8ooUMf7Gy — NCAA March Madness (@marchmadness) March 25, 2017 \nHowever, Wisconsin players shouldn't hang their heads. The Badgers left it all out on the court. \nIn regulation, it was Wisconsin's Zak Showalter that was the first hero of the game. He drilled a clutch one-footed 3-pointer for the tie to keep the Badgers' hopes alive. — NCAA March Madness (@marchmadness) March 25, 2017 \nTo recap: There were TWO stunning one-footed 3-point clutch shots - one for each team - in one game that ended past midnight ET with the first buzzer-beater of the NCAA tournament. Thank you, basketball gods. \nFlorida will take on South Carolina on Sunday. Read or Share this story: http://ftw.usatoday.com/2017/03/florida-chris-chiozza-buzzer-beater-overtime-3-pointer-one-foot-highlight-march-madness-clutch-video-ncaa-tournament-sweet-16 Most Popular", "external_links": [], "published": "2017-03-25T13:10:00.000+03:00", "crawled": "2017-03-25T09:30:51.829+03:00", "highlightTitle": ""}