{"organizations": [], "uuid": "adcc0c2aa0148190ee37ccfb1db21992968920f3", "thread": {"social": {"gplus": {"shares": 0}, "pinterest": {"shares": 0}, "vk": {"shares": 0}, "linkedin": {"shares": 0}, "facebook": {"likes": 480, "shares": 480, "comments": 0}, "stumbledupon": {"shares": 0}}, "site_full": "www.rappler.com", "main_image": "https://assets.rappler.com/DB7FA823E580488AB06FF4CBD9342DA7/img/A2AA97AC5F2E4048ACACC77A21954AA5/20170319-duterte-arrival-myanmar.jpg", "site_section": "http://feeds.feedburner.com/rappler/", "section_title": "RAPPLER", "url": "http://www.rappler.com/nation/164618-duterte-departure-myanmar-thailand-official-visits", "country": "US", "domain_rank": 1586, "title": "Duterte flies to Myanmar, Thailand for official visits", "performance_score": 4, "site": "rappler.com", "participants_count": 1, "title_full": "Duterte flies to Myanmar, Thailand for official visits", "spam_score": 0.0, "site_type": "blogs", "published": "2017-03-19T14:11:00.000+02:00", "replies_count": 0, "uuid": "adcc0c2aa0148190ee37ccfb1db21992968920f3"}, "author": "Rappler.com", "url": "http://www.rappler.com/nation/164618-duterte-departure-myanmar-thailand-official-visits", "ord_in_thread": 0, "title": "Duterte flies to Myanmar, Thailand for official visits", "locations": [], "entities": {"persons": [{"name": "philippines duterte", "sentiment": "negative"}, {"name": "duterte", "sentiment": "negative"}, {"name": "mya", "sentiment": "negative"}, {"name": "enrique manalo", "sentiment": "none"}, {"name": "manalo", "sentiment": "none"}, {"name": "delfin lorenzana", "sentiment": "none"}, {"name": "rodrigo duterte", "sentiment": "none"}, {"name": "salvador medialdea", "sentiment": "none"}, {"name": "manny piñol", "sentiment": "none"}, {"name": "vicente sotto iii", "sentiment": "none"}, {"name": "isidro lapeña", "sentiment": "none"}, {"name": "hermogenes esperon jr", "sentiment": "none"}, {"name": "aung hlaing", "sentiment": "none"}, {"name": "suu kyi", "sentiment": "none"}, {"name": "alan peter cayetano", "sentiment": "none"}, {"name": "martin andanar", "sentiment": "none"}, {"name": "ramon lopez", "sentiment": "none"}, {"name": "alex chua", "sentiment": "none"}, {"name": "aung san suu kyi", "sentiment": "none"}, {"name": "htin kyaw", "sentiment": "none"}, {"name": "prayut chan-o-cha", "sentiment": "none"}, {"name": "malacañang", "sentiment": "none"}], "locations": [{"name": "myanmar", "sentiment": "none"}, {"name": "thailand", "sentiment": "none"}, {"name": "philippines", "sentiment": "none"}, {"name": "davao city", "sentiment": "none"}, {"name": "davao city", "sentiment": "none"}, {"name": "davao international airport", "sentiment": "none"}, {"name": "naypyidaw", "sentiment": "none"}], "organizations": [{"name": "philippine airlines", "sentiment": "none"}, {"name": "philippine drug enforcement agency", "sentiment": "none"}, {"name": "defense", "sentiment": "none"}, {"name": "asean", "sentiment": "none"}]}, "highlightText": "", "language": "english", "persons": [], "text": "Philippines Duterte flies to Myanmar, Thailand for official visits (UPDATED) Duterte's visits to Myanmar and Thailand are part of his 'introductory' trips to ASEAN countries, as the country prepares to host the organization's 50th year Published 2:57 PM, March 19, 2017 Updated 2:05 AM, March 20, 2017 OFFICIAL VISIT. President Rodrigo Duterte walks past honor guards upon his arrival in Naypyidaw, Myanmar on March 19, 2017 for a two-day official visit. Photo by King Rodriguez/Presidential Photo \nDAVAO CITY, Philippines (UPDATED) – President Rodrigo Duterte departed Sunday, March 19, for official visits to Myanmar and Thailand, focusing on the Philippines' diplomatic and trade relations with the two ASEAN neighbors. \n\"These visits will complete my swing of our ASEAN neighborhood,\" he said in his pre-departure statement at the Davao International Airport. \"It will also presage the important regional leadership role reposed upon us for this historic ASEAN year.\" \nHe also said that he will \"look after our nation's interest\" as he seeks to pursue the \"collective objectives of the ASEAN region.\" \nDuterte departed Davao City via a chartered Philippine Airlines flight, bound for Naypyidaw, the capital of Myanmar. \nIn Myanmar, Duterte will meet Burmese democracy icon Aung San Suu Kyi, now Myanmar's State Counselor and Foreign Minister, and will have bilateral talks with Myanmar President Htin Kyaw. (READ: Duterte to meet Aung San Suu Kyi in Myanmar) \nHe will proceed to neighboring Thailand next, where he will hold a bilateral meeting with Thai Prime Minister Prayut Chan-o-cha. \nHe will be out of the country from Sunday to Wednesday, March 22. \nIn Myanmar, Duterte said his trip will underscore the Philippines' \"commitment to deepen partnership with Myanmar towards a brighter and better future.\" \n\"As developing countries with similar historic experiences and facing the same challenges, we can use the synergies of interests as basis for strengthened cooperation,\" he said. \nIn his meetings with Suu Kyi and with Commander-in-Chief of Defense Senior General Min Aung Hlaing, Duterte will convey the Philippines' \"support for the reforms being undertaken by Myanmar as well as in its efforts to address challenges... of certain problems in these regions.\" \nMeanwhile, in Thailand – a country with which the Philippines has had official relations for the past 67 years – Duterte will \"renew the Philippines' commitment to further enhance our excellent relations.\" \n\"I look forward to meeting Prime Minister Prayut Chan-o-cha to discuss strengthening defense relations, intensifying trade and investment, and enhancing education, cooperation, among others,\" he added. \nIn both trips, Duterte is set to meet with members of the Filipino community. \n\"In both Myanmar and Thailand, I welcome the important [opportunity] of meeting our kababayans (countrymen) who have been key partners in our program for positive change and reform in our government,\" he said. \nDuterte's visits to Myanmar and Thailand are part of his \"introductory\" trips to ASEAN countries, partly in fulfillment of the Philippines' role as ASEAN chairman this year. \nThe official delegation for the trips include Acting Foreign Secretary Enrique Manalo, Defense Secretary Delfin Lorenzana, National Security Adviser Hermogenes Esperon Jr, Agriculture Secretary Manny Piñol, Trade Secretary Ramon Lopez, Communications Secretary Martin Andanar, Philippine Drug Enforcement Agency Director General Isidro Lapeña, and Philippine Ambassador to Myanmar Alex Chua. \nAlso part of the official delegation are senators Alan Peter Cayetano and Vicente Sotto III. \nThese will be the first foreign trips to be attended by Manalo as Acting Foreign Secretary. \nExecutive Secretary Salvador Medialdea will be the caretaker of the government while Duterte is abroad, Malacañang said. – Rappler.com HOW DOES THIS STORY MAKE YOU FEEL? Happy", "external_links": [], "published": "2017-03-19T14:11:00.000+02:00", "crawled": "2017-03-19T20:33:40.388+02:00", "highlightTitle": ""}