{"organizations": [], "uuid": "1cf8d797c38ffc3ab8478a65f36fa6585466c652", "thread": {"social": {"gplus": {"shares": 1}, "pinterest": {"shares": 0}, "vk": {"shares": 0}, "linkedin": {"shares": 1}, "facebook": {"likes": 493, "shares": 493, "comments": 0}, "stumbledupon": {"shares": 0}}, "site_full": "www.telegraph.co.uk", "main_image": "http://www.telegraph.co.uk/content/dam/news/2017/03/16/JS123449021-ivanka-Haley-xlarge_trans_NvBQzQNjv4BqGUYuUYfFicv_KcN2Lq9pqAOOSysbaljS44Q0ZDjWxds.jpg", "site_section": "http://www.telegraph.co.uk/newsfeed/rss/news_main.xml", "section_title": "News", "url": "http://www.telegraph.co.uk/news/2017/03/16/ivanka-trump-joins-justin-trudeau-broadway-show-welcoming-foreigners/", "country": "GB", "domain_rank": 317, "title": "Ivanka Trump joins Justin Trudeau at Broadway show about welcoming foreigners", "performance_score": 4, "site": "telegraph.co.uk", "participants_count": 1, "title_full": "Ivanka Trump joins Justin Trudeau at Broadway show about welcoming foreigners", "spam_score": 0.0, "site_type": "blogs", "published": "2017-03-16T10:55:00.000+02:00", "replies_count": 0, "uuid": "1cf8d797c38ffc3ab8478a65f36fa6585466c652"}, "author": "Chris Graham", "url": "http://www.telegraph.co.uk/news/2017/03/16/ivanka-trump-joins-justin-trudeau-broadway-show-welcoming-foreigners/", "ord_in_thread": 0, "title": "Ivanka Trump joins Justin Trudeau at Broadway show about welcoming foreigners", "locations": [], "entities": {"persons": [{"name": "justin trudeau", "sentiment": "negative"}, {"name": "ivanka trump gree", "sentiment": "negative"}, {"name": "ivanka trump", "sentiment": "negative"}, {"name": "trump", "sentiment": "none"}, {"name": "donald trump", "sentiment": "none"}, {"name": "sophie", "sentiment": "none"}, {"name": "noah", "sentiment": "none"}, {"name": "michael paulson", "sentiment": "none"}, {"name": "ivanka", "sentiment": "none"}, {"name": "benjamin netanyahu", "sentiment": "none"}, {"name": "gerald schoenfeld", "sentiment": "none"}, {"name": "trudeau", "sentiment": "none"}, {"name": "justin", "sentiment": "none"}, {"name": "mike pence", "sentiment": "none"}, {"name": "chris graham", "sentiment": "none"}, {"name": "nikki haley", "sentiment": "none"}], "locations": [{"name": "broadway", "sentiment": "none"}, {"name": "united states", "sentiment": "none"}, {"name": "new york", "sentiment": "none"}, {"name": "us", "sentiment": "none"}, {"name": "canada", "sentiment": "none"}, {"name": "gander", "sentiment": "none"}, {"name": "hawaii", "sentiment": "none"}, {"name": "newfoundland", "sentiment": "none"}], "organizations": [{"name": "ivanka trump news", "sentiment": "none"}, {"name": "united nations", "sentiment": "none"}, {"name": "ap", "sentiment": "none"}]}, "highlightText": "", "language": "english", "persons": [], "text": "News Ivanka Trump joins Justin Trudeau at Broadway show about welcoming foreigners Ivanka Trump greets patrons as Nikki Haley, left, looks on before the start of the Broadway debut of the musical \"Come From Away\" Credit: AP Chris Graham 16 March 2017 • 3:55am \nI vanka Trump has joined Justin Trudeau in attending a Broadway show that celebrates giving foreigners a warm welcome. \nThe president's daughter and the Canadian prime minister, who sat next to each other during the play, were part of a political power-crowd at the new musical “Come From Away” on Wednesday night. \nCelebrating Canadian compassion following 9/11, the story is set in the small Newfoundland town of Gander, which saw its population double after it took in thousands of passengers and crew from dozens of planes diverted when US air space was closed following the terror attacks. One recurring theme involves prejudice against Muslims. — Michael Paulson (@MichaelPaulson) March 16, 2017 \n“The world gets to see what it is to lean on each other and be there for each other through the darkest times,” Mr Trudeau, who was with his wife Sophie, said as he introduced the play at the Gerald Schoenfeld Theatre. \nH e also hailed the friendship of the two countries. “There is no relationship quite like the friendship between Canada and the United States ... Our friends are there for those tough times,” he added. Canadian Prime Minister Justin Trudeau speaks to the audience before the start of the Broadway musical \"Come From Away,\" in New York Credit: AP \nThe appearance of the first daughter and Mr Trudeau at the play coincided with a Hawaii judge blocking Donald Trump's efforts to freeze immigration by refugees and citizens o f some predominantly Muslim nations. Ivanka attending a broadway show called 'Come From Away' with Justin Trudeau #IvankaTrump #justintrudeau pic.twitter.com/KEZ6yXJkUw — Ivanka Trump News (@ivankanews) March 16, 2017 \nT he timing would not have been lost on the audience, which included about 120 ambassadors from around the world, including Nikki Haley , the US Ambassador to the United Nations. \nM s Trump and Mr Trudeau arrived at the New York theatre in the same motorcade but in different vehicles. \nLast month, the pair took part in a roundtable discussion about women in the workforce, where photos of the first daughter's expression as she looked at the Canadian leader sent social media into a frenzy . Watch | Ivanka Trump joins meeting with Justin Trudeau and her father 00:50 \nT revor Noah, host of the The Daily Show, commented at the time: \"She looks like she’s ready to risk it all. She looks like she’s considering dressing up as a Syrian refugee just so Canada will take her in, like, ‘Let me in, Justin!'\" \nMr Trudeau's warm reception at the theatre was in contrast to the ones that greeted two other world leaders who recently attended the Broadway smash \"Hamilton\" - Israeli Prime Minister Benjamin Netanyahu and Vice President-elect Mike Pence . Both received more than a smattering of boos.", "external_links": [], "published": "2017-03-16T10:55:00.000+02:00", "crawled": "2017-03-16T06:12:21.623+02:00", "highlightTitle": ""}