{"organizations": [], "uuid": "1d742233e286124209f9c8e7157d986a6745808f", "thread": {"social": {"gplus": {"shares": 0}, "pinterest": {"shares": 0}, "vk": {"shares": 0}, "linkedin": {"shares": 0}, "facebook": {"likes": 307, "shares": 307, "comments": 0}, "stumbledupon": {"shares": 0}}, "site_full": "www.philly.com", "main_image": "http://media.philly.com/images/ZAHAV_INTERIOR__Michael_Persico-4_1200.jpg", "site_section": "", "section_title": "", "url": "http://www.philly.com/philly/blogs/the-insider/Solomonov-Starr-2017-James-Beard-nominations.html", "country": "US", "domain_rank": 3314, "title": "Solomonov, Vernick, Starr: Familiar foodie names on list of 2017 James Beard nominations", "performance_score": 3, "site": "philly.com", "participants_count": 0, "title_full": "Solomonov, Vernick, Starr: Familiar foodie names on list of 2017 James Beard nominations", "spam_score": 0.528, "site_type": "blogs", "published": "2017-03-16T00:17:00.000+02:00", "replies_count": 0, "uuid": "1d742233e286124209f9c8e7157d986a6745808f"}, "author": "Michael Klein", "url": "http://www.philly.com/philly/blogs/the-insider/Solomonov-Starr-2017-James-Beard-nominations.html", "ord_in_thread": 0, "title": "Solomonov, Vernick, Starr: Familiar foodie names on list of 2017 James Beard nominations", "locations": [], "entities": {"persons": [{"name": "solomonov", "sentiment": "negative"}, {"name": "james beard", "sentiment": "negative"}, {"name": "starr", "sentiment": "negative"}, {"name": "vernick", "sentiment": "negative"}, {"name": "sam calagione", "sentiment": "none"}, {"name": "greg vernick", "sentiment": "none"}, {"name": "rich landau", "sentiment": "none"}, {"name": "michael klein", "sentiment": "none"}, {"name": "camille cogswell", "sentiment": "none"}, {"name": "stephen starr", "sentiment": "none"}, {"name": "michael solomonov", "sentiment": "none"}, {"name": "le coucou", "sentiment": "none"}, {"name": "zahav", "sentiment": "none"}], "locations": [{"name": "new york", "sentiment": "none"}, {"name": "rittenhouse  philadelphia", "sentiment": "none"}, {"name": "philadelphia", "sentiment": "none"}, {"name": "philly.com", "sentiment": "none"}, {"name": "mid-atlantic", "sentiment": "none"}, {"name": "marigold kitchen's kochan", "sentiment": "none"}, {"name": "zahav", "sentiment": "none"}], "organizations": [{"name": "daily news", "sentiment": "none"}, {"name": "vernick food & drink", "sentiment": "none"}, {"name": "philly.com", "sentiment": "none"}, {"name": "inquirer", "sentiment": "none"}, {"name": "society hill towers", "sentiment": "none"}, {"name": "dogfish head craft brewery", "sentiment": "none"}]}, "highlightText": "", "language": "english", "persons": [], "text": "Solomonov, Vernick, Starr: Familiar foodie names on list of 2017 James Beard nominations Updated: March 15, 2017 — 2:58 PM EDT 185 Share Michael Klein Staff Writer Michael Klein, editor/producer of Philly.com/food, has written about Philadelphia’s restaurant scene since 1993 in his Inquirer column, “Table Talk,” and on his Philly.com blog, “The Insider.” More by Michael Klein Marigold Kitchen's Kochan opening restaurant in Rittenhouse \nPhiladelphia's notable finalist is Zahav, the modern Israeli restaurant in Society Hill Towers, which made the lists for chef (Michael Solomonov) and service. Solomonov was a finalist last year and is the last Philadelphian to win the Mid-Atlantic chef category (in 2011). His cookbook Zahav was the Beard's cookbook of the year in 2016. \nZahav sous chef Camille Cogswell (right) also was nominated for rising star chef of the year. \nFor best chef in the Mid-Atlantic region, Rich Landau of Vedge/V Street/Wiz Kid and Greg Vernick of Vernick Food & Drink are finalists for the second consecutive year. \nStephen Starr of Starr Restaurants is a nominee again for restaurateur. His New York restaurant Le Coucou is a nominee for best new restaurant. \nSam Calagione, of Dogfish Head Craft Brewery, was nominated again for wine, spirits, or beer professional. \nSee the list of semifinalists here . Published: March 15, 2017 — 1:17 PM EDT | Updated: March 15, 2017 — 2:58 PM EDT Do you have a minute?... \nOver the past year, the Inquirer, the Daily News and Philly.com have uncovered corruption in local and state public offices, shed light on hidden and dangerous environmental risks, and deeply examined the region’s growing heroin epidemic. This is indispensable journalism, brought to you by the largest, most experienced newsroom in the region. Fact-based journalism of this caliber isn’t cheap. We need your support to keep our talented reporters, editors and photographers holding government accountable, looking out for the public interest, and separating fact from fiction. If you already subscribe, thank you. If not, please consider doing so by clicking on the button below. Subscriptions can be home delivered in print, or digitally read on nearly any mobile device or computer, and start as low as 25¢ per day. We're thankful for your support in every way. We encourage respectful comments but reserve the right to delete anything that doesn't contribute to an engaging dialogue Help us moderate this thread by flagging comments that violate our guidelines Commenting policy | Comments FAQ Comment policy: \nPhilly.com comments are intended to be civil, friendly conversations. Please treat other participants with respect and in a way that you would want to be treated. You are responsible for what you say. And please, stay on topic. If you see an objectionable post, please report it to us using the \"Report Abuse\" option. \nPlease note that comments are monitored by Philly.com staff. We reserve the right at all times to remove any information or materials that are unlawful, threatening, abusive, libelous, defamatory, obscene, vulgar, pornographic, profane, indecent or otherwise objectionable. Personal attacks, especially on other participants, are not permitted. We reserve the right to permanently block any user who violates these terms and conditions. \nAdditionally comments that are long, have multiple paragraph breaks, include code, or include hyperlinks may not be posted. ", "external_links": [], "published": "2017-03-16T00:17:00.000+02:00", "crawled": "2017-03-16T02:30:47.331+02:00", "highlightTitle": ""}