{"organizations": [], "uuid": "8b7070cfe78d151b3a7228abb0a0b3d06923810c", "thread": {"social": {"gplus": {"shares": 0}, "pinterest": {"shares": 0}, "vk": {"shares": 0}, "linkedin": {"shares": 0}, "facebook": {"likes": 446, "shares": 446, "comments": 0}, "stumbledupon": {"shares": 0}}, "site_full": "www.philly.com", "main_image": "http://media.philly.com/images/CheesesteakBurrito_1200.jpg", "site_section": "", "section_title": "", "url": "http://www.philly.com/philly/blogs/food_department/How-to-roll-on-National-Cheesesteak-Day.html", "country": "US", "domain_rank": 3314, "title": "How to roll for free on National Cheesesteak Day", "performance_score": 4, "site": "philly.com", "participants_count": 0, "title_full": "How to roll for free on National Cheesesteak Day", "spam_score": 0.236, "site_type": "blogs", "published": "2017-03-23T20:07:00.000+02:00", "replies_count": 0, "uuid": "8b7070cfe78d151b3a7228abb0a0b3d06923810c"}, "author": "Michael Klein", "url": "http://www.philly.com/philly/blogs/food_department/How-to-roll-on-National-Cheesesteak-Day.html", "ord_in_thread": 0, "title": "How to roll for free on National Cheesesteak Day", "locations": [], "entities": {"persons": [{"name": "michael", "sentiment": "neutral"}, {"name": "o'donnell", "sentiment": "none"}, {"name": "michael klein", "sentiment": "none"}, {"name": "evelyn balis", "sentiment": "none"}, {"name": "tony luke", "sentiment": "none"}, {"name": "reza", "sentiment": "none"}, {"name": "tony luke jr.", "sentiment": "none"}, {"name": "klein", "sentiment": "none"}, {"name": "monterey jack", "sentiment": "none"}, {"name": "mirna ghassemi", "sentiment": "none"}], "locations": [{"name": "sicklerville", "sentiment": "none"}, {"name": "gloucester city", "sentiment": "none"}, {"name": "n. broadway", "sentiment": "none"}, {"name": "philadelphia", "sentiment": "none"}, {"name": "philly.com", "sentiment": "none"}, {"name": "feasterville", "sentiment": "none"}, {"name": "twin oaks", "sentiment": "none"}, {"name": "deptford", "sentiment": "none"}, {"name": "clements bridge road", "sentiment": "none"}], "organizations": [{"name": "daily news", "sentiment": "none"}, {"name": "adelphia restaurant", "sentiment": "none"}, {"name": "inquirer", "sentiment": "none"}]}, "highlightText": "", "language": "english", "persons": [], "text": "How to roll for free on National Cheesesteak Day Updated: March 23, 2017 — 8:27 AM EDT Share Michael Klein Staff Writer Michael Klein, editor/producer of Philly.com/food, has written about Philadelphia’s restaurant scene since 1993 in his Inquirer column, “Table Talk,” and on his Philly.com blog, “The Insider.” More by Michael Klein Arrow icon \nNational Cheesesteak Day, which sounds like an oxymoron given the sandwich's Philadelphia roots, will be marked by giveaways and specials on Friday, March 24. \nTony Luke Jr. will give away cheesesteaks from noon to 6 p.m. (or while supplies last) at his Tony Luke's shop in the Crossings at Twin Oaks in Sicklerville (663 Cross Keys Rd.) \nAt Andalé Latino Grill (144 E. Street Rd. in Feasterville), Reza and Mirna Ghassemi have developed the chimichurri cheesesteak burrito, which contains grilled, sliced steak, chimichurri sauce, a blend of Monterey Jack and mild Cheddar cheeses, caramelized onions, pico de gallo, pickled cabbage and aji sauce. On March 24, everyone who dines in will receive one comp small burrito. Here's a backgrounder on Andalé \nCousins Bill and Evelyn Balis of Adelphia Restaurant will roll back the price of their cheesesteaks to $4.95, which was the price on the menu when their fathers opened at 1750 Clements Bridge Road in Deptford in 1987. In addition to the cheesesteak rollback, they will offer comp mini-cheesesteaks at the bar during happy hour from 3 to 7 p.m. \nO'Donnell's Restaurant & Bar (401 N. Broadway, Gloucester City) will give out samples of its Heavyweight Fight \"Belly Buster\" cheesesteak from 3 to 7 p.m. with a purchase. Read more by \nOver the past year, the Inquirer, the Daily News and Philly.com have uncovered corruption in local and state public offices, shed light on hidden and dangerous environmental risks, and deeply examined the region’s growing heroin epidemic. This is indispensable journalism, brought to you by the largest, most experienced newsroom in the region. Fact-based journalism of this caliber isn’t cheap. We need your support to keep our talented reporters, editors and photographers holding government accountable, looking out for the public interest, and separating fact from fiction. If you already subscribe, thank you. If not, please consider doing so by clicking on the button below. Subscriptions can be home delivered in print, or digitally read on nearly any mobile device or computer, and start as low as 25¢ Help us moderate this thread by flagging comments that violate Commenting policy | ", "external_links": [], "published": "2017-03-23T20:07:00.000+02:00", "crawled": "2017-03-23T15:07:42.043+02:00", "highlightTitle": ""}