{"organizations": [], "uuid": "f30916dd79a204c63c4d4a5bb7725e8555023bfb", "thread": {"social": {"gplus": {"shares": 1}, "pinterest": {"shares": 0}, "vk": {"shares": 0}, "linkedin": {"shares": 0}, "facebook": {"likes": 105, "shares": 105, "comments": 0}, "stumbledupon": {"shares": 0}}, "site_full": "www.philly.com", "main_image": "http://media.philly.com/images/030717-conwaymcmaster.jpg", "site_section": "", "section_title": "", "url": "http://www.philly.com/philly/blogs/real-time/Philadelphia-figures-in-the-Trump-administration-a-guide.html", "country": "US", "domain_rank": 3314, "title": "Philadelphia-area figures in the Trump administration: A guide", "performance_score": 1, "site": "philly.com", "participants_count": 0, "title_full": "Philadelphia-area figures in the Trump administration: A guide", "spam_score": 0.014, "site_type": "blogs", "published": "2017-03-07T21:42:00.000+02:00", "replies_count": 0, "uuid": "f30916dd79a204c63c4d4a5bb7725e8555023bfb"}, "author": "Emily Babay", "url": "http://www.philly.com/philly/blogs/real-time/Philadelphia-figures-in-the-Trump-administration-a-guide.html", "ord_in_thread": 0, "title": "Philadelphia-area figures in the Trump administration: A guide", "locations": [], "entities": {"persons": [{"name": "trump", "sentiment": "negative"}, {"name": "kellyanne conway", "sentiment": "none"}, {"name": "schultz", "sentiment": "none"}, {"name": "mcgahn", "sentiment": "none"}, {"name": "emily babay", "sentiment": "none"}, {"name": "michael flynn", "sentiment": "none"}, {"name": "flynn", "sentiment": "none"}, {"name": "jay clayton", "sentiment": "none"}, {"name": "h.r. mcmaster", "sentiment": "none"}, {"name": "cozen o'connor", "sentiment": "none"}, {"name": "emily babay arrow", "sentiment": "none"}, {"name": "joseph mcgahn", "sentiment": "none"}, {"name": "donald mcgahn", "sentiment": "none"}, {"name": "george conway", "sentiment": "none"}, {"name": "roxborough", "sentiment": "none"}, {"name": "conway", "sentiment": "none"}, {"name": "patrick", "sentiment": "none"}, {"name": "mcmaster", "sentiment": "none"}, {"name": "james d. schultz", "sentiment": "none"}, {"name": "pence", "sentiment": "none"}, {"name": "rod rosenstein", "sentiment": "none"}, {"name": "jeff sessions", "sentiment": "none"}], "locations": [{"name": "south jersey", "sentiment": "none"}, {"name": "hammonton", "sentiment": "none"}, {"name": "philly", "sentiment": "none"}, {"name": "atlantic city", "sentiment": "none"}, {"name": "philadelphia", "sentiment": "none"}, {"name": "penn", "sentiment": "none"}, {"name": "galloway township", "sentiment": "none"}, {"name": "new york", "sentiment": "none"}, {"name": "white house", "sentiment": "none"}, {"name": "philly.com", "sentiment": "none"}, {"name": "camden", "sentiment": "none"}, {"name": "russia", "sentiment": "none"}, {"name": "pennsylvania", "sentiment": "none"}], "organizations": [{"name": "daily news", "sentiment": "none"}, {"name": "lipton, rosen & katz", "sentiment": "none"}, {"name": "trump", "sentiment": "none"}, {"name": "real time news desk", "sentiment": "none"}, {"name": "inquirer", "sentiment": "none"}, {"name": "federal election commission", "sentiment": "none"}, {"name": "wachtell", "sentiment": "none"}, {"name": "valley forge military academy and college", "sentiment": "none"}, {"name": "wharton school", "sentiment": "none"}, {"name": "university of pennsylvania", "sentiment": "none"}, {"name": "white house", "sentiment": "none"}, {"name": "philly.com", "sentiment": "none"}, {"name": "atco", "sentiment": "none"}, {"name": "securities and exchange commission", "sentiment": "none"}]}, "highlightText": "", "language": "english", "persons": [], "text": "Philadelphia-area figures in the Trump administration: A guide Updated: March 7, 2017 — 3:21 PM EST 61 Share Emily Babay Staff Writer \nEmily Babay works on the Real Time News Desk. She writes about everything from crime to transit problems — and occasionally about good news. More by Emily Babay Arrow icon \nPresident Trump's administration has a small but significant Philadelphia flavor. \nThere aren't many key figures with ties to the area, but a few of the most important officials in the nascent administration hail from the greater region. \nHere's a guide to administration figures with links to the Philadelphia region. \nLt. Gen. H.R. McMaster, national security adviser: McMaster, 54, grew up in Roxborough and graduated from Valley Forge Military Academy and College in 1980. He was named national security adviser in February when Michael Flynn was forced out of the post after it was disclosed that Flynn had misled Vice President Pence about having spoken with the Russian ambassador about sanctions. McMaster is Trump's top aide on national security issues. Read more about McMaster: \nWill Philly native be able to influence Trump as national security adviser? \nKellyanne Conway, adviser: Conway, 49, grew up in South Jersey. She was born in Camden, then moved to Atco at age 3 and attended schools in Hammonton. Conway managed Trump's presidential campaign – becoming the first woman to manage a successful presidential campaign – and was an adviser for his transition team before being named a counselor to the president. Her husband, George Conway , is a partner at the New York law firm Wachtell, Lipton, Rosen & Katz and has been floated as a potential solicitor general in the Trump administration. Read more about Conway: \nQ&A with Kellyanne Conway: Trump's 'anchor in the storm' \nJames D. Schultz, associate White House counsel: Schultz, 44, is a Cozen O'Connor partner and former general counsel for Pennsylvania. The Galloway Township native led the Philadelphia law firm's government-affairs and regulatory practice group before he was named to the White House post in January. Read more about Schultz: \nDonald McGahn, White House counsel: McGahn, 48, grew up in Atlantic City . The former member of the Federal Election Commission and attorney for Trump's presidential campaign comes from a prominent Atlantic City family : One uncle, Patrick \"Paddy\" McGahn was a legendary lawyer there; another, Joseph McGahn , was a state senator. \nUnder consideration: \nA few more Philadelphia-linked officials have been selected for high-level posts in the administration but are awaiting confirmation. \nRod Rosenstein , Trump's pick for deputy attorney general (who would lead the investigation into the Trump campaign and Russia following Attorney General Jeff Sessions' recusal ), is a Philadelphia native and graduated from the University of Pennsylvania's Wharton School. Jay Clayton , Trump's choice to lead the Securities and Exchange Commission, grew up in Pennsylvania, including in Philadelphia, and received engineering and law degrees from Penn , and is an adjunct professor at the law school. Read more by Emily Babay Published: March 7, 2017 — 9:42 AM EST | Updated: March 7, 2017 — 3:21 PM EST The Philadelphia Inquirer Do you have a minute?... \nOver the past year, the Inquirer, the Daily News and Philly.com have uncovered corruption in local and state public offices, shed light on hidden and dangerous environmental risks, and deeply examined the region’s growing heroin epidemic. This is indispensable journalism, brought to you by the largest, most experienced newsroom in the region. Fact-based journalism of this caliber isn’t cheap. We need your support to keep our talented reporters, editors and photographers holding government accountable, looking out for the public interest, and separating fact from fiction. If you already subscribe, thank you. If not, please consider doing so by clicking on the button below. Subscriptions can be home delivered in print, or digitally read on nearly any mobile device or computer, and start as low as 25¢ per day. We're thankful for your support in every way. We encourage respectful comments but reserve the right to delete anything that doesn't contribute to an engaging dialogue Help us moderate this thread by flagging comments that violate our guidelines Commenting policy | Comments FAQ Comment policy: \nPhilly.com comments are intended to be civil, friendly conversations. Please treat other participants with respect and in a way that you would want to be treated. You are responsible for what you say. And please, stay on topic. If you see an objectionable post, please report it to us using the \"Report Abuse\" option. \nPlease note that comments are monitored by Philly.com staff. We reserve the right at all times to remove any information or materials that are unlawful, threatening, abusive, libelous, defamatory, obscene, vulgar, pornographic, profane, indecent or otherwise objectionable. Personal attacks, especially on other participants, are not permitted. We reserve the right to permanently block any user who violates these terms and conditions. \nAdditionally comments that are long, have multiple paragraph breaks, include code, or include hyperlinks may not be posted. ", "external_links": [], "published": "2017-03-07T21:42:00.000+02:00", "crawled": "2017-03-08T01:32:18.262+02:00", "highlightTitle": ""}