{"organizations": [], "uuid": "cfd13f5b7ba28f3f88b09ca0f1ef3d093c616848", "thread": {"social": {"gplus": {"shares": 0}, "pinterest": {"shares": 0}, "vk": {"shares": 0}, "linkedin": {"shares": 0}, "facebook": {"likes": 235, "shares": 235, "comments": 0}, "stumbledupon": {"shares": 0}}, "site_full": "www.geo.tv", "main_image": "https://www.geo.tv/assets/uploads/updates/2017-03-13/134070_114730_updates.jpg", "site_section": "http://feeds.feedburner.com/geo/GiKR", "section_title": "GEO TV - Pakistan", "url": "https://www.geo.tv/latest/134070-Chinese-Turkish-troops-to-take-part-in-Pakistan-Day-parade-ISPR", "country": "TV", "domain_rank": 8287, "title": "Chinese, Turkish troops to take part in Pakistan Day parade: ISPR", "performance_score": 2, "site": "geo.tv", "participants_count": 0, "title_full": "Chinese, Turkish troops to take part in Pakistan Day parade: ISPR", "spam_score": 0.0, "site_type": "blogs", "published": "2017-03-13T18:46:00.000+02:00", "replies_count": 0, "uuid": "cfd13f5b7ba28f3f88b09ca0f1ef3d093c616848"}, "author": "", "url": "https://www.geo.tv/latest/134070-Chinese-Turkish-troops-to-take-part-in-Pakistan-Day-parade-ISPR", "ord_in_thread": 0, "title": "Chinese, Turkish troops to take part in Pakistan Day parade: ISPR", "locations": [], "entities": {"persons": [{"name": "ispr maj gen asif ghafoor", "sentiment": "none"}, {"name": "asif ghafoor", "sentiment": "none"}], "locations": [{"name": "pakistan", "sentiment": "none"}, {"name": "china", "sentiment": "none"}, {"name": "islamabad", "sentiment": "none"}], "organizations": [{"name": "ispr", "sentiment": "negative"}, {"name": "turkish chinese army", "sentiment": "none"}, {"name": "pakistan army", "sentiment": "none"}, {"name": "chinese army troops", "sentiment": "none"}, {"name": "muslim league", "sentiment": "none"}, {"name": "navy", "sentiment": "none"}, {"name": "air force", "sentiment": "none"}, {"name": "chinese army", "sentiment": "none"}, {"name": "inter-services public relations", "sentiment": "none"}]}, "highlightText": "", "language": "english", "persons": [], "text": "Pak army acquires high-tech defence system from China: ISPR \nRAWALPINDI: Contingents of Chinese and Turkish armies will participate in the Pakistan Day parade on March 23, the military’s media wing Inter-Services Public Relations (ISPR) announced on Monday. \nDirector-General ISPR Maj Gen Asif Ghafoor tweeted that Chinese Army troops and the Turkish military band will participate in the parade, to be held on March 23 in Islamabad to mark the Pakistan Day celebrations. Pak Day Parade 23rd Mar 2017. Chinese Army Troops and Turkish Military Band will participate in the Parade. pic.twitter.com/BzwfPXcgK6 — Maj Gen Asif Ghafoor (@OfficialDGISPR) March 13, 2017 \nAccording to reports, contingents of the Pakistan Army, Navy and Air Force have arrived in the federal capital for parade rehearsals, amid strict security measures. \nPakistan Day is a national holiday in Pakistan to commemorate the Lahore Resolution of March 23, 1940, when the Muslim League drafted the political resolution calling for establishing an independent federation. 0 0 Chinese, Turkish troops to take part in Pakistan Day parade: ISPR   Geo News, Ispr, March 23, Pakistan Day Parade, Troops, Turkish Chinese Army.   \"Chinese, Turkish troops to take part in Pakistan Day parade: ISPR\" is https://www.geo.tv/latest/134070-Chinese-Turkish-troops-to-take-part-in-Pakistan-Day-parade-ISPR+geo%2FGiKR+%28Geo+Pakistan+- ", "external_links": [], "published": "2017-03-13T18:46:00.000+02:00", "crawled": "2017-03-13T09:26:16.194+02:00", "highlightTitle": ""}