{"organizations": [], "uuid": "92efb8c1c860769fc914613491471e66409d4424", "thread": {"social": {"gplus": {"shares": 0}, "pinterest": {"shares": 0}, "vk": {"shares": 0}, "linkedin": {"shares": 0}, "facebook": {"likes": 140, "shares": 140, "comments": 0}, "stumbledupon": {"shares": 0}}, "site_full": "ftw.usatoday.com", "main_image": "https://www.gannett-cdn.com/-mm-/7ab0ce1793eeb295d8f6b5cc2d6b7807f6e56bcd/c=0-272-3880-2454&amp;r=x1683&amp;c=3200x1680/local/-/media/2017/03/24/USATODAY/usatsports/booker-suns.jpg", "site_section": "http://rssfeeds.usatoday.com/UsatodaycomNba-TopStories", "section_title": "GANNETT Syndication Service", "url": "http://ftw.usatoday.com/2017/03/devin-booker-phoenix-suns-70-points-stats-crazy-history-records", "country": "US", "domain_rank": 313, "title": "7 ridiculous stats from Booker's 70-point game", "performance_score": 1, "site": "usatoday.com", "participants_count": 1, "title_full": "7 ridiculous stats from Booker's 70-point game", "spam_score": 0.0, "site_type": "blogs", "published": "2017-03-25T12:38:00.000+03:00", "replies_count": 0, "uuid": "92efb8c1c860769fc914613491471e66409d4424"}, "author": "USA TODAY", "url": "http://ftw.usatoday.com/2017/03/devin-booker-phoenix-suns-70-points-stats-crazy-history-records", "ord_in_thread": 0, "title": "7 ridiculous stats from Booker's 70-point game", "locations": [], "entities": {"persons": [{"name": "booker", "sentiment": "negative"}, {"name": "devin booker", "sentiment": "negative"}, {"name": "alysha tsuji", "sentiment": "none"}, {"name": "wilt chamberlain", "sentiment": "none"}, {"name": "kobe bryant", "sentiment": "none"}, {"name": "earl watson", "sentiment": "none"}, {"name": "chris forsberg", "sentiment": "none"}, {"name": "watson", "sentiment": "none"}, {"name": "kobe", "sentiment": "none"}, {"name": "tom chambers", "sentiment": "none"}, {"name": "ben golliver", "sentiment": "none"}], "locations": [{"name": "usa", "sentiment": "none"}, {"name": "td garden", "sentiment": "none"}, {"name": "u.s", "sentiment": "none"}], "organizations": [{"name": "facebook", "sentiment": "neutral"}, {"name": "raptors", "sentiment": "none"}, {"name": "suns", "sentiment": "none"}, {"name": "nba", "sentiment": "none"}, {"name": "celtics", "sentiment": "none"}, {"name": "lakers", "sentiment": "none"}, {"name": "espn stats & info", "sentiment": "none"}, {"name": "supersonics", "sentiment": "none"}]}, "highlightText": "", "language": "english", "persons": [], "text": "  7 ridiculous stats from Booker's 70-point game Devin Booker made history. Post to Facebook 7 ridiculous stats from Booker's 70-point game Devin Booker made history.  //ftw.usatoday.com/2017/03/devin-booker-phoenix-suns-70-points-stats-crazy-history-records   7 ridiculous stats from Booker's 70-point game Alysha Tsuji , USA TODAY 12:38   \nDevin Booker scored a phenomenal 70 points in the Suns' loss to the Celtics on Friday night at TD Garden - a 20-year-old dropped 70. Many players around the NBA tweeted in shock, and the Suns celebrated in the locker room afterwards , even though they just lost the game, 130-120. Earl Watson unapologetic about using fouls and timeouts to aid Booker's 70 point night. Watson: \"Do something about it.\" â€” Chris Forsberg (@ESPNForsberg) March 25, 2017 \nBy scoring 70, Booker broke some records and placed himself among some greats in NBA history, and again, he's 20 - he's not even old enough to buy alcohol in the U.S. A night to remember. \nHere are seven crazy stats: 1. Broke the franchise record Devin Booker broke Suns record for points in a game. Tom Chambers previously held that record with 60 in March 1990 against SuperSonics â€” ESPN Stats & Info (@ESPNStatsInfo) March 25, 2017 2. Did it as the youngest player at 20 years old Devin Booker is the youngest player to score at least 60 points in a game (age 20) â€” ESPN Stats & Info (@ESPNStatsInfo) March 25, 2017 3. Only the 11th time in NBA HISTORY a player has pulled this off Devin Booker ( @Suns ): 11th 70-point game in NBA history.First since Kobe Bryant scored 81 points vs Raptors in 2006 pic.twitter.com/GFBq7WTpLl â€” ESPN Stats & Info (@ESPNStatsInfo) March 25, 2017 4. Most points EVER scored vs. Celtics Devin Booker's 70 points for @Suns are the most in a game against the Celtics. pic.twitter.com/V4zvkbD7jp â€” ESPN Stats & Info (@ESPNStatsInfo) March 25, 2017 5. Most points scored in a game in the NBA since Kobe's 81 Suns' Devin Booker finishes w/ franchise-record 70 points vs. Celtics, most in NBA since Lakers' Kobe Bryant had 81 vs. Raptors on 1/22/2006 â€” Ben Golliver (@BenGolliver) March 25, 2017 6. Devin Booker has been added to a short list that includes these guys Players who have scored 70+ PTS in @NBA history:ðŸ”¸Wilt Chamberlain", "external_links": [], "published": "2017-03-25T12:38:00.000+03:00", "crawled": "2017-03-25T08:34:30.851+03:00", "highlightTitle": ""}