{"organizations": [], "uuid": "d2e82c28d1b670e85d4faae502bf925bf3318281", "thread": {"social": {"gplus": {"shares": 0}, "pinterest": {"shares": 0}, "vk": {"shares": 0}, "linkedin": {"shares": 0}, "facebook": {"likes": 206, "shares": 206, "comments": 0}, "stumbledupon": {"shares": 0}}, "site_full": "www.philly.com", "main_image": "http://media.philly.com/images/20161016_dn_rs216312_kevin_hart_1.jpg", "site_section": "http://www.philly.com/philly_entertainment.rss", "section_title": "Philly.com Entertainment", "url": "http://www.philly.com/philly/blogs/entertainment/celebrities_gossip/Kevin-Hart-to-perform-second-surprise-show-at-Punch-Line-Philly-tonight.html", "country": "US", "domain_rank": 3314, "title": "Kevin Hart to perform second surprise show at Punch Line Philly tonight", "performance_score": 2, "site": "philly.com", "participants_count": 1, "title_full": "Kevin Hart to perform second surprise show at Punch Line Philly tonight", "spam_score": 0.0, "site_type": "blogs", "published": "2017-03-22T00:59:00.000+02:00", "replies_count": 0, "uuid": "d2e82c28d1b670e85d4faae502bf925bf3318281"}, "author": "Nick Vadala", "url": "http://www.philly.com/philly/blogs/entertainment/celebrities_gossip/Kevin-Hart-to-perform-second-surprise-show-at-Punch-Line-Philly-tonight.html", "ord_in_thread": 0, "title": "Kevin Hart to perform second surprise show at Punch Line Philly tonight", "locations": [], "entities": {"persons": [{"name": "kevin hart", "sentiment": "neutral"}, {"name": "nick vadala", "sentiment": "none"}, {"name": "nicole kidman", "sentiment": "none"}, {"name": "nick vadala arrow", "sentiment": "none"}, {"name": "bryan cranston", "sentiment": "none"}, {"name": "hughe dillon", "sentiment": "none"}, {"name": "cranston", "sentiment": "none"}, {"name": "hart", "sentiment": "none"}, {"name": "keith robinson", "sentiment": "none"}], "locations": [{"name": "punch line philly", "sentiment": "none"}, {"name": "aston", "sentiment": "none"}, {"name": "philly", "sentiment": "none"}, {"name": "south philly", "sentiment": "none"}, {"name": "philadelphia", "sentiment": "none"}, {"name": "philly.com", "sentiment": "none"}], "organizations": [{"name": "punch line philly", "sentiment": "neutral"}, {"name": "daily news", "sentiment": "none"}, {"name": "city council", "sentiment": "none"}, {"name": "sun center studios", "sentiment": "none"}, {"name": "inquirer", "sentiment": "none"}, {"name": "lincoln financial field", "sentiment": "none"}, {"name": "warmdaddy", "sentiment": "none"}]}, "highlightText": "", "language": "english", "persons": [], "text": "Kevin Hart to perform second surprise show at Punch Line Philly tonight Updated: March 21, 2017 — 2:05 PM EDT 0 Share \nNick Vadala writes about food and entertainment for Philly.com. More by Nick Vadala Arrow icon \nKevin Hart will return to Punch Line Philly for a second consecutive surprise live set tonight, the comedian announced this afternoon. \nHart announced his new set on Twitter today, writing that he will be at Punch Line to “work on some new material” for his next comedy tour at 10:30 p.m. tonight. Tickets are currently on sale , and run $35 each before fees. \nI'm headed to @punchlinephilly tonight at 10:30pm to work on some new material for my next comedy tour.. tickets @ https://t.co/rhsu3jbN1f \n— Kevin Hart (@KevinHart4real) March 21, 2017 \nThe Philly native has performed several surprise comedy sets in the city since he returned home earlier this year to film Untouchable with Bryan Cranston and Nicole Kidman. Hart previously performed at Warmdaddy’s in South Philly in February, followed by a surprise 20-minute set at a Helium Comedy Club show headlined by Keith Robinson last week. \nHart’s proposed upcoming comedy tour will feature some of the comedian’s first new material since his blockbuster “What Now?” tour. That material from that tour, which Billboard reports as the highest grossing comedy tour of all time, is featured in Kevin Hart: What Now? , which was filmed at Lincoln Financial Field . \nCity Council last week officially named July 6 “Kevin Hart Day” in Philadelphia . In response to the honor, Hart wrote on social media that “summers will never be the same again.” \nThe comedian previously was spotted driving around Philly in a Ferrari with Untouchable co-star Cranston while working on the film. Currently, most remaining shoots are scheduled to take place at Sun Center Studios in Aston. HughE Dillon , however, reports that a final Philly-based shoot is set to take place the week of March 27. Read more by Nick Vadala More Coverage March 21, 2017 — 2:05 PM EDT Do you have a minute?... \nOver the past year, the Inquirer, the Daily News and Philly.com have uncovered corruption in local and state public offices, shed light on hidden and dangerous environmental risks, and deeply examined the region’s growing heroin epidemic. This is indispensable journalism, brought to you by the largest, most experienced newsroom in the region. Fact-based journalism of this caliber isn’t cheap. We need your support to keep our talented reporters, editors and photographers holding government accountable, looking out for the public interest, and separating fact from fiction. If you already subscribe, thank you. If not, please consider doing so by clicking on the button below. Subscriptions can be home delivered in print, or digitally read on nearly any mobile device or computer, and start as low as 25¢ per day. We're thankful for your support in every way. Help us moderate this thread by flagging comments that violate Commenting policy |", "external_links": [], "published": "2017-03-22T00:59:00.000+02:00", "crawled": "2017-03-21T20:31:06.652+02:00", "highlightTitle": ""}