{"organizations": [], "uuid": "a9e43e8ac585cde71d30065d918c6e2f81d988ec", "thread": {"social": {"gplus": {"shares": 0}, "pinterest": {"shares": 0}, "vk": {"shares": 0}, "linkedin": {"shares": 1}, "facebook": {"likes": 350, "shares": 350, "comments": 0}, "stumbledupon": {"shares": 0}}, "site_full": "www.vanguardngr.com", "main_image": "http://www.vanguardngr.com/vangurad.png", "site_section": "http://www.vanguardngr.com/feed", "section_title": "Vanguard News", "url": "http://www.vanguardngr.com/2017/03/lumen-christi-bags-overall-best-result-2016-wassce/", "country": "US", "domain_rank": 2203, "title": "Lumen Christi bags overall best result in 2016 WASSCE", "performance_score": 3, "site": "vanguardngr.com", "participants_count": 1, "title_full": "Lumen Christi bags overall best result in 2016 WASSCE", "spam_score": 0.0, "site_type": "blogs", "published": "2017-03-30T09:58:00.000+03:00", "replies_count": 0, "uuid": "a9e43e8ac585cde71d30065d918c6e2f81d988ec"}, "author": "Nwafor Polycarp", "url": "http://www.vanguardngr.com/2017/03/lumen-christi-bags-overall-best-result-2016-wassce/", "ord_in_thread": 0, "title": "Lumen Christi bags overall best result in 2016 WASSCE", "locations": [], "entities": {"persons": [{"name": "lumen christi", "sentiment": "positive"}, {"name": "osinbajo", "sentiment": "none"}, {"name": "ayodeji oluwafisayomi", "sentiment": "none"}, {"name": "adeloye ope", "sentiment": "none"}, {"name": "nwafor polycarp", "sentiment": "none"}, {"name": "yemi osinbajo", "sentiment": "none"}, {"name": "ishola adedapo", "sentiment": "none"}], "locations": [{"name": "liberia", "sentiment": "none"}, {"name": "ghana", "sentiment": "none"}, {"name": "nigeria", "sentiment": "none"}, {"name": "lagos", "sentiment": "none"}, {"name": "abuja", "sentiment": "none"}, {"name": "monrovia", "sentiment": "none"}, {"name": "uromi", "sentiment": "none"}, {"name": "yaba", "sentiment": "none"}, {"name": "edo state", "sentiment": "none"}], "organizations": [{"name": "waec", "sentiment": "none"}, {"name": "loyola jesuit college", "sentiment": "none"}, {"name": "annual council", "sentiment": "none"}, {"name": "providence emmanuel  lumen christi international high school", "sentiment": "none"}, {"name": "queens college", "sentiment": "none"}]}, "highlightText": "", "language": "english", "persons": [], "text": "Home » News » Lumen Christi bags overall best result in 2016 WASSCE Lumen Christi bags overall best result in 2016 WASSCE On 2:58 am In News   \nBy Providence Emmanuel \nLumen Christi International High School, Uromi, Edo State, has emerged the overall best performing school in the country by winning the Augustus Bandele Oyediran trophy for producing the best overall results in the 2016 West African Secondary School Certificate Examination, WASSCE. \nThe school emerged winner with best aggregate, determined on the results of best 50 candidates based on their grades in English Language, Mathematics and a Science subject, to cling the prestigious awards instituted in 1985. \nFrom 1985 till date, only 12 schools have won the award: Queens College, Yaba, Lagos, won the maiden edition, five consecutive times, is Loyola Jesuit College, among others. \nThere were also awards for individual performance in the international, national and sub-regional categories. The first international award for 1985 examination was presented in Monrovia, Liberia, in 1986, where Nigeria took the maiden award with Ishola Adedapo taking the star prize. Since then the competition for top spots has always been between Nigeria and Ghana but Nigeria was dominant between 1999 and 2008. From 2008, Ghana took over the international category carting away the three top spots except in 2011 when Miss Adeloye Ope, took the third position. And the latest with Ayodeji Oluwafisayomi coming second. \nSpeaking at the 65th WAEC’s Annual Council meeting in Abuja, Vice President, Yemi Osinbajo, said that the current method of teaching was defective as students lack capacity of critical thinking for solution to problems. \nOsinbajo added that it was expedient for educators to break from the past by setting a moral and ethical standard to define success. Nwafor Polycarp", "external_links": [], "published": "2017-03-30T09:58:00.000+03:00", "crawled": "2017-03-30T04:46:29.897+03:00", "highlightTitle": ""}