{"organizations": [], "uuid": "8d2eeefefcca62f36f056d4514ca1fa69e8c0df3", "thread": {"social": {"gplus": {"shares": 0}, "pinterest": {"shares": 1}, "vk": {"shares": 0}, "linkedin": {"shares": 0}, "facebook": {"likes": 154, "shares": 154, "comments": 19}, "stumbledupon": {"shares": 0}}, "site_full": "www.buzzfeed.com", "main_image": "https://img.buzzfeed.com/buzzfeed-static/static/2017-03/22/13/tmp/buzzfeed-prod-fastlane-02/069830a4f7914fd73a7222d1819fc95d-5.jpg?crop=554:290;0,0", "site_section": "http://www.buzzfeed.com//index.xml", "section_title": "BuzzFeed - Latest", "url": "https://www.buzzfeed.com/annakopsky/tonguetacle", "country": "US", "domain_rank": 137, "title": "18 Bizarre Sex Toys That'll Confuse The Hell Out Of You", "performance_score": 1, "site": "buzzfeed.com", "participants_count": 1, "title_full": "18 Bizarre Sex Toys That'll Confuse The Hell Out Of You", "spam_score": 0.0, "site_type": "blogs", "published": "2017-03-24T07:31:00.000+03:00", "replies_count": 0, "uuid": "8d2eeefefcca62f36f056d4514ca1fa69e8c0df3"}, "author": "Anna Kopsky", "url": "https://www.buzzfeed.com/annakopsky/tonguetacle", "ord_in_thread": 0, "title": "18 Bizarre Sex Toys That'll Confuse The Hell Out Of You", "locations": [], "entities": {"persons": [{"name": "chrissy smyth", "sentiment": "none"}, {"name": "katherine haché", "sentiment": "none"}, {"name": "tony cox", "sentiment": "none"}, {"name": "piggie", "sentiment": "none"}, {"name": "anna kopsky", "sentiment": "none"}, {"name": "—ale garcia", "sentiment": "none"}, {"name": "—kelly hutchins", "sentiment": "none"}, {"name": "kelly hutchins", "sentiment": "none"}, {"name": "dong fister", "sentiment": "none"}, {"name": "kitty vibrator", "sentiment": "none"}, {"name": "alaea roberts", "sentiment": "none"}], "locations": [{"name": "amazon", "sentiment": "none"}], "organizations": [{"name": "facebook available", "sentiment": "none"}, {"name": "buzzfeed community on facebook", "sentiment": "none"}, {"name": "alc", "sentiment": "none"}, {"name": "etsy", "sentiment": "none"}, {"name": "facebook sadly", "sentiment": "none"}, {"name": "facebook available on amazon", "sentiment": "none"}]}, "highlightText": "", "language": "english", "persons": [], "text": "View this image › \ninstagram.com / instagram.com — es174874 \nAvailable on Amazon for $42.85.\nID: 10733818 2. Seadragon Lil’ Squirt, a somewhat ~smaller~ dildo that ejaculates lube into you. View this image › \nbad-dragon.com — Shush1988 \nAvailable from Bad Dragon starting at $35.\nID: 10740880 3. The Electroshock Stimulation Kit you can stick any place on your body where you want to feel a shock. View this image › \ndhgate.com / dhgate.com You can also use the plug if you’d like more of an… internal experience.\n—Kelly Hutchins, Facebook\nAvailable on Amazon for $58.99.\nID: 10734117 4. The Handie, which claims to be even better than your own hand at jacking you off. View this image › \nyoutube.com / instagram.com Complete with self-lube and a tight grip.\n—Ale Garcia, Facebook\nSadly, it’s no longer available.\nID: 10743253 5. The Zombie Fleshlight, which works just like a normal Fleshlight — except it’s spookier. View this image › \nfleshlight.com — ghost25025 \nAvailable from Fleshlight for $72.95.\nID: 10741450 6. The vibrating tongue ring, which undoubtedly makes oral sex more fun. View this image › \ninstagram.com / bodycandy.com —Katherine Haché, Facebook\nAvailable from Body Candy for $19.99.\nID: 10734122 7. These mystical dragon dildos and tails. View this image › \nbad-dragon.com / bad-dragon.com — idroppedmytaco \nAvailable from Bad Dragon from $55 (for the purple tail ) and from $70 (for the dragon penis ).\nID: 10740955 8. The Area 51 Love Doll, an ~out of this world~ blow-up doll. You know what it’s for. View this image › \namazon.com —Chrissy Smyth, Facebook\nSadly, it’s no longer available.\nID: 10743330 9. The Werewolf Muzzle, which isn’t for your face — you put a penis in it. View this image › \nbad-dragon.com —Katherine Haché, Facebook\nAvailable from Bad Dragon for $130.\nID: 10740902 10. The Grim Reaper Dildo, which is a little ominous but also… exciting, tbh. View this image › \nninjasexology.com / sextoyreviewland.blogspot.com —Tony Cox, Facebook\nAvailable from Divine Interventions for $59.\nID: 10740657 11. The Screaming O Mini Octopus Vibrator, which has tiny tentacles to add just the right amount of sensation. View this image › \naliexpress.com —Alaea Roberts, Facebook\nSadly, it’s no longer available.\nID: 10741542 12. The Dildo Sword, which is just a dildo with cool handles, m’ladies and good sirs. View this image › \nblissfullyorgasmic.com / geekysextoys.com — stunningepiphanies \nBlack glass sword available from Glassvibrations for $49 and gray and blue silicone sword from Etsy for $120.\nID: 10733872 13. The Half Pup Mask, for when you want to role play on all fours. View this image › \nprimalhardwere.com — elizabethb44 \nAvailable from Primal Hardwere from $200.\nID: 10741352 14. The Hello Kitty Vibrator, so you can let your quirky personality shine while experiencing your big O. View this image › \nTwitter: @hanleia / instagram.com —Kelly Hutchins, Facebook\nSadly, it’s no longer available.\nID: 10733801 15. The Mythos Dildo, for people who really want to prove how much they love monstrous-looking creatures. View this image › \netsy.com — Anna Kopsky \nCustom styles available from Etsy starting at $150.\nID: 10733861 16. The Erotic Love Piggie, which is literally an inflatable pig sex doll wearing makeup. Not judging. View this image › \namazing.net / foxysextoys.com — ALC \nAvailable from Amazon for $11.71.\nID: 10733836 17. The Rascal Double Dong Fister, meant to just shove right in so you can enjoy maximum pleasure. View this image › \namazon.com / amazon.com — bocalauren \nAvailable from Love Is Love for $199.\nID: 10733918 18. And the Tonguetacle, inspired by hentai fantasies, which allows you to lick yourself — anywhere. View this image › \nTwitter: @Curious_Kitt / primalhardwere.com — elizabethb44 \nAvailable from Primal Hardwere for $130.\nID: 10741331 You can see more insanely unique sex toys here . ID: 10743563 Want to be featured on BuzzFeed? Follow the BuzzFeed Community on Facebook and Twitter ! ID: 10743566 Check out more articles on BuzzFeed.com!", "external_links": [], "published": "2017-03-24T07:31:00.000+03:00", "crawled": "2017-03-23T23:46:36.092+02:00", "highlightTitle": ""}