{"organizations": [], "uuid": "bd75de7820cb7eae3e385ed0b7f78a663cd9a52c", "thread": {"social": {"gplus": {"shares": 4}, "pinterest": {"shares": 1}, "vk": {"shares": 0}, "linkedin": {"shares": 0}, "facebook": {"likes": 747, "shares": 747, "comments": 0}, "stumbledupon": {"shares": 0}}, "site_full": "www.geo.tv", "main_image": "https://www.geo.tv/assets/uploads/updates/2017-03-23/135237_013528_updates.jpg", "site_section": "http://feeds.feedburner.com/GeoBulletins", "section_title": "GEO TV - Pakistan", "url": "https://www.geo.tv/latest/135237-77th-Pakistan-Day-celebration-to-begin-with-military-parade", "country": "TV", "domain_rank": 8287, "title": "77th Pakistan Day celebration to begin with military parade", "performance_score": 7, "site": "geo.tv", "participants_count": 0, "title_full": "77th Pakistan Day celebration to begin with military parade", "spam_score": 0.0, "site_type": "blogs", "published": "2017-03-23T08:29:00.000+02:00", "replies_count": 0, "uuid": "bd75de7820cb7eae3e385ed0b7f78a663cd9a52c"}, "author": "", "url": "https://www.geo.tv/latest/135237-77th-Pakistan-Day-celebration-to-begin-with-military-parade", "ord_in_thread": 0, "title": "77th Pakistan Day celebration to begin with military parade", "locations": [], "entities": {"persons": [{"name": "li keqianghas", "sentiment": "none"}, {"name": "asif ghafoor", "sentiment": "none"}, {"name": "coas qamar javed bajwa", "sentiment": "none"}, {"name": "mohammad zakaullah", "sentiment": "none"}, {"name": "shaheen", "sentiment": "none"}, {"name": "mamnoon hussain", "sentiment": "none"}, {"name": "nawaz sharif", "sentiment": "none"}, {"name": "khawaja asif", "sentiment": "none"}, {"name": "geo", "sentiment": "none"}, {"name": "li keqiang", "sentiment": "none"}, {"name": "muhammad nawaz sharif", "sentiment": "none"}, {"name": "qamar javed bajwa", "sentiment": "none"}], "locations": [{"name": "pakistan zindabad", "sentiment": "none"}, {"name": "pakistan", "sentiment": "none"}, {"name": "turkey", "sentiment": "none"}, {"name": "cpec", "sentiment": "none"}, {"name": "karachi", "sentiment": "none"}, {"name": "saudia arabia", "sentiment": "none"}, {"name": "parade avenue", "sentiment": "none"}, {"name": "china", "sentiment": "none"}], "organizations": [{"name": "pakistan army", "sentiment": "none"}, {"name": "ispr", "sentiment": "none"}, {"name": "muslim league", "sentiment": "none"}, {"name": "ispr", "sentiment": "none"}, {"name": "navy", "sentiment": "none"}, {"name": "china pakistan economic corridor", "sentiment": "none"}, {"name": "inter services public relations", "sentiment": "none"}, {"name": "air force", "sentiment": "none"}, {"name": "coas", "sentiment": "none"}, {"name": "pak air force", "sentiment": "none"}]}, "highlightText": "", "language": "english", "persons": [], "text": "77th Pakistan Day celebration to begin with military parade | Pakistan Day Parade: Chinese troops arrive in Pakistan \nISLAMABAD: The annual Pakistan day parade will be held today in Parade Avenue near the landmark Shakarparian hills. \nPersonnel from all three services: Pakistan Army, Navy and Air Force, along with their counterparts from China, Saudia Arabia and Turkey will give their respective performances on the occasion. Pak Air Force`s jet, Shaheen, will also flypast over the skies of Karachi today. \nIn his special message on Pakistan Day, Chief of Army Staff (COAS) General Qamar Javed Bajwa called upon the entire nation saying “Let us pledge today to clean ‘our Pakistan’ from fasaadis.” \nAccording to a tweet by Director General Inter Services Public Relations (ISPR) Major General Asif Ghafoor, the COAS in his message on Pakistan Day said, on March 23, 1940 we pledged to create Pakistan. We honorably succeeded in creation of our homeland. Let us pledge again today that we shall clean our country from facetious, he said. “We all own Pakistan. Pakistan Zindabad,” \nPrime Minister Nawaz Sharif, President Mamnoon Hussain and Chief of Army Staff General Qamar Javed Bajwa will attend the ceremony along with Chief of Naval Staff Admiral Mohammad Zakaullah and Defence Minister Khawaja Asif. \nEarlier, Chinese Prime Minister Li Keqianghas extended his warm congratulations and best wishes to the government of Pakistan and Prime Minister Muhammad Nawaz Sharif on the occasion of 78th Pakistan Day. \nIn his message of felicitation to his Pakistani counterpart, the Chinese premier said in recent years, under the leadership of Your Excellency, the Pakistani people had properly responded to different kinds of challenges and made new achievements in maintaining national security, stability and economic development. \nHe said Pakistan relations maintained a rapid momentum of development and in particular, the construction of China Pakistan Economic Corridor moved forward steadily, and had played a demonstrative role for the mutually beneficial cooperation among China and other countries along the \"Belt and Road\". \nLi Keqiang said the Chinese government had always viewed and developed China-Pakistan relations from a strategic and long-term perspective. \nHe said China was willing to work with the Pakistani government to push forward China-Pakistan all-weather strategic cooperative partnership for new and continuous progress. \"May I wish Pakistan enjoy prosperity and its people well-being,\" the Chinese premier said. \nPakistan Day commemorates the passing of Lahore Resolution, under which a separate nation for the Muslims of The British Indian Empire demanded by Muslim League was passed on March 23, 1940. Every year the nation celebrates the day with extraordinary zeal. \n0 0 77th Pakistan Day celebration to begin with military parade   23,   23,   Pakistan Day, Pakistan, Pakistan News, Geo, Geo News, Coas Qamar Javed Bajwa, Ispr, China, Cpec, Pm Nawaz Sharif, Geo, Geo News.   \"77th Pakistan Day celebration to begin with military parade\" is https://www.geo.tv/latest/135237-77th-Pakistan-Day-celebration-to-begin-with-military-parade  ", "external_links": [], "published": "2017-03-23T08:29:00.000+02:00", "crawled": "2017-03-22T23:06:29.957+02:00", "highlightTitle": ""}