{"organizations": [], "uuid": "d2b40d030766da9c323c92ca3c9526f3a7fd13f7", "thread": {"social": {"gplus": {"shares": 0}, "pinterest": {"shares": 0}, "vk": {"shares": 0}, "linkedin": {"shares": 0}, "facebook": {"likes": 142, "shares": 142, "comments": 0}, "stumbledupon": {"shares": 0}}, "site_full": "www.rappler.com", "main_image": "https://assets.rappler.com/3FF35506E2054D1690A6E8FD81E2BF9B/img/78E2B8EA760A4DEB8BDF3195D8A53AB9/20170312-sinag1-001.jpg", "site_section": "http://feeds.feedburner.com/rappler/", "section_title": "RAPPLER", "url": "http://www.rappler.com/entertainment/news/163981-list-sinag-maynila-2017-winners", "country": "US", "domain_rank": 1586, "title": "FULL LIST: Winners, Sinag Maynila 2017", "performance_score": 1, "site": "rappler.com", "participants_count": 1, "title_full": "FULL LIST: Winners, Sinag Maynila 2017", "spam_score": 0.0, "site_type": "blogs", "published": "2017-03-12T16:49:00.000+02:00", "replies_count": 0, "uuid": "d2b40d030766da9c323c92ca3c9526f3a7fd13f7"}, "author": "Rappler.com", "url": "http://www.rappler.com/entertainment/news/163981-list-sinag-maynila-2017-winners", "ord_in_thread": 0, "title": "FULL LIST: Winners, Sinag Maynila 2017", "locations": [], "entities": {"persons": [{"name": "bhoy instik", "sentiment": "none"}, {"name": "james arvin rosendal", "sentiment": "none"}, {"name": "kristo best", "sentiment": "none"}, {"name": "tu pug imatuy", "sentiment": "none"}, {"name": "kristoffer king", "sentiment": "none"}, {"name": "karl barit", "sentiment": "none"}, {"name": "kristo", "sentiment": "none"}, {"name": "raymond", "sentiment": "none"}, {"name": "malona sulatan", "sentiment": "none"}, {"name": "avelino balmes jr", "sentiment": "none"}, {"name": "julio diaz", "sentiment": "none"}, {"name": "kristofer king", "sentiment": "none"}, {"name": "arnel mardoquio", "sentiment": "none"}, {"name": "arbi barbarona", "sentiment": "none"}, {"name": "raymond francisco", "sentiment": "none"}, {"name": "kristo  best", "sentiment": "none"}, {"name": "francisco", "sentiment": "none"}, {"name": "albert michael idioma", "sentiment": "none"}, {"name": "alexa villano/rappler", "sentiment": "none"}, {"name": "bhoy intsik", "sentiment": "none"}, {"name": "diego marx dobles", "sentiment": "none"}, {"name": "bryan jimenez", "sentiment": "none"}], "locations": [{"name": "philippines", "sentiment": "none"}, {"name": "manila", "sentiment": "none"}], "organizations": [{"name": "la la land", "sentiment": "none"}, {"name": "bhoy intsik  sm people's choice", "sentiment": "none"}, {"name": "samsung hall", "sentiment": "none"}]}, "highlightText": "", "language": "english", "persons": [], "text": "FULL LIST: Winners, Sinag Maynila 2017 'Tu Pug Imatuy' wins big at this year's awards night Published 10:02 PM, March 12, 2017 Updated 10:45 PM, March 12, 2017 BEST PICTURE. 'Tu Pug Imatuy' director Arbi Barbarona and the cast and crew of the film accepting the Best Picture award. Photo by Alexa Villano/Rappler \nMANILA, Philippines – The winners of the 2017 Sinag Maynila film festival were revealed on Sunday, March 12 at the Samsung Hall, SM Aura. \nThe movie Tu Pug Imatuy (The Right To Kill) won 6 awards, including Best Picture, Best Director, and Best Actress for Malona Sulatan. A post shared by @sinagmaynila on Mar 12, 2017 at 5:14am PDT \nActor Raymond \"RS\" Francisco won for his role in Bhoy Instik. He tied with Kristoffer King for the movie Kristo . \nRaymond, who has been acting since he was a kid, was emotional as he accepted the award. \n\"I just want to check the results. Baka ma-La La Land,\" Raymond said, refering to the recent Oscar's incident , wherein La La Land was mistakenly named as Best Picture, though the actual winner was Moonlight . Raymond Francisco and Malona Sulatan with their Best Actor awards. Photo by Alexa Villano/Rappler \n\"It's my first time na humawak ng (to hold an) award. I've been acting since I was 6 years old. This is the first time I got validated as an actor. Thank you to everybody,\" he said. \nHere is the list of winners. \nFull-length Film Best Film: Tu Pug Imatuy Best Actress: Malona Sulatan (Tu Pug Umatuy) Best Actor: Kristofer King, Kristo and Raymond Francisco, Bhoy Intsik Best Director: Arbi Barbarona, Tu Pug Imatuy Best Supporting Performance: Julio Diaz, Kristo Best Screenplay: Arnel Mardoquio, Tu Pug Imatuy Best Production Design: James Arvin Rosendal, Kristo Best Cinematography: Bryan Jimenez and Arbi Barbarona , Tu Pug Imatuy Best Editing: Diego Marx Dobles, Kristo Best Music: Arbi Barbarona , Tug Pug Imatuy Best Sound: Albert Michael Idioma, Kristo \nBest Documentary: Avelino Balmes Jr , Hango \nShort Film: Karl Barit, Aliens Ata \nSinag Box Office: Bhoy Intsik \nSM People's Choice: Beyond The Block \n– Rappler.com HOW DOES THIS STORY MAKE YOU FEEL? Happy", "external_links": [], "published": "2017-03-12T16:49:00.000+02:00", "crawled": "2017-03-12T19:18:01.265+02:00", "highlightTitle": ""}