{"organizations": [], "uuid": "227c751c285357afe384b5f4de5b37cd3cace436", "thread": {"social": {"gplus": {"shares": 0}, "pinterest": {"shares": 0}, "vk": {"shares": 0}, "linkedin": {"shares": 0}, "facebook": {"likes": 244, "shares": 244, "comments": 0}, "stumbledupon": {"shares": 0}}, "site_full": "www.rappler.com", "main_image": "https://assets.rappler.com/9D955D681CCD406BB7985DC216F7F175/img/E3EA91EB8152484A922751A3184BD395/Cotabato-bus.jpg", "site_section": "http://feeds.feedburner.com/rappler/", "section_title": "RAPPLER", "url": "http://www.rappler.com/nation/164030-bus-north-cotabato-burned-down", "country": "US", "domain_rank": 1586, "title": "Alleged NPA rebels burn bus in North Cotabato", "performance_score": 2, "site": "rappler.com", "participants_count": 1, "title_full": "Alleged NPA rebels burn bus in North Cotabato", "spam_score": 0.0, "site_type": "blogs", "published": "2017-03-13T09:58:00.000+02:00", "replies_count": 0, "uuid": "227c751c285357afe384b5f4de5b37cd3cace436"}, "author": "Editha Z. Caduaya", "url": "http://www.rappler.com/nation/164030-bus-north-cotabato-burned-down", "ord_in_thread": 0, "title": "Alleged NPA rebels burn bus in North Cotabato", "locations": [], "entities": {"persons": [{"name": "caoagdan", "sentiment": "none"}, {"name": "rappler", "sentiment": "none"}, {"name": "villarin", "sentiment": "none"}, {"name": "nagdagan", "sentiment": "none"}, {"name": "rudy s. caoagdan", "sentiment": "none"}, {"name": "aceh villarin", "sentiment": "none"}, {"name": "romeo galgo jr", "sentiment": "none"}], "locations": [{"name": "north cotabato philippines", "sentiment": "none"}, {"name": "north cotabato", "sentiment": "none"}, {"name": "makilala", "sentiment": "none"}, {"name": "philippines", "sentiment": "none"}, {"name": "bagong silang", "sentiment": "none"}, {"name": "davao city", "sentiment": "none"}, {"name": "republic of the philippines", "sentiment": "none"}, {"name": "lima", "sentiment": "none"}, {"name": "barangay bagong silang", "sentiment": "none"}, {"name": "tacurong-davao", "sentiment": "none"}], "organizations": [{"name": "npa", "sentiment": "negative"}, {"name": "yellow bus lines", "sentiment": "none"}, {"name": "cpp", "sentiment": "none"}, {"name": "new people's army", "sentiment": "none"}, {"name": "communist party of the philippines", "sentiment": "none"}, {"name": "ndf", "sentiment": "none"}]}, "highlightText": "", "language": "english", "persons": [], "text": "Philippines Alleged NPA rebels burn bus in North Cotabato The incident occurs just days after the communist rebels and the Philippine government announced the resumption of formal peace negotiations Published 11:29 AM, March 13, 2017 Updated 11:55 AM, March 13, 2017 \nDAVAO CITY, Philippines – Alleged members of the communist New People's Army (NPA) torched a bus plying the Tacurong-Davao route on Monday, March 13. \nThe incident occurred at around 8:45 am Monday along the highway in Bagong Silang, Makilala, North Cotabato. Barangay Bagong Silang is just 3 kilometers away from the Makilala bus terminal. \nSuperintendent Romeo Galgo Jr, regional police spokesman, blamed the NPA for the attack. \nAceh Villarin and her 3-year-old daughter were among the estimated 50 passengers of the bus, which is owned by Yellow Bus Lines. \nVillarin said the suspects were all in the bus, one of whom suddenly asked the bus driver to stop. \" Nagdagan ang bus, naay Lima ka armadong lalaki ning tindog, ang isa misinggit, Sige naug na mong tanan, Ayaw mo ug kahadluk, Ayaw mo ug kabalaka, ang among tuyo kining bus lang ,\" Villarin told Rappler. \n(While the bus was running, 5 armed men stood up, one of them shouted, everyone disembark, do not be scared, do not be afraid, Do not worry, we just want the bus.) \n\"We were scared but they told us to disembark so we followed the order,\" she said in the local dialect. \n\"It is very unfortunate this incident happened when we just learned that the talks between the CPP [Communist Party of the Philippines] and the GRP [Government of the Republic of the Philippines] is about to resume,\" Makilala Municipal Mayor Rudy S. Caoagdan told Rappler. (READ: PH, NDF agree to resume formal peace talks ) \n\"It is very unfortunate. I cannot feel the sincerity,\" Caoagdan said. – Rappler.com HOW DOES THIS STORY MAKE YOU FEEL? Happy", "external_links": [], "published": "2017-03-13T09:58:00.000+02:00", "crawled": "2017-03-13T09:00:33.626+02:00", "highlightTitle": ""}