{"organizations": [], "uuid": "d60e43d483c76468a115e7bb81c5babea0d58a0e", "thread": {"social": {"gplus": {"shares": 0}, "pinterest": {"shares": 0}, "vk": {"shares": 0}, "linkedin": {"shares": 0}, "facebook": {"likes": 351, "shares": 351, "comments": 0}, "stumbledupon": {"shares": 0}}, "site_full": "www.independent.ie", "main_image": "http://www.independent.ie/world-news/north-america/article35522342.ece/ALTERNATES/h342/Matt.jpg", "site_section": "http://www.independent.ie/rss", "section_title": "Independent.ie - Independent.ie RSS Feed", "url": "http://www.independent.ie/world-news/north-america/dad-found-dead-four-days-after-he-disappeared-from-lake-leaving-son-2-alone-in-the-woods-35522343.html", "country": "IE", "domain_rank": 3626, "title": "Dad found dead four days after he disappeared from lake leaving son (2) alone in the woods", "performance_score": 3, "site": "independent.ie", "participants_count": 0, "title_full": "Dad found dead four days after he disappeared from lake leaving son (2) alone in the woods", "spam_score": 0.0, "site_type": "blogs", "published": "2017-03-12T02:48:00.000+02:00", "replies_count": 0, "uuid": "d60e43d483c76468a115e7bb81c5babea0d58a0e"}, "author": "", "url": "http://www.independent.ie/world-news/north-america/dad-found-dead-four-days-after-he-disappeared-from-lake-leaving-son-2-alone-in-the-woods-35522343.html", "ord_in_thread": 0, "title": "Dad found dead four days after he disappeared from lake leaving son (2) alone in the woods", "locations": [], "entities": {"persons": [{"name": "independe", "sentiment": "negative"}, {"name": "oliver", "sentiment": "none"}, {"name": "meinert", "sentiment": "none"}, {"name": "matt", "sentiment": "none"}, {"name": "matty", "sentiment": "none"}, {"name": "oliver photo", "sentiment": "none"}, {"name": "matthew meinert", "sentiment": "none"}, {"name": "matthew", "sentiment": "none"}], "locations": [{"name": "grapevine lake", "sentiment": "none"}, {"name": "denton creek", "sentiment": "none"}, {"name": "texas", "sentiment": "none"}], "organizations": [{"name": "tarrant county medical examiner", "sentiment": "none"}, {"name": "texas parks and wildlife department", "sentiment": "none"}, {"name": "trophy club police department", "sentiment": "none"}]}, "highlightText": "", "language": "english", "persons": [], "text": "Dad found dead four days after he disappeared from lake leaving son (2) alone in the woods Independent.ie A 38-year-old dad was found dead four days after he vanished from a fishing trip with his young son. http://www.independent.ie/world-news/north-america/dad-found-dead-four-days-after-he-disappeared-from-lake-leaving-son-2-alone-in-the-woods-35522343.html http://www.independent.ie/world-news/north-america/article35522342.ece/9a3f4/AUTOCROP/h342/Matt.jpg Matthew Meinert with son Oliver Photo: Trophy Club Police Department A 38-year-old dad was found dead four days after he vanished from a fishing trip with his young son. \nMatthew Meinert went missing from the Grapevine Lake in Texas where he was on a fishing trip with his son Oliver. \nPolice received a 911 call on Monday March 6 saying his fishing boat had been discovered on the shore of the lake. \nTwo-year-old Oliver was found on Tuesday wandering on his own with cuts and scratches. He was taken to hospital and was reunited with his mum Autumn. \nOn Friday night, after an extensive search, Matthew's body was recovered from the water. \nTrophy Club Police Department confirmed the discovery. \nA statement read: \"At approximately 5.58pm on Friday, March 10, 2017, 38-year-old Matthew Meinert was discovered deceased in Denton Creek by the Texas Parks and Wildlife Department. \n\"The Tarrant County Medical Examiner has scheduled an autopsy and the cause of death is pending. No foul play is suspected. \n\"Game Wardens recovered the body in approximately 6 feet of water near the area Meinert’s boat was located on Monday, March 6, 2017. \" \nA Go-Fund-Me page has been set up to help support the family. \n\"It is something you can do to give back to Matt, Autumn, Oliver, and the entire Meinert family to show support for them as they endure this nightmare that is their reality,\" the page reads. \n\"If you know Matty, then you know what an amazing soul he is. Gregarious, charming, kind hearted. His love for his family is one of his most admirable qualities.\" Online Editors Follow @Independent_ie Your Comments Comments that are judged to be defamatory, abusive or in bad taste are not acceptable and contributors who consistently fall below certain criteria will be permanently blacklisted. Comments must be concise and to the point. The moderator will not enter into debate with individual contributors and the moderator’s decision is final. The comment facility is removed after 48 hours.", "external_links": [], "published": "2017-03-12T02:48:00.000+02:00", "crawled": "2017-03-12T03:56:41.167+02:00", "highlightTitle": ""}