{"organizations": [], "uuid": "aeefeb4a297546351b7969371e27f40b58061e23", "thread": {"social": {"gplus": {"shares": 0}, "pinterest": {"shares": 0}, "vk": {"shares": 0}, "linkedin": {"shares": 0}, "facebook": {"likes": 125, "shares": 125, "comments": 0}, "stumbledupon": {"shares": 0}}, "site_full": "www.geo.tv", "main_image": "https://www.geo.tv/assets/uploads/updates/2017-03-29/135924_124735_updates.jpg", "site_section": "http://feeds.feedburner.com/GeoBulletins", "section_title": "GEO TV - World", "url": "https://www.geo.tv/latest/135924-Complete-shutdown-in-Srinagar-over-killing-of-four-Kashmir-youths", "country": "TV", "domain_rank": 8287, "title": "Complete shutdown in Srinagar over killing of four Kashmir youths", "performance_score": 1, "site": "geo.tv", "participants_count": 0, "title_full": "Complete shutdown in Srinagar over killing of four Kashmir youths", "spam_score": 0.0, "site_type": "blogs", "published": "2017-03-29T20:43:00.000+03:00", "replies_count": 0, "uuid": "aeefeb4a297546351b7969371e27f40b58061e23"}, "author": "", "url": "https://www.geo.tv/latest/135924-Complete-shutdown-in-Srinagar-over-killing-of-four-Kashmir-youths", "ord_in_thread": 0, "title": "Complete shutdown in Srinagar over killing of four Kashmir youths", "locations": [], "entities": {"persons": [{"name": "kashmiri", "sentiment": "none"}, {"name": "ashfaz ahmad", "sentiment": "none"}, {"name": "muhammad yasin malik", "sentiment": "none"}, {"name": "mirwaiz umar farooq", "sentiment": "none"}, {"name": "saqib ahmad", "sentiment": "none"}, {"name": "zahid rashid", "sentiment": "none"}, {"name": "yasin malik", "sentiment": "none"}, {"name": "syed ali gilani", "sentiment": "none"}], "locations": [{"name": "srinagar", "sentiment": "none"}, {"name": "kashmir", "sentiment": "none"}, {"name": "srinagar", "sentiment": "none"}, {"name": "chadoora", "sentiment": "none"}, {"name": "budgam", "sentiment": "none"}, {"name": "india", "sentiment": "none"}], "organizations": [{"name": "latest pakistan news", "sentiment": "none"}]}, "highlightText": "", "language": "english", "persons": [], "text": "Complete shutdown in Srinagar over killing of four Kashmir youths | 0 0 \nSRINAGAR: A complete shutdown is being observed in occupied Kashmir over the killing of four Kashmiri youths by Indian troops in Chadoora area of Budgam district. \nIndian troops shot dead three youths Zahid Rashid, Saqib Ahmad and Ashfaz Ahmad, on Tuesday as they held a demonstration at Chadoora, the Kashmir media service said. Another youth was martyred when Indian police attack a house in the area. \nOver 30 people sustained injuries. \nThe strike call has been given by Kashmiri leader Syed Ali Gilani, Mirwaiz Umar Farooq and Muhammad Yasin Malik. Shops, schools and businesses have been close while traffic is off the roads. \nMeanwhile, the Indian government has imposed curfew-like restrictions to stop people from staging anti-India demonstrations. \n0 0 Complete shutdown in Srinagar over killing of four Kashmir youths was posted in world   Budgam, Chadoora, India, Kashmir, Latest Geo News, Latest Pakistan News, Mirwaiz Umar Farooq, Yasin Malik.   \"Complete shutdown in Srinagar over killing of four Kashmir youths\" is https://www.geo.tv/latest/135924-Complete-shutdown-in-Srinagar-over-killing-of-four-Kashmir-youths . More From World:", "external_links": [], "published": "2017-03-29T20:43:00.000+03:00", "crawled": "2017-03-29T11:05:46.885+03:00", "highlightTitle": ""}