{"organizations": [], "uuid": "32e17043cc2cbfe8b1ce9a230bce1410e26681b8", "thread": {"social": {"gplus": {"shares": 0}, "pinterest": {"shares": 0}, "vk": {"shares": 0}, "linkedin": {"shares": 4}, "facebook": {"likes": 256, "shares": 256, "comments": 0}, "stumbledupon": {"shares": 0}}, "site_full": "www.philly.com", "main_image": "http://media.philly.com/images/moar-render-1200.jpg", "site_section": "", "section_title": "", "url": "http://www.philly.com/philly/blogs/entertainment/Joe-Biden-to-speak-at-opening-of-the-Museum-of-the-American-Revolution.html", "country": "US", "domain_rank": 3314, "title": "Joe Biden to speak at opening of the Museum of the American Revolution", "performance_score": 2, "site": "philly.com", "participants_count": 0, "title_full": "Joe Biden to speak at opening of the Museum of the American Revolution", "spam_score": 0.478, "site_type": "blogs", "published": "2017-03-23T02:03:00.000+02:00", "replies_count": 0, "uuid": "32e17043cc2cbfe8b1ce9a230bce1410e26681b8"}, "author": "Nick Vadala", "url": "http://www.philly.com/philly/blogs/entertainment/Joe-Biden-to-speak-at-opening-of-the-Museum-of-the-American-Revolution.html", "ord_in_thread": 0, "title": "Joe Biden to speak at opening of the Museum of the American Revolution", "locations": [], "entities": {"persons": [{"name": "joe biden", "sentiment": "neutral"}, {"name": "david mccullough", "sentiment": "none"}, {"name": "nick vadala", "sentiment": "none"}, {"name": "cokie roberts", "sentiment": "none"}, {"name": "nick vadala arrow", "sentiment": "none"}, {"name": "hamilton", "sentiment": "none"}, {"name": "james harcourt", "sentiment": "none"}, {"name": "h.f. gerry lenfest", "sentiment": "none"}, {"name": "mccullough", "sentiment": "none"}, {"name": "kate bedingfield", "sentiment": "none"}, {"name": "quin", "sentiment": "none"}, {"name": "john p. jumper", "sentiment": "none"}, {"name": "michael quinn", "sentiment": "none"}, {"name": "roberts", "sentiment": "none"}, {"name": "biden", "sentiment": "none"}], "locations": [{"name": "philadelphia", "sentiment": "none"}, {"name": "philly.com", "sentiment": "none"}, {"name": "washington square", "sentiment": "none"}, {"name": "broadway", "sentiment": "none"}, {"name": "independence hall", "sentiment": "none"}, {"name": "sydney", "sentiment": "none"}], "organizations": [{"name": "daily news", "sentiment": "none"}, {"name": "university of delaware", "sentiment": "none"}, {"name": "american revolution", "sentiment": "none"}, {"name": "university of pennsylvania", "sentiment": "none"}, {"name": "philly.com", "sentiment": "none"}, {"name": "inquirer", "sentiment": "none"}]}, "highlightText": "", "language": "english", "persons": [], "text": "Joe Biden to speak at opening of the Museum of the American Revolution Updated: March 22, 2017 — 5:58 PM EDT 78 Share \nNick Vadala writes about food and entertainment for Philly.com. More by Nick Vadala Arrow icon \nThe Museum of the American Revolution will welcome former Vice President Joe Biden as a speaker at its opening day on Wednesday, April 19. \nPulitzer prize-winning writer David McCullough and political commentator Cokie Roberts will also speak. Tickets for the event are required, and will be made available via an NBC10 contest, running April 3 to 14 . General admission tickets to enter the museum (but not attend the opening ceremony) are currently available online. \n“Vice President Biden has worked tirelessly on both sides of the aisle at the highest levels of government, and is committed to the Philadelphia region,” museum president and CEO Michael Quinn said via a release. “With a passion for education and deep appreciation for history, he embodies the Museum’s mission to instill the lessons of liberty in every rising generation.” \nThe opening ceremony’s events will begin April 19 at 8 a.m., with a ribbon-cutting scheduled for 10:30 a.m. in the Museum’s outdoor plaza. Prior to the ribbon-cutting, a the ceremony will feature an opening program that runs from Washington Square to Independence Hall. \nIn addition to Biden, McCullough, and Roberts speaking on opening day, Founding Museum Chairman Emeritus H.F. Gerry Lenfest, Museum chairman General John P. Jumper , and CEO Quin will also address attendees. Hamilton’s Sydney James Harcourt will be on hand to perform songs from the hit Broadway show. \nFormer Vice President Biden earlier this year revealed that he would join the staff at the University of Pennsylvania and the University of Delaware. Spokeswoman Kate Bedingfield told the Inquirer last month that Biden will be at each campus approximately one day a week. Read more by Nick Vadala Published: March 22, 2017 — 3:22 PM EDT | Updated: March 22, 2017 — 5:58 PM EDT Do you have a minute?... \nOver the past year, the Inquirer, the Daily News and Philly.com have uncovered corruption in local and state public offices, shed light on hidden and dangerous environmental risks, and deeply examined the region’s growing heroin epidemic. This is indispensable journalism, brought to you by the largest, most experienced newsroom in the region. Fact-based journalism of this caliber isn’t cheap. We need your support to keep our talented reporters, editors and photographers holding government accountable, looking out for the public interest, and separating fact from fiction. If you already subscribe, thank you. If not, please consider doing so by clicking on the button below. Subscriptions can be home delivered in print, or digitally read on nearly any mobile device or computer, and start as low as 25¢ per day. We're thankful for your support in every way. We encourage respectful comments but reserve the right to delete anything that doesn't contribute to an engaging dialogue Help us moderate this thread by flagging comments that violate our guidelines Commenting policy | Comments FAQ Comment policy: \nPhilly.com comments are intended to be civil, friendly conversations. Please treat other participants with respect and in a way that you would want to be treated. You are responsible for what you say. And please, stay on topic. If you see an objectionable post, please report it to us using the \"Report Abuse\" option. \nPlease note that comments are monitored by Philly.com staff. We reserve the right at all times to remove any information or materials that are unlawful, threatening, abusive, libelous, defamatory, obscene, vulgar, pornographic, profane, indecent or otherwise objectionable. Personal attacks, especially on other participants, are not permitted. We reserve the right to permanently block any user who violates these terms and conditions. \nAdditionally comments that are long, have multiple paragraph breaks, include code, or include hyperlinks may not be posted. ", "external_links": [], "published": "2017-03-23T02:03:00.000+02:00", "crawled": "2017-03-23T03:11:01.337+02:00", "highlightTitle": ""}