{"organizations": [], "uuid": "3d721d4fd002c5f24431a8452677087ee042519f", "thread": {"social": {"gplus": {"shares": 1}, "pinterest": {"shares": 0}, "vk": {"shares": 0}, "linkedin": {"shares": 1}, "facebook": {"likes": 618, "shares": 618, "comments": 5}, "stumbledupon": {"shares": 0}}, "site_full": "www.usatoday.com", "main_image": "http://www.gannett-cdn.com/-mm-/fee989da1ebc13fc0c39d509b2fffc330adb62b6/c=0-98-2934-1755&amp;r=x633&amp;c=1200x630/local/-/media/USATODAY/USATODAY/2014/04/25//1398478293005-AP-OBAMA-31042539.JPG", "site_section": "http://rssfeeds.usatoday.com/UsatodaycomBooks-TopStories", "section_title": "GANNETT Syndication Service", "url": "http://www.usatoday.com/story/life/books/2017/03/13/obama-books-to-be-published-worldwide-from-ireland-to-india/99116268/", "country": "US", "domain_rank": 313, "title": "Barack, Michelle Obama books will be published worldwide", "performance_score": 6, "site": "usatoday.com", "participants_count": 1, "title_full": "Barack, Michelle Obama books will be published worldwide", "spam_score": 0.0, "site_type": "blogs", "published": "2017-03-13T20:49:00.000+02:00", "replies_count": 0, "uuid": "3d721d4fd002c5f24431a8452677087ee042519f"}, "author": "The Associated Press", "url": "http://www.usatoday.com/story/life/books/2017/03/13/obama-books-to-be-published-worldwide-from-ireland-to-india/99116268/", "ord_in_thread": 0, "title": "Barack, Michelle Obama books will be published worldwide", "locations": [], "entities": {"persons": [{"name": "michelle obama", "sentiment": "negative"}, {"name": "barack", "sentiment": "negative"}, {"name": "charles dharapak", "sentiment": "none"}], "locations": [{"name": "south america", "sentiment": "none"}, {"name": "mexico", "sentiment": "none"}, {"name": "u.s.", "sentiment": "none"}, {"name": "canada", "sentiment": "none"}, {"name": "spain", "sentiment": "none"}, {"name": "ireland", "sentiment": "none"}, {"name": "cinco de mayo", "sentiment": "none"}, {"name": "australia", "sentiment": "none"}, {"name": "south africa", "sentiment": "none"}, {"name": "united kingdom", "sentiment": "none"}, {"name": "india", "sentiment": "none"}], "organizations": [{"name": "financial times", "sentiment": "none"}, {"name": "penguin random house", "sentiment": "none"}, {"name": "associated press", "sentiment": "none"}, {"name": "facebook barack", "sentiment": "none"}, {"name": "usa today", "sentiment": "none"}]}, "highlightText": "", "language": "english", "persons": [], "text": "  Barack, Michelle Obama books will be published worldwide The publishing of the upcoming books by the former president and first lady will be a global event. Post to Facebook Barack, Michelle Obama books will be published worldwide The publishing of the upcoming books by the former president and first lady will be a global event.  //usat.ly/2mBR1Ga   1   Barack, Michelle Obama books will be published worldwide The Associated Press 9:49 a.m. ET March 13, 2017 The first lady wore florals at a celebration of Cinco de Mayo in 2010. (Photo: Charles Dharapak AP) CONNECT 1 COMMENT EMAIL MORE \nThe publishing of the upcoming books by Barack and Michelle Obama will be a global event. \nPenguin Random House announced Monday that it has lined up publishers from Ireland to South Africa for the two books, to be released by the Crown imprint in the U.S. and Canada. \nTitles and release dates have not been announced. \nThe advance from Penguin Random House for the former president and first lady, whose popularity extends well beyond the U.S., is widely believed to be tens of millions of dollars. According to a report in the Financial Times , bidding for the two books topped $60 million. \nPenguin Random House acquired the books jointly last month. \nThe publisher has Spanish-language editions planned for Spain, Mexico and several countries in South America. English editions will come out in the United Kingdom, Australia, India and elsewhere. Deals for other countries are still pending. \nThe former president has written previous best sellers, including the memoir Dreams From My Father and The Audacity of Hope , both top 10 USA TODAY best sellers. Barack, Michelle Obama get book deals CONNECT 1 COMMENT EMAIL MORE \nCopyright 2017 The Associated Press. All rights reserved. This material may not be published, broadcast, rewritten or redistributed. Read or Share this story: http://usat.ly/2mBR1Ga USA Today's Best-Selling Books List", "external_links": [], "published": "2017-03-13T20:49:00.000+02:00", "crawled": "2017-03-13T16:38:45.991+02:00", "highlightTitle": ""}