{"organizations": [], "uuid": "b8e3e808ed429c92e60165d459666bf5d74ce44e", "thread": {"social": {"gplus": {"shares": 0}, "pinterest": {"shares": 0}, "vk": {"shares": 0}, "linkedin": {"shares": 0}, "facebook": {"likes": 830, "shares": 830, "comments": 4}, "stumbledupon": {"shares": 0}}, "site_full": "www.merdeka.com", "main_image": "https://cdns.klimg.com/merdeka.com/i/w/news/2017/03/22/824934/540x270/soal-fadli-zon-fahri-hamzah-kpk-bakal-pilah-kasusnya-dulu.jpg", "site_section": "http://www.merdeka.com/feed", "section_title": "Merdeka.com", "url": "https://www.merdeka.com/peristiwa/soal-fadli-zon-fahri-hamzah-kpk-bakal-pilah-kasusnya-dulu.html", "country": "ID", "domain_rank": 378, "title": "Soal Fadli Zon & Fahri Hamzah, KPK bakal pilah kasusnya dulu", "performance_score": 8, "site": "merdeka.com", "participants_count": 1, "title_full": "Soal Fadli Zon & Fahri Hamzah, KPK bakal pilah kasusnya dulu", "spam_score": 0.0, "site_type": "blogs", "published": "2017-03-22T09:41:00.000+02:00", "replies_count": 0, "uuid": "b8e3e808ed429c92e60165d459666bf5d74ce44e"}, "author": "editor@merdeka.com (Editor)", "url": "https://www.merdeka.com/peristiwa/soal-fadli-zon-fahri-hamzah-kpk-bakal-pilah-kasusnya-dulu.html", "ord_in_thread": 0, "title": "Soal Fadli Zon & Fahri Hamzah, KPK bakal pilah kasusnya dulu", "locations": [], "entities": {"persons": [{"name": "yu", "sentiment": "negative"}, {"name": "soal fadli zon", "sentiment": "negative"}, {"name": "fahri hamzah", "sentiment": "negative"}, {"name": "rabu", "sentiment": "negative"}, {"name": "nama wakil ketua dpr fadli zon dan fahri hamzah", "sentiment": "none"}, {"name": "senin", "sentiment": "none"}, {"name": "disini", "sentiment": "none"}, {"name": "takdir suhan", "sentiment": "none"}, {"name": "andreas", "sentiment": "none"}, {"name": "pak ken", "sentiment": "none"}, {"name": "febri", "sentiment": "none"}, {"name": "jaksa", "sentiment": "none"}, {"name": "tanya jaksa.namun handang", "sentiment": "none"}, {"name": "jadi", "sentiment": "none"}, {"name": "ditjen pajak kementerian keuangan", "sentiment": "none"}, {"name": "eggi sudjana", "sentiment": "none"}, {"name": "ramapanicker rajamohanan nair", "sentiment": "none"}, {"name": "fadli zon", "sentiment": "none"}, {"name": "amalia gedung kpk", "sentiment": "none"}, {"name": "handang soekarno", "sentiment": "none"}], "locations": [], "organizations": [{"name": "handang", "sentiment": "none"}, {"name": "ek prima ekspor indonesia", "sentiment": "none"}]}, "highlightText": "", "language": "english", "persons": [], "text": "Soal Fadli Zon & Fahri Hamzah, KPK bakal pilah kasusnya dulu Rabu, 22 Maret 2017 09:41 Reporter : Yunita Amalia Gedung KPK. Â©2014 merdeka.com/dwi narwoko \nMerdeka.com - Nama Wakil Ketua DPR Fadli Zon dan Fahri Hamzah muncul dalam sidang kasus pemberian suap terhadap Kasubdit Direktorat Penegakan Hukum pada Ditjen Pajak Kementerian Keuangan, Handang Soekarno. Kedua nama ini baru muncul saat Handang hadir menjadi saksi dengan terdakwa Ramapanicker Rajamohanan Nair, pemberi suap Handang.Juru Bicara KPK, Febri Diansyah mengatakan hal tersebut masih dipelajari lebih lanjut guna memastikan ada atau tidaknya unsur pidana yang dilakukan Handang terhadap pihak lain.\"Kami perlu memilah mana yang ada kaitan dengan indikasi korupsi yang jadi kewenangan KPK, dan mana yang murni soal pajak,\" kata Febri, Rabu (22/3).Dia juga mengakui, nama-nama yang muncul saat sidang, Senin (21/3) lalu memang belum pernah dipanggil saat proses penyidikan terkait kasus ini. Kendati demikian, Febri menegaskan pihaknya akan mempelajari segala fakta persidangan guna mengembangkan kasus ini jika terdapat bukti permulaan yang cukup.\"Dakwaan masih proses penyusunan. Sejumlah nama yang muncul di sidang RRN memang belum diperiksa di penyidikan HS ini,\" jelasnya.\"KPK lebih lanjut tentu tetap mempelajari dan mencermati fakta yang muncul di persidangan,\" imbuhnya.Sebelumnya, saat persidangan kasus suap PT EK Prima Ekspor Indonesia dengan terdakwa Ramapanicker Rajamohanan Nair, jaksa penuntut umum KPK menghadirkan Handang Soekarno untuk memberikan kesaksiannya.Saat itu jaksa KPK, Takdir Suhan, bertanya kepada Handang mengenai adanya percakapan antara Handang dengan Andreas alias Gondres. Sambil menunjukkan bukti percakapan tersebut ada nama Eggi Sudjana, Fadli Zon, Fahri Hamzah.\"Ada komunikasi whatsapp tanggal 7 November 2016. Disini ada nama Eggi Sudjana, Fadli Zon, Fahri Hamzah, ini apa kaitannya Pak Gondres kirim ke Handang?\" Tanya jaksa.Namun Handang mengaku lupa adanya percakapan tersebut. Jaksa kemudian mengatakan ada bukti indikasi kuat adanya penyalahgunaan pajak yang dilakukan oleh dua wakil DPR itu.\"Sebagaimana bukti permulaan diduga ada penyalahgunaan pajak,\" tukasnya.\"Jadi komunikasi aktivitasnya Pak Ken lewat ajudan, ajudan ke Handang,\" tandasnya. [dan]", "external_links": [], "published": "2017-03-22T09:41:00.000+02:00", "crawled": "2017-03-22T06:26:55.435+02:00", "highlightTitle": ""}