{"organizations": [], "uuid": "782c15f25add9e2114be1baaab27b92b3f565aa5", "thread": {"social": {"gplus": {"shares": 0}, "pinterest": {"shares": 0}, "vk": {"shares": 0}, "linkedin": {"shares": 0}, "facebook": {"likes": 125, "shares": 125, "comments": 0}, "stumbledupon": {"shares": 0}}, "site_full": "www.purdue.edu", "main_image": "", "site_section": "http://www.purdue.edu/newsroom/rss/facstaff.xml", "section_title": "Purdue News for Faculty and Staff", "url": "http://www.purdue.edu/newsroom/purduetoday/releases/2017/Q1/armstrong,-carlson-receive-murphy-awards.html", "country": "US", "domain_rank": 1530, "title": "Armstrong, Carlson receive Murphy Awards", "performance_score": 1, "site": "purdue.edu", "participants_count": 0, "title_full": "Armstrong, Carlson receive Murphy Awards", "spam_score": 0.0, "site_type": "blogs", "published": "2017-03-23T01:00:00.000+02:00", "replies_count": 0, "uuid": "782c15f25add9e2114be1baaab27b92b3f565aa5"}, "author": "", "url": "http://www.purdue.edu/newsroom/purduetoday/releases/2017/Q1/armstrong,-carlson-receive-murphy-awards.html", "ord_in_thread": 0, "title": "Armstrong, Carlson receive Murphy Awards", "locations": [], "entities": {"persons": [{"name": "carlson", "sentiment": "negative"}, {"name": "photo/rebecca wilcox", "sentiment": "negative"}, {"name": "armstrong", "sentiment": "negative"}, {"name": "dorsey armstrong", "sentiment": "negative"}, {"name": "signe kastberg", "sentiment": "none"}, {"name": "melanie morgan", "sentiment": "none"}, {"name": "david sears", "sentiment": "none"}, {"name": "erica carlson", "sentiment": "none"}, {"name": "murphy", "sentiment": "none"}, {"name": "stephanie gardner", "sentiment": "none"}, {"name": "charles b. murphy", "sentiment": "none"}], "locations": [], "organizations": [{"name": "purdue university", "sentiment": "negative"}, {"name": "department of physics and astronomy", "sentiment": "none"}, {"name": "teaching academy", "sentiment": "none"}, {"name": "purdue", "sentiment": "none"}, {"name": "department of curriculum", "sentiment": "none"}, {"name": "department of biological sciences", "sentiment": "none"}, {"name": "brian lamb school of communication", "sentiment": "none"}, {"name": "department of educational studies", "sentiment": "none"}]}, "highlightText": "", "language": "english", "persons": [], "text": "Armstrong, Carlson receive Murphy Awards Dorsey Armstrong (Purdue University photo/Rebecca Wilcox) Download image Dorsey Armstrong, professor in the Department of English, and Erica Carlson, professor in the Department of Physics and Astronomy, have been named recipients of the 2017 Outstanding Undergraduate Teaching Award in Memory of Charles B. Murphy. Armstrong and Carlson were surprised with the news on Wednesday (March 22). Purdue is announcing recipients of the Murphy Award and the Exceptional Early Career Award throughout the week. Murphy Award winners named already are Signe Kastberg, associate professor in the Department of Curriculum and Instruction, and Melanie Morgan, associate professor in the Brian Lamb School of Communication. Exceptional Early Career Award recipients are Stephanie Gardner, assistant professor in the Department of Biological Sciences, and David Sears, clinical assistant professor in the Department of Educational Studies. Erica Carlson (Purdue University photo/Rebecca Wilcox) Download image The University's highest undergraduate teaching honor, the Murphy Award is accompanied by a $10,000 cash award and induction into Purdue's Teaching Academy, which provides leadership for the improvement of undergraduate, graduate and outreach teaching. Murphy was a history professor at Purdue from 1927 to 1970. The Exceptional Early Career Award recognizes outstanding undergraduate teaching among Purdue's early career, tenure-track faculty. Recipients of the award will receive a $5,000 award with additional funds for a department business account. The recipients of both awards will be honored at an invitation-only luncheon on April 3. A list of past Murphy Award and Early Career Award recipients is at https://www.purdue.edu/provost/faculty/charlesAward.html . A list of all winners of teaching awards is at www.purdue.edu/cie/teachingawards/awards.html . Faculty-Staff News", "external_links": [], "published": "2017-03-23T01:00:00.000+02:00", "crawled": "2017-03-23T19:15:01.686+02:00", "highlightTitle": ""}