{"organizations": [], "uuid": "baa92719a46689225212ac89a898ec4638967d11", "thread": {"social": {"gplus": {"shares": 0}, "pinterest": {"shares": 0}, "vk": {"shares": 0}, "linkedin": {"shares": 0}, "facebook": {"likes": 728, "shares": 728, "comments": 0}, "stumbledupon": {"shares": 0}}, "site_full": "lifestyle.inquirer.net", "main_image": "http://lifestyle.inquirer.net/files/2017/03/LEGOLAND-brick-fries.jpeg", "site_section": "http://www.inquirer.net/fullfeed", "section_title": "INQUIRER.net", "url": "http://lifestyle.inquirer.net/257165/lego-fries-more-kawaii-coming-from-soon-to-open-legoland-japan/", "country": "US", "domain_rank": 813, "title": "LEGO fries, more kawaii coming from soon-to-open LEGOLAND Japan", "performance_score": 7, "site": "inquirer.net", "participants_count": 0, "title_full": "LEGO fries, more kawaii coming from soon-to-open LEGOLAND Japan", "spam_score": 0.0, "site_type": "blogs", "published": "2017-03-13T17:59:00.000+02:00", "replies_count": 0, "uuid": "baa92719a46689225212ac89a898ec4638967d11"}, "author": "", "url": "http://lifestyle.inquirer.net/257165/lego-fries-more-kawaii-coming-from-soon-to-open-legoland-japan/", "ord_in_thread": 0, "title": "LEGO fries, more kawaii coming from soon-to-open LEGOLAND Japan", "locations": [], "entities": {"persons": [{"name": "kinjo futo", "sentiment": "none"}, {"name": "alfred bayle", "sentiment": "none"}], "locations": [{"name": "legoland japan", "sentiment": "none"}, {"name": "marina snack shack", "sentiment": "none"}, {"name": "nagoya", "sentiment": "none"}, {"name": "lego city", "sentiment": "none"}, {"name": "kingdom", "sentiment": "none"}, {"name": "miniland", "sentiment": "none"}, {"name": "legoland japan  legoland japan", "sentiment": "none"}, {"name": "bricktopia", "sentiment": "none"}], "organizations": [{"name": "lego", "sentiment": "neutral"}, {"name": "coral reef pizza&pasta buffet", "sentiment": "none"}, {"name": "legoland japan stuff", "sentiment": "none"}, {"name": "oasis snacks", "sentiment": "none"}, {"name": "legoland japan grab", "sentiment": "none"}, {"name": "legoland japan pick", "sentiment": "none"}]}, "highlightText": "", "language": "english", "persons": [], "text": "LEGO fries, more kawaii coming from soon-to-open LEGOLAND Japan INQUIRER.net / 06:59 PM March 13, 2017 These fries from Oasis Snacks are the kind of LEGO bricks that you don’t leave lying around. Image: LEGOLAND Japan \nWith just a month to go before opening, LEGOLAND Japan, in its official website released teaser photos of some of the food items, restaurants and stalls that will be featured in the park. The seven distinct areas of LEGOLAND Japan are Factory, Bricktopia, Adventure, Knight’s Kingdom, Pirate Shore, Miniland and LEGO City. Image: LEGOLAND Japan \nLEGOLAND Japan will be divided into seven areas with eight food stands and five restaurants for guests to indulge in, reports RocketNews24. Cool down with some colorful slushies at Bricktopia. Image: LEGOLAND Japan Pick up some sweets from the PINO Cart. Image: LEGOLAND Japan Grab a chicken dinner at the end of the day. Image LEGOLAND Japan Stuff your belly at the Coral Reef Pizza&Pasta Buffet. Image: LEGOLAND Japan Stop by at the Marina Snack Shack for some hotdogs. Image: LEGOLAND Japan \nLEGOLAND Japan in Nagoya will open its gates on April 1. Kinjo Futo is the nearest train station to the park and is about twenty minutes away from Nagoya station. International visitors may check out their official English website for further details. Alfred Bayle/ JB ADVERTISEMENT", "external_links": [], "published": "2017-03-13T17:59:00.000+02:00", "crawled": "2017-03-13T16:33:56.572+02:00", "highlightTitle": ""}