{"organizations": [], "uuid": "ec47c9f3b650efdf32118e965b2b378998e1b357", "thread": {"social": {"gplus": {"shares": 2}, "pinterest": {"shares": 0}, "vk": {"shares": 0}, "linkedin": {"shares": 0}, "facebook": {"likes": 489, "shares": 489, "comments": 0}, "stumbledupon": {"shares": 0}}, "site_full": "www.nbcnews.com", "main_image": "https://media3.s-nbcnews.com/j/newscms/2017_12/1943806/170324-paul-ryan-healcare-vote-pulled-437p_e4b78ac09d6c484fceb4f631c6b5ebd7.nbcnews-fp-1200-800.jpg", "site_section": "http://feeds.nbcnews.com/feeds/topstories", "section_title": "NBC News Top Stories", "url": "http://www.nbcnews.com/politics/donald-trump/yes-speaker-ryan-you-do-have-worst-job-washington-n738381", "country": "US", "domain_rank": 478, "title": "Yes, Speaker Ryan, You Do Have The Worst Job In Washington", "performance_score": 4, "site": "nbcnews.com", "participants_count": 1, "title_full": "Yes, Speaker Ryan, You Do Have The Worst Job In Washington", "spam_score": 0.0, "site_type": "blogs", "published": "2017-03-25T09:20:00.000+03:00", "replies_count": 0, "uuid": "ec47c9f3b650efdf32118e965b2b378998e1b357"}, "author": "Jane C. Timm", "url": "http://www.nbcnews.com/politics/donald-trump/yes-speaker-ryan-you-do-have-worst-job-washington-n738381", "ord_in_thread": 0, "title": "Yes, Speaker Ryan, You Do Have The Worst Job In Washington", "locations": [], "entities": {"persons": [{"name": "ryan", "sentiment": "neutral"}, {"name": "jane c. timm", "sentiment": "neutral"}, {"name": "tom davis", "sentiment": "none"}, {"name": "davis", "sentiment": "none"}, {"name": "boehner", "sentiment": "none"}, {"name": "paul ryan", "sentiment": "none"}, {"name": "john boehner", "sentiment": "none"}, {"name": "obamacare", "sentiment": "none"}], "locations": [{"name": "washington", "sentiment": "none"}, {"name": "virginia", "sentiment": "none"}, {"name": "speakership", "sentiment": "none"}, {"name": "wisconsin", "sentiment": "none"}], "organizations": [{"name": "freedom caucus", "sentiment": "none"}, {"name": "congress", "sentiment": "none"}, {"name": "gop", "sentiment": "none"}, {"name": "house gop", "sentiment": "none"}, {"name": "white house", "sentiment": "none"}, {"name": "republican white house", "sentiment": "none"}, {"name": "house", "sentiment": "none"}, {"name": "democratic white house", "sentiment": "none"}]}, "highlightText": "", "language": "english", "persons": [], "text": "Mar 24 2017, 9:20 pm ET Yes, Speaker Ryan, You Do Have The Worst Job In Washington by Jane C. Timm advertisement \nHouse Speaker Paul Ryan's biggest nightmare just became reality: His party's divisions defeated his party's own agenda. \nThe GOP's factions turned Ryan's first big governance test since his party won control of Congress and the White House in November into an enormous flop, and it deflated the party's central campaign promise to repeal and replace Obamacare. After years of disagreement on how to oppose the Democratic White House, the party is just as divided in how to lead with a Republican White House. \n\"Moving from an opposition party to a governing party, comes with growing pains and well, we're feeling those growing pains today,\" Ryan said Friday afternoon announcing the bill was being pulled, with palpable frustration at the party whose votes he failed to wrangle. \n\"Ultimately, this all kind of comes down to a choice: Are all of us willing to give a little to get something done?\" the Wisconsin Republican continued. \"If we're willing to do that, we still have such an incredible opportunity in front of us. There remains so much we can do…that's why I'm here.\" \nBut Ryan is facing the stark reality that's plagued his predecessors for decades: Leading a polarized body makes getting anything big done increasingly near impossible and makes the Speakership the most thankless job in Washington. Play Speaker Ryan: Pulling Health Care Bill 'Disappointing' 1:54 autoplay autoplay Copy this code to your website or blog <iframe src=\"http://www.nbcnews.com/widget/video-embed/905923139772\" width=\"560\" height=\"315\" frameborder=\"0\" allowfullscreen></iframe> \nIt's why Ryan didn't want the post in the first place. He spent weeks deflecting suggestions he might seek it. Later, as he agreed to step up, Ryan demanded party unity, telling members he wouldn't take the job unless he was supported by everyone — from the conservative Freedom Caucus to the moderate Tuesday Group, both of which, it turns out, struggled to get on board with the healthcare bill for different reasons. \nRyan's immediate predecessor, House Speaker John Boehner, resigned from Congress in the middle of his term amid far-right efforts to oust him. Boehner had already lived through one unpopular government shutdown that he'd spent months trying to avoid and, days later, he did a deal with Democrats to fund the government that would likely have cost him his Speakership had he not already given it up. \nAnd the same far-right, tea party wave of Republicans that made Boehner's life miserable includes many of the same representatives — and the Freedom Caucus — who balked at the House bill. \n\"You've got a group of Republicans who don't know how to say yes,\" former Virginia Republican Rep. Tom Davis said. \"They are a great opposition party. They're great at ripping the other side apart, but they can't get to yes.\" \nDavis said Ryan's choices are limited. He can try to get the Freedom Caucus to take their \"ideological blinders\" off or move to the middle and try to work with moderate Democrats. \nBut, he added, after Friday, things aren't looking great for Ryan or the House GOP> \n\"It makes them look incompetent, it makes them look like the gang that can't shoot straight,\" he said. \"The problem (for Ryan) is the Democrats smell blood in the water.\" Jane C. Timm", "external_links": [], "published": "2017-03-25T09:20:00.000+03:00", "crawled": "2017-03-25T06:56:06.921+03:00", "highlightTitle": ""}