{"organizations": [], "uuid": "78814ed5eae78312d9b6baa0c49db508f0c8aa84", "thread": {"social": {"gplus": {"shares": 0}, "pinterest": {"shares": 0}, "vk": {"shares": 0}, "linkedin": {"shares": 0}, "facebook": {"likes": 249, "shares": 249, "comments": 0}, "stumbledupon": {"shares": 0}}, "site_full": "www.geo.tv", "main_image": "https://www.geo.tv/assets/uploads/updates/2017-03-05/133270_040331_updates.jpg", "site_section": "http://feeds.feedburner.com/GeoSport-GeoTvNetwork", "section_title": "GEO TV - Sports", "url": "https://www.geo.tv/latest/133270-Two-t20s-added-in-West-Indies-Pakistan-series", "country": "TV", "domain_rank": 8287, "title": "Two t20s added in West Indies-Pakistan series", "performance_score": 2, "site": "geo.tv", "participants_count": 0, "title_full": "Two t20s added in West Indies-Pakistan series", "spam_score": 0.0, "site_type": "blogs", "published": "2017-03-05T11:02:00.000+02:00", "replies_count": 0, "uuid": "78814ed5eae78312d9b6baa0c49db508f0c8aa84"}, "author": "", "url": "https://www.geo.tv/latest/133270-Two-t20s-added-in-West-Indies-Pakistan-series", "ord_in_thread": 0, "title": "Two t20s added in West Indies-Pakistan series", "locations": [], "entities": {"persons": [{"name": "roland holder", "sentiment": "none"}, {"name": "sabina park", "sentiment": "none"}, {"name": "geo", "sentiment": "none"}], "locations": [{"name": "pakistan", "sentiment": "none"}, {"name": "trinidad & tobago", "sentiment": "none"}, {"name": "sun 14 3rd test windsor park", "sentiment": "none"}, {"name": "karachi", "sentiment": "none"}, {"name": "barbados", "sentiment": "none"}, {"name": "west indies", "sentiment": "none"}, {"name": "jamaica", "sentiment": "none"}, {"name": "kensington oval", "sentiment": "none"}, {"name": "guyana", "sentiment": "none"}, {"name": "twenty20 international queen’s park oval", "sentiment": "none"}, {"name": "port of spain", "sentiment": "none"}, {"name": "bridgetown", "sentiment": "none"}, {"name": "dominica", "sentiment": "none"}, {"name": "trinidad", "sentiment": "none"}, {"name": "queen’s park oval", "sentiment": "none"}], "organizations": [{"name": "wicb", "sentiment": "none"}, {"name": "west indies cricket board", "sentiment": "none"}, {"name": "3rd twenty20 international queen’s park oval  sun", "sentiment": "none"}]}, "highlightText": "", "language": "english", "persons": [], "text": "Two t20s added in West Indies-Pakistan series | Pakistan cricket team to tour West Indies from March 27 \nKARACHI: The West Indies Cricket Board has announced the addition of two Twenty20 Internationals to the itinerary for the Pakistan Tour of the West Indies. \nAs a consequence of the additional matches, the series between World Twenty20 champions West Indies and the visiting Pakistanis will now be contested over four matches. \n“Twenty20 is an exciting format and this is another opportunity for our fans to indulge in the thrilling atmosphere that surrounds these matches,” said Roland Holder, WICB manager, cricket operations. \n“We look forward to fans in Barbados and Trinidad coming out and cheering our team on to victory.” \nThe first of the two additional T20Is will be played on Sunday, March 26 at Kensington Oval in Bridgetown, Barbados. \nThe series then moves to the Queen’s Park Oval in the Trinidad & Tobago capital of Port of Spain, where they will now be three T20Is instead of the originally carded two. \nThe matches will now be contested on Thursday, March 30, a public holiday, and will be followed by matches on Saturday, April 1 and Sunday, April 2. \nSCHEDULE OF MATCHES \nSun 26 1st Twenty20 International Kensington Oval, Bridgetown \nThu 30 2nd Twenty20 International Queen’s Park Oval, Trinidad \nAPRIL \nSat 1 3rd Twenty20 International Queen’s Park Oval \nSun 2 4th Twenty20 International Queen’s Park Oval \nFri 7 1st One-day International National Cricket Stadium, Guyana \nSun 9 2nd One-day International National Cricket Stadium \nTue 11 3rd One-day International National Cricket Stadium \nSat 15 to Mon 17 Tour Match Trelawny Stadium, Jamaica \nFri 22 to Tue 26 1st Test Sabina Park, Jamaica \nSun 30 to Thu, MAY 4 2nd Test Kensington Oval \nWed 10 to Sun 14 3rd Test Windsor Park, Dominica \n0 0 Two t20s added in West Indies-Pakistan series was posted in sports of Geo TV - https://www.geo.tv on March 05, 2017 and was last updated on March 05, 2017. This news story is related to West Indies- Pakistan Series, T20, Sports, Sports News, Geo, Geo News, . Permanent link to the news story \"Two t20s added in West Indies-Pakistan series\" is https://www.geo.tv/latest/133270-Two-t20s-added-in-West-Indies-Pakistan-series+GeoSport-GeoTvNetwork+%28Geo+Sport+-+Geo+TV+Network%29 . More From Sports:", "external_links": [], "published": "2017-03-05T11:02:00.000+02:00", "crawled": "2017-03-05T01:23:55.990+02:00", "highlightTitle": ""}