{"organizations": [], "uuid": "a4a5ee533ee7982dacd87411f0052cae85e558ee", "thread": {"social": {"gplus": {"shares": 3}, "pinterest": {"shares": 0}, "vk": {"shares": 0}, "linkedin": {"shares": 1}, "facebook": {"likes": 201, "shares": 201, "comments": 0}, "stumbledupon": {"shares": 0}}, "site_full": "www.freejobalert.com", "main_image": "", "site_section": "http://www.freejobalert.com/feed", "section_title": "FreeJobAlert.com", "url": "http://www.freejobalert.com/nielit/39584/", "country": "US", "domain_rank": 1608, "title": "NIELIT Recruitment 2017 – 117 Sr & Jr Faculty Posts", "performance_score": 2, "site": "freejobalert.com", "participants_count": 1, "title_full": "NIELIT Recruitment 2017 – 117 Sr & Jr Faculty Posts", "spam_score": 0.0, "site_type": "blogs", "published": "2017-03-08T13:56:00.000+02:00", "replies_count": 0, "uuid": "a4a5ee533ee7982dacd87411f0052cae85e558ee"}, "author": "freejobalert.com", "url": "http://www.freejobalert.com/nielit/39584/", "ord_in_thread": 0, "title": "NIELIT Recruitment 2017 – 117 Sr & Jr Faculty Posts", "locations": [], "entities": {"persons": [], "locations": [{"name": "mohali", "sentiment": "none"}, {"name": "b.e", "sentiment": "none"}, {"name": "chandigarh", "sentiment": "none"}, {"name": "nielit chandigarh", "sentiment": "none"}, {"name": "punjab", "sentiment": "none"}], "organizations": [{"name": "neft", "sentiment": "none"}, {"name": "senior faculty & junior faculty", "sentiment": "none"}, {"name": "punjab national bank", "sentiment": "none"}, {"name": "electronics/ electronics & electricals/ electronics & instrumentation", "sentiment": "none"}, {"name": "polytechnic diploma in electronics/ electronics & electricals/ electronics & instrumentation", "sentiment": "none"}, {"name": "skype", "sentiment": "none"}, {"name": "government of india", "sentiment": "none"}, {"name": "rtgs", "sentiment": "none"}, {"name": "ministry of electronics and information technology", "sentiment": "none"}, {"name": "mca", "sentiment": "none"}, {"name": "national institute of electronics and information technology", "sentiment": "none"}]}, "highlightText": "", "language": "english", "persons": [], "text": "NIELIT Recruitment 2017 – 117 Sr & Jr Faculty Posts NIELIT Recruitment 2017 – 117 Sr & Jr Faculty Posts : Ministry of Electronics and Information Technology, Government of India, National Institute of Electronics and Information Technology (NIELIT), Chandigarh has published notification for the recruitment of 117 Senior Faculty & Junior Faculty vacancies on contract basis for CABA and DREAM Centers. Eligible candidates may apply in prescribed application format. Other details like age limit, educational qualification, selection process, application fee & how to apply are given below…. NIELIT Vacancy Details: Total No. of Posts: 117 Name of the Post: 1. Senior Faculty: 80 Posts 2. Junior Faculty: 31 Posts 3. Sr Faculty: 02 Posts 4. Jr Faculty: 04 Posts Age Limit: Candidates age limit should be between 19 – 48 years for Post No. 01 & 02 and 21 – 48 years for Post No. 03 & 04 as on 01-01-2017. Educational Qualification : Candidates should possess MCA/ B.Tech (CS/IT)/ M.Sc (CS/IT)/ NIELIT A Level/ PGDCA/ BCA with 02 Years Post Qualification experience for Post No. 01, NIELIT ‘O’ Level/ 12th pass with Diploma in CAM-DTP/ CABA-MDTP for Post No. 02, B.E/ B.Tech in Electronics/ Electronics & Electricals/ Electronics & Instrumentation for Post No. 03 & 03 year Polytechnic Diploma in Electronics/ Electronics & Electricals/ Electronics & Instrumentation or Diploma in Repair of Electronic Appliances and Maintenance for Post No. 04. Selection Process : Candidates will be selected based on Skype interview. Application Fee: Candidates should pay Rs. 350/- for Post No. 01 & 02 and Rs. 500/- for Post No. 03 & 04 through NEFT/ RTGS or Demand draft in favour of Director, NIELIT Chandigarh payable at Chandigarh/ Mohali (Punjab) (Bank Name – Punjab National Bank, Account No 78540059 19, IFSC Code – PUNB0785400). How to Apply : Eligible candidates may send their application in prescribed format with a recent colour passport size photograph should be affixed on the application along with the attested copies of their testimonials including post qualification and experience by post/ courier to the National Institute of Electronics and Information Technology (NIELIT), C-134, Industrial Area, Phase-8 (Sector 72), Mohali-160 071, Punjab. For more details like remuneration, experience, duration & other information click on the link given below…. NIELIT Recruitment 2017", "external_links": [], "published": "2017-03-08T13:56:00.000+02:00", "crawled": "2017-03-08T10:00:57.816+02:00", "highlightTitle": ""}