{"organizations": [], "uuid": "59a2341f5efe7ba92a596d4d392c70965a81eecc", "thread": {"social": {"gplus": {"shares": 0}, "pinterest": {"shares": 0}, "vk": {"shares": 0}, "linkedin": {"shares": 0}, "facebook": {"likes": 941, "shares": 941, "comments": 1}, "stumbledupon": {"shares": 0}}, "site_full": "www.koimoi.com", "main_image": "http://static.koimoi.com/wp-content/new-galleries/2017/03/best-action-shivaay-best-trailer-fan-best-poster-airlift-winners-koimoi-audience-poll-2016-0001.jpg", "site_section": "http://www.koimoi.com/feed/", "section_title": "Koimoi", "url": "http://www.koimoi.com/bollywood-audience-poll-2016/shivaay-wins-best-action-fan-bags-best-trailer-airlift-wins-best-poster-audience-poll-2016-results/", "country": "US", "domain_rank": 9127, "title": "Shivaay Wins Best Action, Fan Bags Best Trailer, Airlift Wins Best Poster : Audience Poll 2016 Results", "performance_score": 9, "site": "koimoi.com", "participants_count": 1, "title_full": "Shivaay Wins Best Action, Fan Bags Best Trailer, Airlift Wins Best Poster : Audience Poll 2016 Results", "spam_score": 0.0, "site_type": "blogs", "published": "2017-03-28T13:33:00.000+03:00", "replies_count": 0, "uuid": "59a2341f5efe7ba92a596d4d392c70965a81eecc"}, "author": "Koimoi.com Team", "url": "http://www.koimoi.com/bollywood-audience-poll-2016/shivaay-wins-best-action-fan-bags-best-trailer-airlift-wins-best-poster-audience-poll-2016-results/", "ord_in_thread": 0, "title": "Shivaay Wins Best Action, Fan Bags Best Trailer, Airlift Wins Best Poster : Audience Poll 2016 Results", "locations": [], "entities": {"persons": [{"name": "resul", "sentiment": "neutral"}, {"name": "akshay", "sentiment": "none"}, {"name": "aamir khan", "sentiment": "none"}, {"name": "baaghi", "sentiment": "none"}, {"name": "ajay", "sentiment": "none"}, {"name": "shah rukh khan", "sentiment": "none"}, {"name": "geeta", "sentiment": "none"}, {"name": "shroff", "sentiment": "none"}, {"name": "koimoi", "sentiment": "none"}, {"name": "shivaay", "sentiment": "none"}, {"name": "deadpool", "sentiment": "none"}, {"name": "salman", "sentiment": "none"}, {"name": "akshay kumar", "sentiment": "none"}, {"name": "salman khan", "sentiment": "none"}, {"name": "shah rukh", "sentiment": "none"}, {"name": "dangal", "sentiment": "none"}, {"name": "akira", "sentiment": "none"}, {"name": "ae dil hai mushkil", "sentiment": "none"}, {"name": "mahavir phoghat", "sentiment": "none"}, {"name": "shivaay ajay devgn", "sentiment": "none"}, {"name": "neerja", "sentiment": "none"}], "locations": [{"name": "shivaay", "sentiment": "none"}, {"name": "hollywood", "sentiment": "none"}, {"name": "kuwait", "sentiment": "none"}, {"name": "india", "sentiment": "none"}], "organizations": [{"name": "deadpool", "sentiment": "none"}, {"name": "airlift, fan & shivaay", "sentiment": "none"}, {"name": "airlift", "sentiment": "none"}]}, "highlightText": "", "language": "english", "persons": [], "text": "Shivaay Wins Best Action, Fan Bags Best Trailer, Airlift Wins Best Poster : Audience Poll 2016 Results Airlift, Fan & Shivaay win category awards. Here's who won what! By Koimoi audience poll 2016 results are now out! Like every year, readers voted their favorite celebrities across various categories. The results for Best Action, Best Trailer and Best Poster have now been compiled. Best Action Movie – Shivaay Best Action Movie – Shivaay Ajay Devgn’s directorial Shivaay , bagged best action with as many as 38% votes in its favor. The film was competing with other films such as Baaghi , Force 2 , Rocky Handsome , Akira and Dishoom . Tiger Shroff’s Baaghi came second with 29% votes for it. In Shivaay , Ajay worked hard on the action scenes. The film failed to leave a mark majorly due to its script. Shivaay borrowed heavily from Hollywood action films yet managed to impress action lovers. Best Trailer – FAN Coming to the trailers, viewers voted for Shah Rukh Khan’s Fan to have had the best trailer. Fan got 28% of the votes among others such as Shivaay , Ae Dil Hai Mushkil , Neerja , Airlift , Sultan etc. Shivaay was voted second best trailer. The tariler was made very intelligently made as it showed common man’s fanboy moment on meeting his superstar, his beautiful moments and obsession with the actor. It certainly struck a chord with Shah Rukh’s fans. Best Poster – Airlift Best Poster – Airlift Amongst the best poster category, Akshay Kumar’s Airlift was voted the highest with 27% votes. Shah Rukh Khan’s Fan poster came a close second with 22% votes in its favor. The Airlift poster was impressive, featuring Akshay and a captivated Kuwait well. Best Scene – Dangal http://www.koimoi.com/wp-content/new-galleries/2017/02/Dangal-Scene.mp4 Best scene was bagged by Aamir Khan’s Dangal with 24% votes. It was the iconic scene in the film where Geeta is seen wrestling with her father Mahavir Phoghat, when there is a tension between the two over the techniques of the sport. A very close second with 23% votes was Salman Khan’s Sultan scene where Salman’s character breaks down after looking at his unfit physique, which is a hurtful moment for a sportsman. Best Hollywood Movie in India – Jungle Book Best Hollywood Movie in India – Jungle Book As expected, after having a fabulous run at the box office in India, The Jungle Book was voted best Hollywood movie in India with 43% votes. It was nominated along with popular names such as Deadpool, The Conjuring 2 and Captain America: Civil War . Deadpool came second with 20% votes in its favor. TAGS", "external_links": [], "published": "2017-03-28T13:33:00.000+03:00", "crawled": "2017-03-28T08:40:47.089+03:00", "highlightTitle": ""}