{"organizations": [], "uuid": "bbc1acea9754baba86ac5f00ad968a3182b3857d", "thread": {"social": {"gplus": {"shares": 0}, "pinterest": {"shares": 0}, "vk": {"shares": 0}, "linkedin": {"shares": 0}, "facebook": {"likes": 551, "shares": 551, "comments": 0}, "stumbledupon": {"shares": 0}}, "site_full": "www.geo.tv", "main_image": "https://www.geo.tv/assets/uploads/updates/2017-03-27/135700_045609_updates.jpg", "site_section": "http://feeds.feedburner.com/geo/GiKR", "section_title": "GEO TV - Pakistan", "url": "https://www.geo.tv/latest/135700-Pakistani-American-doctor-awarded-with-Ellis-Island-Medal-of-Honour", "country": "TV", "domain_rank": 8287, "title": "Pakistani-American doctor to receive Ellis Island Medal of Honour", "performance_score": 5, "site": "geo.tv", "participants_count": 0, "title_full": "Pakistani-American doctor to receive Ellis Island Medal of Honour", "spam_score": 0.0, "site_type": "blogs", "published": "2017-03-28T03:37:00.000+03:00", "replies_count": 0, "uuid": "bbc1acea9754baba86ac5f00ad968a3182b3857d"}, "author": "", "url": "https://www.geo.tv/latest/135700-Pakistani-American-doctor-awarded-with-Ellis-Island-Medal-of-Honour", "ord_in_thread": 0, "title": "Pakistani-American doctor to receive Ellis Island Medal of Honour", "locations": [], "entities": {"persons": [{"name": "fareed zakaria", "sentiment": "none"}, {"name": "haider", "sentiment": "none"}, {"name": "mohan h patel", "sentiment": "none"}, {"name": "kessler", "sentiment": "none"}, {"name": "adil haider", "sentiment": "none"}, {"name": "aga khan", "sentiment": "none"}, {"name": "dinesh paliwal", "sentiment": "none"}, {"name": "annapoorna s kini", "sentiment": "none"}, {"name": "indra nooyi", "sentiment": "none"}, {"name": "yashvant patel", "sentiment": "none"}, {"name": "baker", "sentiment": "none"}], "locations": [{"name": "ellis island", "sentiment": "none"}, {"name": "hopkins", "sentiment": "none"}, {"name": "new york", "sentiment": "none"}, {"name": "america", "sentiment": "none"}, {"name": "us", "sentiment": "none"}, {"name": "pakistan", "sentiment": "none"}, {"name": "karachi", "sentiment": "none"}], "organizations": [{"name": "ellis island medal of honour", "sentiment": "negative"}, {"name": "aga khan hospital university", "sentiment": "none"}, {"name": "pepsico", "sentiment": "none"}, {"name": "harvard medical school", "sentiment": "none"}, {"name": "facebook", "sentiment": "none"}, {"name": "johns hopkins hospital", "sentiment": "none"}, {"name": "saint patrick’s high school", "sentiment": "none"}, {"name": "brigham and women’s hospital", "sentiment": "none"}, {"name": "harman international industries", "sentiment": "none"}, {"name": "harvard t.h. chan school of public health", "sentiment": "none"}, {"name": "american dream", "sentiment": "none"}, {"name": "ellis island medal of honour   ellis", "sentiment": "none"}, {"name": "center for surgery and public health", "sentiment": "none"}, {"name": "john hopkins bloomberg school of public health", "sentiment": "none"}]}, "highlightText": "", "language": "english", "persons": [], "text": "Pakistani-American doctor to receive Ellis Island Medal of Honour | 0 Photo: courtesy Facebook/Adil Haider \nDr Adil Haider, a Pakistani-American doctor, has been selected to received the Ellis Island Medal of Honour, one of the the highest civilian awards for US immigrants. \nThe award is gifted to a select few individuals for excelling in their field and inspiring others. \nHaider, who is currently Kessler Director of Center for Surgery and Public Health, collaborative initiative of Brigham and Women’s Hospital, Harvard Medical School, and the Harvard T.H. Chan School of Public Health, spent early life in Pakistan. \nDr Haider went to Saint Patrick’s High School in Karachi and then completed his medical education from the Aga Khan Hospital University in 1998. \nIn 2000, he received MPH from John Hopkins Bloomberg School of Public Health. Later, he became a trauma and critical care surgeon at Johns Hopkins Hospital. \n“I am very humbled to have been bestowed this honour,” he wrote in a Facebook post, adding “Two things are for sure: 1) There are certainly many others who deserve this far more than me and I am just lucky to have been recognised. 2) Only in America is this possible. Sue Baker gave me a job at Hopkins the day I came from Aga Khan. Since then I have been blessed with amazing mentors and teammates at work and the worlds most supporting and caring family and friends at home.” \n“This medal reminds us that the American Dream is alive its our job to protect it and ensure that it remains for all to come, generation after generation,” he added. \nThank you all so much for the well wishes and congrats. I am very humbled to have been bestowed this honor. Two things... Posted by Adil Haider on Sunday, March 26, 2017 \n\nDr Haider is accredited with establishing the field of trauma disparities research and uncovering impact of racial disparities after traumatic injuries. He hopes to eradicate the disparities in healthcare in the US. \nThe other recipients of the award include five Indian Americans including PepsiCo CEO Indra Nooyi, author Fareed Zakaria, Harman International Industries chairman CEO Dinesh Paliwal, Dr Annapoorna S Kini, Yashvant Patel and Mohan H Patel. \nThe recipients will be awarded in a ceremony on Ellis Island, New York, on May 13. \nList of other recipients can be viewed here . 0 0 Pakistani-American doctor to receive Ellis Island Medal of Honour   Ellis Island Medal Of Honour, Geo News, Geo News Latest, Pakistan.   \"Pakistani-American doctor to receive Ellis Island Medal of Honour\" is https://www.geo.tv/latest/135700-Pakistani-American-doctor-awarded-with-Ellis-Island-Medal-of-Honour+geo%2FGiKR+%28Geo+Pakistan+- ", "external_links": [], "published": "2017-03-28T03:37:00.000+03:00", "crawled": "2017-03-27T18:13:33.930+03:00", "highlightTitle": ""}