{"organizations": [], "uuid": "dc8dfa12a44544e36c7ce0955a1dcad6a2844b8b", "thread": {"social": {"gplus": {"shares": 0}, "pinterest": {"shares": 0}, "vk": {"shares": 0}, "linkedin": {"shares": 0}, "facebook": {"likes": 129, "shares": 129, "comments": 0}, "stumbledupon": {"shares": 0}}, "site_full": "www.arsenal.com", "main_image": "http://www.arsenal.com/assets/_files/scaled/711x400/jan_17/gun__1484129550_emirates_fa_cup.jpg", "site_section": "http://feeds.arsenal.com/arsenal-news", "section_title": "Arsenal FC News Feed", "url": "http://www.arsenal.com/news/news-archive/20170311/emirates-fa-cup-semi-final-draw-details", "country": "GB", "domain_rank": 6897, "title": "Emirates FA Cup semi-final draw details", "performance_score": 1, "site": "arsenal.com", "participants_count": 0, "title_full": "Emirates FA Cup semi-final draw details", "spam_score": 0.0, "site_type": "blogs", "published": "2017-03-12T03:29:00.000+02:00", "replies_count": 0, "uuid": "dc8dfa12a44544e36c7ce0955a1dcad6a2844b8b"}, "author": "", "url": "http://www.arsenal.com/news/news-archive/20170311/emirates-fa-cup-semi-final-draw-details", "ord_in_thread": 0, "title": "Emirates FA Cup semi-final draw details", "locations": [], "entities": {"persons": [{"name": "drayton park", "sentiment": "none"}, {"name": "arsene wenger", "sentiment": "none"}, {"name": "theo walcott", "sentiment": "none"}, {"name": "aaron ramsey", "sentiment": "none"}, {"name": "alexis", "sentiment": "none"}, {"name": "olivier giroud", "sentiment": "none"}], "locations": [{"name": "wembley stadium features access", "sentiment": "none"}, {"name": "emirates stadium", "sentiment": "none"}, {"name": "uk", "sentiment": "none"}, {"name": "london", "sentiment": "none"}], "organizations": [{"name": "arsenal football club plc", "sentiment": "none"}, {"name": "arsenal football club plc", "sentiment": "none"}, {"name": "lincoln city", "sentiment": "none"}, {"name": "arsenal digital membership", "sentiment": "none"}, {"name": "arsenal football club", "sentiment": "none"}, {"name": "arsenal.com weekly e-newsletter", "sentiment": "none"}]}, "highlightText": "", "language": "english", "persons": [], "text": "Search the entire site Emirates FA Cup semi-final draw details \nWe will find out who we will face in Emirates FA Cup semi-finals when the draw is made on Monday \nWe booked our place in a record 29th semi-final as we beat National League side Lincoln City 5-0 at Emirates Stadium on Saturday. \nWe have been allocated ball No 4 in the draw, which takes place from 9.30pm (UK time). \nThe semi-final ties will be played across the weekend of April 22-23, 2017. \nFollow @Arsenal on Twitter for news of the FA Cup draw and stay close to Arsenal.com for ticket information. \nMore quizzes coming soon! Copyright 2017 The Arsenal Football Club plc. Permission to use quotations from this article is granted subject to appropriate credit being given to www.arsenal.com as the source 11 Mar 2017 Theo Walcott, Olivier Giroud, Alexis and Aaron Ramsey all on the scoresheet as we book our place at Wembley Stadium Features Access to all Arsenal Player VideosReceive the digital member e-newsletter Email Address or Arsenal Membership number Red, Silver, Gold, Platinum and Junior Gunner Members should log in using your membership number Password Forgotten Password? Login or activate your Membership Remember me Access to all Arsenal Player Videos | Receive the digital member e-newsletter What benefits do you get with Arsenal Digital Membership? * Title Month Year Please ensure you enter the correct Date of Birth as it will be required if you need to reset your password Please ensure that you enter your parents email address and click here to review our privacy policy for those who are under 13. Please note that an email address can only be used once to register as a Digital Member so you cannot register for both an adult and junior membership under the same email address. Mobile Number Get all the news from Arsenal.com Weekly E-Newsletter (only in English) I would like to receive the weekly e-newsletter which includes match reviews and offers from The Arsenal Football Club plc and its commercial partners. Club Information and Offers (only in English) I would like to receive information and offers relating to The Arsenal Football Club plc. Offers and Information about Commercial Partners (only in English) I would like to receive information and offers relating to The Arsenal Football Club plc's commercial partners.For further details, see our Privacy Policy or write to us at Data Protection Officer, The Arsenal Football Club PLC, 75 Drayton Park, London N5 1BU I accept the terms and conditions Remember me Access to all Arsenal Player Videos | Receive the digital member e-newsletter What benefits do you get with Arsenal Digital Membership? \nwelcome to Digital Membership Extended highlights and 90 minute replays Live audio commentary on our match dayshow Arsene Wenger's pre and post match press conference video Exclusive interviews with the players All the best build up and post-match analysis", "external_links": [], "published": "2017-03-12T03:29:00.000+02:00", "crawled": "2017-03-12T01:54:16.104+02:00", "highlightTitle": ""}