{"organizations": [], "uuid": "8721e058be864afc3bbf24b2b63fe0735cbc831a", "thread": {"social": {"gplus": {"shares": 0}, "pinterest": {"shares": 0}, "vk": {"shares": 0}, "linkedin": {"shares": 1}, "facebook": {"likes": 290, "shares": 290, "comments": 0}, "stumbledupon": {"shares": 0}}, "site_full": "www.nbcnews.com", "main_image": "https://media1.s-nbcnews.com/j/newscms/2017_13/1947241/170328-scotland-referendum-nicola-sturgeon-se-457p_a8f6503e992f01711381702c21003001.nbcnews-fp-1200-800.jpg", "site_section": "http://feeds.feedburner.com/msn/zQor", "section_title": "NBC News Top Stories", "url": "http://www.nbcnews.com/storyline/brexit-referendum/scottish-parliament-backs-bid-new-independence-referendum-n739716", "country": "US", "domain_rank": 478, "title": "Scottish Parliament Backs Bid for New Independence Referendum", "performance_score": 2, "site": "nbcnews.com", "participants_count": 0, "title_full": "Scottish Parliament Backs Bid for New Independence Referendum", "spam_score": 0.0, "site_type": "blogs", "published": "2017-03-29T06:29:00.000+03:00", "replies_count": 0, "uuid": "8721e058be864afc3bbf24b2b63fe0735cbc831a"}, "author": "", "url": "http://www.nbcnews.com/storyline/brexit-referendum/scottish-parliament-backs-bid-new-independence-referendum-n739716", "ord_in_thread": 0, "title": "Scottish Parliament Backs Bid for New Independence Referendum", "locations": [], "entities": {"persons": [{"name": "theresa may", "sentiment": "none"}, {"name": "brexit", "sentiment": "none"}, {"name": "sturgeon", "sentiment": "none"}, {"name": "russell cheyne", "sentiment": "none"}, {"name": "nicola sturgeon", "sentiment": "none"}], "locations": [{"name": "scotland", "sentiment": "none"}, {"name": "england", "sentiment": "none"}, {"name": "europe", "sentiment": "none"}, {"name": "northern ireland", "sentiment": "none"}, {"name": "eu", "sentiment": "none"}, {"name": "uk", "sentiment": "none"}, {"name": "wales", "sentiment": "none"}, {"name": "london", "sentiment": "none"}, {"name": "edinburgh", "sentiment": "none"}, {"name": "united kingdom", "sentiment": "none"}], "organizations": [{"name": "parliament backs bid for new independence referendum mar", "sentiment": "negative"}, {"name": "reuters", "sentiment": "negative"}, {"name": "et scottish parliament backs bid for new independence referendum", "sentiment": "negative"}, {"name": "afp", "sentiment": "none"}, {"name": "european union", "sentiment": "none"}, {"name": "scottish parliament", "sentiment": "none"}, {"name": "sturgeon", "sentiment": "none"}]}, "highlightText": "", "language": "english", "persons": [], "text": "Mar 28 2017, 6:29 pm ET Scottish Parliament Backs Bid for New Independence Referendum by Reuters advertisement \nEDINBURGH/LONDON â€” The Scottish parliament on Tuesday backed a bid to hold a new independence referendum in 2018 or 2019, but the British government immediately rejected the proposal. \nThe stand-off further complicates the United Kingdom's political situation just as years of daunting negotiations on the terms of its exit from the European Union are about to begin. Play Scottish Lawmakers Vote to Seek New Independence Referendum 0:41 autoplay autoplay Copy this code to your website or blog <iframe src=\"http://www.nbcnews.com/widget/video-embed/908596803590\" width=\"560\" height=\"315\" frameborder=\"0\" allowfullscreen></iframe> \nThe Brexit issue has strained ties between the UK's four constituent parts because England and Wales voted to leave the EU while Scotland and Northern Ireland voted to remain. \nBritish Prime Minister Theresa May is due to trigger Article 50 of the bloc's Lisbon Treaty on Wednesday, a formal step that will start two years of talks on withdrawal terms and future trade relations. \nThe Scottish legislature in Edinburgh voted by a majority of 69 to 59 to give First Minister Nicola Sturgeon a mandate to formally seek permission from the British parliament in London to prepare for a referendum in late 2018 or early 2019. \n\"The people of Scotland should have the right to choose between Brexit, possibly a very hard Brexit, or becoming an independent country able to chart our own course,\" Sturgeon said earlier in the chamber. Scotland's First Minister Nicola Sturgeon speaks in the chamber at the Scottish Parliament in Edinburgh on March 28. Russell Cheyne / Pool via AFP - Getty Images \nBut the British government swiftly responded that it would refuse to enter into negotiations on Sturgeon's proposal. \n\"It would be unfair to the people of Scotland to ask them to make a crucial decision without the necessary information about our future relationship with Europe, or what an independent Scotland would look like,\" it said in a statement. \nSturgeon has said the shape of the future deal should become clear between the autumn of 2018 and the spring of 2019, and the Scottish executive would also put forward a detailed plan by then for what independence would entail. \nScots voted against independence by 55 to 45 percent in 2014 but Sturgeon argues the Brexit vote changed circumstances and they should not be dragged out of the EU against their will. \n\"When the nature of the change that is made inevitable by Brexit becomes clear, that change should not be imposed upon us,\" she said. \nMay has said \"now is not the time\" for a new vote on Scottish independence and insisted her focus was on getting a good Brexit deal that would work for every part of the UK. Play", "external_links": [], "published": "2017-03-29T06:29:00.000+03:00", "crawled": "2017-03-29T05:10:04.449+03:00", "highlightTitle": ""}