{"organizations": [], "uuid": "2c3eb4068378ce5fc6a2be2d268e9a3027cfab56", "thread": {"social": {"gplus": {"shares": 0}, "pinterest": {"shares": 0}, "vk": {"shares": 0}, "linkedin": {"shares": 0}, "facebook": {"likes": 789, "shares": 789, "comments": 0}, "stumbledupon": {"shares": 0}}, "site_full": "www.vanguardngr.com", "main_image": "http://d19lga30codh7.cloudfront.net/wp-content/uploads/2015/10/Senate-chambers1-e1444735013619.jpg", "site_section": "http://www.vanguardngr.com/feed", "section_title": "Vanguard News", "url": "http://www.vanguardngr.com/2017/03/senate-approves-45-ambassadorial-nominees-rejects-2/", "country": "US", "domain_rank": 2203, "title": "Senate rejects Justice Nsofor, Mr. Daodu, approves 45 other ambassadorial nominees", "performance_score": 7, "site": "vanguardngr.com", "participants_count": 1, "title_full": "Senate rejects Justice Nsofor, Mr. Daodu, approves 45 other ambassadorial nominees", "spam_score": 0.0, "site_type": "blogs", "published": "2017-03-24T01:55:00.000+02:00", "replies_count": 0, "uuid": "2c3eb4068378ce5fc6a2be2d268e9a3027cfab56"}, "author": "Nwafor Polycarp", "url": "http://www.vanguardngr.com/2017/03/senate-approves-45-ambassadorial-nominees-rejects-2/", "ord_in_thread": 0, "title": "Senate rejects Justice Nsofor, Mr. Daodu, approves 45 other ambassadorial nominees", "locations": [], "entities": {"persons": [{"name": "daodu", "sentiment": "negative"}, {"name": "stephen ugba", "sentiment": "none"}, {"name": "tijani bande", "sentiment": "none"}, {"name": "haruna abdullahi", "sentiment": "none"}, {"name": "uyagwe igbe", "sentiment": "none"}, {"name": "nasarawa", "sentiment": "none"}, {"name": "monsurat sunmonu", "sentiment": "none"}, {"name": "garba gajam", "sentiment": "none"}, {"name": "bukola saraki", "sentiment": "none"}, {"name": "muhammadu buhari", "sentiment": "none"}, {"name": "suleiman hassan", "sentiment": "none"}, {"name": "ahmed bamilli", "sentiment": "none"}, {"name": "y. aliu", "sentiment": "none"}, {"name": "d. abdulkadir", "sentiment": "none"}, {"name": "haruna ungogo", "sentiment": "none"}, {"name": "uzoma emenike", "sentiment": "none"}, {"name": "bala mohammad mairiga", "sentiment": "none"}, {"name": "baba madugu", "sentiment": "none"}, {"name": "goni zanna bura", "sentiment": "none"}, {"name": "maj gen ashimiyu olaniyi", "sentiment": "none"}, {"name": "nwafor polycarp", "sentiment": "none"}, {"name": "jonah odo", "sentiment": "none"}, {"name": "sylvanus nsofor", "sentiment": "none"}, {"name": "yusuf maitama tuggar", "sentiment": "none"}, {"name": "nsofor", "sentiment": "none"}, {"name": "afolahan adeyemi", "sentiment": "none"}, {"name": "ahmed musa ibeto", "sentiment": "none"}, {"name": "rotimi akeredolu", "sentiment": "none"}, {"name": "jacob igbekele daodu", "sentiment": "none"}, {"name": "amin dalhatu", "sentiment": "none"}, {"name": "prof mohammed yisa", "sentiment": "none"}, {"name": "orji ngofa", "sentiment": "none"}, {"name": "frank efeduma", "sentiment": "none"}, {"name": "george adesola oguntade", "sentiment": "none"}, {"name": "suzanne aderonke folarin", "sentiment": "none"}, {"name": "mohammadu rimi barade", "sentiment": "none"}, {"name": "baba ahmad jidda", "sentiment": "none"}, {"name": "deborah iliya", "sentiment": "none"}, {"name": "sylvanus adiewere nsofor", "sentiment": "none"}, {"name": "aminu iyawa", "sentiment": "none"}, {"name": "sunmonu", "sentiment": "none"}, {"name": "modupe irele", "sentiment": "none"}, {"name": "musa mohammad", "sentiment": "none"}, {"name": "sahabi isa gada", "sentiment": "none"}, {"name": "chris eze", "sentiment": "none"}, {"name": "kabir umar", "sentiment": "none"}, {"name": "james dmika", "sentiment": "none"}, {"name": "stanley diriyai", "sentiment": "none"}, {"name": "eniola ajayi", "sentiment": "none"}, {"name": "christopher okeke", "sentiment": "none"}, {"name": "isa dodo", "sentiment": "none"}, {"name": "nurudeen mohammed", "sentiment": "none"}, {"name": "habbiss ibrahim ugbada", "sentiment": "none"}, {"name": "maj gen godwin umoh rtd", "sentiment": "none"}], "locations": [{"name": "justice nsofor", "sentiment": "none"}, {"name": "nigeria", "sentiment": "none"}, {"name": "oyo state", "sentiment": "none"}, {"name": "ekiti", "sentiment": "none"}, {"name": "borno", "sentiment": "none"}, {"name": "katsina", "sentiment": "none"}, {"name": "osun", "sentiment": "none"}, {"name": "kano", "sentiment": "none"}, {"name": "adamawa", "sentiment": "none"}, {"name": "kebbi state", "sentiment": "none"}, {"name": "zamfara", "sentiment": "none"}, {"name": "taraba", "sentiment": "none"}, {"name": "enugu", "sentiment": "none"}, {"name": "lagos", "sentiment": "none"}, {"name": "kogi", "sentiment": "none"}, {"name": "bauchi", "sentiment": "none"}, {"name": "akoko", "sentiment": "none"}, {"name": "kaduna", "sentiment": "none"}, {"name": "yobe", "sentiment": "none"}, {"name": "ondo state", "sentiment": "none"}, {"name": "sokoto", "sentiment": "none"}, {"name": "jigawa", "sentiment": "none"}, {"name": "anambra", "sentiment": "none"}, {"name": "kwara", "sentiment": "none"}, {"name": "niger", "sentiment": "none"}, {"name": "gombe", "sentiment": "none"}, {"name": "cross river", "sentiment": "none"}, {"name": "bayelsa", "sentiment": "none"}, {"name": "abia", "sentiment": "none"}, {"name": "ogun", "sentiment": "none"}, {"name": "ondo", "sentiment": "none"}], "organizations": [{"name": "senate", "sentiment": "negative"}, {"name": "justice nsofor", "sentiment": "negative"}, {"name": "department of state services", "sentiment": "none"}, {"name": "nwafor polycarp comments  senate", "sentiment": "none"}, {"name": "federal capital territory", "sentiment": "none"}, {"name": "committee on foreign affairs", "sentiment": "none"}, {"name": "fct", "sentiment": "none"}, {"name": "dss", "sentiment": "none"}, {"name": "akwa ibom", "sentiment": "none"}, {"name": "apc oyo central", "sentiment": "none"}, {"name": "imo state", "sentiment": "none"}, {"name": "court of appeal", "sentiment": "none"}, {"name": "justice of court of appeal", "sentiment": "none"}, {"name": "apc", "sentiment": "none"}]}, "highlightText": "", "language": "english", "persons": [], "text": "Home » News » Senate rejects Justice Nsofor, Mr. Daodu, approves 45 other ambassadorial nominees Senate rejects Justice Nsofor, Mr. Daodu, approves 45 other ambassadorial nominees On 7:55 pm In News by Nwafor Polycarp Comments \nSenate on Wednesday rejected the nomination of two out of 47 non-career ambassadorial nominees presented for approval by President Muhammadu Buhari in January. \nThe affected nominees, who were rejected, based on the report of the Committee on Foreign Affairs are 82 year old Justice Sylvanus Nsofor from Imo State and Mr. Jacob Igbekele Daodu from Ondo State. Justice Sylvanus Adiewere Nsofor, retired as a Justice of Court of Appeal in March 2005, after clocking the mandatory retirement age of 70. He had served as a judge for 28 years with about 13 years spent in the Court of Appeal. \nThe committee, headed by Senator Monsurat Sunmonu (APC Oyo Central), screened the nominees. \nSenator Sunmonu, while presenting the report, said Justice Nsofor looked fragile and tired while his responses to the issues raised during screening were either not answered or devoid of details. \nShe added that Daodu did not respond to issues raised satisfactorily, apart from the negative security report against him by the Department of State Services, DSS. \n“During the screening exercise the nominee’s answers did not have direct bearing to the issues raised and the answers were not satisfactory to the committee’s expectation. \n“Besides, there is an adverse report on the nominee’s suitability for appointment as ambassador”, she said. \nDaodu, from Akoko area of Ondo State is an architect by profession and also a former commissioner for physical planning in the state. He lacked the support of the APC executive in the state, who accused him of anti-party activities in the last governorship election, won by Governor Rotimi Akeredolu. \nThose who were approved include: Uzoma Emenike (Abia), Aminu Iyawa (Adamawa), Maj Gen Godwin Umoh Rtd (Akwa Ibom), Christopher Okeke (Anambra), Yusuf Maitama Tuggar (Bauchi), Baba Madugu (Bauchi), Stanley Diriyai (Bayelsa). \nOthers are Stephen Ugba (Benue) Baba Ahmad Jidda (Borno) Etubom Asuquo (Cross River), Frank Efeduma (Delta) Jonah Odo (Ebonyi), and Uyagwe Igbe from Edo State Eniola Ajayi (Ekiti), Chris Eze (Enugu), Suleiman Hassan (Gombe). \nOthers include Justice Sylvanus Nsofor (Imo), Amin Dalhatu (Jigawa), Ahmed Bamilli and Deborah Iliya (both from Kaduna), Prof D. Abdulkadir(Kano) and Haruna Ungogo (Kano), Justice Isa Dodo(Katsina) and Mohammadu Rimi Barade (Katsina) and Tijani Bande from Kebbi State. \nThe other nominees who scaled the Senate hurdle are: Prof Y. Aliu (Kogi) Nurudeen Mohammed and Prof Mohammed Yisa (both from Kwara), Justice George Adesola Oguntade and Modupe Irele (both from Lagos), Musa Mohammad (Nasarawa), Ahmed Musa Ibeto (Niger), Suzanne Aderonke Folarin (Ogun), Jacob Igbekele Daodu (Ondo), Afolahan Adeyemi (Osun), and Maj Gen Ashimiyu Olaniyi from Oyo State. \nJames Dmika and Haruna Abdullahi (both from Plateau), Orji Ngofa (Rivers), Sahabi Isa Gada and Kabir Umar (both from Sokoto) Jika Ado (Taraba), Goni Zanna Bura (Yobe), Garba Gajam and Capt Bala Mohammad Mairiga (both from Zamfara) and Habbiss Ibrahim Ugbada from the Federal Capital Territory, FCT, were also approved by the Senate. \nThe Senate President, Dr. Bukola Saraki commended the committee for a job well done. \nHe called on the nominees to be good ambassadors of Nigeria in any country to which they are posted. \nHe further called on the Federal Government to ensure the payment of salary arrears of the Nigerian Embassy staff across the globe in order to project the country’s image positively. Nwafor Polycarp", "external_links": [], "published": "2017-03-24T01:55:00.000+02:00", "crawled": "2017-03-23T20:49:29.097+02:00", "highlightTitle": ""}