{"organizations": [], "uuid": "db1d2de0d39bc08a1f4d6ee2ad8d70111edc37bc", "thread": {"social": {"gplus": {"shares": 0}, "pinterest": {"shares": 0}, "vk": {"shares": 0}, "linkedin": {"shares": 0}, "facebook": {"likes": 226, "shares": 226, "comments": 0}, "stumbledupon": {"shares": 0}}, "site_full": "www.geo.tv", "main_image": "https://www.geo.tv/assets/uploads/updates/2017-03-24/135368_122951_updates.jpg", "site_section": "http://feeds.feedburner.com/geo/GiKR", "section_title": "GEO TV - Pakistan", "url": "https://www.geo.tv/latest/135368-Maryam-Nawaz-to-contest-for-NA-seat-in-2018-elections", "country": "TV", "domain_rank": 8287, "title": "Maryam Nawaz to contest for NA seat in 2018 elections", "performance_score": 2, "site": "geo.tv", "participants_count": 0, "title_full": "Maryam Nawaz to contest for NA seat in 2018 elections", "spam_score": 0.0, "site_type": "blogs", "published": "2017-03-24T20:20:00.000+03:00", "replies_count": 0, "uuid": "db1d2de0d39bc08a1f4d6ee2ad8d70111edc37bc"}, "author": "", "url": "https://www.geo.tv/latest/135368-Maryam-Nawaz-to-contest-for-NA-seat-in-2018-elections", "ord_in_thread": 0, "title": "Maryam Nawaz to contest for NA seat in 2018 elections", "locations": [], "entities": {"persons": [{"name": "maryam nawaz", "sentiment": "negative"}, {"name": "nawaz", "sentiment": "none"}, {"name": "nawaz sharif", "sentiment": "none"}, {"name": "jang pervaiz bashir", "sentiment": "none"}, {"name": "ivanka trump", "sentiment": "none"}, {"name": "asif farooqi", "sentiment": "none"}], "locations": [{"name": "malala", "sentiment": "none"}, {"name": "panama case", "sentiment": "none"}, {"name": "panama", "sentiment": "none"}, {"name": "pakistan", "sentiment": "none"}, {"name": "lahore", "sentiment": "none"}, {"name": "lahore", "sentiment": "none"}, {"name": "urdu", "sentiment": "none"}], "organizations": [{"name": "bbc", "sentiment": "none"}, {"name": "pakistan muslim league", "sentiment": "none"}, {"name": "national assembly", "sentiment": "none"}, {"name": "geo news", "sentiment": "none"}]}, "highlightText": "", "language": "english", "persons": [], "text": "Maryam Nawaz to contest for NA seat in 2018 elections | Maryam Nawaz lauds contribution of Malala, Sharmeen \nLAHORE: Prime Minister Nawaz Sharif’s daughter Maryam Nawaz has plans to contest for a National Assembly seat in the 2018 general elections. \nAccording to a report by senior journalist – Daily Jang Pervaiz Bashir, Maryam Nawaz will contest for NA seat from Lahore in the next general elections, due in 2018. \nThe PM’s daughter refuted earlier reports published recently that she was considering contesting sooner and said she had no plan or reason to do so. \nWhen contacted for comments, Maryam Nawaz confirmed she plans to contest in 2018 elections but her decision has no connection with the Panama case, regardless of what the outcome of the case may be. \nBritish media conglomerate BBC last week disclosed its latest additions to its curated list of Presidential Daughters around the world, which now has Maryam Nawaz and Ivanka Trump included among other authoritative figures. \nOn the website, BBC said that Maryam Nawaz \"played a prominent role in managing her father's successful re-election campaign in 2013, [and] now works for his party, the right-wing Pakistan Muslim League (Nawaz).\" \nThe 43-year-old lady has risen to power rapidly, making a name for herself \"as someone powerful, if not a designated political heir to her father,\" the media outlet's Urdu correspondent Asif Farooqi said. 0 0 Maryam Nawaz to contest for NA seat in 2018 elections   2018 General Elections, Geo News, Maryam Nawaz, Pakistan News, Panama Case, Pm.   \"Maryam Nawaz to contest for NA seat in 2018 elections\" is https://www.geo.tv/latest/135368-Maryam-Nawaz-to-contest-for-NA-seat-in-2018-elections+geo%2FGiKR+%28Geo+Pakistan+- ", "external_links": [], "published": "2017-03-24T20:20:00.000+03:00", "crawled": "2017-03-24T10:45:38.143+03:00", "highlightTitle": ""}