{"organizations": [], "uuid": "d9468337467d77552eb69fd986bfdb8669f5ec8e", "thread": {"social": {"gplus": {"shares": 0}, "pinterest": {"shares": 0}, "vk": {"shares": 0}, "linkedin": {"shares": 0}, "facebook": {"likes": 574, "shares": 574, "comments": 0}, "stumbledupon": {"shares": 0}}, "site_full": "www.slate.com", "main_image": "http://www.slate.com/content/dam/slate/articles/podcasts/gist/2017/03/170309-thegist-bakutrumphotel.jpg.CROP.cq5dam_web_1280_1280_jpeg.jpg", "site_section": "http://www.slate.com/articles.teaser.all.10.rss", "section_title": "Slate Articles", "url": "http://www.slate.com/articles/podcasts/gist/2017/03/adam_davidson_on_trump_s_shady_baku_azerbaijan_hotel.html", "country": "US", "domain_rank": 628, "title": "Trump’s Azerbaijan Problem", "performance_score": 5, "site": "slate.com", "participants_count": 1, "title_full": "Trump’s Azerbaijan Problem", "spam_score": 0.0, "site_type": "blogs", "published": "2017-03-10T06:43:00.000+02:00", "replies_count": 0, "uuid": "d9468337467d77552eb69fd986bfdb8669f5ec8e"}, "author": "Mike Pesca", "url": "http://www.slate.com/articles/podcasts/gist/2017/03/adam_davidson_on_trump_s_shady_baku_azerbaijan_hotel.html", "ord_in_thread": 0, "title": "Trump’s Azerbaijan Problem", "locations": [], "entities": {"persons": [{"name": "mike pesca", "sentiment": "negative"}, {"name": "trump", "sentiment": "negative"}, {"name": "davidson", "sentiment": "none"}, {"name": "donald trump", "sentiment": "none"}, {"name": "kevin sullivan", "sentiment": "none"}, {"name": "adam davidson", "sentiment": "none"}, {"name": "maria konnikova", "sentiment": "none"}], "locations": [{"name": "azerbaijan", "sentiment": "none"}, {"name": "iran", "sentiment": "none"}, {"name": "trump tower", "sentiment": "none"}, {"name": "baku", "sentiment": "none"}], "organizations": [{"name": "trump organization", "sentiment": "none"}, {"name": "npr", "sentiment": "none"}, {"name": "getty images  listen", "sentiment": "none"}, {"name": "green mountain coffee", "sentiment": "none"}, {"name": "revolutionary guard", "sentiment": "none"}, {"name": "new yorker", "sentiment": "none"}, {"name": "washington post", "sentiment": "none"}, {"name": "facebook", "sentiment": "none"}]}, "highlightText": "", "language": "english", "persons": [], "text": "A daily news and culture podcast with Mike Pesca. March 9 2017 6:43 PM Trump’s Azerbaijan Problem The New Yorker ’s Adam Davidson looked into one of the Trump Organization’s most questionable deals and found lots of red flags. The Trump Tower in downtown Baku, Azerbaijan. Kevin Sullivan/ Washington Post via Getty Images \nListen to Episode 696 of Slate ’s The Gist: \nSlate Plus members: Get your ad-free podcast feed . Advertisement \nPresident Donald Trump has overseen many shady deals, but New Yorker staff writer Adam Davidson thinks he may have found the most questionable one. Davidson says a Trump Organization hotel in Baku, Azerbaijan, links the president to some shady oligarchs as well as Iran’s Revolutionary Guard, a shadow-government ideological group. Read Davidson’s piece, “ Donald Trump’s Worst Deal .” \nMaria Konnikova has today’s Spiel on the theory of trickle-down hate-speech. \nToday’s sponsor: \nGreen Mountain Coffee. Green Mountain Coffee is passionate about making a smoother tasting cup. Try it today with code TRYGMC. \nJoin Slate Plus ! Members get bonus segments, exclusive member-only podcasts, and more. Sign up for a free trial today at slate.com/gistplus . \nJoin the discussion of this episode on Facebook . \nEmail: Twitter: @slategist \nMike Pesca is the host of the Slate daily podcast The Gist. He also contributes reports and commentary to NPR.", "external_links": [], "published": "2017-03-10T06:43:00.000+02:00", "crawled": "2017-03-10T02:22:34.227+02:00", "highlightTitle": ""}