{"organizations": [], "uuid": "abe88f99468dc1f10e5be4b99105d08a3cb4204f", "thread": {"social": {"gplus": {"shares": 0}, "pinterest": {"shares": 0}, "vk": {"shares": 0}, "linkedin": {"shares": 1}, "facebook": {"likes": 527, "shares": 527, "comments": 0}, "stumbledupon": {"shares": 0}}, "site_full": "www.vanguardngr.com", "main_image": "http://d19lga30codh7.cloudfront.net/wp-content/uploads/2016/05/Buratai-f.jpg", "site_section": "http://www.vanguardngr.com/feed", "section_title": "Vanguard News", "url": "http://www.vanguardngr.com/2017/03/boko-haram-militancy-challenge-armys-capacity-says-buratai/", "country": "US", "domain_rank": 2203, "title": "Boko Haram, militancy challenge Army’s capacity, says Buratai", "performance_score": 5, "site": "vanguardngr.com", "participants_count": 1, "title_full": "Boko Haram, militancy challenge Army’s capacity, says Buratai", "spam_score": 0.0, "site_type": "blogs", "published": "2017-03-14T14:00:00.000+02:00", "replies_count": 0, "uuid": "abe88f99468dc1f10e5be4b99105d08a3cb4204f"}, "author": "Okogba", "url": "http://www.vanguardngr.com/2017/03/boko-haram-militancy-challenge-armys-capacity-says-buratai/", "ord_in_thread": 0, "title": "Boko Haram, militancy challenge Army’s capacity, says Buratai", "locations": [], "entities": {"persons": [{"name": "buratai boko haram", "sentiment": "negative"}, {"name": "boko haram", "sentiment": "negative"}, {"name": "chukwudubem abraham", "sentiment": "none"}, {"name": "lucky irabor", "sentiment": "none"}, {"name": "tukur buratai", "sentiment": "none"}, {"name": "buratai", "sentiment": "none"}, {"name": "tukur", "sentiment": "none"}, {"name": "lafiya dole", "sentiment": "none"}, {"name": "ndahi marama", "sentiment": "none"}, {"name": "lt-gen", "sentiment": "none"}], "locations": [{"name": "niger delta", "sentiment": "none"}, {"name": "nigeria", "sentiment": "none"}, {"name": "north-east", "sentiment": "none"}, {"name": "maiduguri", "sentiment": "none"}, {"name": "ibadan", "sentiment": "none"}], "organizations": [{"name": "army", "sentiment": "negative"}, {"name": "buratai home", "sentiment": "negative"}, {"name": "allenge army", "sentiment": "none"}, {"name": "nigerian army ibadan", "sentiment": "none"}, {"name": "goc", "sentiment": "none"}, {"name": "nigerian army", "sentiment": "none"}]}, "highlightText": "", "language": "english", "persons": [], "text": "Home » News » Boko Haram, militancy challenge Army’s capacity, says Buratai Boko Haram, militancy challenge Army’s capacity, says Buratai On 8:00 am In News by Okogba Comments \nBy Ndahi Marama \nM AIDUGURI— THE Chief of Army Staff, COAS, Lt-Gen. Tukur Buratai, has said the Boko Haram insurgency in the North-East, militancy in Niger Delta and other criminalities in the country have challenged the Nigerian Army’s operational capacity to fulfil its constitutional roles. \nBuratai, who spoke yesterday while declaring open the First Commanding Officers’ Workshop organised by the Division 2, Nigerian Army, Ibadan, in Maiduguri, said Nigeria was faced with security challenges that had impacted negatively on the livelihoods of people. CHIEF OF ARMY STAFF (COAS), LT.-GEN. TUKUR BURATAI \nThe Chief of Army Staff, who was represented by Theatre Commander of Operation Lafiya Dole, Major General Lucky Irabor, said Boko Haram insurgency manifested the gravest threat to the nation’s national security. \nAccording to him, “the Boko Haram insurgency, militancy, pipeline vandalism, cattle rustling as well as kidnapping, ethnology-religious crisis, robbery and other forms of criminalities have constituted the gravest danger to national security, while also exposing lapses in the Nigerian Army’s operational capability and capacity.” \nHe said the five-day workshop was being held at the Operation Lafiya Dole theatre command in Maiduguri because of the unique lessons in active operational area like the North-East, where the military is prosecuting the counter-insurgency/terrorism war. \nThe COAS urged participants (commanding officers) to rededicate themselves and motivate their troops towards what he described as “being professionally responsive on the discharge of their constitutional roles in the nation.” \nGeneral Officer Commanding, GOC, 2 Division, Nigerian Army Ibadan, Major-General Chukwudubem Abraham, said in his opening remarks that the theme of the workshop, Empowering Unit Commanders in the Nigerian Army to be Professionally Responsive in Containing Current Security Challenge in Nigeria , was apt considering the current security challenges in the country.", "external_links": [], "published": "2017-03-14T14:00:00.000+02:00", "crawled": "2017-03-14T08:56:50.514+02:00", "highlightTitle": ""}