{"organizations": [], "uuid": "02eb9da8a8aa843c36c81d528cfff2960fc7cad8", "thread": {"social": {"gplus": {"shares": 2}, "pinterest": {"shares": 0}, "vk": {"shares": 0}, "linkedin": {"shares": 0}, "facebook": {"likes": 431, "shares": 431, "comments": 0}, "stumbledupon": {"shares": 0}}, "site_full": "www.themarysue.com", "main_image": "http://static02.mediaite.com/themarysue/uploads/2017/03/Tina-Guo-Wonder-Woman-432x243.png", "site_section": "http://www.themarysue.com/feed", "section_title": "The Mary Sue", "url": "http://www.themarysue.com/things-we-saw-today-1462/", "country": "US", "domain_rank": 11247, "title": "Things We Saw Today: The Metal-as-Hell Cellist Behind the Wonder Woman Theme", "performance_score": 4, "site": "themarysue.com", "participants_count": 1, "title_full": "Things We Saw Today: The Metal-as-Hell Cellist Behind the Wonder Woman Theme", "spam_score": 0.0, "site_type": "blogs", "published": "2017-03-06T06:30:00.000+02:00", "replies_count": 0, "uuid": "02eb9da8a8aa843c36c81d528cfff2960fc7cad8"}, "author": "Marykate Jasper", "url": "http://www.themarysue.com/things-we-saw-today-1462/", "ord_in_thread": 0, "title": "Things We Saw Today: The Metal-as-Hell Cellist Behind the Wonder Woman Theme", "locations": [], "entities": {"persons": [{"name": "marykate jasper", "sentiment": "negative"}, {"name": "remezcla", "sentiment": "none"}, {"name": "— tina guo", "sentiment": "none"}, {"name": "batman v superman", "sentiment": "none"}, {"name": "guo", "sentiment": "none"}, {"name": "danny rand", "sentiment": "none"}, {"name": "katya ojeda", "sentiment": "none"}, {"name": "pink ranger", "sentiment": "none"}, {"name": "tina guo", "sentiment": "none"}, {"name": "amy jo johnson", "sentiment": "none"}], "locations": [{"name": "usa", "sentiment": "none"}, {"name": "tumblr", "sentiment": "none"}, {"name": "nerdist", "sentiment": "none"}, {"name": "pinterest", "sentiment": "none"}], "organizations": [{"name": "npr", "sentiment": "none"}, {"name": "cbr", "sentiment": "none"}, {"name": "justice", "sentiment": "none"}, {"name": "google", "sentiment": "none"}, {"name": "facebook", "sentiment": "none"}, {"name": "disney", "sentiment": "none"}, {"name": "disney channel original movie", "sentiment": "none"}]}, "highlightText": "", "language": "english", "persons": [], "text": "Things We Saw Today: The Metal-as-Hell Cellist Behind the Wonder Woman Theme by Marykate Jasper | 6:30 pm, March 5th, 2017 \nTina Guo, the classically trained musician who provided the badass cello riffs on Wonder Woman’s theme from Batman V Superman: Dawn of Justice , shared a video of her making the song even more metal. She told io9 that the video below is in preparation for her personal work, rather than a new song for Wonder Woman , but she is recording something for Wonder Woman . Either way, we can still enjoy (a) her talent (b) her use of the hashtag #PizzaPower. \n— Tina Guo (@Tinaguo) March 5, 2017 Amy Jo Johnson, the original Pink Ranger, pranked the cast of the new Power Rangers movie by pretending to be a reporter at their press junket. (via Nerdist ) ScreenCrush shared an amazing look at all the visual effects work that went into Batman V Superman: Dawn of Justice . Even though I wasn’t a fan of the movie overall, I still found the amount of work and artistry that goes into creating these scenes astounding. It’s worth checking out. Remezcla and NPR’s Latino USA released a story about the fascinating, super-secret process of creating the Spanish-language dub of Rogue One: A Star Wars Story . The secrecy around the film was just absurd. As described by io9 , translator Katya Ojeda “had to translate from a rotoscoped version of the film. The entire screen was in black, and when the actors talked, little ‘bubbles’ would open up so she could observe the lip movements.” (via io9 ) Danny Rand will not wear a costume in the first season of Iron Fist, so fans of navel-deep plunging necklines will have to wait. (via CBR ) Disney has posted the first five minutes of their Disney Channel Original Movie, Tangled: Before Ever After . The movie is a sort of extended pilot for Tangled: The Series . (via /Film ) \n(image via screengrab from Guo’s video ) \nWant more stories like this? Become a subscriber and support the site! \nFollow The Mary Sue on Twitter , Facebook , Tumblr , Pinterest , & Google+ . Follow The Mary Sue Like us on Facebook filed under", "external_links": [], "published": "2017-03-06T06:30:00.000+02:00", "crawled": "2017-03-06T02:19:14.739+02:00", "highlightTitle": ""}