{"organizations": [], "uuid": "96bd78f8ee3bcde88c605cef301748535964e95a", "thread": {"social": {"gplus": {"shares": 10}, "pinterest": {"shares": 20}, "vk": {"shares": 0}, "linkedin": {"shares": 0}, "facebook": {"likes": 352, "shares": 352, "comments": 0}, "stumbledupon": {"shares": 0}}, "site_full": "www.lifehack.org", "main_image": "", "site_section": "http://www.lifehack.org", "section_title": "Lifehack", "url": "http://www.lifehack.org/565814/47-all-time-funniest-songs-cheer-you", "country": "US", "domain_rank": 2009, "title": "47 All-Time Funniest Songs To Cheer You Up", "performance_score": 3, "site": "lifehack.org", "participants_count": 1, "title_full": "47 All-Time Funniest Songs To Cheer You Up", "spam_score": 0.0, "site_type": "blogs", "published": "2017-03-21T18:00:00.000+02:00", "replies_count": 0, "uuid": "96bd78f8ee3bcde88c605cef301748535964e95a"}, "author": "Anna Chui", "url": "http://www.lifehack.org/565814/47-all-time-funniest-songs-cheer-you", "ord_in_thread": 0, "title": "47 All-Time Funniest Songs To Cheer You Up", "locations": [], "entities": {"persons": [{"name": "tsamina", "sentiment": "none"}, {"name": "ken", "sentiment": "none"}, {"name": "mika", "sentiment": "none"}, {"name": "ya", "sentiment": "none"}, {"name": "bruno mars bruno mars", "sentiment": "none"}, {"name": "spotify", "sentiment": "none"}, {"name": "lou bega", "sentiment": "none"}, {"name": "macarena", "sentiment": "none"}, {"name": "kendrick lamar #yolo", "sentiment": "none"}, {"name": "erica", "sentiment": "none"}, {"name": "axel", "sentiment": "none"}, {"name": "tunak tunak tun", "sentiment": "none"}, {"name": "dragostea din tei", "sentiment": "none"}, {"name": "adam levine", "sentiment": "none"}, {"name": "rebecca black well", "sentiment": "none"}, {"name": "grace kelly", "sentiment": "none"}, {"name": "michael jackson", "sentiment": "none"}, {"name": "dub-i-dub", "sentiment": "none"}, {"name": "yolanda", "sentiment": "none"}, {"name": "mark ronson", "sentiment": "none"}, {"name": "ricky martin", "sentiment": "none"}, {"name": "roger miller", "sentiment": "none"}, {"name": "barbie girl", "sentiment": "none"}, {"name": "carly ras jepsen", "sentiment": "none"}, {"name": "olivia newton-john", "sentiment": "none"}, {"name": "katy perry", "sentiment": "none"}, {"name": "cyndi lauper", "sentiment": "none"}, {"name": "tsamina mina", "sentiment": "none"}, {"name": "daler mehndi yes", "sentiment": "none"}, {"name": "tina", "sentiment": "none"}, {"name": "shakira", "sentiment": "none"}, {"name": "frankie avalon", "sentiment": "none"}, {"name": "john travolta", "sentiment": "none"}, {"name": "monica", "sentiment": "none"}, {"name": "waka waka", "sentiment": "none"}, {"name": "ke", "sentiment": "none"}], "locations": [{"name": "la la la la long", "sentiment": "none"}, {"name": "bruno mars", "sentiment": "none"}, {"name": "sieben", "sentiment": "none"}, {"name": "lonely island", "sentiment": "none"}, {"name": "madagascar", "sentiment": "none"}], "organizations": [{"name": "yolo", "sentiment": "none"}, {"name": "mj", "sentiment": "none"}, {"name": "lipps inc", "sentiment": "none"}, {"name": "vanilla ice", "sentiment": "none"}, {"name": "africa", "sentiment": "none"}, {"name": "abba funny", "sentiment": "none"}, {"name": "village people young", "sentiment": "none"}, {"name": "la la la la long a la la la la long long li long long long", "sentiment": "none"}, {"name": "la vida loca", "sentiment": "none"}, {"name": "youtube", "sentiment": "none"}]}, "highlightText": "", "language": "english", "persons": [], "text": "When you feel like having a bad day or just having some down time because of the stressful work, some annoying people, or the bad weather; you don’t always want to talk with people about how you feel. You’d probably prefer chilling on your own with some music playing, particularly some songs that would make you smile, right?\nAs a music lover, I love listening to and playing different kinds of music. Recently I’ve researched on the funniest songs on YouTube and Spotify and have shortlisted 50 funny and upbeat songs that will surely cheer you up! The list of songs ranged from the 70s, 80s and 90s hits to recent pop songs, you’ll definitely find positive vibes from one of them.\nJust sing along when you’re feeling down. Some of the music videos are quite funny too! (By the way, if you love these songs, I’ve got you the complete playlist at the end!)\n1. Sweat (A La La La La Long) – Inner Circle Forget about La La Land , and sing aloud “la la la la….”\nI’ve been watching you!\nA La La La La Long\nA La La La La Long Long\nLi Long Long Long.\n2. Witch Doctor – Cartoons Annoying but super funny!\nOoo eee oo ah ah\nTing tang walla walla bang bang….\n3. Wannabe – Spice Girls Yoooo tell me what you want! I just want some fun!\nI’ll tell you what I want, what I really really want,\nSo tell me what you want, what you really really want,\nI wanna, I wanna, I wanna, I wanna, I wanna really really really wanna zigazig ha.\n4. Dragostea Din Tei – O-Zone We just can’t help singing along the languages we don’t understand, don’t we?\nMai-ia-hii Mai-ia-huu Mai-ia-ha Mai-ia-haha\nMai-ia-hii Mai-ia-huu Mai-ia-ha Mai-ia-haha\n5. Boom, Boom, Boom, Boom!! – Vengaboys We just wanna do the “BOOM” sound anyway.\nBoom boom boom boom\nI want to do the boom\n6. Barbie Girl – Aqua Oh who would miss this? Barbie Girl’s just always our favorite! (I always do the lip dub when it’s Ken singing by the way.)\nYou can brush my hair, undress me everywhere\nImagination, life is your creation\n7. Friday – Rebecca Black Well, what’s better than Fridays?\nIt’s Friday, Friday\nGotta get down on Friday\nEverybody’s lookin’ forward to the weekend, weekend\n 8. U Can’t Touch This – MC Hammer We love the music anyway, for the lyrics? Of course it’s “can’t touch this”!\nCan’t touch this (oh-oh oh oh oh-oh-oh)\nCan’t touch this (oh-oh oh oh oh-oh-oh)\nMy-my-my-my music…\n9. Mambo No. 5 (A Little Bit Of….) – Lou Bega Ladies and gentlemen, just a list of ladies in his life, okay?\nA little bit of Monica in my life\nA little bit of Erica by my side\nA little bit of Rita is all I need\nA little bit of Tina is what I see\n10 .Call Me Maybe – Carly Ras Jepsen Oh so it’s call me Maybe, or call me, maybe? Not funny? Fine…\nHey, I just met you,\nAnd this is crazy,\nBut here’s my number,\nSo call me, maybe!\n11. Stayin’ Alive – Bee Gees Falsetto is the focus here, okay?\nAh, ha, ha, ha, stayin’ alive, stayin’ alive.\nAh, ha, ha, ha, stayin’ alive.\n12. Gonna Make You Sweat (Everybody Dance Now) – C & C Music Factory Again, falsetto is the focus here, okay?\nEv’rybody dance now!\nEv’rybody dance now!\nYeah! Yeah!\nEv’rybody dance now!\nYeah! Yeah! Yeah!\n13. I Like to Move It – Real 2 Real I know what you’re thinking, it’s not originated from  Madagascar !\nI like to move it, move it.\nI like to move it, move it.\nYa like to… move it.\n14. Y.M.C.A – Village People Young man, when you’re singing this along, don’t forget your hand gestures for Y-M-C-A.\nIt’s fun to stay at the Y.M.C.A.\nIt’s fun to stay at the Y.M.C.A.\n15. Tunak Tunak Tun – Daler Mehndi Yes, we’re in love with the foreign language. Do you know that Tunak Tunak Tun actually means dear / beloved? It’s a Bhangra Pop song. [1] \nTunak tunak tun, tunak tunak tun, tunak tunak tun, da da da\nTunak tunak tun, tunak tunak tun, tunak tunak tun, da da da\n16. Lemon Tree – Fools Garden This is funny in a kind of sad way…\nI’m sitting here in a boring room, it’s just another rainy\nSunday afternoon. I’m wasting my time, I got nothing to do.\nI’m hanging around, I’m waiting for you,\nBut nothing ever happens – and I wonder.\n17. Macarena – Los Del Rio Eh,… Macarena – the only word we sing whenever this song plays. It’s actually a pretty funny song about the girl Macarena wanting to meet a boyfriend in the States! [2] \nDale a tu cuerpo alegría Macarena…..\n¡Eh,… Macarena! Aaay!\n18. Gangnam Style – PSY This was the most popular song back a few years ago, and I bet you know how to dance to this song!\nOp, op, op, op Oppa Gangnam Style\nGangnam Style\n19. Funky Town – Lipps Inc. The funky music just makes you feel so energetic and want to keep moving!\nWell, I talk about it, talk about it\nTalk about it, talk about it Talk about, talk about\nTalk about movin’\n20. #SELFIE – The Chainsmokers A not-so-long ago released song about the common phenomenon of people taking selfie all the time. The monologue is just so cool.\nAfter we go to the bathroom, can we go smoke a cigarette?\nI really need one\nBut first, Let me take a selfie\n21. Lollipop – Mika This is just a lovely idea to suck on the lollipop haha!\nSucking too hard on your lollipop,\nOr love’s gonna get you down\n22. The Lazy Song – Bruno Mars This just speaks our minds when we want some slack time.\nToday I don’t feel like doing anything\nI just wanna lay in my bed\n23. Hot N Cold – Katy Perry (and the Chipettes version’s even better) The original Katy Perry version is nice, but I’d also recommend you to try the Chipette version!\nYou’re up then you’re down You’re wrong when it’s right It’s black and it’s white\nWe fight, we break up We kiss, we make up\n24. Dub-I-Dub – Me & My I can’t even remember other lyrics in the song besides Dub-I-Dub. We just love to sing it along!\nDub-i-dub-i-dub-i-dub-dub-dub Dub-i-dub-i-dub-i-yeah-yeah\nDub-i-dub-i-dub-i-dub-dub-dub I don’t need your love\n25. Girls Just Wanna Have Fun – Cyndi Lauper Well yes, girls just wanna have fun. Period.\nOh daddy dear you know you’re still number one\nBut girls they want to have fun Oh girls just want to have\n26. We No Speak Americano – Yolanda Be Cool, DCup Just sing along and knot your head with pa pa l’ americano.\nPa pa l’ americano\nPa pa l’ americano\nPa pa l’ americano\n27. Livin’ La Vida Loca – Ricky Martin Just admit it! You like this song too!\nUpside, inside out she’s livin la vida loca\nShe’ll push and pull you down, livin la vida loca\n28. Dancing Lasha Tumbai – VERKA SERDUCHKA It’s a German song about speaking dance, the song sounds really lovely!\nSieben, Sieben, ai lyu lyu Sieben, Sieben, ein, zwei…\nein, zwei, drei\n29. My First Kiss – 3oh3! feat. Ke$ha The sound of the kiss is the thing you definitely can’t miss in the song.\nMy first kiss went a little like this\n[muach] and twist [muach muach] and twist\n30. We Will Rock You – Queen Hey buddy, just listen how I’m gonna rock you!\nWe will we will rock you\nWe will we will rock you\n31. Uptown Funk – Mark Ronson & Bruno Mars Bruno Mars and Mark Ronson are just awesome here, who can resist the beat of this song?\nI’m too hot (hot damn)\nCall the po-lice and the fireman\n32. Summer Nights – Olivia Newton-John, John Travolta (soundtrack from Grease) From the musical Grease, the “tell mer more” song will never bore you!\nTell me more, tell me more How much dough did he spend?\nTell me more, tell me more Could she get me a friend?\n 33. Rude – MAGIC! The funny part is how honest the guy is being with his lover’s dad, don’t you think so?\nWhy you gotta be so rude? Don’t you know I’m human too? Why you gotta be so rude?\nI’m gonna marry her anyway\n34. We Like To Party! – Vengaboys Yes, we know that they really like to party, yes we get that.\nWe like to party\nWe like, we like to party…. We like to party\n35. Beat It – Michael Jackson A song about beating up the other, it’s kind of funny. (Don’t get me wrong. This is a really nice song and MJ is a legend!)\nShowin’ how funky strong is your fight\nIt doesn’t matter who’s wrong or right\nJust beat it, beat it\n36. Sexy And I Know It – LMFAO Whoever says they’re sexy and they know it is funny enough.\nGirl look at that body\nGirl look at that body\nI work out  I’m sexy and I know it\n37. Waka Waka – Shakira This is a lovely song and we all like to sing along “waka waka”!\nTsamina mina, eh eh Waka waka, eh eh\nTsamina mina zangalewa\nThis time for Africa\n38. Pump It – The Black Eyed Peas Personally I think the part singing “louder” is worth highlighting.\nPump it (louder)\nPump it (louder)\nPump it (louder)\n…..\n39. Hooked on a Feeling – Blue Swede I can’t stop this feeling either, the sound of ooga-chaka keeps ringing in my head.\nOoga-chaka Ooga-Ooga\nOoga-chaka Ooga-Ooga\n….\n40. Grace Kelly – Mika A very cute song about becoming more elegant and look better to impress another person.\nI could be brown I could be blue I could be violet sky\nI could be hurtful I could be purple I could be anything you like\n41. Don’t Stop Me Now – Queen I think this is a very nice song to play (or sing) to someone if they’re trying to stop you from having a good time.\nDon’t stop me now I’m having such a good time\nI’m having a ball\nDon’t stop me now\nIf you wanna have a good time just give me a call\n42. Money Money Money – Abba Funny but sad song about the reality…\nI work all night, I work all day, to pay the bills I have to pay  Ain’t it sad\nAnd still there never seems to be a single penny left for me  That’s too bad\n43. Beauty School Drop Out – Frankie Avalon (soundtrack from Grease) Another song from Grease, the approach of trying to motivate the girl is quite funny.\nBeauty school dropout, No graduation day for you.\nBeauty school dropout, Missed your midterms and flunked shampoo!\n44. Ice Ice Baby – Vanilla Ice The rap is cool, but we only remember the vanilla ice baby. Yes, our fault.\nIce ice baby, Vanilla\nIce ice baby, Vanilla\n45. You Can’t Roller Skate In A Buffalo Herd – Roger Miller The lyrics are just so cute about skating in different places!\nYa can’t roller skate in a buffalo herd  But you can be happy if you’ve a mind to\nYa can’t take a shower in a parakeet cage  But you can be happy if you’ve a mind to\n46. YOLO – The Lonely Island, Adam Levine, Kendrick Lamar #YOLO, the way the song’s telling people to live the moment is funny. I particularly like these lines:\nNever go to loud clubs  ‘Cause it’s bad for your ears.\nYour friends will all be sorry  When they can’t hear.\n47. Axel F – Crazy Frog Bing bing bing bing, bing bing, bing bing bing bing, bing bing bing…. BANG BANG… can you think of anything funnier and crazier than this?\nJust follow and listen to the complete playlist here on Spotify: \nReference [1] ^ Quora: What do the lyrics to “Tunak Tunak Tun” mean in English? [2] ^ Lyricstranslate: Macarena The post 47 All-Time Funniest Songs To Cheer You Up appeared first on Lifehack .", "external_links": [], "published": "2017-03-21T18:00:00.000+02:00", "crawled": "2017-03-22T07:42:47.795+02:00", "highlightTitle": ""}