{"organizations": [], "uuid": "7321917416e63429f1c71a8fc778e0e49fd2ffaa", "thread": {"social": {"gplus": {"shares": 0}, "pinterest": {"shares": 17}, "vk": {"shares": 0}, "linkedin": {"shares": 0}, "facebook": {"likes": 326, "shares": 326, "comments": 29}, "stumbledupon": {"shares": 0}}, "site_full": "www.buzzfeed.com", "main_image": "https://img.buzzfeed.com/buzzfeed-static/static/2017-03/23/18/enhanced/buzzfeed-prod-fastlane-01/original-5090-1490309939-2.jpg?crop=1009:528;0,0", "site_section": "http://buzzfeed.com//index.xml", "section_title": "BuzzFeed - Latest", "url": "https://www.buzzfeed.com/michellerennex/wooooooow", "country": "US", "domain_rank": 137, "title": "22 Guys From The '00s That Everyone Crushed On Then Vs Now", "performance_score": 3, "site": "buzzfeed.com", "participants_count": 1, "title_full": "22 Guys From The '00s That Everyone Crushed On Then Vs Now", "spam_score": 0.0, "site_type": "blogs", "published": "2017-03-24T09:01:00.000+03:00", "replies_count": 0, "uuid": "7321917416e63429f1c71a8fc778e0e49fd2ffaa"}, "author": "Michelle Rennex", "url": "https://www.buzzfeed.com/michellerennex/wooooooow", "ord_in_thread": 0, "title": "22 Guys From The '00s That Everyone Crushed On Then Vs Now", "locations": [], "entities": {"persons": [{"name": "justin bieber", "sentiment": "neutral"}, {"name": "justin timberlake getty", "sentiment": "none"}, {"name": "pete wentz getty", "sentiment": "none"}, {"name": "jake gyllenhaal getty", "sentiment": "none"}, {"name": "jared leto getty", "sentiment": "none"}, {"name": "chad michael murray getty", "sentiment": "none"}, {"name": "adam brody getty", "sentiment": "none"}, {"name": "john cho getty", "sentiment": "none"}, {"name": "joe jonas getty", "sentiment": "none"}, {"name": "ben mckenzie getty", "sentiment": "none"}, {"name": "zac efron getty", "sentiment": "none"}, {"name": "channing tatum getty", "sentiment": "none"}, {"name": "jesse mccartney getty", "sentiment": "none"}, {"name": "michelle rennex", "sentiment": "none"}, {"name": "corbin bleu getty", "sentiment": "none"}, {"name": "nicholas hoult getty", "sentiment": "none"}, {"name": "jake", "sentiment": "none"}, {"name": "nick lachey getty", "sentiment": "none"}, {"name": "ashton kutcher getty", "sentiment": "none"}, {"name": "tbh", "sentiment": "none"}, {"name": "dev patel getty", "sentiment": "none"}, {"name": "taylor lautner getty", "sentiment": "none"}, {"name": "pete wentz", "sentiment": "none"}], "locations": [{"name": "sydney", "sentiment": "none"}], "organizations": [{"name": "wilmer valderrama getty", "sentiment": "none"}]}, "highlightText": "", "language": "english", "persons": [], "text": "Then: Obviously started the choker trend. Iconic. \nNow: He looks like an off-brand Justin Bieber.\nID: 10754050 2. Chad Michael Murray Getty Images\nGetty Images\n  Then: Cute. Trendy with his spiky hair. Wore this t-shirt/collared shirt combo tho. Points must be taken away.\nNow: Aged like a fine wine. Learned how to raise eyebrow for photos. Nice.\nID: 10753240 3. Zac Efron Getty Images\nGetty Images\n  Then: Was definitely wearing a hat before this photo. It was probably a snapback. \nNow: Definition of a perfect glow-up. His hair even does that flick thing. Good job.\nID: 10753269 4. Lil Bow Wow Getty Images\nGetty Images\n  Then: You just knew he was going to grow up to be fine. \nNow: You were 100% correct.\nID: 10753441 5. Channing Tatum Getty Images\nGetty Images\n  Then: Step Up was a great film. Had that “bad boy your mum told you not to go near” vibe. \nNow: Is a dad now. Idk. Hair is still kinda spiky? I guess?\nID: 10753302 6. Pete Wentz Getty Images\nGetty Images\n  Then: Um, there was a lot going on with ’00s Pete Wentz. The guyliner, the hair, just wow. \nNow: Stubble makes everything better. He’s also a dad now. He gets DILF points.\nID: 10753391 7. Ben McKenzie Getty Images\nGetty Images\n  Then: not my flavour. But I’m going to be attacked in the comments if he’s not in here. \nNow: Tbh he kinda looks the same. He just started to push his hair back which is good. Nice paisley tie. Different. Unusual. I approve.\nID: 10753515 8. Corbin Bleu Getty Images\nGetty Images\n  Then: That baby blue button-up is really something. Props to him. \nNow: Less fro, more chest hair. Same shirt, different colour.\nID: 10754247 9. Adam Brody Getty Images\nGetty Images\n  Then: Nerdy. Cute. Curly hair. Dimples. Just wow. \nNow: He just grew some stubble and stopped smiling with his teeth. Still would. 10/10.\nID: 10753564 10. Wilmer Valderrama Getty Images\nGetty Images\n  Then: Cute. Looks looks like an off-duty model. \nNow: He got more stubble and lost the beanie. I approve.\nID: 10754205 11. Jesse McCartney Getty Images\nGetty Images\n  Then: Rewind it back 10 years ago and I would’ve given him my “Beautiful Soul”. ;)\nNow: He’s got dark hair now. That’s nice, a bit of a change is always good.\nID: 10753897 12. Ashton Kutcher Getty Images\nGetty Images\n  Then: He was that weird kind of sexy. The goofy kind of sexy. Plus he had a lot of hair. \nNow: Tbh I think he looks better older. Or it could be the tuxedo. Who knows?\nID: 10753926 13. John Cho Getty Images\nGetty Images\n  Then: Spiky hair was really the style of the ’00s it seems.\nNow: Pushed that hair back. Good decision.\nID: 10754258 14. Jared Leto Getty Images\nGetty Images\n  Then: Look at those big, beautiful blue eyes. Amazing areas. \nNow: He looks the same. Which means he’s still beautiful. Great stuff.\nID: 10754034 15. Usher Getty Images\nGetty Images\n  Then: Hat to the side so you know he’s extra cool. \nNow: That fur throw makes him look like he’s really warm. Classy. Nice.\nID: 10754119 16. Nick Lachey Getty Images\nGetty Images\n  Then: This really isn’t my vibe but people loved Newlyweds: The First Year so here we are. \nNow: He literally looks the same. He’s just a little less orange.\nID: 10754149 17. Nicholas Hoult Getty Images\nGetty Images\n  Then: A cutie with an awkward haircut. \nNow: There was no way he was going to grow up looking anything other than beautiful.\nID: 10754332 18. Dev Patel Getty Images\nGetty Images\n  Then: Adorable and dorky-looking. \nNow: A great glow-up. One for the history books.\nID: 10754301 19. Joe Jonas Getty Images\nGetty Images\n  Then: So young. So very, very young. \nNow: Mmmmhmmm, I told you beards fix everything.\nID: 10754344 20. Jake Gyllenhaal Getty Images\nGetty Images\n  Then: I’m not going to lie, I didn’t know who Jake was until the last few years. I have no opinions. \nNow: He looks like a wolf with his beard now. I’m here for it.\nID: 10754358 21. Taylor Lautner Getty Images\nGetty Images\n  Then: Real-life porcupine aesthetic. \nNow: Stubble? Check. Less spikes? Check. Perfect. That’s all we need.\nID: 10754350 22. And Justin Timberlake Getty Images\nGetty Images\n  Then: I don’t know what the fuck his ’00s look was. Did people find this attractive? Anyone?\nNow: Beards make everything better. Plus his new hair is a real improvement but one of his eyes look fake. I need an explanation.\nID: 10754014 Check out more articles on BuzzFeed.com! \nMichelle Rennex is a staff writer for BuzzFeed and is based in Sydney.", "external_links": [], "published": "2017-03-24T09:01:00.000+03:00", "crawled": "2017-03-24T01:12:25.644+02:00", "highlightTitle": ""}