{"organizations": [], "uuid": "ab3922e2e12877b53600cc068254ce4c9a4176b9", "thread": {"social": {"gplus": {"shares": 1}, "pinterest": {"shares": 1}, "vk": {"shares": 0}, "linkedin": {"shares": 1}, "facebook": {"likes": 167, "shares": 167, "comments": 0}, "stumbledupon": {"shares": 0}}, "site_full": "www.usatoday.com", "main_image": "https://www.gannett-cdn.com/-mm-/bf92816f5c01ad672c3e9ab22771dabe840fc5e3/c=3-0-1596-900&amp;r=x633&amp;c=1200x630/local/-/media/2017/03/29/USATODAY/USATODAY/636264019082862793-FotorCreated.png", "site_section": "http://rssfeeds.usatoday.com/usatoday-LifeTopStories", "section_title": "GANNETT Syndication Service", "url": "http://www.usatoday.com/story/life/entertainthis/2017/03/30/2017-book-to-movie-adaptations-list/99793458/", "country": "US", "domain_rank": 313, "title": "13 books to read before they become movies in 2017", "performance_score": 1, "site": "usatoday.com", "participants_count": 1, "title_full": "13 books to read before they become movies in 2017", "spam_score": 0.0, "site_type": "blogs", "published": "2017-03-31T05:17:00.000+03:00", "replies_count": 0, "uuid": "ab3922e2e12877b53600cc068254ce4c9a4176b9"}, "author": "USA TODAY", "url": "http://www.usatoday.com/story/life/entertainthis/2017/03/30/2017-book-to-movie-adaptations-list/99793458/", "ord_in_thread": 0, "title": "13 books to read before they become movies in 2017", "locations": [], "entities": {"persons": [{"name": "kelly lawler", "sentiment": "neutral"}, {"name": "stephen king", "sentiment": "none"}, {"name": "diane ackerman", "sentiment": "none"}, {"name": "kenneth branagh", "sentiment": "none"}, {"name": "tom hanks", "sentiment": "none"}, {"name": "charlie hunnam", "sentiment": "none"}, {"name": "alicia vikander", "sentiment": "none"}, {"name": "julia roberts", "sentiment": "none"}, {"name": "david grann", "sentiment": "none"}, {"name": "laura linney", "sentiment": "none"}, {"name": "amy schumer", "sentiment": "none"}, {"name": "daniel bruhl", "sentiment": "none"}, {"name": "roland deschain", "sentiment": "none"}, {"name": "stephen king  stephen king", "sentiment": "none"}, {"name": "deborah moggach", "sentiment": "none"}, {"name": "emma watson", "sentiment": "none"}, {"name": "rachel", "sentiment": "none"}, {"name": "johnny depp", "sentiment": "none"}, {"name": "jacob tremblay", "sentiment": "none"}, {"name": "agatha christie", "sentiment": "none"}, {"name": "david finkel", "sentiment": "none"}, {"name": "percy fawcett", "sentiment": "none"}, {"name": "christoph waltz", "sentiment": "none"}, {"name": "judi dench", "sentiment": "none"}, {"name": "rebecca hall", "sentiment": "none"}, {"name": "steve coogan", "sentiment": "none"}, {"name": "weiz", "sentiment": "none"}, {"name": "kate winslet", "sentiment": "none"}, {"name": "tom holland", "sentiment": "none"}, {"name": "roland", "sentiment": "none"}, {"name": "jessica chastain", "sentiment": "none"}, {"name": "auggie", "sentiment": "none"}, {"name": "norton", "sentiment": "none"}, {"name": "r.j. palacio", "sentiment": "none"}, {"name": "anika noni rose", "sentiment": "none"}, {"name": "john boyega", "sentiment": "none"}, {"name": "daisy ridley", "sentiment": "none"}, {"name": "herman koch", "sentiment": "none"}, {"name": "bill skarsgard", "sentiment": "none"}, {"name": "hercule poirot", "sentiment": "none"}, {"name": "dave eggers", "sentiment": "none"}, {"name": "robert pattinson", "sentiment": "none"}, {"name": "daphne", "sentiment": "none"}, {"name": "nicola yoon", "sentiment": "none"}, {"name": "sienna miller", "sentiment": "none"}, {"name": "richard gere", "sentiment": "none"}, {"name": "amandla stenberg", "sentiment": "none"}, {"name": "idris elba", "sentiment": "none"}, {"name": "cara delevingne", "sentiment": "none"}, {"name": "nick robinson", "sentiment": "none"}, {"name": "charles martin", "sentiment": "none"}], "locations": [{"name": "usa", "sentiment": "none"}, {"name": "poland", "sentiment": "none"}, {"name": "amsterdam", "sentiment": "none"}, {"name": "amazon", "sentiment": "none"}], "organizations": [{"name": "orient express", "sentiment": "none"}, {"name": "warsaw zoo", "sentiment": "none"}, {"name": "ap", "sentiment": "none"}, {"name": "miles teller", "sentiment": "none"}]}, "highlightText": "", "language": "english", "persons": [], "text": "13 books to read before they become movies in 2017 Kelly Lawler , USA TODAY 5:17 p.m. ET March 30, 2017 \n'The Zookeeper's Wife' in book and movie form. (Photo: WW Norton; AP) \nSummer movie season is almost upon us, which means you have some homework. \n2017 has already had a handful of book-to-movie adaptations and there are a host more coming, featuring stars like Emma Watson, Idris Elba and Jacob Tremblay. But don’t worry, you still have time to head to the library, turn on your Kindle or audiobook and catch up. Here are 13 books that you’ll be hearing more about as the head to the screen later this year. 1. The Zookeeper’s Wife by Diane Ackerman \nThe Holocaust drama hits the big screen this weekend, but there's plenty of time to catch up before it leaves theaters. The book tells the true story of the Warsaw Zoo owners who saved hundreds of Jewish people from the Nazis in occupied Poland by hiding them in their villa and empty cages. The adaptation stars Jessica Chastain and Daniel Bruhl. \nThe Zookeeper’s Wife hits theaters March 31. 2. The Lost City of Z by David Grann \nJournalist David Grann tells the true story of British explorer Percy Fawcett, who disappeared while searching for a fabled civilization in the Amazon in 1925. The film version will star Tom Holland, Charlie Hunnam, Sienna Miller and Robert Pattinson. \nThe Lost City of Z hits theaters April 14. 3. The Circle by Dave Eggers \nA young woman takes a job at a Google-like tech conglomerate, which is great until things start to get a little scary. The film puts together big stars like Emma Watson, Tom Hanks and John Boyega. \nThe Circle hits theaters April 28. 4. The Dinner by Herman Koch \nThis dark and intense novel follows two sets of parents grappling with the horrible crime their teenage sons have committed. The couples in the film are played by Laura Linney, Steve Coogan, Richard Gere and Rebecca Hall. \nThe Dinner hits theaters May 5. 5. Everything, Everything by Nicola Yoon \nThis YA novel is about a girl with a rare condition that makes her allergic to almost everything, leading to a life in quarantine. Then she meets the boy next door. Amandla Stenberg, Nick Robinson and Anika Noni Rose. \nEverything, Everything hits theaters May 19. 6. My Cousin Rachel by Daphne du Maurier \nThe classic novel follows a young Englishman and his beautiful, mysterious cousin, who may or may not have been involved in a murder. Playing the titular Rachel in the movie is an IRL Rachel: Ms. Weiz. \nMy Cousin Rachel hits theaters June 9. 7. The Dark Tower I: The Gunslinger by Stephen King \nStephen King’s sci-fi epic follows \"gunslinger\" Roland Deschain as he searches for the titular dark tower, hoping it will preserve his dying world. Idris Elba is leading the movie as Roland. \nThe Dark Tower hits theaters July 28. 8. Tulip Fever by Deborah Moggach \nThis period piece follows an artist who falls in love with the young married woman he is commissioned to paint during the tulip mania era of 16th-century Amsterdam. Alicia Vikander, Christoph Waltz and Cara Delevingne are a part of the star-studded cast. \nTulip Fever hits theaters Aug. 25. 9. It by Stephen King \nThe master is on a roll with adaptations this year. It follows seven adults who return to their hometown to confront an evil from their childhoods. And yes, it has that clown, who will be played by Bill Skarsgard. \nIt hits theaters Sept. 8. 10. The Mountain Between Us by Charles Martin \nTwo strangers survive a plane crash and must survive in the wilderness together. The movie cast Idris Elba and Kate Winslet as these very beautiful plane crash survivors. \nThe Mountain Between Us hits theaters Oct. 20. 11. Thank You For Your Service by David Finkel \nThis nonfiction book follows the lives of soldiers as the adjust to live back home after serving overseas. Miles Teller and Amy Schumer are set to star. \nThank You For Your Service hits theaters Oct. 27. 12. Wonder by R.J. Palacio \nThe novel follows Auggie, a young boy with a serious facial deformity struggling to be accepted in a new school. Jacob Tremblay and Julia Roberts star in the film version. \nWonder hits theaters Nov. 17. 13. Murder on the Orient Express by Agatha Christie \nThe classic Agatha Christie mystery follows detective Hercule Poirot as he attempts to solve a murder on the famous train. The adaptation is directed by and starring Kenneth Branagh, along with big names like Johnny Depp, Daisy Ridley and Judi Dench. \nMurder on the Orient Express hits theaters Nov. 22. Read or Share this story: http://usat.ly/2oEebM4 Most Popular", "external_links": [], "published": "2017-03-31T05:17:00.000+03:00", "crawled": "2017-03-31T00:34:13.908+03:00", "highlightTitle": ""}