{"organizations": [], "uuid": "645f85c639d98faf7f301e988524554ac935c895", "thread": {"social": {"gplus": {"shares": 1}, "pinterest": {"shares": 0}, "vk": {"shares": 0}, "linkedin": {"shares": 0}, "facebook": {"likes": 136, "shares": 136, "comments": 0}, "stumbledupon": {"shares": 0}}, "site_full": "www.geo.tv", "main_image": "https://www.geo.tv/assets/uploads/updates/2017-03-08/133596_023847_updates.jpg", "site_section": "http://feeds.feedburner.com/geo/GiKR", "section_title": "GEO TV - Pakistan", "url": "https://www.geo.tv/latest/133596-Investigation-reveals-Chaudhry-Aslam-was-betrayed-by-bodyguard", "country": "TV", "domain_rank": 8287, "title": "Investigation reveals Chaudhry Aslam was betrayed by bodyguard", "performance_score": 1, "site": "geo.tv", "participants_count": 0, "title_full": "Investigation reveals Chaudhry Aslam was betrayed by bodyguard", "spam_score": 0.0, "site_type": "blogs", "published": "2017-03-08T21:16:00.000+02:00", "replies_count": 0, "uuid": "645f85c639d98faf7f301e988524554ac935c895"}, "author": "", "url": "https://www.geo.tv/latest/133596-Investigation-reveals-Chaudhry-Aslam-was-betrayed-by-bodyguard", "ord_in_thread": 0, "title": "Investigation reveals Chaudhry Aslam was betrayed by bodyguard", "locations": [], "entities": {"persons": [{"name": "chaudhry aslam", "sentiment": "negative"}, {"name": "muqadar haider", "sentiment": "none"}, {"name": "hasan", "sentiment": "none"}, {"name": "muhammad aslam khan", "sentiment": "none"}, {"name": "khan", "sentiment": "none"}, {"name": "imran bhatti", "sentiment": "none"}, {"name": "shah jee", "sentiment": "none"}, {"name": "qari javed", "sentiment": "none"}, {"name": "wazir", "sentiment": "none"}, {"name": "chaudhry aslam murder", "sentiment": "none"}, {"name": "chaudhry aslam  chaudhry aslam", "sentiment": "none"}, {"name": "naeem bukhari", "sentiment": "none"}, {"name": "zafar saeen", "sentiment": "none"}, {"name": "aslam", "sentiment": "none"}, {"name": "chaudhry aslam ssp", "sentiment": "none"}, {"name": "kamran", "sentiment": "none"}, {"name": "chaudhry", "sentiment": "none"}], "locations": [{"name": "karachi", "sentiment": "none"}, {"name": "south waziristan", "sentiment": "none"}, {"name": "pakistan", "sentiment": "none"}, {"name": "lyari", "sentiment": "none"}, {"name": "sipah-e-sahaba", "sentiment": "none"}, {"name": "mansehra", "sentiment": "none"}, {"name": "karachi", "sentiment": "none"}, {"name": "khyber pakhtunkhwa", "sentiment": "none"}, {"name": "lyari expressway", "sentiment": "none"}], "organizations": [{"name": "asi", "sentiment": "none"}, {"name": "investigation wing of the cid", "sentiment": "none"}, {"name": "crime investigation department", "sentiment": "none"}, {"name": "awsj", "sentiment": "none"}, {"name": "ctd", "sentiment": "none"}, {"name": "ltf", "sentiment": "none"}, {"name": "rangers", "sentiment": "none"}, {"name": "lyari task force", "sentiment": "none"}, {"name": "central investigation department", "sentiment": "none"}]}, "highlightText": "", "language": "english", "persons": [], "text": "Investigation reveals Chaudhry Aslam was betrayed by bodyguard | 0 0 \nKARACHI: Investigators probing the death of Superintendant of Police (SP) Muhammad Aslam Khan aka Chaudhry Aslam of the Crime Investigation Department (CID) revealed the officer's own driver cum bodyguard was involved in his murder. \nChaudhry Aslam was martyred in 2014 when his convoy was attacked using an Improvised Explosive Device (IED) planted in a vehicle on the Lyari Expressway. According to then SP Muqadar Haider, \"the explosion was so powerful that the vehicle's wreckage was thrown some 20 to 30 feet away from the site of the explosion\". \nAlso read: Karachi renames street after Chaudhry Aslam \nSuspects being held by the CTD revealed that Kamran, who was at the time behind the wheel of Aslam's pickup truck, was involved in the attack and was in fact, a member of the banned Sipah-e-Sahaba which later reinvented itself as Ahle-Sunnat-Wal-Jamaat (AWSJ). \nKamran gave information regarding Aslam’s movement to his killers including Naeem Bukhari, Karachi chief of Lashkar-e-Jhangvi (LeJ). Suspects in the case in police custody revealed that police constable Kamran helped in conducting reconnaissance for the murder. \nSuspects in the case currently in police custody revealed that police constable Kamran helped in reconnaissance for the assassination. \nKamran gave information about Aslam to Imran Bhatti, a police informant who was later arrested by the Rangers, the suspects revealed. \nThe suicide bomber was called by Imran Bhatti from South Waziristan, revealed Qari Javed, Zafar Saeen, Wazir and Hasan alias Shah Jee during interrogations. \nAlso read: 100-150 kg explosives used in attack on Chaudhry Aslam \nWho was Chaudhry Aslam \nChaudhry Aslam, was seen as one of Pakistan’s toughest police officers. He survived several attacks on his life, including a suicide attack on his residence in September 2011 in which almost eight people were killed \nStarting his career as an ASI in 1984, Muhammad Aslam Khan, commonly known as Chaudhry Aslam, was serving as the Superintendent Police (SP) of the Central Investigation Department (CID). He had served as a station house officer (SHO) at a number of police stations in the metropolis. \nHe originally hailed from Mansehra in Khyber Pakhtunkhwa and Chaudhry was added in front of his name due to his role in the Karachi operation. \nIn 2010, Khan was appointed as a head of the Investigation Wing of the CID. Earlier, he also headed the Lyari Task Force (LTF) to uproot gangsters from Lyari. 0 0 Investigation reveals Chaudhry Aslam was betrayed by bodyguard   Chaudhry Aslam Murder, Chaudhry Aslam Ssp.   \"Investigation reveals Chaudhry Aslam was betrayed by bodyguard\" is https://www.geo.tv/latest/133596-Investigation-reveals-Chaudhry-Aslam-was-betrayed-by-bodyguard+geo%2FGiKR+%28Geo+Pakistan+- ", "external_links": [], "published": "2017-03-08T21:16:00.000+02:00", "crawled": "2017-03-08T12:55:57.572+02:00", "highlightTitle": ""}