{"organizations": [], "uuid": "d51991060d7720a0b4a471f307d0fe708cfe1369", "thread": {"social": {"gplus": {"shares": 0}, "pinterest": {"shares": 0}, "vk": {"shares": 0}, "linkedin": {"shares": 0}, "facebook": {"likes": 121, "shares": 121, "comments": 0}, "stumbledupon": {"shares": 0}}, "site_full": "www.geo.tv", "main_image": "https://www.geo.tv/assets/uploads/updates/2017-03-20/134937_040852_updates.jpg", "site_section": "http://feeds.feedburner.com/GeoSport-GeoTvNetwork", "section_title": "GEO TV - Sports", "url": "https://www.geo.tv/latest/134937-Hockey-Hat-trick-hero-Abubakr-Mahmood-powers-Pakistan-to-victory", "country": "TV", "domain_rank": 8287, "title": "Hockey: Hat-trick hero Abubakr Mahmood powers Pakistan to victory", "performance_score": 1, "site": "geo.tv", "participants_count": 0, "title_full": "Hockey: Hat-trick hero Abubakr Mahmood powers Pakistan to victory", "spam_score": 0.0, "site_type": "blogs", "published": "2017-03-20T23:08:00.000+02:00", "replies_count": 0, "uuid": "d51991060d7720a0b4a471f307d0fe708cfe1369"}, "author": "", "url": "https://www.geo.tv/latest/134937-Hockey-Hat-trick-hero-Abubakr-Mahmood-powers-Pakistan-to-victory", "ord_in_thread": 0, "title": "Hockey: Hat-trick hero Abubakr Mahmood powers Pakistan to victory", "locations": [], "entities": {"persons": [{"name": "abubakr mahmood", "sentiment": "negative"}, {"name": "haseem khan", "sentiment": "none"}, {"name": "abubakr", "sentiment": "none"}, {"name": "mahmood", "sentiment": "none"}, {"name": "amjad", "sentiment": "none"}, {"name": "stephend jennes", "sentiment": "none"}, {"name": "cory bennett", "sentiment": "none"}], "locations": [{"name": "pakistan", "sentiment": "none"}, {"name": "new zealand", "sentiment": "none"}, {"name": "national hockey stadium", "sentiment": "none"}, {"name": "wellington", "sentiment": "none"}, {"name": "pakistan hockey", "sentiment": "none"}, {"name": "faisalabad", "sentiment": "none"}], "organizations": [{"name": "sports news", "sentiment": "none"}, {"name": "green shirts", "sentiment": "none"}, {"name": "black sticks", "sentiment": "none"}]}, "highlightText": "", "language": "english", "persons": [], "text": "Pakistan hockey team reaches New Zealand for bilateral series \nYoung Abubakr Mahmood slammed a penalty corner hat-trick in Pakistan's well-deserved 4-2 win over New Zealand in the third test at Wellington's National Hockey Stadium, taking the five-match series to 1-1. \nMahmood, who hails from Faisalabad, impressed with his match-winning performance in his first ever selection with Pakistan's senior national team. \nPakistan dominated for most of the first half. Off the second penalty corner, captain Haseem Khan put his side ahead with a well-executed indirect drill, bringing the score to Pakistan 1-New Zealand 0. \nJust minutes into the second half, Pakistan doubled the advantage via another penalty corner when Abubakrâ€™s superb low drag flick found the right corner of the goal. The third goal in the 35th minute off the fifth PC was the replica of the previous one as Abubakr was again spot on. \nDown by three goals, the hosts had a hard time getting past Pakistan goal-keeper Amjad but they persisted and Cory Bennett was finally able to score. \nThe Green Shirts got a penalty corner of their own and the brilliant Abubakr completed his hat trick, this time off a ripper sent high to the left side of the net. \nTrailing 1-4 with just seven minutes left, the Black Sticks continued finally added another goal when Stephend Jennes sent a scorcher via an upright reverse in the last minute. \nThe fourth test will be played on Wednesday. 0 0 Hockey: Hat-trick hero Abubakr Mahmood powers Pakistan to victory   Geo News, Sports News, Hockey, Pakistan Hockey, Abubakr Mahmood, Pakistan Vs New Zealand.   \"Hockey: Hat-trick hero Abubakr Mahmood powers Pakistan to victory\" is https://www.geo.tv/latest/134937-Hockey-Hat-trick-hero-Abubakr-Mahmood-powers-Pakistan-to-victory+GeoSport- ", "external_links": [], "published": "2017-03-20T23:08:00.000+02:00", "crawled": "2017-03-20T13:30:00.540+02:00", "highlightTitle": ""}