{"organizations": [], "uuid": "cba2bbadf203a5945d186c87b46199c055253db5", "thread": {"social": {"gplus": {"shares": 0}, "pinterest": {"shares": 0}, "vk": {"shares": 0}, "linkedin": {"shares": 0}, "facebook": {"likes": 913, "shares": 913, "comments": 0}, "stumbledupon": {"shares": 0}}, "site_full": "www.telegraph.co.uk", "main_image": "http://www.telegraph.co.uk/content/dam/news/2017/03/20/JS84074342_BBC_Television-Mrs-Brown27s-Boys-Christmas-Special-xlarge_trans_NvBQzQNjv4BqCHco2f1jjYcmYrb_Lt46UuqMDeUZsFRqIVE_-I0v4s0.jpg", "site_section": "http://www.telegraph.co.uk/newsfeed/rss/letters.xml", "section_title": "News", "url": "http://www.telegraph.co.uk/news/2017/03/21/queen-huge-fan-mrs-browns-boys-shows-star-reveals/", "country": "GB", "domain_rank": 317, "title": "The Queen is a huge fan of Mrs Brown's Boys, show's star reveals", "performance_score": 9, "site": "telegraph.co.uk", "participants_count": 1, "title_full": "The Queen is a huge fan of Mrs Brown's Boys, show's star reveals", "spam_score": 0.0, "site_type": "blogs", "published": "2017-03-21T07:01:00.000+02:00", "replies_count": 0, "uuid": "cba2bbadf203a5945d186c87b46199c055253db5"}, "author": "Hannah Furness", "url": "http://www.telegraph.co.uk/news/2017/03/21/queen-huge-fan-mrs-browns-boys-shows-star-reveals/", "ord_in_thread": 0, "title": "The Queen is a huge fan of Mrs Brown's Boys, show's star reveals", "locations": [], "entities": {"persons": [{"name": "mrs brown", "sentiment": "positive"}, {"name": "jennifer gibney", "sentiment": "none"}, {"name": "yui mok/pa", "sentiment": "none"}, {"name": "o'carroll", "sentiment": "none"}, {"name": "brendan o'carroll", "sentiment": "none"}, {"name": "cathy", "sentiment": "none"}, {"name": "john", "sentiment": "none"}, {"name": "alan peebles", "sentiment": "none"}, {"name": "agnes", "sentiment": "none"}, {"name": "brendan o'caroroll", "sentiment": "none"}], "locations": [{"name": "buckin", "sentiment": "none"}, {"name": "balmoral", "sentiment": "none"}, {"name": "antiques roadshow", "sentiment": "none"}, {"name": "buckingham palace", "sentiment": "none"}, {"name": "wales", "sentiment": "none"}, {"name": "downton abbey", "sentiment": "none"}, {"name": "edinburgh", "sentiment": "none"}], "organizations": [{"name": "radio times", "sentiment": "none"}, {"name": "bbc", "sentiment": "none"}, {"name": "army", "sentiment": "none"}, {"name": "buckingham palace", "sentiment": "none"}, {"name": "bbc hannah furness", "sentiment": "none"}]}, "highlightText": "", "language": "english", "persons": [], "text": "The Queen is a huge fan of Mrs Brown's Boys, show's star reveals Mrs Brown's Boys is a hit at Buckingham Palace Credit: Alan Peebles /BBC Hannah Furness , Arts Correspondent 21 March 2017 • 12:01am \nI t has been lambasted by critics , baffled the middle classes and left the bien pensant wondering what its millions of fans see in it. \nBut Mrs Brown's Boys has one important viewer on its side, if the show's creator is to be believed: the Queen. \nBrendan O'Carroll, who plays Mrs Brown in the BBC comedy, has claimed that the Queen and her family are such fans of the show that a copy of the Christmas special was requested by Buckingham Palace last year. Brendan O'Caroroll stars in Mrs Brown's Boys Credit: Yui Mok/PA \nI n an interview with the Radio Times, O'Carroll was reminded that the programme's Christmas Day episode won eight million viewers, more than the Queen's speech once catch-up figures were taken into account. \nHe told the magazine: \"We also do know that they are personal fans! \n“They’re mad about the show.” \nBuckingham Palace did not comment on the claim, which is one of a string of rumours about television programmes enjoyed by the Queen and the Duke of Edinburgh. The Queen's spokesman refused to confirm if she is a fan Credit: John Stillwell/PA \nS he has previously been reported to be a fan of Pointless, the afternoon quiz show, Antiques Roadshow, vintage comedies such as Keeping Up Appearances and Dad's Army, Downton Abbey, and dozens of others besides. \nAt least some of the many claims have been dismissed by insiders as the result of a savvy television PR machine, or the assumption of flattered actors who have met the Queen and been impressed by her pre-prepared knowledge of their shows. \nO'Carroll's new iteration of Mrs Brown's Boys is in the form of a chat show, where a celebrities mother is interviewed by Agnes in the kitchen while her more famous offspring is on stage. The cast of Mrs Brown's Boys \nT he actor joked he would like to invite the Queen and Prince of Wales to appear. \nHe joked: \"It can’t be a Christmas special because we’ve already got one [the regular Mrs Brown Christmas show has been commissioned by the BBC to 2020] but there’s nothing wrong with it being an Easter special.\" \nLast year, a newspaper claimed the Queen watched most of her television while at Balmoral. \nThe full interview with O'Carroll and his wife Jennifer Gibney, who plays Cathy, is published in the Radio Times now.", "external_links": [], "published": "2017-03-21T07:01:00.000+02:00", "crawled": "2017-03-21T02:14:00.887+02:00", "highlightTitle": ""}