{"organizations": [], "uuid": "9da5df540212bd4c6486b8949570276864e6735e", "thread": {"social": {"gplus": {"shares": 0}, "pinterest": {"shares": 0}, "vk": {"shares": 0}, "linkedin": {"shares": 0}, "facebook": {"likes": 113, "shares": 113, "comments": 0}, "stumbledupon": {"shares": 0}}, "site_full": "ftw.usatoday.com", "main_image": "https://www.gannett-cdn.com/-mm-/36307db5ebe77390dfe4329cac12320192c53f26/c=0-845-2680-2353&amp;r=x633&amp;c=1200x630/local/-/media/2017/03/22/USATODAY/usatsports/nba__detroit_pistons_at_chicago_bulls_89734008.jpg", "site_section": "http://rssfeeds.usatoday.com/UsatodaycomNba-TopStories", "section_title": "GANNETT Syndication Service", "url": "http://ftw.usatoday.com/2017/03/dwyane-wade-fashion-outfit-short-sleeve-blazer-miami-south-beach-fans-bulls-chicago-return-jokes-twitter", "country": "US", "domain_rank": 313, "title": "Wade goes Miami with outfit choice in Chicago", "performance_score": 1, "site": "usatoday.com", "participants_count": 1, "title_full": "Wade goes Miami with outfit choice in Chicago", "spam_score": 0.0, "site_type": "blogs", "published": "2017-03-23T10:20:00.000+02:00", "replies_count": 0, "uuid": "9da5df540212bd4c6486b8949570276864e6735e"}, "author": "USA TODAY", "url": "http://ftw.usatoday.com/2017/03/dwyane-wade-fashion-outfit-short-sleeve-blazer-miami-south-beach-fans-bulls-chicago-return-jokes-twitter", "ord_in_thread": 0, "title": "Wade goes Miami with outfit choice in Chicago", "locations": [], "entities": {"persons": [{"name": "wade goe", "sentiment": "negative"}, {"name": "dwyane wade", "sentiment": "negative"}, {"name": "wade", "sentiment": "negative"}, {"name": "drake", "sentiment": "none"}, {"name": "alysha tsuji", "sentiment": "none"}, {"name": "ben rohrbach", "sentiment": "none"}, {"name": "derek jamal", "sentiment": "none"}, {"name": "rikki", "sentiment": "none"}, {"name": "yvonne marie", "sentiment": "none"}, {"name": "devin perez", "sentiment": "none"}], "locations": [{"name": "miami", "sentiment": "none"}, {"name": "chicago", "sentiment": "none"}, {"name": "chicago   wade", "sentiment": "none"}, {"name": "miami wade", "sentiment": "none"}, {"name": "usa", "sentiment": "none"}, {"name": "south beach", "sentiment": "none"}], "organizations": [{"name": "facebook", "sentiment": "neutral"}, {"name": "nba", "sentiment": "none"}, {"name": "pistons", "sentiment": "none"}, {"name": "bulls", "sentiment": "none"}]}, "highlightText": "", "language": "english", "persons": [], "text": "  Wade goes Miami with outfit choice in Chicago Looking good, Dwyane Wade. Post to Facebook Wade goes Miami with outfit choice in Chicago Looking good, Dwyane Wade.  //ftw.usatoday.com/2017/03/dwyane-wade-fashion-outfit-short-sleeve-blazer-miami-south-beach-fans-bulls-chicago-return-jokes-twitter   Join the Nation's Conversation   Wade goes Miami with outfit choice in Chicago Alysha Tsuji , USA TODAY 11:20 p.m. ET March 22, 2017 \nDwyane Wade, who's out for the season with an elbow injury , decided to go with a short sleeve blazer on Wednesday night when the Bulls beat the Pistons in Chicago. As they noted on the broadcast, Wade looked ready to go out to the clubs in South Beach. D-Wade came out South Beach ready...ðŸŒ´ pic.twitter.com/k8NfHJrw5f â€” Bleacher Report (@BleacherReport) March 23, 2017 \nTwitter cracked a few jokes. The outfit really is something. Wade is one of the more fashion-forward players in the NBA. \nSome said that the outfit seemed to be inspired by Drake's new album, More Life . dwayne wade dressed like how listening to \"passionfruit\" makes me feel pic.twitter.com/on13W0tRob â€” Rikky! Rikki! RikkÃ¨! (@rwxoxo) March 23, 2017 30 degrees in Chicago but Dwyane Wade listened to 'More Life' all weekend soâ€¦. pic.twitter.com/hGioE5cEG1 â€” Def Pen Hoops (@DefPenHoops) March 23, 2017 \nOthers tweeted about how Miami Wade looked - so Miami that maybe he should think about returning to the Heat where he won three championships . You can take the Dwyane Wade out of Miami, but you can't take the Miami Vice out of D-Wade. https://t.co/TsnL2m8fuf â€” Ben Rohrbach (@brohrbach) March 23, 2017 You can take the man out of Miami but you can't take the Miami out of the man @DwyaneWade https://t.co/5otmuRnFUC â€” Devin Perez (@DevinPerez15) March 23, 2017 @DwyaneWade is immune to the Chicago Winter. Lol https://t.co/GwmQymovbQ â€” Derek Jamal (@D_Jamal21) March 23, 2017 Lmaooo Miami misses you, come back ðŸ¤— @DwyaneWade https://t.co/bFagpmh0TK â€” Yvonne Marie (@Its_YvonneMarie) March 23, 2017 Hey @DwyaneWade everyone in Miami loves the look! #Miami https://t.co/zJUhEbhsNJ", "external_links": [], "published": "2017-03-23T10:20:00.000+02:00", "crawled": "2017-03-23T05:32:25.193+02:00", "highlightTitle": ""}