{"organizations": [], "uuid": "6e55d3c16f1081c167b902e82f05300138a341aa", "thread": {"social": {"gplus": {"shares": 0}, "pinterest": {"shares": 0}, "vk": {"shares": 0}, "linkedin": {"shares": 0}, "facebook": {"likes": 213, "shares": 213, "comments": 0}, "stumbledupon": {"shares": 0}}, "site_full": "www.thewrap.com", "main_image": "http://www.thewrap.com/wp-content/uploads/2017/03/Olly-the-Rescue-Dog-.jpg", "site_section": "http://www.thewrap.com/feed", "section_title": "TheWrapTheWrap", "url": "http://www.thewrap.com/olly-the-rescue-dog-destroys-crufts-agility-course-sends-commentator-into-hysterics/", "country": "US", "domain_rank": 5807, "title": "Olly the Rescue Dog Destroys Agility Course, Sends Commentator Into Hysterics (Video)", "performance_score": 2, "site": "thewrap.com", "participants_count": 1, "title_full": "Olly the Rescue Dog Destroys Agility Course, Sends Commentator Into Hysterics (Video)", "spam_score": 0.0, "site_type": "blogs", "published": "2017-03-14T07:40:00.000+02:00", "replies_count": 0, "uuid": "6e55d3c16f1081c167b902e82f05300138a341aa"}, "author": "Debbie Emery", "url": "http://www.thewrap.com/olly-the-rescue-dog-destroys-crufts-agility-course-sends-commentator-into-hysterics/", "ord_in_thread": 0, "title": "Olly the Rescue Dog Destroys Agility Course, Sends Commentator Into Hysterics (Video)", "locations": [], "entities": {"persons": [{"name": "olly", "sentiment": "negative"}, {"name": "karen", "sentiment": "none"}, {"name": "jennifer aniston", "sentiment": "none"}, {"name": "jack russell terrier", "sentiment": "none"}, {"name": "pembroke welsh corgi", "sentiment": "none"}], "locations": [{"name": "pembrokes", "sentiment": "none"}, {"name": "new york", "sentiment": "none"}, {"name": "birmingham", "sentiment": "none"}, {"name": "england", "sentiment": "none"}, {"name": "madison square garden", "sentiment": "none"}, {"name": "u.k.", "sentiment": "none"}, {"name": "pembroke welsh corgi", "sentiment": "none"}, {"name": "westminster", "sentiment": "none"}], "organizations": [{"name": "getty images  a lhasa apso", "sentiment": "none"}, {"name": "nec", "sentiment": "none"}, {"name": "crufts", "sentiment": "none"}, {"name": "getty images  every", "sentiment": "none"}, {"name": "getty images  another pembroke welsh corgi", "sentiment": "none"}, {"name": "141st westminster kennel club dog show", "sentiment": "none"}]}, "highlightText": "", "language": "english", "persons": [], "text": "Search Olly the Rescue Dog Destroys Agility Course, Sends Commentator Into Hysterics (Video) \n“What a nose dive, and he couldn’t care less,” commentator says as the Jack Russell Terrier face-plants over a jump Debbie Emery | March 13, 2017 @ 5:40 PM \nOlly the Jack Russell Terrier isn’t going to win Best in Show anytime soon, but he won the internet on Monday with his enthusiastic agility-course performance. \nThe scrappy little rescue dog competed at Crufts (the U.K. version of the Westminster Dog Show) this weekend and what he lacked in ability and accuracy, he more than made up for with joyful abandon. \nThe 10-week old adopted pup barreled, face-planted and generally destroyed the course designed for the Rescue Dog Agility contest — leaving his handler, Karen, desperately chasing after him … and the British commentator in hysterics. \n“He’s all over the place, and so he should be,” said the voiceover from the NEC Exhibition Centre in Birmingham, England. “Wrong way … oh, it doesn’t matter.” \n“Olly is totally crazy, as you can see, he is having a ball.” \nOur hero tripped over one fence sliding across the fake turf, totally missed another and then simply sprinted out of the arena. \n“What a nose dive, and he couldn’t care less,” the highly amused commentator added. \nWatch the adorable video above. Westminster Dog Show: Meet the Cute, Coddled Canines Competing In New York (Photos) \nIt's not all glamour when competing at Westminster, sometimes you just need a well-earned nap to recover from all the preening and trotting up and down. Click on to check out this sleepy Yorkshire Terrier and other competitors in action. Getty Images \nIt's a Corgi party as two Pembrokes and a Cardigan Corgi herd together at Westminster. Getty Images \nA Lhasa Apso shows off a head of satin hair that would make even Jennifer Aniston jealous. Getty Images \nThis Pembroke Welsh Corgi may be short, but there's speed in those stummy little legs. Getty Images \nAnother Pembroke Welsh Corgi takes a short-legged stroll around Madison Square Garden. Getty Images \nA Havanese stands to attention with its young handler as the judge gets up close and personal. Getty Images \nA Bulldog and a Borzoi chill out together backstage. Getty Images \nA brown and white Pembroke Welsh Corgi looks out over his minions. Getty Images \nThis Italian Greyhound looks very engaged in the action. Getty Images \nWhite furred Malteses slink around like ghosts on Halloween. Getty Images \nThis Poodle definitely spent longer at the groomer's than most of us do in the hair salon. Getty Images \nA laid back French Bulldog takes it all in his stride. Getty Images \nRevived from a nap, this Yorkshire Terrier puts on a serious face for the judges, despite wearing a cute little red ribbon. Getty Images \nGood things come in twos, especially when it comes to Whippets -- the super models of Westminster. Getty Images \nA spotty face is a good thing when it comes on a beautiful English Setter. Getty Images \nA curly-haired Lakeland Terrier looks a little overwhelmed with the circus going on around. Getty Images \nAn Australian Shepherd gives his hundreds of fans the cold shoulder backstage. Getty Images \nA Briard gets on two legs for a blow dry. Getty Images \nEvery dog has its day, and this Bulldog has had a really long one and now needs to sleep it off. Getty Images \nThis Komondor could teach the music industry's top hip-hop stars a thing or two about cool dreads. Getty Images Next Slide 1 of 20 \nThe 141st Westminster Kennel Club Dog Show has taken over Madison Square Garden, making TheWrap go gooey over the top contenders \nIt's not all glamour when competing at Westminster, sometimes you just need a well-earned nap to recover from all the preening and trotting up and down. Click on to check out this sleepy Yorkshire Terrier and other competitors in action. Show Comments Related Content", "external_links": [], "published": "2017-03-14T07:40:00.000+02:00", "crawled": "2017-03-14T02:57:21.584+02:00", "highlightTitle": ""}