{"organizations": [], "uuid": "2ae8dcbc176ae4b7d5d9358f1e5b23de69870899", "thread": {"social": {"gplus": {"shares": 0}, "pinterest": {"shares": 0}, "vk": {"shares": 0}, "linkedin": {"shares": 0}, "facebook": {"likes": 123, "shares": 123, "comments": 0}, "stumbledupon": {"shares": 0}}, "site_full": "www.philly.com", "main_image": "http://media.philly.com/images/RS_phillyThumb2_1200x800_20170321_SGAME28_E_356462815.jpg", "site_section": "http://www.philly.com/philly_sports.rss", "section_title": "Philly.com Sports", "url": "http://www.philly.com/philly/blogs/rick-obrien/Rosters-for-the-2017-Albert-C-Donofrio-Hoops-Classic-.html", "country": "US", "domain_rank": 3314, "title": "Rosters for the 2017 Albert C. Donofrio Hoops Classic", "performance_score": 1, "site": "philly.com", "participants_count": 1, "title_full": "Rosters for the 2017 Albert C. Donofrio Hoops Classic", "spam_score": 0.0, "site_type": "blogs", "published": "2017-03-22T02:37:00.000+02:00", "replies_count": 0, "uuid": "2ae8dcbc176ae4b7d5d9358f1e5b23de69870899"}, "author": "Rick O'Brien", "url": "http://www.philly.com/philly/blogs/rick-obrien/Rosters-for-the-2017-Albert-C-Donofrio-Hoops-Classic-.html", "ord_in_thread": 0, "title": "Rosters for the 2017 Albert C. Donofrio Hoops Classic", "locations": [], "entities": {"persons": [{"name": "albert c. donofrio", "sentiment": "negative"}, {"name": "eli brooks", "sentiment": "none"}, {"name": "watson martin luther king sophisaiah anderson martin luther king jrdonnelle holly martin luther king jryasir durant martin luther king", "sentiment": "none"}, {"name": "scott williamsport srtyrese martin william allen srtalek williams william allen", "sentiment": "none"}, {"name": "cosby-roundtree neumann goretti", "sentiment": "none"}, {"name": "carroll", "sentiment": "none"}, {"name": "kevin dodds bishop shanahan jrgreg barton downingtown west jreric esposito", "sentiment": "none"}, {"name": "srjesse mcpherson carroll", "sentiment": "none"}, {"name": "rick o'brien", "sentiment": "none"}, {"name": "kyle thompson st. joe", "sentiment": "none"}, {"name": "sankofa jrmagd abdelwahab upper darby jrali sharif bartram sophwill mcnair", "sentiment": "none"}, {"name": "inge neumann goretti srelijah mitchell mater dei prep sreric kenny abington sr  marc rodriguez", "sentiment": "none"}, {"name": "dion harris del val srallen betrand roman jrdavid beatty imhotep charter srlynn greer", "sentiment": "none"}, {"name": "anthony", "sentiment": "none"}, {"name": "joshua coleman", "sentiment": "none"}, {"name": "john neumann", "sentiment": "none"}, {"name": "ryan", "sentiment": "none"}, {"name": "m.a. jrmatt carter", "sentiment": "none"}, {"name": "mady northeast prep jrkassir kay audien reed", "sentiment": "none"}, {"name": "daron russell imhotep charter srashley jones neumann-goretti", "sentiment": "none"}, {"name": "wood jrwill mcnair martin luther king jrantwaun butler del val charter jrkevin anderson", "sentiment": "none"}, {"name": "ryan sophejah obanye reno prep jrpeteria edmonds reno prep sophahmad wimbush", "sentiment": "none"}, {"name": "mcnair martin luther king hs jrsam sessoms shipley jr  elijah kiah-el martin luther king srrobbie heath abington", "sentiment": "none"}, {"name": "bailey owen j. roberts", "sentiment": "none"}], "locations": [{"name": "washington upper moreland srryan coyle upper moreland jrchristian o'donnell upper moreland sophshane stone upper moreland sranthony green upper moreland", "sentiment": "none"}, {"name": "bunyon valley", "sentiment": "none"}, {"name": "soph  yellow jackets devin hill valley", "sentiment": "none"}, {"name": "holland st. george", "sentiment": "none"}, {"name": "spring grove srtaylor funk manheim township", "sentiment": "none"}, {"name": "philly.com", "sentiment": "none"}, {"name": "jr  hunting park", "sentiment": "none"}, {"name": "sudan chester srabraham deng valley", "sentiment": "none"}, {"name": "schuylkill", "sentiment": "none"}, {"name": "ntwari valley", "sentiment": "none"}, {"name": "southeastern pennsylvania", "sentiment": "none"}, {"name": "downingtown east", "sentiment": "none"}, {"name": "chester county malik slay downingtown east jrgreg barton downingtown east jralex capitano great valley", "sentiment": "none"}], "organizations": [{"name": "roman catholic frmarcus littles neumann goretti jrjulius phillips archbishop wood soph  hunting park ii jihad mapp abington friends sophkharon randolph haverford jrcyrie coats west philly jrmalik lorenzano west philly", "sentiment": "none"}, {"name": "isaiah wiggins pocono mountain west srmichael bealer souderton srcharles ervin faith christian jrdyony bueno stroudsburg sr  logan bailey scranton prep srsam iorio parkland srseth maxwell abington heights srlance singh pocono mountain west srshon wilson stroudsburg srmaqi watson math civics science srjalen vaughns pocono mountain west srwill melson bethlehem catholic jrryan young bethlehem catholic jrbryce calloway berks catholic sophzach sabol emmaus sophjustin paz bethlehem catholic sophjulian thomas bethlehem catholic fr  old school cavaliers", "sentiment": "none"}, {"name": "daily news", "sentiment": "none"}, {"name": "tech sophimere harris west catholic sopheric ayala putnam science academy", "sentiment": "none"}, {"name": "penn relays", "sentiment": "none"}, {"name": "nelson w.c. rustin sophtajir asparagus w.c. rustin sophaugustas verickevicus church farm srfaustas kulbicka church farm srjames lawton church farm srjohn bolajak chruch farm sophjhamir brickus coatesville fr  justin jaworski perkiomen valley srmatthew faw upper merion srethan miller upper merion", "sentiment": "none"}, {"name": "lewis valley forge military acad jrmekhi morris del val", "sentiment": "none"}, {"name": "inquirer", "sentiment": "none"}, {"name": "keystone blazers black shyheim abernathy phoenixville hs srnick richards patrick school sravery close phoenixville srjamir harris patrick school srchristian ings neumann-goretti sophjordan walker patrick school jrjulius phillips archbishop wood sophmarcus mcclary patrick school sral-amir daws patrick school sophdavid angelo bishop shanahan jrtavon jones linden jrvaldir manuel patrick school jrtyrel bladen coatesville jrbauy koka patrick school srmichael watkins linden jr  ahmad williams plymouth whitemarsh jrahmin williams plymouth whitemarsh jrkevin tilghman plymouth whitemarsh jrnaheem mcleod plymouth whitemarsh sophish horn plymouth whitemarsh jradam henderson parkway jrshannon bibbs abington friends jrjahi randall lincoln jrnoah fennell lower merion srnassir coleman lincoln", "sentiment": "none"}, {"name": "sessoms shipley jr  jodan pierce union catholic srdarnell brodie newark east side srchip roriston summit hs srcasmir ochiaki st. mary's srcalistus anyichi st. mary's srelija olaniyi newark east side sramadu benbaw newark east side srhassan ceesay newark east side jrjahid jenkins newark east side jrtaj benning bergen catholic srshamir johnson newark east side jrahmad fleur st mary", "sentiment": "none"}, {"name": "hoggard carroll frandrew king downingtown east frjustin anderson carroll jrcollin gillespie arch wood srbrandon mccullough avon grove srmikeal jones girard college fr  pizza time jackson scialanca christopher dock", "sentiment": "none"}, {"name": "civics & sciences", "sentiment": "none"}, {"name": "jrmatt dade episcopal academy sophgavin burke haverford school sophjeff woodward methacton fromar nichols friends' central fr  del val toros joe breece upper merion sranthony shepper upper merion srandrew persaud upper merion srmatt faw upper merion srethan miller upper merion sraidan newell upper merion srkharon knight norristown srnazir jordan upper darby jrjason cook roman catholic sr  del val vc lance ford north penn srclifton moore hatboro-horsham srzeke snowden faith christian srtrevonn pitts cheltenham sraj mitchell north penn sophrichard rivers carroll soph  george gord0n downingtown west srandrew sims lenape jrjesse saul bishop eustace sralgt dipiertraptinio bishop eustace srconner delaney episcopal academy srchris arcidiacono neshaminy jrkhari williams archbishop carroll srcheo houston plymouth whitemarsh srmatt walker plymouth whitemarsh srkareem breeden plymouth whitemarsh", "sentiment": "none"}, {"name": "philly.com", "sentiment": "none"}, {"name": "archer mcs srcameron reddish westtown hs jrmarcus littles ng jrseth lundy roman catholic sophzack crisler la salle", "sentiment": "none"}, {"name": "chereef knox imhotep charter sopheric dixon abington sophisaiah wong notre dame sophhakim byrd neumann goretti frjustin paz bethlehem catholic sophajiri johnson bonner-prendergast jrsean simon la salle", "sentiment": "none"}, {"name": "snyder palisades frmatt pattyson c.b. east jrryan hagan spring-ford soph  bryce spriggs friends' central sophakello mosby e&s jrmarvin freeman sun valley sophwilliam moore gratz jrtour'e banks friends' central jrquentin johnson springfield jrisaiah morgan lower merion jrtahmir thompson mcdevitt jrjaneim aiken cristo rey frcraig logan girard college jrfranklin anderson valley day jrjosh martin lower merion sopharion lewis valley forge jr  positive image ii letrell west st. joseph srkiyon hardy shipley srzuri peyton sch academy srrashon johnson gratz srdonte moore martin luther king", "sentiment": "none"}]}, "highlightText": "", "language": "english", "persons": [], "text": "Rosters for the 2017 Albert C. Donofrio Hoops Classic Updated: March 21, 2017 â€” 3:37 PM EDT 72 Share Rick O'Brien Staff Writer \nRick O'Brien has been writing for the Inquirer since 1993, primarily covering high school sports in Southeastern Pennsylvania. He focuses on football and boys' basketball and baseball, with other events (Penn Relays, regattas on the Schuylkill, etc.) and some pro sports mixed in. More by Rick O'Brien \nTentative Rosters for the 2017 Albert C. Donofrio Classic \nChester County Malik Slay Downingtown East JrGreg Barton Downingtown East JrAlex Capitano Great Valley JrJake Nelson W.C. Rustin SophTajir Asparagus W.C. Rustin SophAugustas Verickevicus Church Farm SrFaustas Kulbicka Church Farm SrJames Lawton Church Farm SrJohn Bolajak Chruch Farm SophJhamir Brickus Coatesville Fr \nJustin Jaworski Perkiomen Valley SrMatthew Faw Upper Merion SrEthan Miller Upper Merion SrCollin MacAdams C.B. West Jr. Kevin Dodds Bishop Shanahan JrGreg Barton Downingtown West JrEric Esposito Conwell-Egan JrMatt Dade Episcopal Academy SophGavin Burke Haverford School SophJeff Woodward Methacton FrOmar Nichols Friends' Central Fr \nDel Val Toros Joe Breece Upper Merion SrAnthony Shepper Upper Merion SrAndrew Persaud Upper Merion SrMatt Faw Upper Merion SrEthan Miller Upper Merion SrAidan Newell Upper Merion SrKharon Knight Norristown SrNazir Jordan Upper Darby JrJason Cook Roman Catholic Sr \nDel Val VC Lance Ford North Penn SrClifton Moore Hatboro-Horsham SrZeke Snowden Faith Christian SrTrevonn Pitts Cheltenham SrAJ Mitchell North Penn SophRichard Rivers Carroll Soph \nGeorge Gord0n Downingtown West SrAndrew Sims Lenape JrJesse Saul Bishop Eustace SrAlgt DiPiertraptinio Bishop Eustace SrConner Delaney Episcopal Academy SrChris Arcidiacono Neshaminy JrKhari Williams Archbishop Carroll SrCheo Houston Plymouth Whitemarsh SrMatt Walker Plymouth Whitemarsh SrKareem Breeden Plymouth Whitemarsh SrMatiss Kulackovskis Archbishop Ryan Sr \nFilly Sol Kyle Thompson St. Joe's Prep JrKhalil Turner Sankofa SophDerruis Ward Sankofa Charter FrJabril Noble Sankofa JrMagd Abdelwahab Upper Darby JrAli Sharif Bartram SophWill McNair M.L. King Jr \nHunting Park I Dion Harris Del Val SrAllen Betrand Roman JrDavid Beatty Imhotep Charter SrLynn Greer III Roman Catholic FrMarcus Littles Neumann Goretti JrJulius Phillips Archbishop Wood Soph \nHunting Park II Jihad Mapp Abington Friends SophKharon Randolph Haverford JrCyrie Coats West Philly JrMalik Lorenzano West Philly SrJustin Bailey Owen J. Roberts HS SrWill McNair Martin Luther King HS JrSam Sessoms Shipley Jr \nElijah Kiah-El Martin Luther King SrRobbie Heath Abington JrShaw King Northeast Prep JrAndrew King Downingtown East FrBB Mady Northeast Prep JrKassir Kay Audien Reed SrRome Ball Northeast Prep SrChris Inge Neumann Goretti SrElijah Mitchell Mater Dei Prep SrEric Kenny Abington Sr \nMarc Rodriguez Father Judge SrMatt Cerruti Wood SrMike Power Father Judge SrJesse McPherson Carroll SrD. Cosby-Roundtree Neumann Goretti Sr \nKeystone Blazers Black Shyheim Abernathy Phoenixville HS SrNick Richards Patrick School SrAvery Close Phoenixville SrJamir Harris Patrick School SrChristian Ings Neumann-Goretti SophJordan Walker Patrick School JrJulius Phillips Archbishop Wood SophMarcus McClary Patrick School SrAl-Amir Daws Patrick School SophDavid Angelo Bishop Shanahan JrTavon Jones Linden JrValdir Manuel Patrick School JrTyrel Bladen Coatesville JrBauy Koka Patrick School SrMichael Watkins Linden Jr \nAhmad Williams Plymouth Whitemarsh JrAhmin Williams Plymouth Whitemarsh JrKevin Tilghman Plymouth Whitemarsh JrNaheem McLeod Plymouth Whitemarsh SophIsh Horn Plymouth Whitemarsh JrAdam Henderson Parkway JrShannon Bibbs Abington Friends JrJahi Randall Lincoln JrNoah Fennell Lower Merion SrNassir Coleman Lincoln SrDavid Beatty Imhotep Charter SrNisheem McNeal-Wright Audenried Sr \nIsaiah Wiggins Pocono Mountain West SrMichael Bealer Souderton SrCharles Ervin Faith Christian JrDyony Bueno Stroudsburg Sr \nLogan Bailey Scranton Prep SrSam Iorio Parkland SrSeth Maxwell Abington Heights SrLance Singh Pocono Mountain West SrShon Wilson Stroudsburg SrMaqi Watson Math Civics Science SrJalen Vaughns Pocono Mountain West SrWill Melson Bethlehem Catholic JrRyan Young Bethlehem Catholic JrBryce Calloway Berks Catholic SophZach Sabol Emmaus SophJustin Paz Bethlehem Catholic SophJulian Thomas Bethlehem Catholic Fr \nOld School Cavaliers Colin Daly Archbishop Carroll SrDa'kQuan Davis Roman Catholic SrMalik Archer MCS SrCameron Reddish Westtown HS JrMarcus Littles NG JrSeth Lundy Roman Catholic SophZack Crisler La Salle SophA.J. Hoggard Carroll FrAndrew King Downingtown East FrJustin Anderson Carroll JrCollin Gillespie Arch Wood SrBrandon McCullough Avon Grove SrMikeal Jones Girard College Fr \nPizza Time Jackson Scialanca Christopher Dock SophDeins Bergis Christopher Dock SrDamian Washington Upper Moreland SrRyan Coyle Upper Moreland JrChristian O'Donnell Upper Moreland SophShane Stone Upper Moreland SrAnthony Green Upper Moreland SrBobby Snyder Palisades FrMatt Pattyson C.B. East JrRyan Hagan Spring-Ford Soph \nBryce Spriggs Friends' Central SophAkello Mosby E&S JrMarvin Freeman Sun Valley SophWilliam Moore Gratz JrTour'e Banks Friends' Central JrQuentin Johnson Springfield JrIsaiah Morgan Lower Merion JrTahmir Thompson McDevitt JrJaneim Aiken Cristo Rey FrCraig Logan Girard College JrFranklin Anderson Valley Day JrJosh Martin Lower Merion SophArion Lewis Valley Forge Jr \nPositive Image II Letrell West St. Joseph SrKiyon Hardy Shipley SrZuri Peyton SCH Academy SrRashon Johnson Gratz SrDonte Moore Martin Luther King Sr \nRaw Sports All Stars Eli Brooks Spring Grove SrTaylor Funk Manheim Township SrStan Scott Williamsport SrTyrese Martin William Allen SrTalek Williams William Allen SrSam Sessoms Shipley Jr \nJodan Pierce Union Catholic SrDarnell Brodie Newark East Side SrChip Roriston Summit HS SrCasmir Ochiaki St. Mary's SrCalistus Anyichi St. Mary's SrElija Olaniyi Newark East Side SrAmadu Benbaw Newark East Side SrHassan Ceesay Newark East Side JrJahid Jenkins Newark East Side JrTaj Benning Bergen Catholic SrShamir Johnson Newark East Side JrAhmad Fleur St Mary's Sr \nTeam Hardnett Daron Russell Imhotep Charter SrAshley Jones Neumann-Goretti Sr \nJoshua Coleman International Christian SrJihad Watson Martin Luther King SophIsaiah Anderson Martin Luther King JrDonnelle Holly Martin Luther King JrYasir Durant Martin Luther King SophXzavier Wayman Constitution SophAmin Bryant Archbishop Ryan SophEjah Obanye Reno Prep JrPeteria Edmonds Reno Prep SophAhmad Wimbush Math, Civics & Sciences Sr \nWeR 1 Chereef Knox Imhotep Charter SophEric Dixon Abington SophIsaiah Wong Notre Dame SophHakim Byrd Neumann Goretti FrJustin Paz Bethlehem Catholic SophAjiri Johnson Bonner-Prendergast JrSean Simon La Salle JrTyree Pickron Archbishop Wood JrWill McNair Martin Luther King JrAntwaun Butler Del Val Charter JrKevin Anderson St. John Neumann SrNashon Holland St. George's Tech SophImere Harris West Catholic SophEric Ayala Putnam Science Academy JrXander Rice St. Anthony's Soph \nYellow Jackets Devin Hill Valley Forge M.A. SrMyles Bunyon Valley Forge M.A. SrJamar Sudan Chester SrAbraham Deng Valley Forge M.A. JrJohn Harrar Strath Haven SrMarius Ntwari Valley Forge M.A. JrMatt Carter MaST Charter SrArion Lewis Valley Forge Military Acad JrMekhi Morris Del Val Charter Sr \nClick HERE to read more posts from The O'Zone. Read more by Rick O'Brien More Coverage March 21, 2017 â€” 2:08 PM EDT | Updated: March 21, 2017 â€” 3:37 PM EDT Do you have a minute?... \nOver the past year, the Inquirer, the Daily News and Philly.com have uncovered corruption in local and state public offices, shed light on hidden and dangerous environmental risks, and deeply examined the regionâ€™s growing heroin epidemic. This is indispensable journalism, brought to you by the largest, most experienced newsroom in the region. Fact-based journalism of this caliber isnâ€™t cheap. We need your support to keep our talented reporters, editors and photographers holding government accountable, looking out for the public interest, and separating fact from fiction. If you already subscribe, thank you. If not, please consider doing so by clicking on the button below. Subscriptions can be home delivered in print, or digitally read on nearly any mobile device or computer, and start as low as 25Â¢ per day. We're thankful for your support in every way. We encourage respectful comments but reserve the right to delete anything that doesn't contribute to an engaging dialogue Help us moderate this thread by flagging comments that violate our guidelines Commenting policy | Comments FAQ Comment policy: \nPhilly.com comments are intended to be civil, friendly conversations. Please treat other participants with respect and in a way that you would want to be treated. You are responsible for what you say. And please, stay on topic. If you see an objectionable post, please report it to us using the \"Report Abuse\" option. \nPlease note that comments are monitored by Philly.com staff. We reserve the right at all times to remove any information or materials that are unlawful, threatening, abusive, libelous, defamatory, obscene, vulgar, pornographic, profane, indecent or otherwise objectionable. Personal attacks, especially on other participants, are not permitted. We reserve the right to permanently block any user who violates these terms and conditions. \nAdditionally comments that are long, have multiple paragraph breaks, include code, or include hyperlinks may not be posted.", "external_links": [], "published": "2017-03-22T02:37:00.000+02:00", "crawled": "2017-03-22T13:26:56.612+02:00", "highlightTitle": ""}