{"organizations": [], "uuid": "3ae1e30c02f301f5f265dae10a52e47f10e1b573", "thread": {"social": {"gplus": {"shares": 2}, "pinterest": {"shares": 0}, "vk": {"shares": 0}, "linkedin": {"shares": 0}, "facebook": {"likes": 348, "shares": 348, "comments": 0}, "stumbledupon": {"shares": 0}}, "site_full": "www.geo.tv", "main_image": "https://www.geo.tv/assets/uploads/updates/2017-03-22/135207_061658_updates.jpg", "site_section": "http://feeds.feedburner.com/GeoBulletins", "section_title": "GEO TV - World", "url": "https://www.geo.tv/latest/135207-Social-media-not-more-important-than-religion-and-faith-Nisar", "country": "TV", "domain_rank": 8287, "title": "Social media not more important than religion and faith: Nisar", "performance_score": 3, "site": "geo.tv", "participants_count": 0, "title_full": "Social media not more important than religion and faith: Nisar", "spam_score": 0.0, "site_type": "blogs", "published": "2017-03-23T01:07:00.000+02:00", "replies_count": 0, "uuid": "3ae1e30c02f301f5f265dae10a52e47f10e1b573"}, "author": "", "url": "https://www.geo.tv/latest/135207-Social-media-not-more-important-than-religion-and-faith-Nisar", "ord_in_thread": 0, "title": "Social media not more important than religion and faith: Nisar", "locations": [], "entities": {"persons": [{"name": "chaudhry nisar ali khan", "sentiment": "negative"}, {"name": "chaudhry nisar", "sentiment": "none"}, {"name": "nisar", "sentiment": "none"}], "locations": [{"name": "islamabad", "sentiment": "none"}, {"name": "islamabad", "sentiment": "none"}, {"name": "pakistan", "sentiment": "none"}, {"name": "dubai", "sentiment": "none"}, {"name": "india", "sentiment": "none"}], "organizations": [{"name": "nisar", "sentiment": "negative"}, {"name": "federal interior", "sentiment": "negative"}, {"name": "federal investigation agency", "sentiment": "none"}, {"name": "social media blasphemy", "sentiment": "none"}, {"name": "social media", "sentiment": "none"}, {"name": "fia", "sentiment": "none"}, {"name": "pcb", "sentiment": "none"}]}, "highlightText": "", "language": "english", "persons": [], "text": "0 0 \nISLAMABAD: Federal Interior Minister Chaudhry Nisar Ali Khan on Wednesday warned those spreading blasphemous content on social media of harsh action against them. \nAddressing a press conference in Islamabad the federal minister said, “social media is not more important than religion and faith,” adding that the issue of blasphemy is not limited to one country but rather one that affects the entire Muslim world. \nHe added, that while Pakistan was taking steps to tackle the problem in light of court orders, a joint agenda defined by Muslim countries will produce effective results. \nThe minister also came down hard against played involved in the spot-fixing scandal and said that we need stop incidents that affect Pakistan image negatively. \nHe said the Federal Investigation Agency (FIA) probe has not yet revealed who was involved in the scandal. \nNisar told journalists, that the Pakistan Cricket Board (PCB) and FIA should cooperate and decide how to proceed with the investigation, adding that the PCB has certain powers that the FIA doesn’t. \nThe FIA doesn’t need permission and does not need to inform anyone in writing to start an investigation, the minister clarified. \nNisar said spot-fixing issue can be traced to foreign countries, adding that the government will go against bookies whether they are in Pakistan, India or Dubai. 0 0 Social media not more important than religion and faith: Nisar was posted in pakistan   Anti Religious Posts On Social Media, Blasphemy Issue, Chaudhry Nisar, Pakistan News, Social Media Blasphemy.   \"Social media not more important than religion and faith: Nisar\" is https://www.geo.tv/latest/135207-Social-media-not-more-important-than-religion-and-faith-Nisar . More From Pakistan:", "external_links": [], "published": "2017-03-23T01:07:00.000+02:00", "crawled": "2017-03-22T15:29:06.074+02:00", "highlightTitle": ""}