{"organizations": [], "uuid": "863b666a806d734c325ea44d58ced30484425a85", "thread": {"social": {"gplus": {"shares": 0}, "pinterest": {"shares": 0}, "vk": {"shares": 0}, "linkedin": {"shares": 23}, "facebook": {"likes": 619, "shares": 619, "comments": 0}, "stumbledupon": {"shares": 0}}, "site_full": "www.vanguardngr.com", "main_image": "http://d19lga30codh7.cloudfront.net/wp-content/uploads/2015/04/DSTV.jpg", "site_section": "http://www.vanguardngr.com/feed", "section_title": "Vanguard News", "url": "http://www.vanguardngr.com/2017/03/multichoice-rewards-dstv-gotv-subscribers/", "country": "US", "domain_rank": 2203, "title": "MultiChoice rewards DStv, GOtv subscribers", "performance_score": 6, "site": "vanguardngr.com", "participants_count": 1, "title_full": "MultiChoice rewards DStv, GOtv subscribers", "spam_score": 0.0, "site_type": "blogs", "published": "2017-03-13T09:29:00.000+02:00", "replies_count": 0, "uuid": "863b666a806d734c325ea44d58ced30484425a85"}, "author": "Nwafor Polycarp", "url": "http://www.vanguardngr.com/2017/03/multichoice-rewards-dstv-gotv-subscribers/", "ord_in_thread": 0, "title": "MultiChoice rewards DStv, GOtv subscribers", "locations": [], "entities": {"persons": [{"name": "shaitan", "sentiment": "none"}, {"name": "dwayne", "sentiment": "none"}, {"name": "nina", "sentiment": "none"}, {"name": "snoop dog", "sentiment": "none"}, {"name": "martin mabutho", "sentiment": "none"}, {"name": "gotv value", "sentiment": "none"}, {"name": "nwafor polycarp", "sentiment": "none"}], "locations": [{"name": "mali", "sentiment": "none"}, {"name": "mohra", "sentiment": "none"}, {"name": "kushi", "sentiment": "none"}, {"name": "hollywood", "sentiment": "none"}], "organizations": [{"name": "gotv", "sentiment": "positive"}, {"name": "multichoice", "sentiment": "positive"}, {"name": "zee bollymovies", "sentiment": "none"}, {"name": "viasat life", "sentiment": "none"}, {"name": "multichoice nigeria", "sentiment": "none"}, {"name": "gotv channel 57", "sentiment": "none"}, {"name": "potluck dinner party", "sentiment": "none"}, {"name": "house of curves", "sentiment": "none"}, {"name": "gotv value", "sentiment": "none"}, {"name": "gotv channel", "sentiment": "none"}, {"name": "martha stewards in martha & snoop", "sentiment": "none"}]}, "highlightText": "", "language": "english", "persons": [], "text": "Home » News » MultiChoice rewards DStv, GOtv subscribers MultiChoice rewards DStv, GOtv subscribers On 3:29   \nPay-TV company,MultiChoice, has introduced two new incentive programmes, DStv THANKS and GOtv WOW, to reward subscribers for their loyalty. \nThe programmes, which started on March 7 and run till 21 March, will see all DStv , GOtv Plus and GOtv Value customers get the opportunity to have unlimited access to exciting channels offering a range of the latest quality content. \nAlso all customers on Premium, Compact, Compact Plus, Family and Access plus GOtv Plus and GOtv Value, who stay continuously connected for three months and more, will have uninterrupted access to the channels. DSTV \nExciting rewards that await loyal customers include monthly airtime bonuses and two brand new entertainment channels for Gotv as well as four additional entertainment channels, featuring the hottest telenovelas, movies and great local and international content on the DStv platform, at no extra cost. \nThe entertainment channels offered as rewards will offer a fantastic line up of ‘not-to-be missed’ new shows on Zee Bollymovies (DStv Channel 114) and GOtv Channel 12, Viasat Life on DStv Channel 177 and GOtv Channel 57, Nina TV on DStv Channel 143 and Trigger on DStv Channel 188. \n“We are delighted to launch DStv THANKS and GOtv WOW to say thank you to our valued customers. Our business is committed to putting customers at the heart of the business and one of the ways is to show our appreciation for their loyalty and support by offering them more value. We remain committed to exploring various ways to improve our value-added benefits. \nand create platforms where we can show gratitude for our customers for being part of our family,” said Martin Mabutho, General Manager, MultiChoice Nigeria. \nZee Bollymovies is a Bollywood movie channel offering a mix of classic and contemporary movies dubbed in English. The channel will launch with movies such as Mohra, Kushi, Shaitan and F itoor. \nViasat Life offers inspiring stories of ordinary people, who have made it big. The channel will feature shows with Hollywood greats like Snoop Dog and Martha Stewards in Martha & Snoop’s Potluck Dinner Party, Dwayne ‘The Rock’ Johnson in Wake-Up Call and a variety of lifestyle shows like, House of Curves, The Three Day Nanny and My Floating Home. \nNina TV is a telenovela channel featuring African and Brazilian novelas of romance, passion, drama, suspense, action and vengeance. Viewers can enjoy movies such Lalola, Brave Woman, Side By Side and Mali. Nwafor Polycarp", "external_links": [], "published": "2017-03-13T09:29:00.000+02:00", "crawled": "2017-03-13T04:17:41.620+02:00", "highlightTitle": ""}