{"organizations": [], "uuid": "eb3dc1c12d68ff1d89a5947641b43c9f1ecd2437", "thread": {"social": {"gplus": {"shares": 0}, "pinterest": {"shares": 0}, "vk": {"shares": 0}, "linkedin": {"shares": 0}, "facebook": {"likes": 201, "shares": 201, "comments": 0}, "stumbledupon": {"shares": 0}}, "site_full": "www.thesun.co.uk", "main_image": "https://www.thesun.co.uk/wp-content/uploads/2017/03/sport-preview-lukaku-townsend.jpg?strip=all&#038;quality=100&#038;w=620&#038;h=413&#038;crop=1", "site_section": "http://www.thesun.co.uk/sol/homepage/sport/football/rss/", "section_title": "Football news - transfers, fixtures, scores, pictures | The Sun", "url": "https://www.thesun.co.uk/sport/football/3225738/romelu-lukaku-wins-premier-league-player-of-the-month-for-marchas-andros-townsend-scoops-award-for-best-goal/", "country": "GB", "domain_rank": 2180, "title": "Romelu Lukaku wins Premier League player of the month for March…as Andros Townsend scoops award for best goal", "performance_score": 2, "site": "thesun.co.uk", "participants_count": 1, "title_full": "Romelu Lukaku wins Premier League player of the month for March…as Andros Townsend scoops award for best goal", "spam_score": 0.0, "site_type": "blogs", "published": "2017-03-31T23:20:00.000+03:00", "replies_count": 0, "uuid": "eb3dc1c12d68ff1d89a5947641b43c9f1ecd2437"}, "author": "gsweet", "url": "https://www.thesun.co.uk/sport/football/3225738/romelu-lukaku-wins-premier-league-player-of-the-month-for-marchas-andros-townsend-scoops-award-for-best-goal/", "ord_in_thread": 0, "title": "Romelu Lukaku wins Premier League player of the month for March…as Andros Townsend scoops award for best goal", "locations": [], "entities": {"persons": [{"name": "romelu lukaku", "sentiment": "negative"}, {"name": "howe", "sentiment": "none"}, {"name": "antonio conte", "sentiment": "none"}, {"name": "patrick vieira", "sentiment": "none"}, {"name": "townsend", "sentiment": "none"}, {"name": "andros towsend", "sentiment": "none"}, {"name": "nathan redmond", "sentiment": "none"}, {"name": "geoff sweet", "sentiment": "none"}, {"name": "jesse lingard", "sentiment": "none"}, {"name": "oumar niasse", "sentiment": "none"}, {"name": "tony currie", "sentiment": "none"}, {"name": "andros townsend", "sentiment": "none"}, {"name": "chelsea", "sentiment": "none"}, {"name": "alexis sanchez", "sentiment": "none"}, {"name": "moussa sissoko", "sentiment": "none"}, {"name": "harry kane", "sentiment": "none"}, {"name": "sammy lee", "sentiment": "none"}, {"name": "eddie howe", "sentiment": "none"}, {"name": "josh king", "sentiment": "none"}, {"name": "fernando llorente", "sentiment": "none"}, {"name": "christian [benteke", "sentiment": "none"}, {"name": "mamadou sakho", "sentiment": "none"}, {"name": "arsene wenger", "sentiment": "none"}, {"name": "ben turner", "sentiment": "none"}, {"name": "lukaku", "sentiment": "none"}, {"name": "robert huth", "sentiment": "none"}, {"name": "ben", "sentiment": "none"}, {"name": "erik lamela", "sentiment": "none"}, {"name": "gini wijnaldum", "sentiment": "none"}, {"name": "artur boruc", "sentiment": "none"}, {"name": "leko", "sentiment": "none"}, {"name": "poch", "sentiment": "none"}], "locations": [{"name": "west bromwich", "sentiment": "none"}, {"name": "southampton", "sentiment": "none"}, {"name": "swansea", "sentiment": "none"}, {"name": "manchester city", "sentiment": "none"}, {"name": "leyton orient", "sentiment": "none"}, {"name": "england", "sentiment": "none"}, {"name": "yeovil", "sentiment": "none"}, {"name": "bournemouth", "sentiment": "none"}, {"name": "montenegro", "sentiment": "none"}, {"name": "italy", "sentiment": "none"}, {"name": "anfield", "sentiment": "none"}, {"name": "merseyside", "sentiment": "none"}], "organizations": [{"name": "andros town", "sentiment": "negative"}, {"name": "premier league", "sentiment": "negative"}, {"name": "andros townsend", "sentiment": "negative"}, {"name": "efl gong", "sentiment": "negative"}, {"name": "west bromwich", "sentiment": "none"}, {"name": "burton albion", "sentiment": "none"}, {"name": "romelu lukaku", "sentiment": "none"}, {"name": "gunners deal tv times what tv", "sentiment": "none"}, {"name": "getty images", "sentiment": "none"}, {"name": "arsenal", "sentiment": "none"}, {"name": "all premier league", "sentiment": "none"}, {"name": "west ham", "sentiment": "none"}, {"name": "chelsea", "sentiment": "none"}, {"name": "eden hazard", "sentiment": "none"}, {"name": "manchester united", "sentiment": "none"}, {"name": "man city  bournemouth", "sentiment": "none"}, {"name": "wilf spurs", "sentiment": "none"}, {"name": "eden hazard to real madrid", "sentiment": "none"}, {"name": "everton", "sentiment": "none"}, {"name": "sunday premier league", "sentiment": "none"}, {"name": "crystal palace", "sentiment": "none"}, {"name": "liverpool", "sentiment": "none"}, {"name": "wilf zaha", "sentiment": "none"}]}, "highlightText": "", "language": "english", "persons": [], "text": "EFL GONG WITH THE WIN Romelu Lukaku wins Premier League player of the month for March…as Andros Townsend scoops award for best goal \nBournemouth's Eddie Howe lands a gong, too, as manager of the month for pulling Cherries nine points clear of drop zone By Geoff Sweet 31st March 2017, 4:20 pm Updated: 31st March 2017, 4:36 pm ROMELU LUKAKU has bagged the Premier League player of the month for March. \nAnd Andros Towsend has picked up the award for goal of the month. Getty Images 5 Romelu Lukaku…player of the month for March \nLukaku scored four times in three games, becoming the first Everton player to hit the 20-goal mark in the Premier League era. \n“I’m really happy,” said Lukaku, who faces Liverpool at Saturday lunchtime in the Merseyside derby at Anfield. \nKeep up to date with ALL the latest football news , gossip and rumours \n“It gives me another boost. I’m playing well at the minute and the team is doing really well.” \nA panel comprising experts, Premier League captains and supporters chose Lukaku from a six-man shortlist including Liverpool’s Gini Wijnaldum, Crystal Palace’s Mamadou Sakho and Nathan Redmond of Southampton. PA:Press Association Lukaku celebrates yet another Premier League goal Getty Images 5 Andros Townsend…the goal of the month winner \nPalace winger Townsend fended off competition from Fernando Llorente, Eden Hazard, Harry Kane, Robert Huth, Jesse Lingard, Alexis Sanchez and Oumar Niasse to claim his prize for his solo effort against West Bromwich. Most popular SHEFF SERVED UP HOT CURRIE Tony Currie looked like a glam rocker and when on song was one of the 70s' top players deal me in Arsenal, Chelsea, Manchester United and ALL Premier League clubs - get the latest transfer news, updates and gossip Ben banned Burton Albion midfielder Ben Turner handed five-match ban by the FA for racially abusing an opponent Blues' Ed-ache Chelsea will NOT sell Eden Hazard to Real Madrid as they look to secure Antonio Conte's long-term future Poch to Chop for Wilf Spurs to move for Wilf Zaha this summer with Erik Lamela and Moussa Sissoko facing axe PAT ON THE BACK Patrick Vieira tipped for Arsenal return to work with Arsene Wenger if boss signs new Gunners deal TV Times What TV channel is showing Arsenal vs Manchester City, what time is it on and what is the team news? Back to my best Crystal Palace winger Andros Townsend says coach Sammy Lee's rollicking turned season around \nLooking back on his wonder goal, Townsend said: “I shrugged off Leko and Christian [Benteke] ran away so he left me the space, and even though I had nothing left I thought ‘I’m going to have to go for this.’ \n“It ended up as a two-v-two attack and thankfully I scored the goal. Getty Images Townsend hit West Bromwich with a wonder goal Some of the best Premier League goals of the month for March Getty Images 5 Eddie Howe bagged the manager of the month gong \n\"It’s definitely up there as one of the best in my career. I’ve been criticised that I’m a great scorer of goals, but not a great goalscorer. \n\"I’ve scored one for Spurs from a similar distance against Swansea, and a couple for England against Italy and Montenegro as well as another for Leyton Orient against Yeovil from a similar distance, so I’ve scored quite a few!” Sunday Premier League match preview featuring Arsenal v Man City \nBournemouth's Josh King and Artur Boruc were the others to miss out on the playewr of the month award, but the club's fine form was recognised as Eddie Howe took the manager's award. \nHowe oversaw a 1-1 draw at Manchester United and wins against West Ham and Swansea as the Cherries pulled nine points clear of the relegation places.", "external_links": [], "published": "2017-03-31T23:20:00.000+03:00", "crawled": "2017-03-31T19:49:37.458+03:00", "highlightTitle": ""}