{"organizations": [], "uuid": "fb1e9d5793f792723e59d1bc0668b577a4d0c321", "thread": {"social": {"gplus": {"shares": 2}, "pinterest": {"shares": 5}, "vk": {"shares": 0}, "linkedin": {"shares": 0}, "facebook": {"likes": 191, "shares": 191, "comments": 0}, "stumbledupon": {"shares": 0}}, "site_full": "www.theguardian.com", "main_image": "https://i.guim.co.uk/img/media/a803ca43b65872499dfdc25d6a3598673d0dbf8d/0_206_4848_2909/master/4848.jpg?w=1200&amp;h=630&amp;q=55&amp;auto=format&amp;usm=12&amp;fit=crop&amp;crop=faces%2Centropy&amp;bm=normal&amp;ba=bottom%2Cleft&amp;blend64=aHR0cHM6Ly91cGxvYWRzLmd1aW0uY28udWsvMjAxNi8wNS8yNS9vdmVybGF5LWxvZ28tMTIwMC05MF9vcHQucG5n&amp;s=71c16e5558b5ee2466ba04d2df41b8ff", "site_section": "http://www.guardian.co.uk/rssfeed/0,,13,00.xml", "section_title": "The Guardian", "url": "https://www.theguardian.com/news/gallery/2017/mar/16/best-photos-of-the-day-an-orchid-mantis-and-starry-skies", "country": "GB", "domain_rank": 170, "title": "Best photos of the day: An orchid mantis and starry skies", "performance_score": 1, "site": "theguardian.com", "participants_count": 1, "title_full": "Best photos of the day: An orchid mantis and starry skies", "spam_score": 0.0, "site_type": "blogs", "published": "2017-03-16T19:42:00.000+02:00", "replies_count": 0, "uuid": "fb1e9d5793f792723e59d1bc0668b577a4d0c321"}, "author": "Sadie Gould", "url": "https://www.theguardian.com/news/gallery/2017/mar/16/best-photos-of-the-day-an-orchid-mantis-and-starry-skies", "ord_in_thread": 0, "title": "Best photos of the day: An orchid mantis and starry skies", "locations": [], "entities": {"persons": [{"name": "sadie gould", "sentiment": "none"}, {"name": "christian stephen/ap geert wilders", "sentiment": "none"}, {"name": "mark rutte", "sentiment": "none"}, {"name": "donald trump", "sentiment": "none"}, {"name": "salman bin abdulaziz al-saud", "sentiment": "none"}, {"name": "xi jinping", "sentiment": "none"}, {"name": "craig mathews", "sentiment": "none"}, {"name": "fernando bizerra jr/epa mcallen", "sentiment": "none"}, {"name": "john thys/afp/getty jakarta", "sentiment": "none"}], "locations": [{"name": "são paulo", "sentiment": "none"}, {"name": "the hague", "sentiment": "none"}, {"name": "padang", "sentiment": "none"}, {"name": "us", "sentiment": "none"}, {"name": "mexico", "sentiment": "none"}, {"name": "brazil", "sentiment": "none"}, {"name": "indonesia", "sentiment": "none"}, {"name": "beijing", "sentiment": "none"}, {"name": "liaocheng", "sentiment": "none"}, {"name": "netherlands", "sentiment": "none"}, {"name": "china", "sentiment": "none"}, {"name": "iraq", "sentiment": "none"}, {"name": "mosul", "sentiment": "none"}], "organizations": [{"name": "best", "sentiment": "positive"}, {"name": "us customs", "sentiment": "none"}, {"name": "vvd", "sentiment": "none"}, {"name": "islamic state", "sentiment": "none"}, {"name": "border protection", "sentiment": "none"}, {"name": "china farmers", "sentiment": "none"}, {"name": "party for freedom", "sentiment": "none"}]}, "highlightText": "", "language": "english", "persons": [], "text": "Best photos of the day: An orchid mantis and starry skies Best photos of the day: An orchid mantis and starry skies View more sharing options Share on Messenger Close \nThe Guardian’s picture editors bring you a selection of photo highlights from around the world, including a cunning flower mimic and a twinkly night Sadie Gould Thursday 16 March 2017 12.42 GMT The Hague, the Netherlands Prime minister and VVD party leader Mark Rutte arrives to deliver a speech after winning the general election Photograph: John Thys/AFP/Getty Jakarta, Indonesia Villagers whose feet are cast in cement blocks sit on a chairs as part of four days of protests to draw attention to what they say is environmental damage to their farmland from a cement factory Photograph: Beawiharta/Reuters Stars twinkle over treetops in a forest Photograph: Patrick Pleul/AFP/Getty Mosul, Iraq A police officer weeps at the site of a mass grave containing about two dozen people, many of them children, in an area recently retaken from Islamic State militants Photograph: Christian Stephen/AP Geert Wilders, leader of the Party for Freedom reacts to the general election results Photograph: Remko de Waal/EPA Craig Mathews holds a sign with protesters before Donald Trump visits for a rally Photograph: DDP USA/Rex/Shutterstock Liaocheng, China Farmers working in a wheat field. Genetically modified organisms are banned in China but the debate over whether to introduce them rages at the annual session of parliament Photograph: STR/AFP/Getty Images São Paulo, Brazil A protester with a sticker reading: ‘No right to less’ attends a demonstration against changes to the pension scheme Photograph: Fernando Bizerra Jr/EPA McAllen, US A woman raises her hands as a US Customs and Border Protection helicopter flies overhead near the Mexican border. The organisation has announced that illegal crossings along the south-west border with Mexico dropped by 40% in February Photograph: John Moore/Getty Images Beijing, China Members of the Saudi delegation wait for the arrival of China’s president, Xi Jinping, and Saudi king, Salman bin Abdulaziz al-Saud, before a welcoming ceremony Photograph: Thomas Peter/Reuters Padang, Indonesia An orchid mantis ( Hymenopus coronatus ) perches on the head of a frog hanging from a tree branch Photograph: Riau/Barcroft", "external_links": [], "published": "2017-03-16T19:42:00.000+02:00", "crawled": "2017-03-16T14:57:48.379+02:00", "highlightTitle": ""}