{"organizations": [], "uuid": "2fb7269db359d444426b8b78f427d203e0490eec", "thread": {"social": {"gplus": {"shares": 0}, "pinterest": {"shares": 1}, "vk": {"shares": 0}, "linkedin": {"shares": 0}, "facebook": {"likes": 284, "shares": 284, "comments": 37}, "stumbledupon": {"shares": 0}}, "site_full": "www.buzzfeed.com", "main_image": "https://img.buzzfeed.com/buzzfeed-static/static/2017-03/9/9/enhanced/buzzfeed-prod-fastlane-01/original-3767-1489071290-7.jpg?crop=821:430;83,68", "site_section": "https://www.buzzfeed.com/world", "section_title": "BuzzFeed World", "url": "https://www.buzzfeed.com/robinedds/can-you-beat-this-a-to-z-geography-quiz", "country": "US", "domain_rank": 137, "title": "Can You Beat This Infuriating A To Z Geography Quiz", "performance_score": 2, "site": "buzzfeed.com", "participants_count": 20, "title_full": "Can You Beat This Infuriating A To Z Geography Quiz", "spam_score": 0.375, "site_type": "blogs", "published": "2017-03-10T00:57:00.000+02:00", "replies_count": 25, "uuid": "2fb7269db359d444426b8b78f427d203e0490eec"}, "author": "Robin Edds", "url": "https://www.buzzfeed.com/robinedds/can-you-beat-this-a-to-z-geography-quiz", "ord_in_thread": 0, "title": "Can You Beat This Infuriating A To Z Geography Quiz", "locations": [], "entities": {"persons": [{"name": "grenadines st vincent", "sentiment": "none"}, {"name": "saint kitts", "sentiment": "none"}, {"name": "robin edds", "sentiment": "none"}, {"name": "vincent", "sentiment": "none"}, {"name": "saint vincent", "sentiment": "none"}], "locations": [{"name": "nauru", "sentiment": "none"}, {"name": "philippines", "sentiment": "none"}, {"name": "tanzania", "sentiment": "none"}, {"name": "morocco", "sentiment": "none"}, {"name": "denmark djibouti dominica denmark", "sentiment": "none"}, {"name": "barbuda", "sentiment": "none"}, {"name": "greece", "sentiment": "none"}, {"name": "antigua", "sentiment": "none"}, {"name": "europe", "sentiment": "none"}, {"name": "nicaragua", "sentiment": "none"}, {"name": "tajikistan", "sentiment": "none"}, {"name": "sri lanka", "sentiment": "none"}, {"name": "brunei", "sentiment": "none"}, {"name": "iraq", "sentiment": "none"}, {"name": "haiti honduras haiti", "sentiment": "none"}, {"name": "fiji", "sentiment": "none"}, {"name": "barbuda antigua barbuda madagascar", "sentiment": "none"}, {"name": "sierra leone", "sentiment": "none"}, {"name": "kuwait", "sentiment": "none"}, {"name": "north", "sentiment": "none"}, {"name": "djibouti", "sentiment": "none"}, {"name": "brazil belize bhutan brunei brazil", "sentiment": "none"}, {"name": "denmark denmark", "sentiment": "none"}, {"name": "andorra sierra leone andorra", "sentiment": "none"}, {"name": "panama", "sentiment": "none"}, {"name": "norway switzerland sweden norway", "sentiment": "none"}, {"name": "mozambique iraq equatorial guinea mozambique", "sentiment": "none"}, {"name": "nepal nauru new zealand nicaragua north korea nepal", "sentiment": "none"}, {"name": "uk", "sentiment": "none"}, {"name": "wales", "sentiment": "none"}, {"name": "guyana", "sentiment": "none"}, {"name": "solomon islands central african republic", "sentiment": "none"}, {"name": "kiribati", "sentiment": "none"}, {"name": "central african republic the dominican republic the czech republic", "sentiment": "none"}, {"name": "czech republic", "sentiment": "none"}, {"name": "mexico", "sentiment": "none"}, {"name": "swaziland", "sentiment": "none"}, {"name": "equatorial guinea", "sentiment": "none"}, {"name": "vatican city vatican vatican city", "sentiment": "none"}, {"name": "sri lanka saudi arabia singapore south korea syria singapore", "sentiment": "none"}, {"name": "grenadines st. vincent & the grenadines dominican republic", "sentiment": "none"}, {"name": "africa", "sentiment": "none"}, {"name": "marshall islands", "sentiment": "none"}, {"name": "sweden", "sentiment": "none"}, {"name": "united kingdom uk the united kingdom the uk belgium vietnam united kingdom", "sentiment": "none"}, {"name": "madagascar saudi arabia antigua", "sentiment": "none"}, {"name": "belize", "sentiment": "none"}, {"name": "grenadines", "sentiment": "none"}, {"name": "saudi arabia", "sentiment": "none"}, {"name": "kyrgyzstan kyrgyzstan", "sentiment": "none"}, {"name": "ivory coast", "sentiment": "none"}, {"name": "dominican republic kiribati philippines the philippines saint kitts", "sentiment": "none"}, {"name": "czech republic dominican republic central african republic", "sentiment": "none"}, {"name": "syria", "sentiment": "none"}, {"name": "kosovo morocco comoros kosovo", "sentiment": "none"}, {"name": "north korea", "sentiment": "none"}, {"name": "bhutan", "sentiment": "none"}, {"name": "mozambique swaziland tanzania mozambique", "sentiment": "none"}, {"name": "holland", "sentiment": "none"}, {"name": "london", "sentiment": "none"}, {"name": "switzerland", "sentiment": "none"}, {"name": "solomon islands", "sentiment": "none"}, {"name": "vietnam", "sentiment": "none"}, {"name": "uruguay uruguay", "sentiment": "none"}, {"name": "honduras", "sentiment": "none"}, {"name": "el salvador", "sentiment": "none"}, {"name": "tibet", "sentiment": "none"}, {"name": "panama poland poland", "sentiment": "none"}, {"name": "liechtenstein", "sentiment": "none"}, {"name": "dominica", "sentiment": "none"}, {"name": "guatemala grenada guyana guatamala guatemala", "sentiment": "none"}, {"name": "greece liechtenstein seychelles venezuela venezuela", "sentiment": "none"}, {"name": "luxembourg mexico luxembourg", "sentiment": "none"}, {"name": "central african republic", "sentiment": "none"}, {"name": "nevis", "sentiment": "none"}, {"name": "central african republic car el salvador marshall islands the marshall islands seychelles solomon islands", "sentiment": "none"}, {"name": "seychelles", "sentiment": "none"}, {"name": "grenada", "sentiment": "none"}, {"name": "hungary", "sentiment": "none"}, {"name": "egypt kuwait ivory coast egypt", "sentiment": "none"}, {"name": "belgium", "sentiment": "none"}, {"name": "dominican republic", "sentiment": "none"}, {"name": "central america", "sentiment": "none"}, {"name": "new zealand", "sentiment": "none"}, {"name": "south korea", "sentiment": "none"}, {"name": "fiji fiji", "sentiment": "none"}], "organizations": [{"name": "barbuda antigua & barbuda antigua", "sentiment": "none"}, {"name": "nevis st kitts", "sentiment": "none"}, {"name": "nevis saint kitts & nevis st kitts & nevis st. kitts and nevis st. kitts & nevis saint vincent", "sentiment": "none"}, {"name": "un", "sentiment": "none"}, {"name": "azerbaijan djibouti fiji tajikistan azerbaijan", "sentiment": "none"}, {"name": "grenadines saint vincent & the grenadines st vincent & the grenadines", "sentiment": "none"}]}, "highlightText": "", "language": "english", "persons": [], "text": "Note: For this quiz, a country is defined as a sovereign state that is recognised by more than half of the 193 UN member states. ID: 10671299 A: Name a country that contains FOUR or more A's. Guess I give up! Madagascar Saudi Arabia Antigua and Barbuda Antigua & Barbuda Antigua + Barbuda Antigua Barbuda Madagascar, Saudi Arabia, and Antigua and Barbuda. B: Name a SIX-LETTER country that starts with a \"B\". Guess I give up! Brazil Belize Bhutan Brunei Brazil, Belize, Brunei, and Bhutan. C: Name a country that ENDS with a C. Guess I give up! Czech Republic Dominican Republic Central African Republic CAR Czech the Central African Republic the Dominican Republic the Czech Republic the car Czech Republic, Dominican Republic, and Central African Republic. D: Name a ONE-WORD country that BEGINS with a D. Guess I give up! Denmark Djibouti Dominica Denmark, Djibouti, and Dominica. E: Name a ONE-WORD country that contains THREE or more E's. Guess I give up! Greece Liechtenstein Seychelles Venezuela Venezuela, Greece, Liechtenstein, and Seychelles. F: Name the ONLY non-European country that begins with an F. Guess I give up! Fiji Fiji. G: Name a country in North, South, or Central America that BEGINS with a G. Guess I give up! Guatemala Grenada Guyana Guatamala Guatemala, Grenada, and Guyana. H: Name a country that BEGINS with H, other than Hungary. Guess I give up! Haiti Honduras Haiti and Honduras. (Holland is not the name of a country, in case youâ€™re wondering.)\nI: Name a country that contains THREE or more I's. Guess I give up! Dominican Republic the Dominican Republic Kiribati Philippines The Philippines Saint Kitts and Nevis St Kitts and Nevis Saint Kitts & Nevis St Kitts & Nevis St. Kitts and Nevis St. Kitts & Nevis Saint Vincent and the Grenadines St Vincent and the Grenadines Saint Vincent & the Grenadines St Vincent & the Grenadines St. Vincent and the Grenadines St. Vincent & the Grenadines Dominican Republic, Kiribati, Philippines, Saint Kitts and Nevis, and Saint Vincent and the Grenadines. J: Name a country that contains a J, but DOESN'T begin with one. Guess I give up! Azerbaijan Djibouti Fiji Tajikistan Azerbaijan, Djibouti, Tajikistan, and Fiji. K: Name the ONLY country that ENDS with a K. Guess I give up! Denmark Denmark. L: Name a country that contains MORE THAN ONE L. Guess I give up! Central African Republic CAR El Salvador Marshall Islands The Marshall Islands Seychelles Solomon Islands the Solomon Islands Central African Republic, El Salvador, the Marshall Islands, Seychelles, and the Solomon Islands. M: Name a country that ENDS with an M. Guess I give up! United Kingdom UK The United Kingdom The UK Belgium Vietnam United Kingdom, Belgium, and Vietnam. N: Name a country that BEGINS with N, but ISN'T in Europe or Africa. Guess I give up! Nepal Nauru New Zealand Nicaragua North Korea Nepal, Nauru, North Korea, New Zealand, and Nicaragua. O: Name a ONE-WORD country that contains THREE O's. Guess I give up! Kosovo Morocco Comoros Kosovo, Morocco, and Comoros. P: Name a SIX-LETTER country that begins with P. Guess I give up! Panama Poland Poland and Panama. Q: Name a country that contains a Q, but DOESN'T begin with one. Guess I give up! Mozambique Iraq Equatorial Guinea Mozambique, Iraq, and Equatorial Guinea. R: Name a country that contains TWO consecutive R's. Guess I give up! Andorra Sierra Leone Andorra and Sierra Leone. S: Name an ASIAN country that begins with an S. Guess I give up! Sri Lanka Saudi Arabia Singapore South Korea Syria Singapore, Sri Lanka, Syria, South Korea and Saudi Arabia. T: Name a country that ENDS in T. Guess I give up! Egypt Kuwait Ivory Coast Egypt, Kuwait, and the Ivory Coast. (Tibet is not a sovereign state.)\nU: Name the only country that contains THREE U's. Guess I give up! Uruguay Uruguay V: Name the only EUROPEAN country that BEGINS with a V. Guess I give up! Vatican City Vatican Vatican City. W: Name a EUROPEAN country that contains a W. Guess I give up! Norway Switzerland Sweden Norway, Sweden, and Switzerland. (Wales is not a sovereign state.)\nX: Name a country that contains an X. Guess I give up! Luxembourg Mexico Luxembourg and Mexico. Y: Name the ONLY country that contains TWO Y's. Guess I give up! Kyrgyzstan Kyrgyzstan. Z: Name an AFRICAN country that contains a Z, but DOESN'T begin with one. Guess I give up! Mozambique Swaziland Tanzania Mozambique, Swaziland, and Tanzania. Can You Beat This Infuriating A To Z Geography Quiz? SHARE YOUR RESULTS ID: 10670703 Check out more articles on BuzzFeed.com!\nRobin Edds is editor-at-large at BuzzFeed UK and is based in London.", "external_links": [], "published": "2017-03-10T00:57:00.000+02:00", "crawled": "2017-03-09T18:59:04.087+02:00", "highlightTitle": ""}