{"organizations": [], "uuid": "8ef0582a4555e54986e6c6f891ef18e99acbc3d9", "thread": {"social": {"gplus": {"shares": 0}, "pinterest": {"shares": 0}, "vk": {"shares": 0}, "linkedin": {"shares": 0}, "facebook": {"likes": 195, "shares": 195, "comments": 0}, "stumbledupon": {"shares": 0}}, "site_full": "hellogiggles.com", "main_image": "", "site_section": "http://hellogiggles.com", "section_title": "HelloGiggles", "url": "http://hellogiggles.com/coming-to-hulu-in-april-dcom/", "country": "US", "domain_rank": 3916, "title": "Here’s what’s coming to Hulu in April (including one of our fave DCOMs!)", "performance_score": 1, "site": "hellogiggles.com", "participants_count": 1, "title_full": "Here’s what’s coming to Hulu in April (including one of our fave DCOMs!)", "spam_score": 0.0, "site_type": "blogs", "published": "2017-03-22T03:36:00.000+02:00", "replies_count": 0, "uuid": "8ef0582a4555e54986e6c6f891ef18e99acbc3d9"}, "author": "Caitlin Gallagher", "url": "http://hellogiggles.com/coming-to-hulu-in-april-dcom/", "ord_in_thread": 0, "title": "Here’s what’s coming to Hulu in April (including one of our fave DCOMs!)", "locations": [], "entities": {"persons": [{"name": "matthew broderick", "sentiment": "none"}, {"name": "morgan freeman", "sentiment": "none"}, {"name": "tommy boy", "sentiment": "none"}, {"name": "tyler perry", "sentiment": "none"}, {"name": "bobby fischer", "sentiment": "none"}, {"name": "frankie muniz", "sentiment": "none"}, {"name": "ben collins", "sentiment": "none"}, {"name": "chaplin", "sentiment": "none"}, {"name": "potter", "sentiment": "none"}, {"name": "nicole kidman", "sentiment": "none"}, {"name": "steve byrne", "sentiment": "none"}, {"name": "brooks", "sentiment": "none"}, {"name": "nat geo", "sentiment": "none"}, {"name": "roger rabbit", "sentiment": "none"}, {"name": "cesar millan", "sentiment": "none"}, {"name": "doris", "sentiment": "none"}, {"name": "joe young", "sentiment": "none"}, {"name": "hilary duff", "sentiment": "none"}, {"name": "shaun of the dead", "sentiment": "none"}, {"name": "johnny tsunami", "sentiment": "none"}, {"name": "george lucas", "sentiment": "none"}, {"name": "felicia", "sentiment": "none"}], "locations": [{"name": "hulu", "sentiment": "none"}, {"name": "america", "sentiment": "none"}, {"name": "deja", "sentiment": "none"}, {"name": "old california", "sentiment": "none"}], "organizations": [{"name": "abc family", "sentiment": "none"}, {"name": "penguins", "sentiment": "none"}, {"name": "sundance tv", "sentiment": "none"}, {"name": "living dead", "sentiment": "none"}, {"name": "ferris bueller", "sentiment": "none"}, {"name": "complete seasons", "sentiment": "none"}, {"name": "nickelodeon", "sentiment": "none"}, {"name": "lens across america", "sentiment": "none"}, {"name": "showtime", "sentiment": "none"}, {"name": "thelma & louise", "sentiment": "none"}, {"name": "hemingway", "sentiment": "none"}, {"name": "robocop", "sentiment": "none"}, {"name": "lincoln", "sentiment": "none"}, {"name": "stevens movie", "sentiment": "none"}, {"name": "amc", "sentiment": "none"}, {"name": "disney channel original movies", "sentiment": "none"}]}, "highlightText": "", "language": "english", "persons": [], "text": "Here’s what’s coming to Hulu in April (including one of our fave DCOMs!) Each month streaming services giveth and streaming services taketh away, and what’s coming to Hulu in April is no exception. Beyond the Hulu original series The Handmaid’s Tale premiering toward the end of the month, we’re also excited to stream some oldies (but goodies) on Hulu in April .\nIf you’re looking to relive your childhood, then Hulu has got you covered in the nostalgia department. Not only will the Frankie Muniz and Hilary Duff movie Agent Cody Banks be available on April 1st, but there will also be some Disney Channel Original Movies .\nMark April 19th on your calendar since both The Even Stevens Movie AND Johnny Tsunami will be available then. As Johnny Tsunami is one of the OG DCOMs, we couldn’t be more pumped to hang 10 with him again.\nfoglicious / foglicious.tumblr.com There’s also quality movies in general that will be available in April. If you want a Matthew Broderick binge, we recommend watching Ferris Bueller’s Day Off , followed by Election . You could also do a Nicole Kidman block with Days of Thunder and The Hours .\nAnd, if you’re just in the need of a good cry, Morgan Freeman narrating March of the Penguins will get the job done.\nNo matter what you’re craving, Hulu has got you covered. So check out the full list of April releases below to prepare yourself accordingly.\nPlease note, anything marked with an asterisk is only available if you have the Showtime add-on. \nAvailable on April 1st 1408 (2007)*\nA Horse Tale (2015)\nAgent Cody Banks (2003)\nAffliction (1998)\nAlmost Famous (2000)\nAmerica’s Sweethearts (2001)*\nBad Company (1995)*\nBangkok Dangerous (2008)*\nBen Collins: Stunt Driver (2015)\nBeyond the Sea (2004)*\nThe Big Empty (2003)\nBigfoot Country (2012)\nThe Burrowers (2009)\nCadillac Man (1990)\nCall Me (1988)\nCasual Encounters (2016)\nChaplin (1993)\nChosen (2016)\nCompany Man (2000)*\nCry Freedom (1987)*\nDancer (2016)\nDays of Thunder (1990)\nDeja vu (2006)*\nDeuce Bigalow: Male Gigolo (1999)*\nEddie Murphy Raw (1987)\nElection (1999)\nThe Ex (2006)*\nFactory Girl (2006)*\nFederal Hill (1994)\nFelicia’s Journey (1999)\nFerris Bueller’s Day Off (1986)\nFifteen and Pregnant (1997)\nFight to the Finish (2016)\nFlyboys (2006)\nFrankenstein (2004)\nFurry Vengeance (2010)*\nGator (1976)\nThe Giant King (2015)\nThe Ghost and the Darkness (1996)\nGuns of the Magnificent Seven (1969)\nHappy Ending s (2005)\nHemingway’s Garden of Eden (2010)\nThe Hours (2002)\nI Am Number Four (2011)*\nI.Q. (1994)\nIn Old California (1942)\nJFK (1991)\nKill Me Again (1989)\nKingdom of Blood (2016)\nKiss the Girls (1997)\nLincoln (2012)*\nThe Magnificent Seven Ride (1972)\nMarch of the Penguins (2005)\nMighty Joe Young (1998)*\nMiss Potter (2006)*\nMother’s Day (2016)*\nMr. Brooks (2007)*\nMulholland Falls (1996)\nMy Best Friend’s Girl (2008)*\nNYC Underground (2013)\nOriginal Sin (2001)\nOut of the Inferno (2016)\nPayback (1999)\nPeople Like Us (2012)*\nThe People vs. George Lucas (2011)\nPony Express (1953)\nPremonition (2007)*\nThe Puffy Chair (2007)\nReturn of the Living Dead 3 (1993)\nReturn of the Living Dead 4 (2006)\nReturn of the Living Dead 5 (2007)\nRoad Trip (2000)\nRobocop (1987)\nRobocop 2 (1990)\nRobocop 3 (1992)\nSaturday Night Fever (1977)\nSearching for Bobby Fischer (1993)\nSerpico (1973)\nSexipede (2010)*\nScrooged (1988)*\nShaun of the Dead (2004)*\nSliver (1993)\nThe Spirit (2008)*\nThe Switch (2010)\nTale of Tales (2015)*\nTapeheads (1988)\nThelma & Louise (1991)\nTommy Boy (1995)\nTrail of Blood (2013)\nTwice Upon a Yesterday (1999)\nTyler Perry’s The Family That Preys (2008)*\nUnder the Sea (2009)\nUsual Suspects (1995)\nThe Warriors (1979)\nWho Framed Roger Rabbit (1998)*\nWicker Park (2004)\nThe Yards (2000)*\n\nAvailable on April 2nd Hello, My Name is Doris (2016)\nAvailable on April 4th Dimension 404 : Series Premiere (RocketJump)\nPrecious Cargo (2016)\nThe Last Exorcism (2010)\nAvailable on April 5th Preacher : Complete Season 1 (AMC)\nPrison Break : Season 5 Premiere (FOX)\nAvailable on April 6th NHL Road to the Outdoor Classics Ep. 4 (2017)\nAvailable on April 7th The Beach Boys: Making Pet Sounds (2017)*\nSteve Byrne: Tell the Damn Joke (2017)*\nAvailable on April 8th Camp Lakebottom : Complete Season 1 (Disney XD)\nFirst Dates : Series Premiere (NBC)\nBarbershop: The Next Cut (2016)\nBeyond the Edge (2016)\nPerfect in ’76 (2017)*\nAvailable on April 9th The Perfect Match (2016)\nIn A World (2013)\nAvailable on April 10th Swelter (2014)\nAvailable on April 13th Short Term 12 (2013)\nAvailable on April 14th The Babadook (2014)\nThe Man Who Knew Infinity (2015)*\nThe Straight Story (1999)*\nAvailable on April 15th DOT : Complete Season 1A (Sprout)\nSid the Science Kid : Complete Seasons 1 and 2 (PBS)\nSid the Science Kid: The Movie (2012)\nAvailable on April 18th Famous in Love : Series Premiere (ABC Family)\nMy Hero Academia : Complete Season 1 (Dubbed Version) (Funimation)\nAin’t Them Bodies Saints (2013)\nElection Day: Lens Across America (2016)\nAvailable on April 19th Pretty Little Liars : Season 7 Premiere (ABC Family)\nTeen Beach Movie (2013)\nDen Brother (2010)\nThe Even Stevens Movie (2003)\nJohnny Tsunami (1999)\nStuck in the Suburbs (2004)\nTiger Cruise (2004)\nAvailable on April 21st LA Story : Complete Season 2 (Awesomeness TV)\nWarpath (1951)\nAvailable on April 22nd Cesar Millan’s Dog Nation : Series Premiere (Nat Geo)\nAvailable on April 24th Top of the Lake : Complete Season 1 (Sundance TV)\nAvailable on April 25th Origins: The Journey of Humankind: Series Premiere (Nat Geo)\nWayward Pines : Complete Season 2 (FX)\nAvailable on April 26th The Handmaid’s Tale : Series Premiere (Hulu Original)\nAvailable on April 29th Teenage Mutant Ninja Turtles : Complete Season 4 (Nickelodeon)\nHappy Hulu-ing!\n", "external_links": [], "published": "2017-03-22T03:36:00.000+02:00", "crawled": "2017-03-21T22:38:25.600+02:00", "highlightTitle": ""}