{"organizations": [], "uuid": "dc8b1ca0b492b9d9dcdb631981df39481dbfe3f0", "thread": {"social": {"gplus": {"shares": 0}, "pinterest": {"shares": 0}, "vk": {"shares": 0}, "linkedin": {"shares": 0}, "facebook": {"likes": 192, "shares": 192, "comments": 0}, "stumbledupon": {"shares": 0}}, "site_full": "www.geo.tv", "main_image": "https://www.geo.tv/assets/uploads/updates/2017-03-27/135622_012804_updates.jpg", "site_section": "http://feeds.feedburner.com/GeoSport-GeoTvNetwork", "section_title": "GEO TV - Sports", "url": "https://www.geo.tv/latest/135622-Shadab-announces-international-arrival-with-memorable-performance-on-debut", "country": "TV", "domain_rank": 8287, "title": "Shadab announces international arrival with memorable performance on debut", "performance_score": 1, "site": "geo.tv", "participants_count": 0, "title_full": "Shadab announces international arrival with memorable performance on debut", "spam_score": 0.0, "site_type": "blogs", "published": "2017-03-27T09:12:00.000+03:00", "replies_count": 0, "uuid": "dc8b1ca0b492b9d9dcdb631981df39481dbfe3f0"}, "author": "", "url": "https://www.geo.tv/latest/135622-Shadab-announces-international-arrival-with-memorable-performance-on-debut", "ord_in_thread": 0, "title": "Shadab announces international arrival with memorable performance on debut", "locations": [], "entities": {"persons": [{"name": "shadab", "sentiment": "positive"}, {"name": "shahid afridi", "sentiment": "none"}, {"name": "shadab khan", "sentiment": "none"}, {"name": "aamir", "sentiment": "none"}, {"name": "afridi", "sentiment": "none"}, {"name": "mohammad aamir", "sentiment": "none"}, {"name": "aizaz khan", "sentiment": "none"}, {"name": "pak", "sentiment": "none"}], "locations": [{"name": "karachi", "sentiment": "none"}, {"name": "hong kong", "sentiment": "none"}, {"name": "pakistan", "sentiment": "none"}, {"name": "barbados", "sentiment": "none"}, {"name": "england", "sentiment": "none"}, {"name": "west indies", "sentiment": "none"}, {"name": "nepal", "sentiment": "none"}], "organizations": [{"name": "psl", "sentiment": "positive"}, {"name": "united arab emirates", "sentiment": "none"}]}, "highlightText": "", "language": "english", "persons": [], "text": "Shadab announces international arrival with memorable performance on debut   \nKARACHI: PSL’s young sensation Shadab Khan launched his international career on Sunday with an impressive record-breaking performance against West Indies at Barbados. \nShadab ended his four over quotas on debut with three wickets, conceding only seven runs at an economy rate of 1.75, which is the most economical four-over bowling spell by a debutant in T20Is. \nHis performance also earned him the man of the match award on his international debut, making him only second Pakistani player to win a man-of-the-match award on his Twenty 20 international debut after Shahid Afridi. \nAfridi won the man of the match award on T20I debut in 2006. However, that match against England was also Pakistan’s first ever international T20 game and the match and a T20I debut for all the 11 playing members of the team. \nHis economy rate of 1.75 in a four-over spell is also the second best by any Pakistani bowler in the history of T20Is after Mohammad Aamir, and overall jointly the third most economical four-over bowling figures in the history of the shortest format of international Cricket. \nHowever, Aamir’s performance of six runs in four overs came against an associate team United Arab Emirates in February 2016. \nThe bowling figures of 4-0-7-3 by Shadab Khan is also the jointly third most economical performance by any bowler in the shortest format of international cricket. \nAizaz Khan of Hong Kong conceded just four runs in his four overs against another associate team Nepal in 2014. Six different bowlers are placed at second position in the list of most economical four-over bowling figures with an economy rate of 1.50 and Shadab is at third place with three over bowlers with the economy rate of 1.75 in four overs spell. 0 0 Shadab announces international arrival with memorable performance on debut   Shadab, Pak, Sport, Sport News,   News.   \"Shadab announces international arrival with memorable performance on debut\" is https://www.geo.tv/latest/135622-Shadab-announces-international-arrival-with-memorable-performance-on-debut+GeoSport- ", "external_links": [], "published": "2017-03-27T09:12:00.000+03:00", "crawled": "2017-03-27T00:32:31.324+03:00", "highlightTitle": ""}