{"organizations": [], "uuid": "1f39061c43be55f6b53b9eacbd3760c32fc56e8e", "thread": {"social": {"gplus": {"shares": 0}, "pinterest": {"shares": 3}, "vk": {"shares": 0}, "linkedin": {"shares": 0}, "facebook": {"likes": 635, "shares": 635, "comments": 0}, "stumbledupon": {"shares": 0}}, "site_full": "freebeacon.com", "main_image": "", "site_section": "http://freebeacon.com", "section_title": "Washington Free Beacon", "url": "http://freebeacon.com/politics/gop-rep-urging-others-stop-referring-mainstream-media/", "country": "US", "domain_rank": 11546, "title": "GOP Rep. Urging Colleagues to Stop Referring to the ‘Mainstream’ Media", "performance_score": 6, "site": "freebeacon.com", "participants_count": 1, "title_full": "GOP Rep. Urging Colleagues to Stop Referring to the ‘Mainstream’ Media", "spam_score": 0.0, "site_type": "blogs", "published": "2017-03-20T22:44:00.000+02:00", "replies_count": 0, "uuid": "1f39061c43be55f6b53b9eacbd3760c32fc56e8e"}, "author": "Sam Dorman", "url": "http://freebeacon.com/politics/gop-rep-urging-others-stop-referring-mainstream-media/", "ord_in_thread": 0, "title": "GOP Rep. Urging Colleagues to Stop Referring to the ‘Mainstream’ Media", "locations": [], "entities": {"persons": [{"name": "hillary clinton", "sentiment": "none"}, {"name": "smith", "sentiment": "none"}, {"name": "lamar smith", "sentiment": "none"}, {"name": "trump", "sentiment": "none"}, {"name": "donald trump", "sentiment": "none"}, {"name": "paul bedard", "sentiment": "none"}], "locations": [{"name": "texas", "sentiment": "none"}, {"name": "washington free beacon", "sentiment": "none"}], "organizations": [{"name": "gop", "sentiment": "negative"}, {"name": "examiner", "sentiment": "none"}, {"name": "abc", "sentiment": "none"}, {"name": "washington examiner", "sentiment": "none"}, {"name": "center for public integrity", "sentiment": "none"}, {"name": "house science", "sentiment": "none"}, {"name": "media research center", "sentiment": "none"}, {"name": "nbc", "sentiment": "none"}, {"name": "technology committee", "sentiment": "none"}, {"name": "house media fairness caucus", "sentiment": "none"}, {"name": "cbs", "sentiment": "none"}]}, "highlightText": "", "language": "english", "persons": [], "text": "One Republican congressman is fed up with what he calls \"the most biased media I've seen in my lifetime\" and has launched a campaign to call out the press for its close association with Democrats.\nRep. Lamar Smith (R., Texas), founder of the House Media Fairness Caucus, believes the media and Democrats are so tightly linked that he has created a new term for both.\n\"The media and Democrats are so close in association and so close in their philosophical views that we might as well use one word to describe both, and that's ‘Mediacrats,'\" Smith told the Washington Examiner in an interview .\nSmith, chairman of the House Science, Space, and Technology Committee, said he is urging fellow lawmakers to stop using the term \"mainstream media\" because of media bias against Republicans and conservatives.\n\"How can the media be considered ‘mainstream' when it doesn't represent a majority of the American people?\" he asked. \"It's more accurate to use the term ‘liberal.'\"\nSmith cited negative coverage of President Donald Trump and the media's lopsided campaign contributions to Hillary Clinton in 2016 as evidence that the press is biased in favor of Democrats.\nNinety-one percent of ABC, CBS, and NBC evening news coverage of the Trump campaign was \"hostile,\" according to the Media Research Center.\nThe Center for Public Integrity found that 96 percent of journalists' campaign contributions benefitted former Democratic presidential nominee Hillary Clinton.\nSmith noted to the Examiner that 55 percent of the public is \"growing weary\" of anti-Trump coverage.\nPoll: 54% call media Trump's ‘opposition party.' Party breakdown in graph… https://t.co/x1uVmxO4pk via @DCExaminer pic.twitter.com/shgUlpZNnL \n— Paul Bedard (@SecretsBedard) March 7, 2017 \n\nSmith, who cited the media as a primary reason why Trump's approval ratings are low, said he is a \"strong advocate\" of Trump's use of Twitter as a remedy to the media's control of public perception.\n\"The only way the president can get around the national liberal media is to tweet,\" Smith said. \"He can connect directly with the American people, and that's why the media doesn't like it.\"\nThe media, according to Smith, wants to \"be the only conduit\" of information for Americans and \"tell the American people what to think.\"\n\"I am concerned that it is hurting our republic, I'm afraid they are hurting themselves, I'm afraid they are hurting the country, and they're clearly so intent on hurting the president that they are taking themselves down at the same time,\" Smith added.\nThe post GOP Rep. Urging Colleagues to Stop Referring to the ‘Mainstream’ Media appeared first on Washington Free Beacon .", "external_links": [], "published": "2017-03-20T22:44:00.000+02:00", "crawled": "2017-03-20T17:53:30.231+02:00", "highlightTitle": ""}