{"organizations": [], "uuid": "0a82f44b0a5efe763b7db6debcda36ec8872f1a0", "thread": {"social": {"gplus": {"shares": 0}, "pinterest": {"shares": 0}, "vk": {"shares": 0}, "linkedin": {"shares": 0}, "facebook": {"likes": 639, "shares": 639, "comments": 0}, "stumbledupon": {"shares": 0}}, "site_full": "www.telegraph.co.uk", "main_image": "http://www.telegraph.co.uk/cars/images/2017/03/14/David-Coulthard_by_Geoff-Pugh-xlarge_trans_NvBQzQNjv4BqJS5q4eY5kGrpBe5csdQ4ABpUPrT7d1ar-s3HRVX_NxA.jpg", "site_section": "http://www.telegraph.co.uk/newsfeed/rss/motoring.xml", "section_title": "Cars", "url": "http://www.telegraph.co.uk/cars/news/goodwood-75th-members-meeting-preview/", "country": "GB", "domain_rank": 317, "title": "Goodwood 75th Members' Meeting Preview", "performance_score": 6, "site": "telegraph.co.uk", "participants_count": 1, "title_full": "Goodwood 75th Members' Meeting Preview", "spam_score": 0.0, "site_type": "blogs", "published": "2017-03-14T19:32:00.000+02:00", "replies_count": 0, "uuid": "0a82f44b0a5efe763b7db6debcda36ec8872f1a0"}, "author": "Paul Hudson", "url": "http://www.telegraph.co.uk/cars/news/goodwood-75th-members-meeting-preview/", "ord_in_thread": 0, "title": "Goodwood 75th Members' Meeting Preview", "locations": [], "entities": {"persons": [{"name": "david coulthard", "sentiment": "negative"}, {"name": "steve soper", "sentiment": "none"}, {"name": "roberto ravaglia", "sentiment": "none"}, {"name": "gerhard berger", "sentiment": "none"}, {"name": "emanuele pirro", "sentiment": "none"}, {"name": "gordon shedden", "sentiment": "none"}, {"name": "anthony reid", "sentiment": "none"}, {"name": "jochen mass", "sentiment": "none"}, {"name": "stig blomqvist", "sentiment": "none"}, {"name": "rob huff", "sentiment": "none"}, {"name": "nicolas minassian", "sentiment": "none"}, {"name": "tom kristensen", "sentiment": "none"}, {"name": "geoff pugh paul hudson", "sentiment": "none"}, {"name": "matt neal", "sentiment": "none"}, {"name": "coulthard", "sentiment": "none"}, {"name": "andrew jordan", "sentiment": "none"}, {"name": "drew gibson", "sentiment": "none"}], "locations": [{"name": "goodwood", "sentiment": "none"}], "organizations": [{"name": "goodwood motor circuit", "sentiment": "none"}, {"name": "goodwood road racing club", "sentiment": "none"}, {"name": "barc", "sentiment": "none"}, {"name": "ford capri", "sentiment": "none"}]}, "highlightText": "", "language": "english", "persons": [], "text": "Goodwood 75th Members' Meeting Preview David Coulthard returns to the track at Goodwood this weekend Credit: Geoff Pugh Paul Hudson 14 March 2017 • 12:32pm \nD avid Coulthard is the the latest addition to the star-studded driver line-up at this weekend’s 75th Members’ Meeting at the Goodwood Motor Circuit. \nThe Scot, a 13-time Grand Prix winner turned F1 commentator, will be racing a 1955 Mercedes 300 SL 417 on the Saturday of the event at midday - and you'll be able to watch all the racing action action here on the Telegraph Cars website. \nOther famous drivers racing in 12 races across the weekend include: Andrew Jordan, 2013 BTCC champion (Mini 1275 GT); Gerhard Berger, 10-time Grand Prix winner (Ford Capri Mk3 3.0S); Tom Kristensen, nine-time Le Mans winner (Rover 3500 SD1); Gordon Shedden, reigning BTCC champion (Rover 3500 SD1); Matt Neal, three-time BTCC champion (Chevrolet Camaro Z28); Roberto Ravaglia, European and World Touring Car Champion (Ford Capri 3.0S); touring car legend Steve Soper (Triumph Dolomite Sprint); Stig Blomqvist, 1984 World Rally champion (Mini 1275 GT); and Rob Huff, former World Touring Car champion, who will be driving another Ford Capri Mk3 3.0S. The daffodils are out so it's officially spring - and the Goodwood Members' Meeting Credit: Drew Gibson \nG oodwood Members’ Meeting House Captains Nicolas Minassian, Emanuele Pirro, Jochen Mass and Anthony Reid will once again be battling it out on the track for points for their respective Houses. \nAway from the racing action, Goodwood Road Racing Club members and their guests can take part in a range of activities including an air rifle range, jeep driving and ferret racing, while enjoying delicious food and drink. An open-to-all party culminating in spectacular fireworks will take place on the Saturday evening. \nThe Goodwood Members’ Meeting is a packed weekend of motor racing founded by Lord March, which aims to recreate the atmosphere and camaraderie of the original BARC Members’ Meetings held at Goodwood throughout the Fifties and Sixties until the circuit closed for racing in 1966. \nT he event features all kinds of cars from classic tin-tops and GTs to classic Formula 1 cars and historic motorcycles, as well as high-speed demonstration runs featuring significant competition cars, aiming to offer visitors a friendly and intimate atmosphere with no crowds.", "external_links": [], "published": "2017-03-14T19:32:00.000+02:00", "crawled": "2017-03-14T18:23:07.115+02:00", "highlightTitle": ""}